id,created_at,original_text,clean_text,retweet_count,hashtags,mentions,original_author
1288562050923409408,2020-07-29 19:48:27+00:00,We are #TeamStreicker ❤️🇺🇸,TeamStreicker red_heart_selector::United_States,48,#TeamStreicker,<UNK>,NikkiHaley
1288555210512781312,2020-07-29 19:21:17+00:00,"The administration is ordering China to reduce the number of diplomats posted in the US to reduce the burden on FBI counterintelligence agents. With 2,000 special agents, the bureau is opening a new Chinese-related case on average every 10 hours.","administration order China reduce number diplomat post reduce burden counterintelligence agent 2,000 special agent bureau open Chinese relate case average hour",148,<UNK>,<UNK>,NikkiHaley
1288540636199686148,2020-07-29 18:23:22+00:00,"Every day brings more stories of small business relief gone wrong. As Congress debates another round of relief for job creators, lawmakers should make sure it goes to the right places and people. @standamericanow",bring story small business relief go wrong Congress debate round relief creator lawmaker sure go right place people @standamericanow,95,<UNK>,@standamericanow,NikkiHaley
1288540423129108480,2020-07-29 18:22:31+00:00,"This week we learned that some big companies got millions of dollars in forgivable fed loans through the Paycheck Protection Program. Yet instead of keeping workers on payroll, some of these firms laid employees off. Federal relief was supposed to prevent this. @standamericanow",week learn company million dollar forgivable loan Paycheck Protection Program instead keep worker payroll firm lay employee federal relief suppose prevent @standamericanow,145,<UNK>,@standamericanow,NikkiHaley
1288539866180071426,2020-07-29 18:20:18+00:00,"Beware of the Dem Party’s 2020 platform. America would re-sign into the Paris Climate agreement that would kill jobs,shrink the economy & put the US at a global disadvantage.The agreement gives China a free pass allowing the world’s largest polluter to keep on dumping & polluting",beware Party 2020 platform America sign Paris Climate agreement kill job shrink economy global disadvantage agreement give China free pass allow world large polluter dumping polluting,1814,<UNK>,<UNK>,NikkiHaley
1288538068396445696,2020-07-29 18:13:10+00:00,"Dems want to re-enter the the Obama-era agreement that gave the Iranian regime billions of dollars it used to support terrorism. It only delayed Iran from getting a nuclear weapon while allowing its bad behavior to continue, which is why the administration exited the Iran deal.",dem want enter Obama agreement give iranian regime billion dollar support terrorism delay Iran get nuclear weapon allow behavior continue administration exit Iran deal,577,<UNK>,<UNK>,NikkiHaley
1288536978833670144,2020-07-29 18:08:50+00:00,"The Democratic Party’s 2020 foreign policy platform calls to rejoin the UN Human Rights Council after the Trump administration rightly withdrew.Never mind that the corrupt body is filled with human rights abusers or that Cuba, Russia & Saudi Arabia are running for seats. #NoToJoe",Democratic Party 2020 foreign policy platform call rejoin Human Rights Council trump administration rightly withdraw mind corrupt body fill human right abuser Cuba Russia Saudi Arabia run seat NoToJoe,330,#NoToJoe,<UNK>,NikkiHaley
1288170153847422976,2020-07-28 17:51:12+00:00,"Great leadership by @LindseyGrahamSC, @SenCapito, and @SenatorRounds for sponsoring a provision mandating the federal government buy American made personal protective equipment to refill the National Strategic Stockpile. #MadeInAmerica🇺🇸",great leadership @LindseyGrahamSC @SenCapito @SenatorRounds sponsor provision mandate federal government American personal protective equipment refill National Strategic Stockpile MadeInAmerica United_States,281,#MadeInAmerica,@LindseyGrahamSC @SenCapito @SenatorRounds,NikkiHaley
1288164943074856960,2020-07-28 17:30:30+00:00,This is a huge development by the administration and @Kodak partnering on the Defense Production Act. The beginning of bringing generic pharmaceutical production back to America! #MadeInAmerica🇺🇸,huge development administration @Kodak partner Defense Production beginning bring generic pharmaceutical production America MadeInAmerica United_States,209,#MadeInAmerica,@Kodak,NikkiHaley
1288157377859067904,2020-07-28 17:00:26+00:00,"Where is the guarantee of religious freedom? “The world we inhabit today, with a pandemic upon us, poses unusual challenges. But there is no world in which the Constitution permits Nevada to favor Caesars Palace over Calvary Chapel.” Justice Neil Gorsuch",guarantee religious freedom world inhabit today pandemic pose unusual challenge world Constitution permit Nevada favor Caesars Palace Calvary Chapel Justice Neil Gorsuch,244,<UNK>,<UNK>,NikkiHaley
1288155408163536897,2020-07-28 16:52:36+00:00,"Anarchists and extremists took to the streets of Portland & Seattle turning their rage toward federal agents and local law enforcement. So far, 20 fed agents have been injured in Portland and 59 police officers in Seattle were injured in the most recent riots. Unacceptable.",anarchist extremist take street Portland Seattle turn rage federal agent local enforcement agent injure Portland police officer Seattle injure recent riot unacceptable,945,<UNK>,<UNK>,NikkiHaley
1287906353571418112,2020-07-28 00:22:57+00:00,"Incredibly, the 2020 Dem platform calls for the US to rejoin the corrupt UN Human Rights Council. Which thing do the Dems like best, the extreme bias against Israel, the refusal to denounce China’s concentration camps, or the support for communist dictators in Cuba & Venezuela?",incredibly 2020 platform call rejoin corrupt Human Rights Council thing Dems like good extreme bias Israel refusal denounce China concentration camp support communist dictator Cuba Venezuela,4217,<UNK>,<UNK>,NikkiHaley
1287869453670080513,2020-07-27 21:56:19+00:00,Tune in tomorrow morning in the 7:00am hour!,tune tomorrow morning 7:00am hour,37,<UNK>,<UNK>,NikkiHaley
1287748336930435076,2020-07-27 13:55:03+00:00,"Great oped by @RonJohnsonWI “Doesn’t it make more sense for Congress to evaluate what has been spent, determine what worked and what didn’t, and then redirect the balance based on what Congress finds? We shouldn’t authorize another dime until we do so.”",great ope @ronjohnsonwi sense Congress evaluate spend determine work redirect balance base Congress find authorize dime,250,<UNK>,@RonJohnsonWI,NikkiHaley
1287746451234336769,2020-07-27 13:47:33+00:00,25 Republicans in Congress recently called for a TikTok ban in a letter sent to the Trump administration. They point out that TikTok can be forced by the Chinese government to hand over user data.,Republicans Congress recently call TikTok letter send trump administration point TikTok force chinese government hand user datum,187,<UNK>,<UNK>,NikkiHaley
1287443060452986881,2020-07-26 17:41:59+00:00,"A non-profit founded by a Pennsylvania military mom,Sneakers for Soldiers ships 300 pairs of shoes per month to troops in Iraq, Afghanistan and Syria.Each shoe is chosen specifically for the soldier, and a personal message from the donor is attached. ❤️🇺🇸 https://sneakersforsoldiers.org/",profit found Pennsylvania military sneaker Soldiers ship pair shoe month troop Iraq Afghanistan Syria shoe choose specifically soldier personal message donor attach red_heart_selector::united_state,407,<UNK>,<UNK>,NikkiHaley
1287225528076967937,2020-07-26 03:17:36+00:00,This was fantastic and such a great memory for them!,fantastic great memory,7,<UNK>,<UNK>,NikkiHaley
1287059229954772993,2020-07-25 16:16:47+00:00,A perfect Saturday ❤️🏖☀️,perfect Saturday red_heart_selector::beach_with_umbrella::sun_selector,105,<UNK>,<UNK>,NikkiHaley
1286734198666035206,2020-07-24 18:45:13+00:00,"Martina, while I understand we differ on politics, I grew up playing tennis as a young girl and I Loved watching you play. You have and will always be one of my favorite tennis players of all time. You and Chrissy Evert were tennis heroes to many of us. Thank you.",Martina understand differ politic grow play tennis young girl love watch play favorite tennis player time Chrissy Evert tennis hero thank,66,<UNK>,<UNK>,NikkiHaley
1286719366751559680,2020-07-24 17:46:17+00:00,Excited for the weekend. Happy Friday❣️ #Bentley,excited weekend Happy Friday heart_exclamation Bentley,112,#Bentley,<UNK>,NikkiHaley
1286674865911738368,2020-07-24 14:49:27+00:00,36 Hackers who targeted verified accounts on Twitter earlier this month gained access to at least 36 of those account-holders' Direct Message inboxes. The ability of hackers to slide into elected officials' DMs has raised fears of blackmail.,hacker target verified account Twitter early month gain access account holder Direct message inboxe ability hacker slide elect official raise fear blackmail,101,<UNK>,<UNK>,NikkiHaley
1286673889704267779,2020-07-24 14:45:35+00:00,The Kremlin is less concerned with the election outcome of any single vote but more generally sowing doubts about the integrity of elections & political institutions in the West.,Kremlin concerned election outcome single vote generally sow doubt integrity election political institution West,85,<UNK>,<UNK>,NikkiHaley
1286667857644969985,2020-07-24 14:21:37+00:00,We know how much @realDonaldTrump wanted to have a blowout convention.Proud of the selfless leadership he has shown in cancelling the convention. He has a great story to tell on how he turned our economy &amp; foreign policy around. We look forward to sharing it in the next 100 days!,know @realDonaldTrump want blowout convention proud selfless leadership show cancel convention great story tell turn economy foreign policy look forward share day,6323,<UNK>,@realDonaldTrump,NikkiHaley
1286663169155502081,2020-07-24 14:02:59+00:00,“Margaret Thatcher believed in the Rule of Law. She would have cancelled cancel culture.”,Margaret Thatcher believe Rule cancel cancel culture,194,<UNK>,<UNK>,NikkiHaley
1286656935903854598,2020-07-24 13:38:13+00:00,Congress may soon go after the foreign hackers trying to steal American secrets. @GOPLeader Kevin McCarthy has introduced a bill that would allow sanctions on anyone who endangers U.S. national security. @standamericanow,Congress soon foreign hacker try steal american secret @GOPLeader Kevin McCarthy introduce bill allow sanction endanger U.S. national security @standamericanow,413,<UNK>,@GOPLeader @standamericanow,NikkiHaley
1286439511778643968,2020-07-23 23:14:15+00:00,Looking forward to Chris Wallace’s interview with Joe Biden.,look forward Chris Wallace interview Biden,6526,<UNK>,<UNK>,NikkiHaley
1286429154439766021,2020-07-23 22:33:05+00:00,Had a great chat with @SenatorLankford on his podcast The Breakdown. We went over the ABCs of why we should all care about what is happening to the people of Hong Kong and the threats China poses to America. This and more. Hope you will tune in tomorrow. ❤️🇺🇸,great chat @senatorlankford podcast Breakdown go abc care happen people Hong Kong threat China pose America hope tune tomorrow red_heart_selector::united_states,68,<UNK>,@SenatorLankford,NikkiHaley
1286344572403167233,2020-07-23 16:56:59+00:00,"“As China is eager to expand its communist ideology and authoritarian international order, Taiwan is on the front line of defending freedom and democracy. We would like to cooperate with like-minded countries to defend our way of life.”",China eager expand communist ideology authoritarian international order Taiwan line defend freedom democracy like cooperate like minded country defend life,196,<UNK>,<UNK>,NikkiHaley
1286320763512016896,2020-07-23 15:22:23+00:00,Any coronavirus cure will be thanks to capitalism. ❤️🇺🇸,coronavirus cure thank capitalism red_heart_selector::united_states,7813,<UNK>,<UNK>,NikkiHaley
1286320532078592001,2020-07-23 15:21:28+00:00,"Vaccine progress is coming at record speed — and it's the result of the free market. About 2 dozen companies are competing to find a cure or treatments to the pandemic. While govt supports, they’re rightly letting innovators and entrepreneurs drive the vaccine process.",vaccine progress come record speed result free market dozen company compete find cure treatment pandemic govt support rightly let innovator entrepreneur drive vaccine process,335,<UNK>,<UNK>,NikkiHaley
1286318029748543488,2020-07-23 15:11:31+00:00,"The next coronavirus relief bill shouldn’t be filled with wasteful spending. For a lesson on what not to do, Congress should look at previous legislation. It’s filled with paydays for bigger companies, leaving less for the small businesses that were promised quick relief.",coronavirus relief bill fill wasteful spending lesson Congress look previous legislation fill payday big company leave small business promise quick relief,156,<UNK>,<UNK>,NikkiHaley
1286316414526279681,2020-07-23 15:05:06+00:00,"Public safety is govt’s most important job. But in Portland, a failure of leadership has led to violence and put people’s lives at risk. The city’s leaders have allowed the situation to spiral out of control. Rarely will you see such a profile in cowardice. @standamericanow",public safety govt important Portland failure leadership violence people life risk city leader allow situation spiral control rarely profile cowardice @standamericanow,628,<UNK>,@standamericanow,NikkiHaley
1286105597935484929,2020-07-23 01:07:23+00:00,“The fact that this governor refuses to accept responsibility for his actions makes our grief & anger far worse. I know I speak for many when I say we need a non-partisan investigation on both the state and federal level so that this never happens again.”,fact governor refuse accept responsibility action make grief anger worse know speak need partisan investigation state federal level happen,2151,<UNK>,<UNK>,NikkiHaley
1285927652193427456,2020-07-22 13:20:18+00:00,It is a new low for Pelosi to refer to the Trump Virus.She didn’t require masks in her committees until mid June & opposed the China travel ban.The only one to blame for this virus is China. Many have died. We should be unified on that front not playing political games with it.,Pelosi refer Trump Virus require mask committee June oppose China travel blame virus China die unify play political game,17136,<UNK>,<UNK>,NikkiHaley
1285698216617541632,2020-07-21 22:08:36+00:00,China is proving it can’t do anything on its own without stealing.,China prove steal,771,<UNK>,<UNK>,NikkiHaley
1285682797022150661,2020-07-21 21:07:20+00:00,"My latest oped on strengthening relations with Taiwan: Economically, both the United States and Taiwan would greatly benefit from a free trade deal. Many members of Congress have publicly supported such a deal, which would be a win for American jobs and workers.",late ope strengthen relation Taiwan economically United States Taiwan greatly benefit free trade deal member Congress publicly support deal american job worker,121,<UNK>,<UNK>,NikkiHaley
1285677925442912256,2020-07-21 20:47:58+00:00,American businesses take great risks when they do business in China. “The ultimate ambition of China’s rulers isn’t to trade with the United States; it is to raid the United States.”,american business great risk business China ultimate ambition China ruler trade United States raid United States,300,<UNK>,<UNK>,NikkiHaley
1285578425437237249,2020-07-21 14:12:36+00:00,"America should shine a light on China’s slave labor— and work to stop it. A good start is the Uighur Forced Labor Prevention Act, co-authored by @SenTedCruz and @marcorubio. It would force companies that sell products in America to prove they don’t use forced labor. #PassTheBill",America shine light China slave labor work stop good start Uighur Forced Labor Prevention author @SenTedCruz @marcorubio force company sell product America prove force labor PassTheBill,1671,#PassTheBill,@SenTedCruz @marcorubio,NikkiHaley
1285557894021353474,2020-07-21 12:51:01+00:00,Congratulations! Love this picture. You look fabulous. Thank you for your friendship and partnership.,congratulation love picture look fabulous thank friendship partnership,18,<UNK>,<UNK>,NikkiHaley
1285367685317046273,2020-07-21 00:15:11+00:00,The same excuses and more were given to me when I was at the UN. What China is doing to these people is disgusting. This interview shows just how ignorant the Chinese people think we all are.,excuse give China people disgusting interview show ignorant chinese people think,1140,<UNK>,<UNK>,NikkiHaley
1285316548039774210,2020-07-20 20:51:59+00:00,"Great to see my friend, and former Wal Mart CEO, Bill Simon discuss our partnership when I was governor. We both were committed to bringing overseas manufacturing back to America and were successful in South Carolina. This is one of the many ways we did it. #MadeInAmerica🇺🇸",great friend Mart Bill Simon discuss partnership governor committed bring overseas manufacturing America successful South Carolina way MadeInAmerica United_States,73,#MadeInAmerica,<UNK>,NikkiHaley
1285314520039272448,2020-07-20 20:43:56+00:00,Where was Biden when Res 2334 (in 2016 against Israel) passed? Where was Biden when Hamas was attacking Israel? Where was Biden when we moved the embassy and he wouldn't do it? Actions are louder than words. We have seen the results of 2 different people.,Biden 2334 2016 Israel pass Biden Hamas attack Israel Biden move embassy action loud word see result different people,1138,<UNK>,<UNK>,NikkiHaley
1285231744417923076,2020-07-20 15:15:00+00:00,"The next coronavirus relief bill must ensure that America can reopen safely & smartly. For that to happen, businesses, schools, & other institutions have to be protected from frivolous lawsuits that would slow the country’s recovery and profit off people’s pain. @standamericanow",coronavirus relief bill ensure America reopen safely smartly happen business school institution protect frivolous lawsuit slow country recovery profit people pain @standamericanow,300,<UNK>,@standamericanow,NikkiHaley
1285228668562833408,2020-07-20 15:02:47+00:00,"Great oped by @SenatorRisch: These actions highlight the attitude of China and Russia on the international stage, where callous indifference toward the rest of humanity is the trademark of their foreign policy.",great ope @SenatorRisch action highlight attitude China Russia international stage callous indifference rest humanity trademark foreign policy,82,<UNK>,@SenatorRisch,NikkiHaley
1285222695668527104,2020-07-20 14:39:03+00:00,"""Look at the difference between Biden & Pres Trump. Who is the person that moved the embassy from Tel Aviv to Jerusalem? Who is the person that pulled out of the Iran deal? Who's the person that allowed me to call out Hamas for the first time in the UN?"" https://www.jpost.com/american-politics/nikki-haley-if-biden-comes-in-all-of-the-progress-we-made-goes-away-635636",look difference Biden Pres Trump person move embassy Aviv Jerusalem person pull Iran deal person allow Hamas time,12056,<UNK>,<UNK>,NikkiHaley
1285044857267015680,2020-07-20 02:52:23+00:00,Always proud of @FrankMartin_SC and how he represents South Carolina. Thank you for the goodness you continue to show the people of our state.,proud @FrankMartin_SC represent South Carolina thank goodness continue people state,41,<UNK>,@FrankMartin_SC,NikkiHaley
1284881541496213505,2020-07-19 16:03:26+00:00,"Dual oped with Bill Simon: While Washington has a role to play by enacting sensible policies at the national level, America is at her best when our states and their people shine. Made in America is more than a slogan—it’s a statement of American strength.",dual ope Bill Simon Washington role play enact sensible policy national level America best state people shine America slogan statement american strength,152,<UNK>,<UNK>,NikkiHaley
1284580382634053632,2020-07-18 20:06:44+00:00,That moment when your heart is full and happy💕,moment heart happy two_hearts,60,<UNK>,<UNK>,NikkiHaley
1284385831030083590,2020-07-18 07:13:39+00:00,"Well done, good and faithful servant! ❤️🇺🇸",good faithful servant red_heart_selector::united_states,206,<UNK>,<UNK>,NikkiHaley
1284216582735106048,2020-07-17 20:01:07+00:00,"If this were any other country but China, the world would be up in arms. Where is the UN now? You will blame Israel 10x over but when it’s China....silence.",country China world arm blame Israel China silence,10850,<UNK>,<UNK>,NikkiHaley
1284211730357288964,2020-07-17 19:41:50+00:00,Hope you will tune in and join us!,hope tune join,19,<UNK>,<UNK>,NikkiHaley
1284126538871570432,2020-07-17 14:03:19+00:00,"If Biden wins in November, it's clear that Warren will significantly shape his approach — on domestic policy in particular — whether or not her name's on the ticket.",Biden win November clear Warren significantly shape approach domestic policy particular ticket,1431,<UNK>,<UNK>,NikkiHaley
1284124140014899200,2020-07-17 13:53:47+00:00,"Russia is trying to steal our coronavirus vaccine research. The goal is the outright theft of cutting-edge research on a coronavirus cure. These same hackers are behind some of the 2016 election meddling, among other silent attacks on America and our allies. @standamericanow",Russia try steal coronavirus vaccine research goal outright theft cut edge research coronavirus cure hacker 2016 election meddling silent attack America ally @standamericanow,194,<UNK>,@standamericanow,NikkiHaley
1284122459487326210,2020-07-17 13:47:06+00:00,"The American people will ultimately pay for Congress’ spending spree. It’s important that Congress not pass another relief package that isn’t tailored to the people who need the most help. Nothing is free, this money will have to be paid back. @standamericanow",american people ultimately Congress spending spree important Congress pass relief package tailor people need help free money pay @standamericanow,519,<UNK>,@standamericanow,NikkiHaley
1284120303531155456,2020-07-17 13:38:32+00:00,"In the last nine months, the US has spent a staggering $5 trillion. The federal debt is already more than $26 trillion. While some of this money was needed to help those hurt by the coronavirus pandemic, much of it was wasteful. @standamericanow",month spend staggering trillion federal debt trillion money need help hurt coronavirus pandemic wasteful @standamericanow,682,<UNK>,@standamericanow,NikkiHaley
1283831704029933568,2020-07-16 18:31:45+00:00,“America needs a newspaper focused on truth and love. Truth is love. The truth is hatred of Trump is destroying this country far more than Trump’s presidency.”,America need newspaper focus truth love truth love truth hatred Trump destroy country Trump presidency,321,<UNK>,<UNK>,NikkiHaley
1283803715116445696,2020-07-16 16:40:32+00:00,Great news! In record time with great prelim results.,great news record time great prelim result,113,<UNK>,<UNK>,NikkiHaley
1283767308066918407,2020-07-16 14:15:52+00:00,"Biden’s energy plan screams “socialist.” It’s full of subsidies and corp welfare for liberal interest groups, while giving the fed govt much more control over America’s energy industry. Then again, that’s what we’d expect from a plan developed by Bernie Sanders. @standamericanow",Biden energy plan scream socialist subsidy corp welfare liberal interest group give govt control America energy industry expect plan develop Bernie Sanders @standamericanow,2371,<UNK>,@standamericanow,NikkiHaley
1283404903323439104,2020-07-15 14:15:48+00:00,"The U.K. joins the U.S., Japan, Australia, New Zealand, and Taiwan in banning Huawei. Now it’s time for other free countries to follow suit — including India, Canada, and our allies in Europe. @standamericanow",U.K. join U.S. Japan Australia Zealand Taiwan ban Huawei time free country follow suit include India Canada ally Europe @standamericanow,580,<UNK>,@standamericanow,NikkiHaley
1283404407699374080,2020-07-15 14:13:49+00:00,"Cancel culture doesn’t speak for the vast majority of Americans. There’s a screaming 1% that’s trying to shout down the other 99%. If we really want to make our country better, we shouldn’t silence anyone. We need to speak up and show that America is better than this. ❤️🇺🇸",cancel culture speak vast majority Americans scream try shout want country well silence need speak America well red_heart_selector::united_states,2519,<UNK>,<UNK>,NikkiHaley
1283386472448561152,2020-07-15 13:02:33+00:00,Courage comes in many forms. Yesterday it was in the form of @bariweiss. Thank you for speaking truth to power in a difficult situation. “Showing up for work as a centrist at an American newspaper should not require bravery.”,courage come form yesterday form @bariweiss thank speak truth power difficult situation show work centrist american newspaper require bravery,265,<UNK>,@bariweiss,NikkiHaley
1283167202951213060,2020-07-14 22:31:15+00:00,Strong and important step by @realDonaldTrump today. Calling out China for the promise they have broken to the people of Hong Kong is not only important for the people of Hong Kong but also the people of Taiwan as well. Taiwan is next. #StandWithHongKong #SupportTaiwan,strong important step @realDonaldTrump today call China promise break people Hong Kong important people Hong Kong people Taiwan Taiwan standwithhongkong SupportTaiwan,328,#StandWithHongKong #SupportTaiwan,@realDonaldTrump,NikkiHaley
1283150525194817537,2020-07-14 21:24:59+00:00,"Our fellow citizens don’t want to tear each other down or wipe away our country’s past. We want to unite and work together to ensure a future where every American is respected, and where America itself lives up to our ideals more fully.",fellow citizen want tear wipe away country past want unite work ensure future American respect America live ideal fully,601,<UNK>,<UNK>,NikkiHaley
