id,created_at,original_text,clean_text,retweet_count,hashtags,mentions,original_author
1283148962602668032,2020-07-14 21:18:47+00:00,“The last thing that cancel-culture warriors want is to have an honest and open discussion about anything. They prefer the quick rush that comes from driving people apart to the hard work of bringing people together.”,thing cancel culture warrior want honest open discussion prefer quick rush come drive people apart hard work bring people,251,<UNK>,<UNK>,NikkiHaley
1283107533289398273,2020-07-14 18:34:09+00:00,My latest article on cancel culture: https://medium.com/@nikkihaley/america-is-better-than-cancel-culture-3ffd3f9e4daf,late article cancel culture,406,<UNK>,<UNK>,NikkiHaley
1283071636086947840,2020-07-14 16:11:31+00:00,What the China Iran deal means and what we should consider doing about it.,China Iran deal mean consider,168,<UNK>,<UNK>,NikkiHaley
1283054740029542412,2020-07-14 15:04:22+00:00,China will impose unspecified sanctions on @LockheedMartin after the US approved a possible $620 million deal to supply missile parts to Taiwan.,China impose unspecified sanction @LockheedMartin approve possible million deal supply missile part Taiwan,143,<UNK>,@LockheedMartin,NikkiHaley
1283015665390149632,2020-07-14 12:29:06+00:00,Great news! Britain shifts away from China by barring Huawei from its 5G network.,great news Britain shift away China bar Huawei network,1010,<UNK>,<UNK>,NikkiHaley
1282756477426565120,2020-07-13 19:19:11+00:00,Tune into my conversation with @mschlapp and @CPAC,tune conversation @mschlapp @CPAC,29,<UNK>,@mschlapp @CPAC,NikkiHaley
1282703405803343875,2020-07-13 15:48:18+00:00,"In Milwaukee, homicides are up 37% so far this year. In Los Angeles, killings are up by double digit percentages, and Kansas City has had 99 killings since January. Murder rates are up in at least 36 cities this year. All examples of how dangerous it is to defund the police.",Milwaukee homicide year Angeles killing double digit percentage Kansas City killing January murder rate city year example dangerous defund police,1281,<UNK>,<UNK>,NikkiHaley
1282702812108005376,2020-07-13 15:45:56+00:00,"Do Joe Biden, Nancy Pelosi, and Chuck Schumer really have the courage to stand up to AOC, the rest of “The Squad,” and the social media mob? @standamericanow",Biden Nancy Pelosi Chuck Schumer courage stand rest Squad social medium @standamericanow,1497,<UNK>,@standamericanow,NikkiHaley
1282702046370697224,2020-07-13 15:42:53+00:00,My thoughts on New York’s mayor and how and his recent photo op in front of Trump Tower,thought York mayor recent photo Trump Tower,311,<UNK>,<UNK>,NikkiHaley
1282658001221029889,2020-07-13 12:47:52+00:00,"China partners with Iran ending Iran’s global isolation. “The partnership ... would vastly expand Chinese presence in banking, telecommunications, ports, railways and dozens of other projects.""",China partner Iran end Iran global isolation partnership vastly expand chinese presence banking telecommunication port railway dozen project,199,<UNK>,<UNK>,NikkiHaley
1282651600566321155,2020-07-13 12:22:26+00:00,Proud of these four friends for speaking the truth about the human rights abuses in China. No sanctions will keep them from speaking out for those who can’t.,proud friend speak truth human right abuse China sanction speak,421,<UNK>,<UNK>,NikkiHaley
1282327269692841989,2020-07-12 14:53:40+00:00,"“I think we’re missing the point. We need police reform, we need prison reform. ... My concern is turning this into a circus instead of trying to do some good stuff. Sports used to be a place where fans could go get away from reality.""",think miss point need police reform need prison reform concern turn circus instead try good stuff sport place fan away reality,1357,<UNK>,<UNK>,NikkiHaley
1282065380874297345,2020-07-11 21:33:01+00:00,Prayers for strength and peace for both of you and your sweet family. ❤️,prayer strength peace sweet family red_heart_selector,3,<UNK>,<UNK>,NikkiHaley
1282011529588736002,2020-07-11 17:59:01+00:00,A win from the Supreme Court this week. Religious liberty lies at the very foundation of America. Our country was founded by people fleeing religious persecution in Europe. It was so important to our Founding Fathers that they wrote these protections into the 1st Amendment. ❤️🇺🇸,Supreme Court week religious liberty lie foundation America country found people flee religious persecution Europe important found father write protection Amendment red_heart_selector::united_states,634,<UNK>,<UNK>,NikkiHaley
1281995144456278022,2020-07-11 16:53:55+00:00,Blessed to have had the opportunity to work with UN Canadian Amb @blanchardCanada! You have been a sweet and fun friend as we worked through our US/Canada relationship. You served Canada well. Wishing you and Monique the very best as you move on.,bless opportunity work canadian @blanchardCanada sweet friend work Canada relationship serve Canada wish Monique good,59,<UNK>,<UNK>,NikkiHaley
1281609749356830720,2020-07-10 15:22:30+00:00,“People will do what they will do.” Pelosi on the lawlessness happening in her state and across our country. Rule of Law is a defining pillar of this country. Sounds like Pelosi is tired and needs to retire. #TermLimits,People Pelosi lawlessness happen state country rule defining pillar country sound like Pelosi tired need retire termlimit,2050,#TermLimits,<UNK>,NikkiHaley
1281608782917795841,2020-07-10 15:18:39+00:00,"FBI Dir Wray described China’s attempts to steal data from every American citizen & company, to infiltrate US colleges/universities, & multiple federal arrests. Wray stated the FBI “is opening a new China-related counterintelligence case about every 10 hours.” @standamericanow",Wray describe China attempt steal datum american citizen company infiltrate college university multiple federal arrest wray state open China relate counterintelligence case hour @standamericanow,276,<UNK>,@standamericanow,NikkiHaley
1281607329536970752,2020-07-10 15:12:53+00:00,"In a major speech this week that needs more attention, FBI Director Christopher Wray made clear that China is ramping up its attempts not just to compete with America, but to defeat us. @standamericanow",major speech week need attention Director Christopher Wray clear China ramp attempt compete America defeat @standamericanow,207,<UNK>,@standamericanow,NikkiHaley
1281603346068111361,2020-07-10 14:57:03+00:00,Thankful for our cherished friendship with UN Israeli Amb @dannydanon. Thank you for partnering with me on strengthening the bond between the US &amp; Israel and fighting for truth. Michael &amp; I wish you &amp; Talie the best as you go home to Israel. Until next year in Jerusalem...💙,thankful cherish friendship israeli @dannydanon thank partner strengthen bond Israel fight truth Michael wish Talie good home Israel year Jerusalem :blue_heart,122,<UNK>,@dannydanon,NikkiHaley
1281273268322938882,2020-07-09 17:05:26+00:00,We need to talk about the lives of young black victims and black police officers murdered due to lawlessness. Their lives matter. The left loses credibility when it starts picking and choosing which lives it talks about and which lives it ignores.,need talk life young black victim black police officer murder lawlessness life matter left lose credibility start pick choosing live talk live ignore,678,<UNK>,<UNK>,NikkiHaley
1281231277534990336,2020-07-09 14:18:35+00:00,"What makes America special, and separates us from other countries, is the rule of law. It allows us our quality of life and our freedom. Getting rid of the police won't give us results. Defunding the police will create lawless chaos, like we see in Venezuela.",make America special separate country rule allow quality life freedom get police result defunde police create lawless chaos like Venezuela,697,<UNK>,<UNK>,NikkiHaley
1281210965372153862,2020-07-09 12:57:52+00:00,"""At the U.N., I saw what made America special and what separated us from other countries was the rule of law. It's what allows us quality of life. It's what allows us our freedom.""",U.N. America special separate country rule allow quality life allow freedom,329,<UNK>,<UNK>,NikkiHaley
1281205204973694976,2020-07-09 12:34:59+00:00,If they want to turn into Venezuela - defund the police. That’s what will happen to America.,want turn Venezuela defund police happen America,1308,<UNK>,<UNK>,NikkiHaley
1280998868419829763,2020-07-08 22:55:04+00:00,Tune in tonight as I join @seanhannity,tune tonight join @seanhannity,99,<UNK>,@seanhannity,NikkiHaley
1280948444102832128,2020-07-08 19:34:42+00:00,Everyone should watch this. @marcelluswiley gives his take on the message of Black Lives Matter moving into the sports arena. “I respect your space. I respect what you are protesting for. But will you respect others who don’t support that same protest.”,watch @marcelluswiley give message Black life Matter move sport arena respect space respect protest respect support protest,355,<UNK>,@marcelluswiley,NikkiHaley
1280929957682778114,2020-07-08 18:21:15+00:00,"Proud of @KLoeffler for standing up to the mob wanting sports to be about uniting people, not dividing people based on political agendas.",proud @kloeffler stand want sport unite people divide people base political agenda,690,<UNK>,@KLoeffler,NikkiHaley
1280887030705201154,2020-07-08 15:30:40+00:00,"Violent criminals are emboldened by the criticism of police officers. As Atlanta’s mayor said, “we’ve had over 75 shootings in the city over the past several weeks. You can’t blame that on Atlanta PD.” Give police the respect/resources they deserve before more innocent kids die.",violent criminal embolden criticism police officer Atlanta mayor say shooting city past week blame Atlanta police respect resource deserve innocent kid,457,<UNK>,<UNK>,NikkiHaley
1280884947587403776,2020-07-08 15:22:23+00:00,China’s goal: Force companies that do business in Hong Kong & individuals who travel to Hong Kong into silence. It’s an assault on free speech in America. American businesses need to stand up to Communist China & lawmakers must take stronger steps to hold China accountable.,China goal force company business Hong Kong individual travel Hong Kong silence assault free speech America american business need stand Communist China lawmaker strong step hold China accountable,371,<UNK>,<UNK>,NikkiHaley
1280883584442740736,2020-07-08 15:16:58+00:00,"Not only did Communist China just end free speech in Hong Kong, it is also trying to stifle free speech everywhere. The new “national security law” that Beijing passed criminalizes any speech anywhere that calls for Hong Kong’s freedom. @standamericanow",Communist China free speech Hong Kong try stifle free speech national security Beijing pass criminalize speech call Hong Kong freedom @standamericanow,514,<UNK>,@standamericanow,NikkiHaley
1280880454342782976,2020-07-08 15:04:32+00:00,"A future stimulus should NOT bail out fiscally-irresponsible states/cities, not extend the increased unemployment insurance making it impossible for some small business to reopen, not give relief to Planned Parenthood & companies backed by financial firms with deep pockets.",future stimulus bail fiscally irresponsible state city extend increase unemployment insurance make impossible small business reopen relief Planned Parenthood company back financial firm deep pocket,566,<UNK>,<UNK>,NikkiHaley
1280878777824956416,2020-07-08 14:57:52+00:00,"If there is another stimulus, the focus should be on individuals & small businesses truly suffering financially, scaling back unemployment benefits that encourage people not to work, & give businesses legal protection from frivolous lawsuits seeking to cash in on the pandemic.",stimulus focus individual small business truly suffer financially scale unemployment benefit encourage people work business legal protection frivolous lawsuit seek cash pandemic,892,<UNK>,<UNK>,NikkiHaley
1280204430244220930,2020-07-06 18:18:15+00:00,"The House passed a $1.5 trillion “infrastructure” bill that incl radical environmental policies. Billions in taxpayer handouts to green energy companies, emissions mandates for states, & items like forcing the Post Office to buy all-electric vehicles.",House pass trillion infrastructure bill incl radical environmental policy billion taxpayer handout green energy company emission mandate state item like force Post Office electric vehicle,148,<UNK>,<UNK>,NikkiHaley
1280202017433149440,2020-07-06 18:08:40+00:00,"The UN Human Rights Council is an embarrassment: 53 countries at the UN HRC, led by Cuba, came out in support of China’s natl security law this week -- a law that has formed the basis of the communist regime’s latest crackdown on the people of Hong Kong.",Human Rights Council embarrassment country Cuba come support China natl security week form basis communist regime late crackdown people Hong Kong,1175,<UNK>,<UNK>,NikkiHaley
1280183441875783680,2020-07-06 16:54:51+00:00,"If you want your heart to sing, with goosebumps on your arms, listen to the amazing rendition of @TheLeeGreenwood with some awesome patriots. ❤️🇺🇸 #AlwaysProudToBeAnAmerican",want heart sing goosebump arm listen amazing rendition @theleegreenwood awesome patriot red_heart_selector::united_states AlwaysProudToBeAnAmerican,123,#AlwaysProudToBeAnAmerican,@TheLeeGreenwood,NikkiHaley
1280138566039941120,2020-07-06 13:56:32+00:00,And these fellas just ran across the driveway... #HaleyFamilyZoo #DontLetTheGatorSeeYou #NotInNYCAnymore,fella driveway HaleyFamilyZoo DontLetTheGatorSeeYou notinnycanymore,39,#HaleyFamilyZoo #DontLetTheGatorSeeYou #NotInNYCAnymore,<UNK>,NikkiHaley
1280123394114101248,2020-07-06 12:56:15+00:00,This little guy literally was scratching on the front door this morning? 😳 #LateForTheParty #WheresHisMom #HeSmelledTheSmoker,little literally scratch door morning flushed_face latefortheparty whereshismom HeSmelledTheSmoker,64,#LateForTheParty #WheresHisMom #HeSmelledTheSmoker,<UNK>,NikkiHaley
1279924856314888193,2020-07-05 23:47:20+00:00,We had an amazing 4th of July weekend with sweet family and friends. We have loved having these two home with us this summer. Love these awesome tshirts from Rooted Threads! ❤️🇺🇸 https://www.rootedthreads.com/,amazing July weekend sweet family friend love have home summer love awesome tshirt rooted Threads red_heart_selector::united_state,156,<UNK>,<UNK>,NikkiHaley
1279892719243071488,2020-07-05 21:39:38+00:00,I’m so sorry Martha. Michael and I will keep you and your family in our prayers. I can only imagine how proud Martin is of you❣️🙏🏼,sorry Martha Michael family prayer imagine proud Martin heart_exclamation::folded_hands_medium light_skin_tone,14,<UNK>,<UNK>,NikkiHaley
1279873070505885697,2020-07-05 20:21:33+00:00,"Over 244 years, millions of Americans have served, fought, & died to preserve the American way of life. This weekend, we can’t forget their sacrifices. We should all take time to honor them and remember we are the land of the free because of the brave. ❤️🇺🇸 @standamericanow",year million Americans serve fight die preserve american life weekend forget sacrifice time honor remember land free brave red_heart_selector::United_States @standamericanow,1152,<UNK>,@standamericanow,NikkiHaley
1279782059184193537,2020-07-05 14:19:54+00:00,This will be a great conversation about the issues facing the Jewish community. Hope you will join us!,great conversation issue face jewish community hope join,110,<UNK>,<UNK>,NikkiHaley
1279395164226826240,2020-07-04 12:42:31+00:00,"Because on our worst day, we are blessed to live in America. Happy Independence Day! ❤️🇺🇸",bad bless live America Happy Independence red_heart_selector::united_states,4535,<UNK>,<UNK>,NikkiHaley
1278800018556760065,2020-07-02 21:17:38+00:00,Wow. @KyleKashuv know your classics my friend. #WelcomeToTheClassics 😎,@kylekashuv know classic friend welcometotheclassics smiling_face_with_sunglasse,7,#WelcomeToTheClassics,@KyleKashuv,NikkiHaley
1278770957298159616,2020-07-02 19:22:09+00:00,Congratulations @TankSchottle. We are so proud of you❣️,congratulation @tankschottle proud heart_exclamation,1,<UNK>,@TankSchottle,NikkiHaley
1278770750774824963,2020-07-02 19:21:20+00:00,It is a fantastic song!,fantastic song,7,<UNK>,<UNK>,NikkiHaley
1278691230394834944,2020-07-02 14:05:20+00:00,Everyone in our country should applaud the job numbers today. Great to see families doing better. Great to see the market doing better. We have to rebuild from Covid but this is a sign that our economy is moving in the right direction! ❤️🇺🇸,country applaud number today great family well great market well rebuild Covid sign economy move right direction red_heart_selector::united_states,1317,<UNK>,<UNK>,NikkiHaley
1278688725015412737,2020-07-02 13:55:23+00:00,Fantastic news! Great to see people getting back to work. ❤️🇺🇸,fantastic news great people get work red_heart_selector::united_state,163,<UNK>,<UNK>,NikkiHaley
1278686644896518144,2020-07-02 13:47:07+00:00,Congratulations! What a blessing💕,congratulation blessing two_hearts,0,<UNK>,<UNK>,NikkiHaley
1278405622158053376,2020-07-01 19:10:26+00:00,"Good to see India ban 59 popular apps owned by Chinese firms, including TikTok, which counts India as one of its largest markets. India is continuing to show it won’t back down from China’s aggression.",good India popular app own chinese firm include TikTok count India large market India continue China aggression,958,<UNK>,<UNK>,NikkiHaley
1278400239871934464,2020-07-01 18:49:03+00:00,Australia will recruit 500 cyber spies and spend $1.3 Billion to go on the offensive amid rising tensions with China and a growing wave of attacks against the nation's critical infrastructure.,Australia recruit cyber spy spend billion offensive amid rise tension China grow wave attack nation critical infrastructure,207,<UNK>,<UNK>,NikkiHaley
1278398658845818884,2020-07-01 18:42:46+00:00,"This should be the beginning, not the end, of holding the Burmese military accountable for their torture of the Rohingya. There will not be full justice until the Intl Court of Justice finds Aung San Suu Kyi and the Burmese military guilty of genocide.",beginning hold burmese military accountable torture Rohingya justice Intl Court Justice find Aung burmese military guilty genocide,62,<UNK>,<UNK>,NikkiHaley
1278352416874934274,2020-07-01 15:39:01+00:00,"The House should pass, & the president should sign, the sanctions bill that unanimously passed the Senate last week. It would empower the US to punish any Chinese official/business involved in the oppression of Hong Kong. #StandWithHongKong @standamericanow",House pass president sign sanction bill unanimously pass Senate week empower punish chinese official business involve oppression Hong Kong standwithhongkong @standamericanow,378,#StandWithHongKong,@standamericanow,NikkiHaley
1278351560448323584,2020-07-01 15:35:37+00:00,"Under new Communist China law, freedom fighters in Hong Kong can be sent to mainland China to face torture, life sentence in jail or worse. Now one of the most pro-democracy groups disbanded, activists are deleting Twitter posts & the freedom leaders are retreating into hiding.",Communist China freedom fighter Hong Kong send mainland China face torture life sentence jail bad democracy group disband activist delete Twitter post freedom leader retreat hiding,1612,<UNK>,<UNK>,NikkiHaley
1278341735043805186,2020-07-01 14:56:34+00:00,The coronavirus pandemic has laid bare that many international bodies are still willing to do the bidding of some of the world’s most dangerous nations — including Iran,coronavirus pandemic lay bare international body willing bidding world dangerous nation include Iran,147,<UNK>,<UNK>,NikkiHaley
1278341296596410369,2020-07-01 14:54:50+00:00,"This is how to topple the tech tyrants, free market style. This is how to reel in the arrogance of the Big Tech liberals without dinging limited government principles. This is how to cut through the censorship — without resorting to more censorship.",topple tech tyrant free market style reel arrogance Tech liberal dinge limited government principle censorship resort censorship,273,<UNK>,<UNK>,NikkiHaley
1278340765563998208,2020-07-01 14:52:43+00:00,The U.S. should publicly warn the IMF that we will not accept its making any loan to Iran,U.S. publicly warn accept make loan Iran,232,<UNK>,<UNK>,NikkiHaley
1278092158248062983,2020-06-30 22:24:50+00:00,Thank you to @UWMadison for acknowledging the petition to remove the statue of Lincoln and Not caving but educating on why it would be counterproductive. We need more of this.,thank @UWMadison acknowledge petition remove statue Lincoln cave educate counterproductive need,296,<UNK>,@UWMadison,NikkiHaley
1277997572490223618,2020-06-30 16:08:59+00:00,Reducing police budgets hurts the very people who need security the most. #StopTheMadness,reduce police budget hurt people need security stopthemadness,855,#StopTheMadness,<UNK>,NikkiHaley
1277996776172199940,2020-06-30 16:05:50+00:00,"A sad day for Hong Kong as Beijing moves forward on its new natl security law. “we are not only denied the hope of a democratic political system, we also will no longer have our freedoms of press, speech, expression, protests — all of that will be over.”",Hong Kong Beijing move forward natl security deny hope democratic political system longer freedom press speech expression protest,562,<UNK>,<UNK>,NikkiHaley
1277980567116513280,2020-06-30 15:01:25+00:00,Minneapolis City Council advances a plan to abolish the police force. Yet 3 Council Members spent $63k on private security over the past 3 weeks. Council is receiving special protection while residents rely on armed groups bc the police are nowhere to be found. @standamericanow,Minneapolis City Council advance plan abolish police force Council Members spend private security past week Council receive special protection resident rely armed group police find @standamericanow,2771,<UNK>,@standamericanow,NikkiHaley
1277783021047988224,2020-06-30 01:56:26+00:00,"A sad moment in our amazing country. We are a country of laws. The second we stop being that, we lose everything our country was based on. This is not accomplishing anything.",moment amazing country country law second stop lose country base accomplish,1951,<UNK>,<UNK>,NikkiHaley
1277761991243939840,2020-06-30 00:32:53+00:00,Congratulations Mark! She is absolutely beautiful! 💕,congratulation Mark absolutely beautiful two_hearts,3,<UNK>,<UNK>,NikkiHaley
1277743466072735746,2020-06-29 23:19:16+00:00,".@WMichaelHaley &amp; I congratulate Janis Shinwary on becoming a US citizen! He is one of many men and women who have served alongside US military in Iraq &amp; Afghanistan, as a combat translator, directly saving American lives. Keeping America’s promises. ❤️🇺🇸 @n1leftbehind",.@WMichaelHaley congratulate Janis Shinwary citizen woman serve alongside military Iraq Afghanistan combat translator directly save american life keep America promise red_heart_selector::united_state @n1leftbehind,144,<UNK>,@WMichaelHaley @n1leftbehind,NikkiHaley
1277721289508126722,2020-06-29 21:51:08+00:00,My oped today: The US should publicly warn the IMF that we will not accept its making any loan to Iran. The answer to Iran’s very real problems isn’t to lift sanctions and give it a bailout — it is to demand that Iran change its monstrous behavior.,oped today publicly warn accept make loan Iran answer Iran real problem lift sanction bailout demand Iran change monstrous behavior,335,<UNK>,<UNK>,NikkiHaley
1277663756764557313,2020-06-29 18:02:32+00:00,"Having too many children is a major reason people are sent to detention camps with the parents of three or more ripped away from their families unless they can pay huge fines. Police raid homes, terrifying parents as they search for hidden children.",have child major reason people send detention camp parent rip away family huge fine Police raid home terrify parent search hidden child,212,<UNK>,<UNK>,NikkiHaley
1277644211773415424,2020-06-29 16:44:52+00:00,Looking forward to a great conversation. Hope you will join us! ❤️🇺🇸,look forward great conversation hope join red_heart_selector::united_states,51,<UNK>,<UNK>,NikkiHaley
1277599308934795264,2020-06-29 13:46:26+00:00,"China & Russia are among the worst human traffickers in the world. Yet, they’re trying to stoke the narrative that America is racist. It’s the height of hypocrisy, and the US should continue to hold them accountable for their human rights violations.",China Russia bad human trafficker world try stoke narrative America racist height hypocrisy continue hold accountable human right violation,504,<UNK>,<UNK>,NikkiHaley
1277598108889866241,2020-06-29 13:41:40+00:00,"Iran can’t be contained regionally if it can buy advanced Russian & Chinese weapons. The arms embargo isn’t perfect, but removing it would give Iran an even freer hand to destabilize the region by exporting terror in support of its revolutionary ideology.",Iran contain regionally advanced russian chinese weapon arm embargo perfect remove Iran free hand destabilize region export terror support revolutionary ideology,151,<UNK>,<UNK>,NikkiHaley
1277582881527861250,2020-06-29 12:41:09+00:00,"Any IMF loan to Iran would be the definition of naive. It would require willful ignorance of Iran’s past and current actions, to say nothing of the murderous character of the regime’s rulers. It would reward not just bad behavior, but truly evil acts. https://www.washingtonexaminer.com/opinion/op-eds/imf-is-angling-to-undermine-us-sanctions-against-iran",loan Iran definition naive require willful ignorance Iran past current action murderous character regime ruler reward behavior truly evil act,405,<UNK>,<UNK>,NikkiHaley
