id,created_at,original_text,clean_text,retweet_count,hashtags,mentions,original_author
1254776617831772163,2020-04-27 14:17:12+00:00,This is indefensible.,indefensible,3960,<UNK>,<UNK>,PeteButtigieg
1254081723039731712,2020-04-25 16:15:57+00:00,It’s more important than ever to separate reality from fiction when it comes to the politics of “voter fraud.”,important separate reality fiction come politic voter fraud,733,<UNK>,<UNK>,PeteButtigieg
1254047737613615104,2020-04-25 14:00:54+00:00,"Together, we are going to get through this crisis. And when we elect @JoeBiden, we will begin to restore the soul of this nation. Today on #SOULSaturday, get involved at http://joebiden.com/soulsaturday",go crisis elect @JoeBiden begin restore soul nation today soulsaturday involve,2204,#SOULSaturday,@JoeBiden,PeteButtigieg
1253700434918871040,2020-04-24 15:00:50+00:00,"I'm looking forward to taking part in @JoeBiden's #SOULSaturday tomorrow. I hope everyone, especially #TeamPete, will join us in thanking our essential workers and connecting with friends and neighbors to show the true character of this nation.",look forward take @JoeBiden SOULSaturday tomorrow hope especially TeamPete join thank essential worker connect friend neighbor true character nation,521,#SOULSaturday #TeamPete,@JoeBiden,PeteButtigieg
1253489596723277825,2020-04-24 01:03:03+00:00,"This pandemic—like climate change—has no respect for borders. These global problems require American leadership, not the opposite.",pandemic like climate change respect border global problem require american leadership opposite,539,<UNK>,<UNK>,PeteButtigieg
1253439525986217987,2020-04-23 21:44:05+00:00,"Holidays now are taking on new meaning, and requiring new ways of honoring old traditions, for people all of faiths. To Muslims around the world marking the start of the holy month, I extend my warmest regards and wish you #RamadanMubarak.",holiday take meaning require way honor tradition people faith Muslims world mark start holy month extend warm regard wish RamadanMubarak,486,#RamadanMubarak,<UNK>,PeteButtigieg
1253424630099918851,2020-04-23 20:44:53+00:00,Looking forward to talking with General @StanMcChrystal shortly! Please join us on Instagram.,look forward talk General @StanMcChrystal shortly join Instagram,141,<UNK>,@StanMcChrystal,PeteButtigieg
1253402181518098433,2020-04-23 19:15:41+00:00,"More than the bluster of our adversaries, it’s the sadness of our allies that shows just how much regard we have lost around the world. It’s not too late for America to restore our leadership role, but it soon will be.",bluster adversary sadness ally show regard lose world late America restore leadership role soon,590,<UNK>,<UNK>,PeteButtigieg
1253338208902889475,2020-04-23 15:01:29+00:00,I am so sorry to hear this heartbreaking news. Chasten and I send our deepest condolences from here in South Bend.,sorry hear heartbreake news chasten send deep condolence South Bend,243,<UNK>,<UNK>,PeteButtigieg
1253324212686557203,2020-04-23 14:05:52+00:00,The good news is that the people protesting on statehouse lawns represent a small minority relative to the attention they got. The bad news is that someone’s political party affects whether they think we should listen to doctors on how to save lives.,good news people protest statehouse lawn represent small minority relative attention news political party affect think listen doctor save life,971,<UNK>,<UNK>,PeteButtigieg
1253322374092480528,2020-04-23 13:58:34+00:00,"Health care is one more area where the pandemic has laid bare why we cannot, and should not, go back to what we had before.",health care area pandemic lay bare,411,<UNK>,<UNK>,PeteButtigieg
1253038012335886342,2020-04-22 19:08:37+00:00,Muffet McGraw has earned legendary status for her tremendous national impact on college basketball—as well as the deep respect and affection of our local community in South Bend. Thank you for your leadership!,Muffet McGraw earn legendary status tremendous national impact college basketball deep respect affection local community South Bend thank leadership,166,<UNK>,<UNK>,PeteButtigieg
1253036355321581568,2020-04-22 19:02:02+00:00,"This #EarthDay in particular, we should pause and consider our relationship with nature. Taking stock of our vulnerability to things we cannot control might fuel our urgency to better manage what is within our power, to pay attention to science, and to care about the big picture.",earthday particular pause consider relationship nature take stock vulnerability thing control fuel urgency better manage power attention science care picture,512,#EarthDay #EarthDay,<UNK>,PeteButtigieg
1252997885202960385,2020-04-22 16:29:10+00:00,I've had enormous respect for General @StanMcChrystal for a long time. On Thursday at 5pm ET we'll be hosting an Instagram Live together to discuss leadership in America today. Go to my Instagram and send us your questions. Hope you can join!,enormous respect General @StanMcChrystal long time Thursday host Instagram live discuss leadership America today Instagram send question hope join,364,<UNK>,@StanMcChrystal,PeteButtigieg
1252986834965204992,2020-04-22 15:45:15+00:00,"A governor making this kind of life-or-death decision should be paying much closer attention to scientists, doctors—and, yes, mayors.",governor make kind life death decision pay close attention scientist doctor mayor,966,<UNK>,<UNK>,PeteButtigieg
1252669053057015808,2020-04-21 18:42:30+00:00,Many of us are eager to take action and make a difference but not used to volunteering from home. @OneFairWage is building a volunteer army to help the millions of workers applying for assistance. Learn more or sign up here:,eager action difference volunteer home @OneFairWage build volunteer army help million worker apply assistance learn sign,269,<UNK>,@onefairwage,PeteButtigieg
1252623840724877312,2020-04-21 15:42:50+00:00,"All this sounds difficult and expensive, because it is. But it’s a cinch and a bargain compared with continued collective quarantine. We’ll have to mobilize in a way not seen since WWII. But that’s exactly what this moment calls for.",sound difficult expensive cinch bargain compare continue collective quarantine mobilize see WWII exactly moment call,432,<UNK>,<UNK>,PeteButtigieg
1252623839214927872,2020-04-21 15:42:50+00:00,"It would take 5 million tests a day by June, 20 million a day by July. It would take a national production board, and/or an interstate compact, to distribute the tests. It would mean enlisting at least 100,000 Americans to help with contact tracing. And it would take leadership.","million test June million July national production board and/or interstate compact distribute test mean enlist 100,000 Americans help contact tracing leadership",432,<UNK>,<UNK>,PeteButtigieg
1252623837595910144,2020-04-21 15:42:50+00:00,"It’s not a choice between continued economic anguish and accelerating widespread death. The way out is through massively increased Testing, Tracing, and Supported Isolation.",choice continued economic anguish accelerate widespread death massively increase testing trace support isolation,160,<UNK>,<UNK>,PeteButtigieg
1252623835406446593,2020-04-21 15:42:49+00:00,"There is a way to safely reopen by summer, and stay open. It won’t be easy but it can be done.",safely reopen summer stay open easy,1099,<UNK>,<UNK>,PeteButtigieg
1252597986191904768,2020-04-21 14:00:06+00:00,Tonight at 8pm ET I'll be hosting a video chat with #TeamPete and answering a few questions. Hope you can join!,tonight host video chat TeamPete answer question hope join,354,#TeamPete,<UNK>,PeteButtigieg
1252577557502885888,2020-04-21 12:38:56+00:00,Countless lives and millions of jobs could be saved if the president had it in him to walk away from the outrage machine and Just Get Us More Tests.,countless life million job save president walk away outrage machine test,11186,<UNK>,<UNK>,PeteButtigieg
1252252362162479110,2020-04-20 15:06:43+00:00,It's not about you.,,3914,<UNK>,<UNK>,PeteButtigieg
1252245398212816898,2020-04-20 14:39:03+00:00,"State and local leaders are working to make this happen, and they deserve more support.",state local leader work happen deserve support,298,<UNK>,<UNK>,PeteButtigieg
1252245395796877313,2020-04-20 14:39:02+00:00,Reject the false choice between indefinite social distancing and trying to snap back to normal. We'll be able to safely begin reopening—if and only if we massively increase testing.,reject false choice indefinite social distancing try snap normal able safely begin reopen massively increase testing,2510,<UNK>,<UNK>,PeteButtigieg
1251258204329316352,2020-04-17 21:16:17+00:00,Good eye. Calling it eclectic is generous. Just got these bookshelves assembled so for now they’re pretty much “organized” by size. But when there is a section for music (or 20th century history?) this great work will have pride of place.,good call eclectic generous bookshelf assemble pretty organize size section music 20th century history great work pride place,24,<UNK>,<UNK>,PeteButtigieg
1250939441583194114,2020-04-17 00:09:38+00:00,What a nice memory--it was always great seeing you on the trail and wonderful meeting Maile! Chasten and I are so grateful for your leadership and sending our best from South Bend.,nice memory great see trail wonderful meeting Maile chasten grateful leadership send good South Bend,407,<UNK>,<UNK>,PeteButtigieg
1250908021301141504,2020-04-16 22:04:47+00:00,"As General @StanMcChrystal says, the battle with COVID-19 will depend on leadership in the field, and requires state and local leaders to be networked together with good information and resources. Once again, this is a time for mayoral leadership across the country.",General @StanMcChrystal say battle COVID-19 depend leadership field require state local leader networked good information resource time mayoral leadership country,407,<UNK>,@StanMcChrystal,PeteButtigieg
1250765538491539467,2020-04-16 12:38:37+00:00,"So, #TeamPete, if you have suggestions for values and principles that should be included in Joe’s campaign code, share your thoughts here:",TeamPete suggestion value principle include campaign code share thought,227,#TeamPete,<UNK>,PeteButtigieg
1250765537333989376,2020-04-16 12:38:36+00:00,"Our campaign lived by a set of values we called the Rules of the Road. They guided me, our staff, and supporters at every step. I’m delighted @TeamJoe is codifying the principles that will guide the campaign to restore leadership and decency to the White House.",campaign live value call Rules Road guide staff supporter step delighted @TeamJoe codify principle guide campaign restore leadership decency White House,1401,<UNK>,@TeamJoe,PeteButtigieg
1250533127241584640,2020-04-15 21:15:05+00:00,"You can now go to the IRS website to see the status of your relief check that @HouseDemocrats fought hard for. Since the president decided it was worth delaying the paper checks for his signature, you might also want to sign up for direct deposit.",website status relief check @HouseDemocrats fight hard president decide worth delay paper check signature want sign direct deposit,923,<UNK>,@HouseDemocrats,PeteButtigieg
1250416234748956672,2020-04-15 13:30:36+00:00,United. #TeamJoe,United TeamJoe,6839,#TeamJoe,<UNK>,PeteButtigieg
1250392372074201089,2020-04-15 11:55:47+00:00,"Leaders can focus on shifting blame, or focus on delivering solutions. Here’s an idea that goes back to WWII for how we can meet the need for massively increased testing.",leader focus shift blame focus deliver solution idea go WWII meet need massively increase testing,1163,<UNK>,<UNK>,PeteButtigieg
1250152604216307712,2020-04-14 20:03:02+00:00,"Mayors get things done. The swift and decisive leadership of @LondonBreed, and local leaders like her, will continue to save lives.",mayor thing swift decisive leadership @londonbreed local leader like continue save life,678,<UNK>,@LondonBreed,PeteButtigieg
1250080933358850053,2020-04-14 15:18:14+00:00,"Full of energy and emboldened by hope, a year ago today we launched our improbable campaign. Now the campaigning continues in new ways, as we work to deliver a presidency marked by decency and a new American era of belonging.",energy embolden hope year today launch improbable campaign campaigning continue way work deliver presidency mark decency american belong,1117,<UNK>,<UNK>,PeteButtigieg
1250069585589608450,2020-04-14 14:33:09+00:00,"Never mind your party loyalty (if Republican) or your allergy to party loyalty (if progressive). Never mind the clever ones who like to parse taking him “seriously” versus “literally."" An American president just said he has absolute power. Do something.",mind party loyalty Republican allergy party loyalty progressive mind clever one like parse take seriously versus literally american president say absolute power,12534,<UNK>,<UNK>,PeteButtigieg
1249855876820865028,2020-04-14 00:23:56+00:00,Very important result in Wisconsin - and a reminder of the vital work ahead. Congratulations @judgekarofsky and thank you for your leadership.,important result Wisconsin reminder vital work ahead congratulation @judgekarofsky thank leadership,967,<UNK>,@judgekarofsky,PeteButtigieg
1249837128554594306,2020-04-13 23:09:26+00:00,Promises made? Yes. Promises kept? No.,promise promise keep,1156,<UNK>,<UNK>,PeteButtigieg
1249797971132256262,2020-04-13 20:33:51+00:00,"As @RevDrBarber says, a pandemic like this both reveals and exploits the fissures in our society that leave millions vulnerable. His conversation with @JoeBiden is timely and important, especially for all who seek a more inclusive account of faith in politics.",@RevDrBarber say pandemic like reveal exploit fissure society leave million vulnerable conversation @JoeBiden timely important especially seek inclusive account faith politic,418,<UNK>,@RevDrBarber @JoeBiden,PeteButtigieg
1249776959623741442,2020-04-13 19:10:21+00:00,"Amen. Like our economy and our health, our democracy is endangered and we must take action.",amen like economy health democracy endanger action,1152,<UNK>,<UNK>,PeteButtigieg
1249709149266550789,2020-04-13 14:40:54+00:00,The work of @runforsomething is more important than ever. I'm looking forward to connecting this evening along with these pioneering Democratic leaders. Grab a ticket and join us! https://secure.actblue.com/donate/frontrow-mon?refcode=pb_tweet,work @runforsomething important look forward connect evening pioneer democratic leader grab ticket join,352,<UNK>,@runforsomething,PeteButtigieg
1249346713007149058,2020-04-12 14:40:42+00:00,"Today Christians around the world celebrate the triumph of light, faith, and life over darkness and death. It’s easy, obligatory even, to say this all has new meaning this year. But meaning is up to us... so let us fill this day with meaning, and with joy. #HappyEaster",today Christians world celebrate triumph light faith life darkness death easy obligatory meaning year meaning fill meaning HappyEaster,2034,#HappyEaster,<UNK>,PeteButtigieg
1248689405033951235,2020-04-10 19:08:48+00:00,"An Easter in isolation seems like a contradiction in terms. But this year, caring about our neighbors means keeping a distance, finding new and safe ways to observe, celebrate, and gather.",Easter isolation like contradiction term year care neighbor mean keep distance find safe way observe celebrate gather,678,<UNK>,<UNK>,PeteButtigieg
1248612428121698304,2020-04-10 14:02:55+00:00,Thank you for reminding us what presidential leadership looks like.,thank remind presidential leadership look like,18159,<UNK>,<UNK>,PeteButtigieg
1248400363406766080,2020-04-10 00:00:15+00:00,We can't let what happened in Wisconsin this week become the norm. This is the time to defend our democracy just as vigilantly as we protect our health and shore up our economy.,happen Wisconsin week norm time defend democracy vigilantly protect health shore economy,1636,<UNK>,<UNK>,PeteButtigieg
1248360379295641600,2020-04-09 21:21:22+00:00,"COVID-19 is deadlier for Black Americans, not because the virus discriminates but because America does. More than ever, intention and resources are needed to confront systemic racial health inequities.",COVID-19 deadly Black Americans virus discriminate America intention resource need confront systemic racial health inequity,1187,<UNK>,<UNK>,PeteButtigieg
1248356116595200000,2020-04-09 21:04:26+00:00,"This decision is perfectly backwards. The longer it takes us to massively increase testing, the more we have to rely on economically devastating lockdowns.",decision perfectly backwards long take massively increase testing rely economically devastating lockdown,4931,<UNK>,<UNK>,PeteButtigieg
1248280587221323777,2020-04-09 16:04:18+00:00,We thought the stakes for November couldn’t be higher. Then they got higher. This is our chance to unite and win.,think stake November high high chance unite,985,<UNK>,<UNK>,PeteButtigieg
1248248983509544965,2020-04-09 13:58:43+00:00,Proud to be on #TeamJoe,proud TeamJoe,3717,#TeamJoe,<UNK>,PeteButtigieg
1248029480251203584,2020-04-08 23:26:30+00:00,Looking forward to returning virtually to @TheView tomorrow! Hope you'll tune in.,look forward return virtually @theview tomorrow hope tune,715,<UNK>,@TheView,PeteButtigieg
1247983423190372355,2020-04-08 20:23:29+00:00,"Best wishes to all observing the beginning of Passover tonight. Even as so many experience this strange form of exile forced by the pandemic, may there be new ways to find connections with loved ones this holiday, and an occasion to gather strength. #ChagSameach",good wish observe beginning Passover tonight experience strange form exile force pandemic way find connection love one holiday occasion gather strength ChagSameach,563,#ChagSameach,<UNK>,PeteButtigieg
1247917718449381377,2020-04-08 16:02:23+00:00,"I’ve admired @BernieSanders’ courage for 20 years and loved getting to know him this last year on the trail. He and his supporters are a tremendous force, and I’m looking forward to teaming up to end the Trump presidency and open the door to a better American era.",admire @BernieSanders courage year love get know year trail supporter tremendous force look forward team trump presidency open door well american,10257,<UNK>,@BernieSanders,PeteButtigieg
1247891530469093377,2020-04-08 14:18:20+00:00,.@ewarren is right. The next COVID-19 relief package must include a plan to protect the right to vote—without risking your health or the health of those around you.,.@ewarren right covid-19 relief package include plan protect right vote risk health health,4951,<UNK>,@ewarren,PeteButtigieg
1247631921439531010,2020-04-07 21:06:44+00:00,This #WorldHealthDay calls for more than words to acknowledge the vital work of health care professionals on the front lines of this crisis—we should also honor them by listening when they urge us to stay home and do what we can to keep ourselves and one another healthy.,worldhealthday call word acknowledge vital work health care professional line crisis honor listen urge stay home healthy,713,#WorldHealthDay,<UNK>,PeteButtigieg
1247612007328763905,2020-04-07 19:47:36+00:00,Seeing our former campaign staff continue to do such important and meaningful work keeps me motivated. Proud of this organization and the folks behind it.,see campaign staff continue important meaningful work keep motivated proud organization folk,320,<UNK>,<UNK>,PeteButtigieg
1247534482485178370,2020-04-07 14:39:33+00:00,"Our democracy will be a casualty of the pandemic, if we fail to protect it. The attack on voting rights in Wisconsin cannot be accepted and must not be repeated.",democracy casualty pandemic fail protect attack vote right Wisconsin accept repeat,3135,<UNK>,<UNK>,PeteButtigieg
1247219449960312832,2020-04-06 17:47:43+00:00,"Racial disparities in health outcomes have long been a matter of life and death. Now they have an enormous new urgency, as patients of color face higher vulnerability to Covid-19. Releasing this data is a basic and needed step.",racial disparity health outcome long matter life death enormous urgency patient color face high vulnerability Covid-19 release data basic need step,475,<UNK>,<UNK>,PeteButtigieg
1247189497944604677,2020-04-06 15:48:42+00:00,"It’s already been a tough few days for the Navy. This is brutal, and embarrassing for an administration that already seemed beyond embarrassment when it comes to how they treat the military.",tough day Navy brutal embarrass administration embarrassment come treat military,7723,<UNK>,<UNK>,PeteButtigieg
1247172878056947714,2020-04-06 14:42:40+00:00,This powerful article shows how the presumption of dangerousness puts Black men in America at risk in countless ways - even when it comes to the freedom to follow CDC guidance safely.,powerful article show presumption dangerousness put black America risk countless way come freedom follow guidance safely,1019,<UNK>,<UNK>,PeteButtigieg
1246458973617901575,2020-04-04 15:25:52+00:00,Great artists often improvise. Impressive to see how quickly @BradPaisley and @Kimwilliamspais—and their collaborators—updated an already compelling new charity initiative to make a difference during this crisis by getting food to those who need support,great artist improvise impressive quickly @bradpaisley @Kimwilliamspais collaborator update compelling charity initiative difference crisis get food need support,368,<UNK>,@BradPaisley @Kimwilliamspais,PeteButtigieg
1246190978886664193,2020-04-03 21:40:57+00:00,"We'll be rolling out a series of endorsements—but many of America’s most promising emerging leaders are not always well known, so I’d love to hear from you. Are you supporting a candidate (for any office) who we should pay attention to? Tell us here: http://wtepac.us/join",roll series endorsement America promising emerge leader known love hear support candidate office attention tell,426,<UNK>,<UNK>,PeteButtigieg
1246190977930403842,2020-04-03 21:40:56+00:00,"Our nation and world are in a period of upheaval right now, which will make it more important than ever to support and elect good leaders this November and into the future. I'm pleased to share that Win the Era PAC is a new way for us to make a positive impact.",nation world period upheaval right important support elect good leader November future pleased share positive impact,1356,<UNK>,<UNK>,PeteButtigieg
1246092409135665154,2020-04-03 15:09:16+00:00,It’s so painful to watch a captain sidelined for looking after his sailors. And it’s so stirring to see their show of loyalty for #CaptainCrozier as he steps ashore. America’s national leadership deficit cannot go on forever.,painful watch captain sideline look sailor stir loyalty CaptainCrozier step ashore America national leadership deficit forever,12282,#CaptainCrozier,<UNK>,PeteButtigieg
1246090021259685892,2020-04-03 14:59:46+00:00,"To our friends in Wisconsin: please request your absentee ballot before today's extended 5pm deadline so that you can stay healthy, stay home, and vote for deserving leaders like Jill Karofsky for the WI Supreme Court. Go to https://myvote.wi.gov/en-US/VoteAbsentee",friend Wisconsin request absentee ballot today extended deadline stay healthy stay home vote deserve leader like Jill Karofsky Supreme Court,889,<UNK>,<UNK>,PeteButtigieg
1245811016140800001,2020-04-02 20:31:06+00:00,"6,000,000+ Americans filed for unemployment. Last week. Mitch McConnell should get to work instead of telling Speaker Pelosi to ""stand down.""","6,000,000 Americans file unemployment week Mitch McConnell work instead tell Speaker Pelosi stand",1102,<UNK>,<UNK>,PeteButtigieg
1245793455328108546,2020-04-02 19:21:20+00:00,So glad to hear this. Sending my best to you and your family.,glad hear send good family,20,<UNK>,<UNK>,PeteButtigieg
1245769887705976832,2020-04-02 17:47:41+00:00,"Today is National #OutToWin Day—and the @VictoryFund is doing great work to recruit, train, &amp; elect out public officials at all levels of government. If you're LGBTQ and have ever considered running, now is the time to learn more and take the pledge at",today national OutToWin @VictoryFund great work recruit train elect public official level government LGBTQ consider run time learn pledge,306,#OutToWin,@VictoryFund,PeteButtigieg
1245730468869410823,2020-04-02 15:11:02+00:00,"This clear, actionable, urgent agenda for a comprehensive federal response deserves widespread attention.",clear actionable urgent agenda comprehensive federal response deserve widespread attention,886,<UNK>,<UNK>,PeteButtigieg
1245720299263361024,2020-04-02 14:30:38+00:00,This is important and alarming research that should guide the next round of policies for low-wage workers with kids during the #COVID19Pandemic,important alarming research guide round policy wage worker kid covid19pandemic,377,#COVID19Pandemic,<UNK>,PeteButtigieg
1245400934672367617,2020-04-01 17:21:35+00:00,"Since it's #CensusDay2020 we just completed ours! It's one of the most important things you can do right now to ensure resources and representation for your community. Fill it out by mail (like we did), by phone, or online at http://2020census.gov",censusday2020 complete important thing right ensure resource representation community fill mail like phone online,806,#CensusDay2020,<UNK>,PeteButtigieg
1245087977392439308,2020-03-31 20:38:01+00:00,These past weeks I've had time and space to reflect on the extraordinary experience of running for president. Looking forward to talking about that and more with @GUPolitics. Join us at 6:30 pm EST for a good conversation!,past week time space reflect extraordinary experience run president look forward talk @gupolitics join 6:30 good conversation,305,<UNK>,@GUPolitics,PeteButtigieg
1245079778828455936,2020-03-31 20:05:26+00:00,You belong. #TransDayOfVisibility,belong TransDayOfVisibility,1519,#TransDayOfVisibility,<UNK>,PeteButtigieg
