id,created_at,original_text,clean_text,retweet_count,hashtags,mentions,original_author
1245029778798923776,2020-03-31 16:46:45+00:00,Worth a listen. We need honest leadership back in the White House.,worth listen need honest leadership White House,1743,<UNK>,<UNK>,PeteButtigieg
1245001458786996225,2020-03-31 14:54:13+00:00,Least I could do! Hope you're staying healthy and thanks again for all the support.,hope stay healthy thank support,18,<UNK>,<UNK>,PeteButtigieg
1244994187734536194,2020-03-31 14:25:19+00:00,We need to do better—and we can. It’s time to ensure every American woman is paid fairly. #EqualPayDay,need well time ensure american woman pay fairly equalpayday,810,#EqualPayDay,<UNK>,PeteButtigieg
1244728729735172096,2020-03-30 20:50:29+00:00,"On #NationalDoctorsDay let's give thanks to them, and all of our medical professionals, for putting their own health and safety on the line to care for others. And right now, the most important way we can honor them is to #StayHome.",nationaldoctorsday thank medical professional put health safety line care right important honor StayHome,1414,#NationalDoctorsDay #StayHome #StayHome,<UNK>,PeteButtigieg
1244710330611138562,2020-03-30 19:37:23+00:00,"Our public health crisis is impacting every aspect of everyday life for all of us, including military families. @BlueStarFamily is once again reaching out to help. If you are a military family member, respond to their Pain Points poll: https://bluestarfam.us/BSF-COVID-19",public health crisis impact aspect everyday life include military family @bluestarfamily reach help military family member respond Pain Points poll,350,<UNK>,@BlueStarFamily,PeteButtigieg
1244651999586648072,2020-03-30 15:45:35+00:00,"And yes, with that said, it still makes sense to give Americans new ways to decouple all kinds of benefits (from retirement and sick leave to health coverage) from specific employment relationships.",say make sense Americans way decouple kind benefit retirement sick leave health coverage specific employment relationship,184,<UNK>,<UNK>,PeteButtigieg
1244651998600810497,2020-03-30 15:45:35+00:00,"Of course, employer-based aid is not enough—cash is needed to support domestic workers, gig workers, the unemployed, and more. But covering wages for employers who keep people on the books is our best shot at keeping jobs intact.",course employer base cash need support domestic worker worker unemployed cover wage employer people book good shot keep job intact,183,<UNK>,<UNK>,PeteButtigieg
1244645352227119104,2020-03-30 15:19:11+00:00,“But undermining our public institutions didn’t begin with Mr. Trump; it’s the lasting legacy of Ronald Reagan....” Forty years of this erosion without replacement has left Americans everywhere more vulnerable. Our era must produce something different.,undermine public institution begin Trump lasting legacy Ronald Reagan year erosion replacement leave Americans vulnerable produce different,668,<UNK>,<UNK>,PeteButtigieg
1244035767715999744,2020-03-28 22:56:54+00:00,Sure is. Good stuff! Be safe and stay well.,sure good stuff safe stay,178,<UNK>,<UNK>,PeteButtigieg
1243525920453001217,2020-03-27 13:10:57+00:00,"“A policy not of Freeze, not of Surrender, but of Mobilization.” Very important work here framing the overall strategy for dealing with #COVID19. It’s much bigger than the stimulus debate.",policy Freeze surrender mobilization important work frame overall strategy deal covid19 big stimulus debate,529,#COVID19,<UNK>,PeteButtigieg
1243261540276543489,2020-03-26 19:40:24+00:00,A major reason for the racial maternal mortality gap is that Black patients are less likely to be believed. It will be another stain on our country if the same patterns of bias create a COVID-19 treatment gap.,major reason racial maternal mortality black patient likely believe stain country pattern bias create covid-19 treatment,604,<UNK>,<UNK>,PeteButtigieg
1243209912177635328,2020-03-26 16:15:15+00:00,"The values that motivated our campaign—like service, kindness, and belonging—will be more important than ever in the days to come, even as we find new ways to make good on them. Stay home, stay safe, and stay hopeful.",value motivate campaign like service kindness belong important day come find way good stay home stay safe stay hopeful,284,<UNK>,<UNK>,PeteButtigieg
1243209911087108096,2020-03-26 16:15:15+00:00,".@SewLoved1, right here in South Bend, has focused their efforts to train people in sewing skills to produce masks and support area medical providers.",.@SewLoved1 right South Bend focus effort train people sewing skill produce mask support area medical provider,182,<UNK>,@SewLoved1,PeteButtigieg
1243209910055247873,2020-03-26 16:15:14+00:00,.@unitehere is providing economic relief for working families facing layoffs and uncertainty during the COVID-19 pandemic. https://unitehere.org/covid-19/?utm_campaign=PFA&amp;utm_medium=email&amp;utm_source=20200325&amp;emci=a2d88288-db6e-ea11-a94c-00155d03b1e8&amp;emdi=9aca878a-ea6e-ea11-a94c-00155d03b1e8&amp;ceid=247141,.@unitehere provide economic relief work family face layoff uncertainty covid-19 pandemic,129,<UNK>,@unitehere,PeteButtigieg
1243209909082173440,2020-03-26 16:15:14+00:00,".@Americares is funding the distribution of critical supplies, education, training, and other support for its staff and partners here at home and around the world.",.@Americares fund distribution critical supply education training support staff partner home world,129,<UNK>,@Americares,PeteButtigieg
1243209907958136832,2020-03-26 16:15:14+00:00,".@onefairwage is providing cash assistance to restaurant workers, car service drivers, delivery workers, and personal service workers who often rely on tips and whose income is threatened by COVID-19.",.@onefairwage provide cash assistance restaurant worker service driver delivery worker personal service worker rely tip income threaten COVID-19,149,<UNK>,@onefairwage,PeteButtigieg
1243209906943074310,2020-03-26 16:15:14+00:00,".@GlobalGiving is sending doctors, nurses, and health care workers to communities in need and is also helping to get masks, ventilators, and other lifesaving medical supplies to hospitals and clinics.",.@GlobalGiving send doctor nurse health care worker community need help mask ventilator lifesave medical supply hospital clinic,142,<UNK>,@GlobalGiving,PeteButtigieg
1243209905944788993,2020-03-26 16:15:13+00:00,.@nokidhungry is working to ensure that no child who normally receives a meal from a school lunch program goes hungry during the pandemic. https://www.nokidhungry.org/coronavirus?utm_campaign=PFA&amp;utm_medium=email&amp;utm_source=20200325&amp;emci=a2d88288-db6e-ea11-a94c-00155d03b1e8&amp;emdi=9aca878a-ea6e-ea11-a94c-00155d03b1e8&amp;ceid=247141,.@nokidhungry work ensure child normally receive meal school lunch program go hungry pandemic,122,<UNK>,@nokidhungry,PeteButtigieg
1243209904929869824,2020-03-26 16:15:13+00:00,.@_MealsonWheels delivers meals to vulnerable senior citizens. Their COVID-19 Response Fund will get emergency resources to local programs.,.@_MealsonWheels deliver meal vulnerable senior citizen COVID-19 Response Fund emergency resource local program,127,<UNK>,@_MealsOnWheels,PeteButtigieg
1243209903839358977,2020-03-26 16:15:13+00:00,.@FeedingAmerica is supporting local food banks to ensure nobody goes hungry during the pandemic. https://www.feedingamerica.org/take-action/coronavirus?utm_campaign=PFA&amp;utm_medium=email&amp;utm_source=20200325&amp;emci=a2d88288-db6e-ea11-a94c-00155d03b1e8&amp;emdi=9aca878a-ea6e-ea11-a94c-00155d03b1e8&amp;ceid=247141,.@FeedingAmerica support local food bank ensure go hungry pandemic,129,<UNK>,@FeedingAmerica,PeteButtigieg
1243209902660767749,2020-03-26 16:15:13+00:00,".@domesticworkers is providing $400 in emergency assistance for qualifying home care workers, nannies, and house cleaners who are experiencing financial hardship due to the COVID-19 pandemic. This allows these workers to stay home and stay safe. https://domesticworkers.org/coronavirus-care-fund?utm_campaign=PFA&amp;utm_medium=email&amp;utm_source=20200325&amp;emci=a2d88288-db6e-ea11-a94c-00155d03b1e8&amp;emdi=9aca878a-ea6e-ea11-a94c-00155d03b1e8&amp;ceid=247141",.@domesticworkers provide emergency assistance qualify home care worker nanny house cleaner experience financial hardship covid-19 pandemic allow worker stay home stay safe,134,<UNK>,@domesticworkers,PeteButtigieg
1243209901763112961,2020-03-26 16:15:12+00:00,"For action-oriented people, it’s difficult to accept that the most important thing we can do right now is stay home. But #TeamPete doesn't sit idly by. So, if you can help, here are organizations focused on making sure our most vulnerable communities stay safe &amp; healthy:",action orient people difficult accept important thing right stay home TeamPete idly help organization focus make sure vulnerable community stay safe healthy,1147,#TeamPete,<UNK>,PeteButtigieg
1242915735304835072,2020-03-25 20:46:18+00:00,"Now, more than ever, it's critical that we are listening to medical and public health professionals. Join us for a Q&A with @darakass over on my Instagram at 5 pm EST.",critical listen medical public health professional join @darakass Instagram,461,<UNK>,@darakass,PeteButtigieg
1242878903552806913,2020-03-25 18:19:56+00:00,"Everything depends on our democracy—and we must protect our democracy as vigorously as we do our health and our economy. This is a start but we need full and swift action on standards, protections, and funding to ensure fair elections this year.",depend democracy protect democracy vigorously health economy start need swift action standard protection funding ensure fair election year,777,<UNK>,<UNK>,PeteButtigieg
1242617348906942464,2020-03-25 01:00:37+00:00,.@darakass is on the front lines of this crisis. She's an emergency medicine doctor dealing with COVID-19 in NYC. Join us tomorrow on my Instagram for a live Q&amp;A at 5pm EST. Send us your questions there.,.@darakass line crisis emergency medicine doctor deal COVID-19 join tomorrow Instagram live q&amp;a send question,915,<UNK>,@darakass,PeteButtigieg
1242445633832857601,2020-03-24 13:38:17+00:00,"Here in South Bend, a local org that trains people in sewing skills has retooled to produce masks and support area medical providers. One more example of people figuring out how to make a difference—and they’re looking for help.",South Bend local train people sewing skill retool produce mask support area medical provider example people figure difference look help,1132,<UNK>,<UNK>,PeteButtigieg
1242304269564477441,2020-03-24 04:16:33+00:00,"These massive investments (not sacrificing the elderly) are how to avoid a depression, and are needed anyway. I’ve been more interested in deficit/debt than most in my party. But that was in a recovery, which is over. Now it’s time to think—and borrow—big.",massive investment sacrifice elderly avoid depression need interested deficit debt party recovery time think borrow,1242,<UNK>,<UNK>,PeteButtigieg
1242108359962222592,2020-03-23 15:18:04+00:00,"Lives depend on preserving the ACA, now more than ever. And lives depend on us going further, until there is no such thing as an uninsured American or an unaffordable prescription.",life depend preserve life depend go thing uninsured American unaffordable prescription,2628,<UNK>,<UNK>,PeteButtigieg
1242106501730316291,2020-03-23 15:10:41+00:00,"I’m wishing a speedy recovery for John, thinking of you and your family, and thankful for the work you have been doing to help shape America’s response.",wish speedy recovery John think family thankful work help shape America response,502,<UNK>,<UNK>,PeteButtigieg
1241380069538496515,2020-03-21 15:04:06+00:00,"We must protect our democracy from the effects of the pandemic, just as we must protect our economy and our health. The steps described in this @BrennanCenter plan deserve attention, action—and funding.",protect democracy effect pandemic protect economy health step describe @BrennanCenter plan deserve attention action funding,1071,<UNK>,@BrennanCenter,PeteButtigieg
1241075716327976963,2020-03-20 18:54:43+00:00,"The president's job is to reassure, as well as protect, the American people. No one should be surprised that given a chance to do so, he responded by personally attacking a reporter. But it is a reminder of what's newly at stake in restoring real leadership to the White House.",president reassure protect american people surprised give chance respond personally attack reporter reminder newly stake restore real leadership White House,12063,<UNK>,<UNK>,PeteButtigieg
1240838177956470791,2020-03-20 03:10:49+00:00,"A “wartime president” should be looking out for the troops, which right now means health workers. Invoking the #DefenseProductionAct to generate more PPE is needed and overdue. Time for action.",wartime president look troop right mean health worker invoke DefenseProductionAct generate need overdue time action,3374,#DefenseProductionAct,<UNK>,PeteButtigieg
1240052134453919746,2020-03-17 23:07:22+00:00,"The Senate should act quickly to approve this relief. Americans need major, swift, direct aid.",Senate quickly approve relief Americans need major swift direct,1297,<UNK>,<UNK>,PeteButtigieg
1238884764234461185,2020-03-14 17:48:39+00:00,"It was an honor! Thanks for taking the time, and for all you bring to stage and screen.",honor thank take time bring stage screen,1211,<UNK>,<UNK>,PeteButtigieg
1238852258265051136,2020-03-14 15:39:29+00:00,"As Americans come together to confront the effects of coronavirus, we’re seeing mayors, governors, and unsung state and local officials leading on the front lines. The quick, decisive action and innovation so many have shown is critical to how we will get through this.",Americans come confront effect coronavirus see mayor governor unsung state local official lead line quick decisive action innovation show critical,2971,<UNK>,<UNK>,PeteButtigieg
1238140983088381953,2020-03-12 16:33:08+00:00,"With lives and livelihoods on the line, Congress must act. This is a good time to call 202-224-3121 and tell your elected representative to put partisanship aside, put our #familiesfirst and pass this emergency legislation.",life livelihood line Congress good time 3121 tell elect representative partisanship aside familiesfirst pass emergency legislation,2409,#familiesfirst,<UNK>,PeteButtigieg
1235610909168582656,2020-03-05 16:59:31+00:00,"Senator @ewarren has made fighting on behalf of working families her life's work. Meeting urgency with moral courage, she’s the kind of leader Americans are fortunate to have, and I’m honored to have run alongside her.",Senator @ewarren fight behalf work family life work meet urgency moral courage kind leader Americans fortunate honor alongside,5049,<UNK>,@ewarren,PeteButtigieg
1234896070158757890,2020-03-03 17:39:01+00:00,How you vote today will shape what happens in November and whether we’re able to build the country we envisioned in our campaign. That’s why I’m asking you to cast your ballot for @JoeBiden. Find your polling location today.,vote today shape happen November able build country envision campaign ask cast ballot @JoeBiden find polling location today,4778,<UNK>,@JoeBiden,PeteButtigieg
1234649788886536192,2020-03-03 01:20:23+00:00,The only way we beat Trump is through a politics that reflects the decency of the American people. It’s what we sought to practice in my campaign—and it’s what @JoeBiden has practiced his whole life. I'm proud to stand with the VP and help make him our next Commander-in-Chief.,beat Trump politics reflect decency american people seek practice campaign @JoeBiden practice life proud stand help Commander chief,15418,<UNK>,@JoeBiden,PeteButtigieg
1234572604859715584,2020-03-02 20:13:40+00:00,"Campaigning beside @AmyKlobuchar I got to see firsthand the midwestern grit, determination and common sense that our country needs more of. I am thankful for the spirit and humor she brought to this race, and I look forward to working with her to build the country we all deserve.",campaign @AmyKlobuchar firsthand midwestern grit determination common sense country need thankful spirit humor bring race look forward work build country deserve,8833,<UNK>,@amyklobuchar,PeteButtigieg
1234299407136444416,2020-03-02 02:08:05+00:00,"Thank you for inviting me into your homes, sharing your stories, and putting your trust in me. We launched our campaign because Americans are hungry for a new kind of politics that brings us together. And together we'll beat this president and build the era that must come next.",thank invite home share story put trust launch campaign Americans hungry kind politic bring beat president build come,17086,<UNK>,<UNK>,PeteButtigieg
1234155073279856641,2020-03-01 16:34:33+00:00,"I stand with all the leaders and advocates in Michigan working to protect LGBTQ+ people from discrimination. As President, I will help pass the Equality Act, and with your courage and activism we can create a community where we all belong.",stand leader advocate Michigan work protect LGBTQ+ people discrimination President help pass Equality courage activism create community belong,1233,<UNK>,<UNK>,PeteButtigieg
1233958992440963072,2020-03-01 03:35:24+00:00,".@TomSteyer, thank you for your passion and your advocacy. This election has been made better by your voice on climate change and strengthening our democracy. I look forward to working with you to defeat Donald Trump and chart a new path for our country.",.@TomSteyer thank passion advocacy election well voice climate change strengthen democracy look forward work defeat Donald Trump chart path country,2165,<UNK>,@TomSteyer,PeteButtigieg
1233889894633758720,2020-02-29 23:00:50+00:00,We can beat this president without burning our party down. We can beat this president without anyone buying our party out. Join us and help build a movement that leaves toxic politics in the past and unifies Americans around bold solutions.,beat president burn party beat president buy party join help build movement leave toxic politic past unifie Americans bold solution,603,<UNK>,<UNK>,PeteButtigieg
1233857003015065605,2020-02-29 20:50:08+00:00,"Great to join our amazing volunteers in Columbia, SC for a Canvass Kick Off. I’m so proud of the extraordinary team we’ve built. Our movement is only possible because millions of Americans have decided our vision is worthy of their time and energy. Thank you for believing.",great join amazing volunteer Columbia Canvass Kick proud extraordinary team build movement possible million Americans decide vision worthy time energy thank believe,355,<UNK>,<UNK>,PeteButtigieg
1233839725103984646,2020-02-29 19:41:28+00:00,"Tenemos la obligación legal y moral de proteger a quienes buscan asilo. Estoy muy agradecido con los abogados que, por ahora, han acabado con el programa inhumano de 'Remain in Mexico'. Cuando sea presidente, acabaré permanentemente con este programa tan cruel.",Tenemos obligación legal moral proteger quiene buscan asilo Estoy agradecido abogados ahora acabado programa inhumano Remain Mexico Cuando presidente acabaré permanentemente este programa cruel,113,<UNK>,<UNK>,PeteButtigieg
1233839722704797700,2020-02-29 19:41:28+00:00,"We have an obligation, legally and morally, to protect asylum seekers. I am thankful for the lawyers who have brought a temporary end to the inhumane Remain in Mexico program. When I am President, I will permanently end this cruel program.",obligation legally morally protect asylum seeker thankful lawyer bring temporary inhumane Remain Mexico program President permanently cruel program,432,<UNK>,<UNK>,PeteButtigieg
1233806750022807552,2020-02-29 17:30:26+00:00,Looking forward to meeting with all of you at our virtual town hall in just a few minutes! I’ll be joined by @TheRyRichardson and @ReggieLove33 to talk about the state of the race and life on the trail. Sign up now for a chance to ask questions: http://p4a.us/RSVPPeteLive,look forward meet virtual town hall minute join @TheRyRichardson @reggielove33 talk state race life trail sign chance question,146,<UNK>,@TheRyRichardson @ReggieLove33,PeteButtigieg
1233798582140129281,2020-02-29 16:57:59+00:00,"Our country is running out of time, and if you don’t want to squander our only chance to defeat Donald Trump, join us. https://secure.actblue.com/donate/pete-buttigieg-social?refcode=20200229-PB-Twitter-13million",country run time want squander chance defeat Donald Trump join,211,<UNK>,<UNK>,PeteButtigieg
1233777302867251201,2020-02-29 15:33:26+00:00,"South Carolina, thank you for welcoming me into your homes, your communities, and your lives these past months. Today, you have the power to show the nation that we don’t have to choose between revolution and the status quo. We can chart a better course, and we will.",South Carolina thank welcome home community life past month today power nation choose revolution status chart well course,887,<UNK>,<UNK>,PeteButtigieg
1233602652208091136,2020-02-29 03:59:26+00:00,"We’re over 60% to our $13 million goal, but we need your help to keep our momentum going. Our campaign is up against billionaires and candidates who have spent decades in the national spotlight, but we’ve shown before we can beat expectations. Chip in: http://p4a.us/13million",million goal need help momentum go campaign billionaire candidate spend decade national spotlight show beat expectation chip,725,<UNK>,<UNK>,PeteButtigieg
1233553741229576192,2020-02-29 00:45:04+00:00,"Renee, I’m forever grateful for your mentorship and for welcoming me like family. I’ll do my best to keep making you proud.",renee forever grateful mentorship welcome like family good make proud,1698,<UNK>,<UNK>,PeteButtigieg
1233517729736425472,2020-02-28 22:21:59+00:00,"We have a chance to not only defeat Donald Trump, but to also leave behind the politics of division. Join us if you’re ready to unite this country around a vision for the future, and chip in if you’re determined to prevent another four years of chaos. https://secure.actblue.com/donate/pete-buttigieg-social?refcode=20200228-PB-Twitter-13million",chance defeat Donald Trump leave politic division join ready unite country vision future chip determined prevent year chaos,257,<UNK>,<UNK>,PeteButtigieg
1233510787483873285,2020-02-28 21:54:23+00:00,"I’m excited to join @TheRyRichardson, @ReggieLove33, and all of you for a virtual town hall on Saturday! Sign up now for a chance to ask questions and discuss the state of the race and life on the campaign trail: http://p4a.us/RSVPPeteLive",excited join @TheRyRichardson @reggielove33 virtual town hall Saturday sign chance question discuss state race life campaign trail,230,<UNK>,@TheRyRichardson @ReggieLove33,PeteButtigieg
1233494360634908672,2020-02-28 20:49:07+00:00,"Issues like Coronavirus are different from traditional national security threats. The virus doesn't care what country it's in—it can't be stopped by a wall. Today’s security challenges, whether in global health, cyber security, or election security, require a focus on the future.",issue like Coronavirus different traditional national security threat virus care country stop wall today security challenge global health cyber security election security require focus future,928,<UNK>,<UNK>,PeteButtigieg
1233459187562295298,2020-02-28 18:29:21+00:00,"South Carolina, tomorrow we can show the nation that Americans are ready to end the division and build a new path forward, together. Let's finish strong.",South Carolina tomorrow nation Americans ready division build path forward finish strong,425,<UNK>,<UNK>,PeteButtigieg
1233397709836619776,2020-02-28 14:25:04+00:00,"I proudly stand with the thousands of @SEIU26 janitors on strike for basic rights like fair pay, paid sick leave, and protections so their jobs don’t harm them or the environment.",proudly stand thousand @seiu26 janitor strike basic right like fair pay sick leave protection job harm environment,312,<UNK>,@SEIU26,PeteButtigieg
1233248321025736706,2020-02-28 04:31:27+00:00,"Los legisladores de Colorado lideran la lucha por nuestro ambiente con este proyecto de ley. HB 1261 ayudará a salvar el planeta para futuras generaciones, pero sólo si la Comisión de Calidad de Aire de Colorado adopta normas audaces—como lo haremos cuando yo sea presidente.",legisladore Colorado lideran lucha nuestro ambiente este proyecto 1261 ayudará salvar planeta para futuras generaciones pero sólo Comisión Calidad Aire Colorado adopta normas audaces como haremos cuando presidente,99,<UNK>,<UNK>,PeteButtigieg
1233248318819573760,2020-02-28 04:31:26+00:00,"Colorado lawmakers are leading the way on climate action with HB 1261. This law will help save our planet for future generations, but only if Colorado's Air Quality Change Commission adopts bold climate rules—as the federal government will do when I’m president.",Colorado lawmaker lead climate action 1261 help save planet future generation Colorado Quality Change Commission adopt bold climate rule federal government president,310,<UNK>,<UNK>,PeteButtigieg
1233242234734047232,2020-02-28 04:07:15+00:00,"We can't change history, but we can confront the shameful failures in our relationship with Tribal Nations and chart a new path based on active diplomacy. On the anniversary of the occupation of Wounded Knee, rescinding medals awarded to those who massacred innocents is a start.",change history confront shameful failure relationship Tribal Nations chart path base active diplomacy anniversary occupation Wounded Knee rescinding medal award massacre innocent start,883,<UNK>,<UNK>,PeteButtigieg
