id,created_at,original_text,clean_text,retweet_count,hashtags,mentions,original_author
1257532112233803782,2020-05-05 04:46:34+00:00,"....because they don’t know how to win, and their so-called Lincoln Project is a disgrace to Honest Abe. I don’t know what Kellyanne did to her deranged loser of a husband, Moonface, but it must have been really bad. John Weaver lost big for Kasich (to me). Crazed Rick Wilson....",know call Lincoln Project disgrace Honest know Kellyanne derange loser husband Moonface John Weaver lose Kasich Crazed Rick Wilson,11869,<UNK>,<UNK>,realDonaldTrump
1257532110971318274,2020-05-05 04:46:33+00:00,"....get even for all of their many failures. You see, these loser types don’t care about 252 new Federal Judges, 2 great Supreme Court Justices, a rebuilt military, a protected 2nd Amendment, biggest EVER Tax & Regulation cuts, and much more. I didn’t use any of them....",failure loser type care Federal Judges great Supreme Court Justices rebuilt military protect Amendment big Regulation cut,7584,<UNK>,<UNK>,realDonaldTrump
1257532101966036993,2020-05-05 04:46:31+00:00,"A group of RINO Republicans who failed badly 12 years ago, then again 8 years ago, and then got BADLY beaten by me, a political first timer, 4 years ago, have copied (no imagination) the concept of an ad from Ronald Reagan, “Morning in America”, doing everything possible to....",group RINO Republicans fail badly year year BADLY beat political timer year copy imagination concept Ronald Reagan Morning America possible,20949,<UNK>,<UNK>,realDonaldTrump
1257501668821868545,2020-05-05 02:45:35+00:00,THANK YOU #USNSComfort!,thank usnscomfort,15075,#USNSComfort,<UNK>,realDonaldTrump
1257438733240094726,2020-05-04 22:35:30+00:00,MSDNC and FAKE NEWS CNN are going wild trying to protect China!,MSDNC FAKE NEWS go wild try protect China,39718,<UNK>,<UNK>,realDonaldTrump
1257438615828865025,2020-05-04 22:35:02+00:00,"A great new book, “Fortitude: American Resilience in the Era of Outrage” by former Navy Seal, and current Texas Congressman @DanCrenshawTX, is now available. A fantastic guy — get your copy today!",great book fortitude American Resilience Outrage Navy Seal current Texas Congressman @dancrenshawtx available fantastic copy today,11330,<UNK>,@DanCrenshawTX,realDonaldTrump
1257315077243334656,2020-05-04 14:24:08+00:00,"Interesting? By Congress not wanting the special 5 minute testing apparatus, they are saying that they are not “essential”. In any event, we have great testing capacity, and have performed 6.5 million tests, which is more than every country in the world, combined!",interesting Congress want special minute testing apparatus say essential event great testing capacity perform million test country world combine,31285,<UNK>,<UNK>,realDonaldTrump
1257304527843110914,2020-05-04 13:42:13+00:00,"Mexico is sadly experiencing very big CoronaVirus problems, and now California, get this, doesn’t want people coming over the Southern Border. A Classic! They are sooo lucky that I am their President. Border is very tight and the Wall is rapidly being built!",Mexico sadly experience CoronaVirus problem California want people come Southern Border Classic sooo lucky President border tight Wall rapidly build,54193,<UNK>,<UNK>,realDonaldTrump
1257303100815261696,2020-05-04 13:36:33+00:00,"Republicans love the biggest Tax Cuts, Rebuilt Military, Choice for Vets, saving 2nd Amendment and many other things my Administration has done, but what they love beyond all else is 252 (so far!) Federal Judges, not including two great Supreme Court Justices. A Big Record!",Republicans love big cut Rebuilt Military Choice Vets save Amendment thing Administration love Federal Judges include great Supreme Court Justices record,22221,<UNK>,<UNK>,realDonaldTrump
1257286796523814914,2020-05-04 12:31:46+00:00,"And I’m Endorsing you also Lacy, you truly deserve it. You are doing a great job, and Omar is a disaster who wants much higher taxes, hates our Military & our Vets, demands Open Borders, and is fighting to take away our great 2nd Amendment. Good luck Lacy!",endorse Lacy truly deserve great Omar disaster want high taxis hate military vet demand open Borders fight away great Amendment good luck Lacy,34112,<UNK>,<UNK>,realDonaldTrump
1257283775375040512,2020-05-04 12:19:45+00:00,"Getting great reviews, finally, for how well we are handling the pandemic, especially our strong production of desperately needed ventilators, the building of field hospitals & beds, and soon, the great things we are doing on testing. People are really working well together!",get great review finally handle pandemic especially strong production desperately need ventilator building field hospital bed soon great thing testing People work,22763,<UNK>,<UNK>,realDonaldTrump
1257258214615367680,2020-05-04 10:38:11+00:00,"“Concast” should open up a long overdue Florida Cold Case against Psycho Joe Scarborough. I know him and Crazy Mika well, used them beautifully in the last Election, dumped them nicely, and will state on the record that he is “nuts”. Besides, bad ratings! #OPENJOECOLDCASE",Concast open long overdue Florida Cold Case Psycho Scarborough know Crazy Mika beautifully election dump nicely state record nuts rating OPENJOECOLDCASE,27020,#OPENJOECOLDCASE,<UNK>,realDonaldTrump
1257138589307219969,2020-05-04 02:42:50+00:00,I’m with the TRUCKERS all the way. Thanks for the meeting at the White House with my representatives from the Administration. It is all going to work out well!,trucker thank meeting White House representative Administration go work,24857,<UNK>,<UNK>,realDonaldTrump
1257047564219822080,2020-05-03 20:41:08+00:00,Thank you Ryan. Working hard!,thank Ryan work hard,18128,<UNK>,<UNK>,realDonaldTrump
1257041820124680192,2020-05-03 20:18:19+00:00,"....Fake News got it wrong again, as always, and tens of thousands of lives were saved by my EARLY BAN of China into our Country. The people that we’re allowed were heavily scrutinized and tested U.S. citizens, and as such, I welcome them with open arms!",Fake News wrong ten thousand life save EARLY China country people allow heavily scrutinize test U.S. citizen welcome open arm,21723,<UNK>,<UNK>,realDonaldTrump
1257041819097092096,2020-05-03 20:18:19+00:00,"Intelligence has just reported to me that I was correct, and that they did NOT bring up the CoronaVirus subject matter until late into January, just prior to my banning China from the U.S. Also, they only spoke of the Virus in a very non-threatening, or matter of fact, manner...",intelligence report correct bring CoronaVirus subject matter late January prior ban China U.S. speak Virus threatening matter fact manner,38779,<UNK>,<UNK>,realDonaldTrump
1257009530673803268,2020-05-03 18:10:00+00:00,Thank you very much to our beautiful “boaters.” I will never let you down!,thank beautiful boater,35740,<UNK>,<UNK>,realDonaldTrump
1256957565562486784,2020-05-03 14:43:31+00:00,"....And then came a Plague, a great and powerful Plague, and the World was never to be the same again! But America rose from this death and destruction, always remembering its many lost souls, and the lost souls all over the World, and became greater than ever before!",come Plague great powerful Plague World America rise death destruction remember lose soul lost soul World great,46761,<UNK>,<UNK>,realDonaldTrump
1256955754428448768,2020-05-03 14:36:19+00:00,So nice to see this great honor. Thank you (but haven’t played golf in a long time)!,nice great honor thank play golf long time,11660,<UNK>,<UNK>,realDonaldTrump
1256954349491818501,2020-05-03 14:30:44+00:00,Going well despite the Fake News!,go despite Fake News,13404,<UNK>,<UNK>,realDonaldTrump
1256931676099350528,2020-05-03 13:00:38+00:00,Some things never get old!,thing,22692,<UNK>,<UNK>,realDonaldTrump
1256930926485024768,2020-05-03 12:57:40+00:00,Progress being made!,progress,7876,<UNK>,<UNK>,realDonaldTrump
1256930571760087041,2020-05-03 12:56:15+00:00,Thank you!,thank,17741,<UNK>,<UNK>,realDonaldTrump
1256930134512357377,2020-05-03 12:54:31+00:00,Keep punching Mike!,punch Mike,16306,<UNK>,<UNK>,realDonaldTrump
1256929658890792960,2020-05-03 12:52:37+00:00,Thank you!,thank,9601,<UNK>,<UNK>,realDonaldTrump
1256928926124904448,2020-05-03 12:49:43+00:00,Wow!,,21720,<UNK>,<UNK>,realDonaldTrump
1256928204801089539,2020-05-03 12:46:51+00:00,"Hopefully our Country will soon mend. We are all missing our wonderful rallies, and many other things!",hopefully country soon mend miss wonderful rally thing,19955,<UNK>,<UNK>,realDonaldTrump
1256915740432760835,2020-05-03 11:57:19+00:00,"The Fake News doesn’t show real polls. Lamestream Media is totally CORRUPT, the Enemy of the People!",Fake News real poll Lamestream Media totally CORRUPT Enemy People,15771,<UNK>,<UNK>,realDonaldTrump
1256911953903202307,2020-05-03 11:42:16+00:00,".@PeteHegseth “Oh bye the way, I appreciate the message from former President Bush, but where was he during Impeachment calling for putting partisanship aside.” @foxandfriends He was nowhere to be found in speaking up against the greatest Hoax in American history!",.@PeteHegseth appreciate message President Bush Impeachment call put partisanship aside @foxandfriend find speak great Hoax american history,28149,<UNK>,@PeteHegseth @foxandfriends,realDonaldTrump
1256788149113520129,2020-05-03 03:30:19+00:00,"Beautiful, thank you to our GREAT @BlueAngels and @AFThunderbirds!",beautiful thank GREAT @blueangels @afthunderbirds,11917,<UNK>,@BlueAngels @AFThunderbirds,realDonaldTrump
1256721351722876933,2020-05-02 23:04:53+00:00,"No reason to turn it down, except politics. We have plenty of testing. Maybe you need a new Doctor over there. Crazy Nancy will use it as an excuse not to show up to work!",reason turn politic plenty testing maybe need doctor crazy Nancy excuse work,14915,<UNK>,<UNK>,realDonaldTrump
1256720284540981248,2020-05-02 23:00:39+00:00,"The Democrats are just, as always, looking for trouble. They do nothing constructive, even in times of crisis. They don’t want to blame their cash cow, China, for the plague. China is blaming Europe. Dr. Fauci will be testifying before the Senate very soon! #DONOTHINGDEMOCRATS",Democrats look trouble constructive time crisis want blame cash China plague China blame Europe Fauci testify Senate soon DONOTHINGDEMOCRATS,16040,#DONOTHINGDEMOCRATS,<UNK>,realDonaldTrump
1256713236331794437,2020-05-02 22:32:38+00:00,Not much time to sleep. Thank you!,time sleep thank,17773,<UNK>,<UNK>,realDonaldTrump
1256711660787695616,2020-05-02 22:26:23+00:00,"So true, although Honest Abe wasn’t bad. Thank you!",true honest thank,20310,<UNK>,<UNK>,realDonaldTrump
1256702883199881216,2020-05-02 21:51:30+00:00,"She was thrown off The View like a dog, Zero T.V. Personas. Now Wallace is a 3rd rate lapdog for Fake News MSDNC (Concast). Doesn’t have what it takes!",throw View like Zero T.V. Personas Wallace rate lapdog Fake News MSDNC Concast take,14375,<UNK>,<UNK>,realDonaldTrump
1256698677864861697,2020-05-02 21:34:47+00:00,Very cool. Please thank him!,cool thank,40610,<UNK>,<UNK>,realDonaldTrump
1256696015702425601,2020-05-02 21:24:13+00:00,"I, for one, am glad to see he is back, and well!",glad,23983,<UNK>,<UNK>,realDonaldTrump
1256693593961627655,2020-05-02 21:14:35+00:00,"Border Wall is going up FAST. Over 172 miles already built. 450 miles by early next year, or sooner! Dems want OPEN BORDERS. I want STRONG BORDERS!",border Wall go fast mile build mile early year soon dem want open border want STRONG border,24028,<UNK>,<UNK>,realDonaldTrump
1256691828516151296,2020-05-02 21:07:34+00:00,"The Impeachment Hoax will be exposed. Crazy Nancy gets Nothing Done, that’s why she got thrown out as Speaker the first time. Also, she should come back to Washington now!",Impeachment Hoax expose crazy Nancy get throw Speaker time come Washington,15598,<UNK>,<UNK>,realDonaldTrump
1256687254703157252,2020-05-02 20:49:24+00:00,"I hate to be promoting AT&T, but @OANN is Great News, not Fake News. Everybody should be carrying them!",hate promote AT&T @OANN Great News Fake News everybody carry,16307,<UNK>,@OANN,realDonaldTrump
1256683935444226048,2020-05-02 20:36:12+00:00,That’s right Jack. Keep up the good work!,right Jack good work,9078,<UNK>,<UNK>,realDonaldTrump
1256630090328346624,2020-05-02 17:02:15+00:00,Thank you Michael. You also!,thank Michael,13245,<UNK>,<UNK>,realDonaldTrump
1256628709496369152,2020-05-02 16:56:46+00:00,The Russia Hoax is the biggest political scandal in American history. Treason!!! Lets see how it ends????,Russia Hoax big political scandal american history Treason let end,33841,<UNK>,<UNK>,realDonaldTrump
1256589520608378881,2020-05-02 14:21:02+00:00,Thank you!,thank,17029,<UNK>,<UNK>,realDonaldTrump
1256573581657604096,2020-05-02 13:17:42+00:00,"96% Approval Rating in the Republican Party. Thank you! Also, just out, highest ever Approval Rating overall in the new Gallup Poll, and shows “Trump beating Sleepy Joe Biden.”",Approval Rating Republican Party thank high Approval Rating overall Gallup Poll show trump beat Sleepy Biden,35171,<UNK>,<UNK>,realDonaldTrump
1256570859935932416,2020-05-02 13:06:53+00:00,"There is tremendous CoronaVirus testing capacity in Washington for the Senators returning to Capital Hill on Monday. Likewise the House, which should return but isn’t because of Crazy Nancy P. The 5 minute Abbott Test will be used. Please inform Dr. Brian P. Monahan. @MarkMeadows",tremendous CoronaVirus testing capacity Washington senator return Capital Hill Monday likewise House return crazy Nancy minute Abbott Test inform Brian Monahan @MarkMeadows,18534,<UNK>,@MarkMeadows,realDonaldTrump
1256366878873792512,2020-05-01 23:36:20+00:00,Don’t allow RIGGED ELECTIONS!,allow rig elections,36195,<UNK>,<UNK>,realDonaldTrump
1256313938247127041,2020-05-01 20:05:58+00:00,....Together we will Fight for Small Businesses and Protect American Energy workers! Shelley has my Complete and Total Endorsement!,fight Small Businesses Protect American Energy worker Shelley Complete Total Endorsement,5962,<UNK>,<UNK>,realDonaldTrump
1256313936980226048,2020-05-01 20:05:58+00:00,"Senator Shelley Moore Capito (@CapitoforWV) is doing a tremendous job for the great people of West Virginia! She strongly defends our Second Amendment, Supports our Veterans and is Strong on Life and the Border....",Senator Shelley Moore Capito @CapitoforWV tremendous great people West Virginia strongly defend Second Amendment support veteran strong Life border,10837,<UNK>,@CapitoforWV,realDonaldTrump
1256243856166850560,2020-05-01 15:27:29+00:00,Concast (@NBCNews) and Fake News @CNN are going out of their way to say GREAT things about China. They are Chinese puppets who want to do business there. They use USA airwaves to help China. The Enemy of the People!,Concast @NBCNews Fake News @cnn go great thing China chinese puppet want business airwave help China Enemy People,42846,<UNK>,@NBCNews @CNN,realDonaldTrump
1256202305680158720,2020-05-01 12:42:23+00:00,"The Governor of Michigan should give a little, and put out the fire. These are very good people, but they are angry. They want their lives back again, safely! See them, talk to them, make a deal.",Governor Michigan little fire good people angry want life safely talk deal,38438,<UNK>,<UNK>,realDonaldTrump
1256195312965877760,2020-05-01 12:14:36+00:00,"Cryin Chuck Schumer, compared to what other Senators have brought home to their states, has brought very little back to N.Y. A totally overrated loser, the one thing he has given them is SALT. He never even called me to stop it. No wonder Cuomo & most others can’t stand him. AOC!",Cryin Chuck Schumer compare senator bring home state bring little New York totally overrate loser thing give SALT call stop wonder Cuomo stand,19793,<UNK>,<UNK>,realDonaldTrump
1256193615724007425,2020-05-01 12:07:51+00:00,"Cryin’ Chuck Schumer was on a late night show using a false talking point over & over again. “We don’t have enough testing ,” he would repeat, when he knows we have done a great job on Testing, just like we have on Ventilators and everything else. He lied, gave NY SALT. Run AOC!",Cryin Chuck Schumer late night false talking point testing repeat know great testing like Ventilators lie give SALT,23830,<UNK>,<UNK>,realDonaldTrump
1256190556839051264,2020-05-01 11:55:42+00:00,Dirty Cop!,Dirty,18443,<UNK>,<UNK>,realDonaldTrump
1256190183298473985,2020-05-01 11:54:13+00:00,"I have done more for farmers and ranchers than any President in history, and it has been my honor in doing so!",farmer rancher President history honor,14547,<UNK>,<UNK>,realDonaldTrump
1256024228777857025,2020-05-01 00:54:46+00:00,“The only thing we got wrong is that it was even worse (the corruption) than we thought.” @Jim_Jordan DIRTY COPS!,thing wrong bad corruption think @Jim_Jordan DIRTY COPS,36028,<UNK>,@Jim_Jordan,realDonaldTrump
1256016249169084417,2020-05-01 00:23:04+00:00,"Vote @MikeGarcia2020 by May 12th! His opponent @ChristyforCA25 voted to fire teachers, and cut their salaries while bumping up her pay. Now she’s mocking our Great Vets! We need Navy Fighter Pilot Mike Garcia in #CA25!",vote @MikeGarcia2020 12th opponent @ChristyforCA25 vote fire teacher salary bump mock great Vets need Navy Fighter Pilot Mike Garcia CA25,10639,#CA25,@MikeGarcia2020 @ChristyforCA25,realDonaldTrump
1256013240896835585,2020-05-01 00:11:06+00:00,"....He is Strong on Crime, the Border, and Second Amendment. Tom has deep roots in Wisconsin, is a big Tax Cutter, and will help me DRAIN THE SWAMP! Tom has my Complete and Total Endorsement. Vote for Tom Tiffany!",strong Crime Border Second Amendment deep root Wisconsin Cutter help drain swamp Complete Total Endorsement vote Tiffany,8058,<UNK>,<UNK>,realDonaldTrump
1256013239487549441,2020-05-01 00:11:06+00:00,"Tom Tiffany (@TomTiffanyWI) is a Great Advocate for the incredible people of Wisconsin (WI07). We need Tom in Congress to help us Make America Great Again! He will Fight for Small Business, supports our Incredible Farmers, Loves our Military and our Vets....",Tiffany @tomtiffanywi Great Advocate incredible people Wisconsin WI07 need Congress help America Great fight Small Business support incredible Farmers love military vet,12854,<UNK>,@TomTiffanyWI,realDonaldTrump
1255926261068763143,2020-04-30 18:25:29+00:00,"Over 120 MILLION Economic Impact Payments have already gone out to hardworking Americans! If you haven’t yet received your payment, go to http://IRS.gov and click on “GET MY PAYMENT” to receive your money FAST!",MILLION Economic Impact payment go hardworking Americans receive payment click payment receive money fast,15928,<UNK>,<UNK>,realDonaldTrump
1255861756741726208,2020-04-30 14:09:10+00:00,"We can’t let the Fake News, and their partner, the Radical Left, Do Nothing Democrats, get away with stealing the Election. They tried that in 2016. How did that work out?",Fake News partner Radical Left Democrats away steal Election try 2016 work,42384,<UNK>,<UNK>,realDonaldTrump
1255842713603387392,2020-04-30 12:53:30+00:00,The Do Nothing Democrats!,Democrats,11729,<UNK>,<UNK>,realDonaldTrump
1255837215927787520,2020-04-30 12:31:39+00:00,FAKE NEWS!,FAKE NEWS,11174,<UNK>,<UNK>,realDonaldTrump
1255837028526297088,2020-04-30 12:30:54+00:00,Great!,great,12738,<UNK>,<UNK>,realDonaldTrump
1255832117583495169,2020-04-30 12:11:23+00:00,DIRTY COP JAMES COMEY GOT CAUGHT!,dirty james COMEY CAUGHT,51261,<UNK>,<UNK>,realDonaldTrump
1255829937690480643,2020-04-30 12:02:43+00:00,Plus many!,plus,12984,<UNK>,<UNK>,realDonaldTrump
1255828428814770176,2020-04-30 11:56:44+00:00,"FAKE POLLING, just like 2016 (but worse)!",FAKE POLLING like 2016 worse,18485,<UNK>,<UNK>,realDonaldTrump
1255826177350144001,2020-04-30 11:47:47+00:00,"What happened to General Michael Flynn, a war hero, should never be allowed to happen to a citizen of the United States again!",happen General Michael Flynn hero allow happen citizen United States,36618,<UNK>,<UNK>,realDonaldTrump
1255825998521741312,2020-04-30 11:47:04+00:00,"Does anybody really believe that Roger Stone, a man whose house was raided early in the morning by 29 gun toting FBI Agents (with Fake News @CNN closely in toe), was treated fairly. How about the jury forewoman with her unannounced hatred &amp; bias. Same scammers as General Flynn!",anybody believe Roger Stone house raid early morning tote Agents Fake News @cnn closely treat fairly jury forewoman unannounced hatred bias scammer General Flynn,27754,<UNK>,@CNN,realDonaldTrump
1255825648448348161,2020-04-30 11:45:41+00:00,"Despite reports to the contrary, Sweden is paying heavily for its decision not to lockdown. As of today, 2462 people have died there, a much higher number than the neighboring countries of Norway (207), Finland (206) or Denmark (443). The United States made the correct decision!",despite report contrary Sweden pay heavily decision lockdown today 2462 people die high number neighbor country Norway Finland Denmark United States correct decision,16787,<UNK>,<UNK>,realDonaldTrump
1255718837762306049,2020-04-30 04:41:15+00:00,Lyin’ Brian Williams of MSDNC!,Lyin Brian Williams MSDNC,18887,<UNK>,<UNK>,realDonaldTrump
1255714490554953736,2020-04-30 04:23:59+00:00,"I must admit that Lyin’ Brian Williams is, while dumber than hell, quite a bit smarter than Fake News @CNN “anchorman” Don Lemon, the “dumbest man on television”. Then you have Psycho Joe “What Ever Happened To Your Girlfriend?” Scarborough, another of the low I.Q. individuals!",admit Lyin Brian Williams dumb hell smart Fake News @cnn anchorman Lemon dumb television Psycho happen girlfriend scarborough I.Q. individual,33675,<UNK>,@CNN,realDonaldTrump
1255710938075889664,2020-04-30 04:09:52+00:00,"Lyin’ Brian Williams of MSDNC, a Concast Scam Company, wouldn’t know the truth if it was nailed to his wooden forehead. Remember when he lied about his bravery in a helicopter? Totally made up story. He’s a true dummy who was thrown off Network News like a dog. Stay tuned!",Lyin Brian Williams MSDNC Concast Scam Company know truth nail wooden forehead remember lie bravery helicopter totally story true dummy throw Network News like stay tune,23423,<UNK>,<UNK>,realDonaldTrump
1255708741950943233,2020-04-30 04:01:08+00:00,"Just told that Fake News @CNN is falsely reporting that I was recently shouting at my campaign manager over made up nonsense. Actually, he is doing a great job, I never shouted at him (been with me for years, including the 2016 win), &amp; have no intention to do so. Just FAKE NEWS!",tell Fake News @cnn falsely report recently shout campaign manager nonsense actually great shout year include 2016 intention FAKE NEWS,25473,<UNK>,@CNN,realDonaldTrump
1255706636972363776,2020-04-30 03:52:46+00:00,".@CNN doesn’t want to speak about their persecution of General Michael Flynn &amp; why they got the story so wrong. They, along with others, should pay a big price for what they have purposely done to this man &amp; his family. They won’t even cover the big breaking news about this scam!",.@CNN want speak persecution General Michael Flynn story wrong price purposely family cover breaking news scam,40765,<UNK>,@CNN,realDonaldTrump
1255661296047067138,2020-04-30 00:52:36+00:00,"Happy Birthday to three time Olympian and five term Congressman, @JimRyun!",happy birthday time Olympian term Congressman @jimryun,7301,<UNK>,@jimryun,realDonaldTrump
1255510996623527936,2020-04-29 14:55:22+00:00,"No, I think Amash would make a wonderful candidate, especially since he is way behind in his district and has no chance of maintaining his Congressional seat. He almost always votes for the Do Nothing Dems anyway. I like him even more than Jill Stein!",think Amash wonderful candidate especially district chance maintain congressional seat vote Dems like Jill Stein,14038,<UNK>,<UNK>,realDonaldTrump
1255507868280856581,2020-04-29 14:42:56+00:00,THANK YOU @MarkLevinShow!,thank @marklevinshow,21114,<UNK>,@marklevinshow,realDonaldTrump
1255484391364665351,2020-04-29 13:09:39+00:00,At least they admit it. The Failing @nytimes &amp; @washingtonpost never correct their Fake Reporting!,admit Failing @nytime @washingtonpost correct Fake reporting,21540,<UNK>,@nytimes @washingtonpost,realDonaldTrump
1255352014042738688,2020-04-29 04:23:38+00:00,"The only reason the U.S. has reported one million cases of CoronaVirus is that our Testing is sooo much better than any other country in the World. Other countries are way behind us in Testing, and therefore show far fewer cases!",reason U.S. report million case CoronaVirus testing sooo well country World country Testing few case,41034,<UNK>,<UNK>,realDonaldTrump
1255325711960768514,2020-04-29 02:39:07+00:00,THANK YOU MICHAEL! @bittyandbeaus,thank MICHAEL @bittyandbeaus,16407,<UNK>,@bittyandbeaus,realDonaldTrump
1255231394923646976,2020-04-28 20:24:20+00:00, https://twitter.com/realDonaldTrump/status/1255145720136359945,,20067,<UNK>,<UNK>,realDonaldTrump
1255145720136359945,2020-04-28 14:43:53+00:00,Thank you @BlueAngels and @AFThunderbirds! #AmericaStrong https://twitter.com/BlueAngels/status/1255144203849326594,thank @blueangels @afthunderbirds AmericaStrong,12096,#AmericaStrong,@BlueAngels @AFThunderbirds,realDonaldTrump
1255133977360265218,2020-04-28 13:57:14+00:00,"But I love Diamond & Silk, and so do millions of people!",love Diamond Silk million people,23919,<UNK>,<UNK>,realDonaldTrump
1255130302655148033,2020-04-28 13:42:38+00:00,Texas to open businesses in phases beginning Friday. Great job being done by @GregAbbott_TX,Texas open business phase begin Friday great @gregabbott_tx,24642,<UNK>,@GregAbbott_TX,realDonaldTrump
1255129366234890240,2020-04-28 13:38:54+00:00,Many States moving to SAFELY & QUICKLY reopen!,state move SAFELY QUICKLY reopen,30916,<UNK>,<UNK>,realDonaldTrump
