id,created_at,original_text,clean_text,retweet_count,hashtags,mentions,original_author
1166711516701347842,2019-08-28 13:57:56+00:00,"Just watched @FoxNews heavily promoting the Democrats through their DNC Communications Director, spewing out whatever she wanted with zero pushback by anchor, @SandraSmithFox. Terrible considering that Fox couldn’t even land a debate, the Dems give them NOTHING! @CNN &amp; @MSNBC....",watch @foxnews heavily promote Democrats Communications Director spew want zero pushback anchor @SandraSmithFox terrible considering land debate Dems @CNN @MSNBC,12570,<UNK>,@FoxNews @SandraSmithFox @CNN @MSNBC,realDonaldTrump
1166706175003545600,2019-08-28 13:36:43+00:00,"Would be very hard for Jeremy Corbyn, the leader of Britain’s Labour Party, to seek a no-confidence vote against New Prime Minister Boris Johnson, especially in light of the fact that Boris is exactly what the U.K. has been looking for, & will prove to be “a great one!” Love U.K.",hard Jeremy Corbyn leader Britain Labour Party seek confidence vote Prime Minister Boris Johnson especially light fact Boris exactly U.K. look prove great love U.K.,18477,<UNK>,<UNK>,realDonaldTrump
1166685686105329664,2019-08-28 12:15:18+00:00,"We are tracking closely tropical storm Dorian as it heads, as usual, to Puerto Rico. FEMA and all others are ready, and will do a great job. When they do, let them know it, and give them a big Thank You - Not like last time. That includes from the incompetent Mayor of San Juan!",track closely tropical storm Dorian head usual Puerto Rico FEMA ready great know thank like time include incompetent Mayor Juan,12157,<UNK>,<UNK>,realDonaldTrump
1166683442098163712,2019-08-28 12:06:23+00:00,"So interesting to read and see all of the free and interesting advice I am getting on China, from people who have tried to handle it before and failed miserably - In fact, they got taken to the cleaners. We are doing very well with China. This has never happened to them before!",interesting read free interesting advice get China people try handle fail miserably fact take cleaner China happen,21517,<UNK>,<UNK>,realDonaldTrump
1166672386214772736,2019-08-28 11:22:27+00:00,"“The infestation of bedbugs at The New York Times office” @OANN was perhaps brought in by lightweight journalist Bret Stephens, a Conservative who does anything that his bosses at the paper tell him to do! He is now quitting Twitter after being called a “bedbug.” Tough guy!",infestation bedbug York Times office @OANN bring lightweight journalist Bret Stephens Conservative boss paper tell quit Twitter call bedbug tough,12365,<UNK>,@OANN,realDonaldTrump
1166551774431498247,2019-08-28 03:23:11+00:00,"A made up Radical Left Story about Doral bedbugs, but Bret Stephens is loaded up with them! Been calling me wrong for years, along with the few remaining Never Trumpers - All Losers!",Radical Left Story doral bedbug Bret Stephens load call wrong year remain Trumpers loser,11025,<UNK>,<UNK>,realDonaldTrump
1166494782904000512,2019-08-27 23:36:43+00:00,"....Another is a one-time BAD Congressman from Illinois who lost in his second term by a landslide, then failed in radio. The third is a man who couldn’t stand up straight while receiving an award. I should be able to take them!",time Congressman Illinois lose second term landslide fail radio stand straight receive award able,14314,<UNK>,<UNK>,realDonaldTrump
1166494781935095810,2019-08-27 23:36:43+00:00,"Can you believe it? I’m at 94% approval in the Republican Party, and have Three Stooges running against me. One is “Mr. Appalachian Trail” who was actually in Argentina for bad reasons....",believe approval Republican Party Stooges run Appalachian Trail actually Argentina reason,18161,<UNK>,<UNK>,realDonaldTrump
1166493307377078272,2019-08-27 23:30:51+00:00,"Axios (whatever that is) sat back and said GEEEEE, let’s see, what can we make up today to embarrass the President? Then they said, “why don’t we say he wants to bomb a hurricane, that should do it!” The media in our Country is totally out of control!",axio say GEEEEE today embarrass President say want bomb hurricane medium country totally control,20202,<UNK>,<UNK>,realDonaldTrump
1166471454705274880,2019-08-27 22:04:01+00:00,"They do stories so big on Elizabeth “Pocahontas” Warren’s crowd sizes, adding many more people than are actually there, and yet my crowds, which are far bigger, get no coverage at all. Fake News!",story Elizabeth Pocahontas Warren crowd size add people actually crowd big coverage Fake News,14567,<UNK>,<UNK>,realDonaldTrump
1166467681182261248,2019-08-27 21:49:01+00:00,It is amazing that I can be at 51% with Zogby when the Fake & Corrupt News is almost 100% against me. Great job Mr. President!,amazing Zogby Fake Corrupt News great President,13594,<UNK>,<UNK>,realDonaldTrump
1166467125155905539,2019-08-27 21:46:49+00:00,"The G7 in France was so successful, and yet when I came back and read the Corrupt and Fake News, and watched numerous networks, it was not even recognizable from what actually took place at the Great G7 event!",France successful come read corrupt Fake News watch numerous network recognizable actually take place Great event,15901,<UNK>,<UNK>,realDonaldTrump
1166466892770549765,2019-08-27 21:45:53+00:00,"Looking forward to being with Dan Bishop in two weeks, in North Carolina. His opponent believes in Open Borders and Sanctuary Cities, and won’t protect your Second Amendment! https://www.donaldjtrump.com/events/sep-noca-2019/",look forward Bishop week North Carolina opponent believe open Borders Sanctuary Cities protect Second Amendment,10014,<UNK>,<UNK>,realDonaldTrump
1166464374900514818,2019-08-27 21:35:53+00:00,".@JudgeJeanine Pirro is following up her #1 Best Seller with another book that is destined to also be #1 – “Radicals, Resistance, and Revenge: The Left's Plot to Remake America.” Out today, go get it!",.@JudgeJeanine Pirro follow good Seller book destine Radicals Resistance revenge Left Plot remake America today,10306,<UNK>,@JudgeJeanine,realDonaldTrump
1166389407588466690,2019-08-27 16:37:59+00:00,The Federal Reserve loves watching our manufacturers struggle with their exports to the benefit of other parts of the world. Has anyone looked at what almost all other countries are doing to take advantage of the good old USA? Our Fed has been calling it wrong for too long!,Federal Reserve love watch manufacturer struggle export benefit part world look country advantage good call wrong long,17527,<UNK>,<UNK>,realDonaldTrump
1166386714211946497,2019-08-27 16:27:17+00:00,100% Confirmed!,Confirmed,11672,<UNK>,<UNK>,realDonaldTrump
1166382203808440320,2019-08-27 16:09:22+00:00,"Wow! Yet another big storm heading to Puerto Rico. Will it ever end? Congress approved 92 Billion Dollars for Puerto Rico last year, an all time record of its kind for “anywhere.”",storm head Puerto Rico Congress approve billion dollar Puerto Rico year time record kind,12700,<UNK>,<UNK>,realDonaldTrump
1166361079716503553,2019-08-27 14:45:26+00:00,The G-7 was a great success for the USA and all. LameStream Media coverage bore NO relationship to what actually happened in France - FAKE NEWS. It was GREAT!,great success LameStream Media coverage bear relationship actually happen France FAKE NEWS great,13096,<UNK>,<UNK>,realDonaldTrump
1166359891193344000,2019-08-27 14:40:42+00:00,"No bedbugs at Doral. The Radical Left Democrats, upon hearing that the perfectly located (for the next G-7) Doral National MIAMI was under consideration for the next G-7, spread that false and nasty rumor. Not nice!",bedbug Doral radical Left Democrats hear perfectly locate Doral National MIAMI consideration spread false nasty rumor nice,14380,<UNK>,<UNK>,realDonaldTrump
1166358721875894272,2019-08-27 14:36:03+00:00,"Starting to look good for the highly respected Prime Minister of the Italian Republic, Giuseppe Conte. Represented Italy powerfully at the G-7. Loves his Country greatly & works well with the USA. A very talented man who will hopefully remain Prime Minister!",start look good highly respected Prime Minister Italian Republic Giuseppe Conte represent Italy powerfully love country greatly work talented hopefully remain Prime Minister,10428,<UNK>,<UNK>,realDonaldTrump
1166357258726498304,2019-08-27 14:30:15+00:00,I have gotten to know President @jairbolsonaro well in our dealings with Brazil. He is working very hard on the Amazon fires and in all respects doing a great job for the people of Brazil - Not easy. He and his country have the full and complete support of the USA!,get know President @jairbolsonaro dealing Brazil work hard Amazon fire respect great people Brazil easy country complete support,22109,<UNK>,@jairbolsonaro,realDonaldTrump
1166176076952940544,2019-08-27 02:30:17+00:00,"Just returned to Washington from France and the very successful G-7, only to find that the Fake News is still trying to perpetuate the phony story that I wanted to use Nuclear weapons to blow up hurricanes before they reach shore. This is so ridiculous, never happened!",return Washington France successful find Fake News try perpetuate phony story want nuclear weapon blow hurricane reach shore ridiculous happen,26623,<UNK>,<UNK>,realDonaldTrump
1166075600789897216,2019-08-26 19:51:02+00:00,Thank you Mark!,thank Mark,11974,<UNK>,<UNK>,realDonaldTrump
1166075166092193792,2019-08-26 19:49:18+00:00,I agree 100%!,agree,9486,<UNK>,<UNK>,realDonaldTrump
1166048146079666176,2019-08-26 18:01:56+00:00,THANK YOU FRANCE🇺🇸🇫🇷 #G7Biarritz,thank FRANCE united_states::france g7biarritz,15888,#G7Biarritz,<UNK>,realDonaldTrump
1165963643424530432,2019-08-26 12:26:09+00:00,"Just wrapped up a great meeting with my friend Prime Minister @NarendraModi of India at the #G7Summit in Biarritz, France!",wrap great meeting friend Prime Minister @NarendraModi India g7summit Biarritz France,23490,#G7Summit,@narendramodi,realDonaldTrump
1165960433683062784,2019-08-26 12:13:24+00:00,"Very productive meeting with Angela Merkel, the Chancellor of the Federal Republic of Germany, at the #G7Summit in Biarritz, France!",productive meeting Angela Merkel Chancellor Federal Republic Germany g7summit Biarritz France,7896,#G7Summit,<UNK>,realDonaldTrump
1165919483191599104,2019-08-26 09:30:41+00:00,Great respect for the fact that President Xi & his Representatives want “calm resolution.” So impressed that they are willing to come out & state the facts so accurately. This is why he is a great leader & representing a great country. Talks are continuing!,great respect fact President representative want calm resolution impressed willing come state fact accurately great leader represent great country talk continue,14966,<UNK>,<UNK>,realDonaldTrump
1165918301932916736,2019-08-26 09:25:59+00:00,The story by Axios that President Trump wanted to blow up large hurricanes with nuclear weapons prior to reaching shore is ridiculous. I never said this. Just more FAKE NEWS!,story axio President Trump want blow large hurricane nuclear weapon prior reach shore ridiculous say fake NEWS,21831,<UNK>,<UNK>,realDonaldTrump
1165911287328645120,2019-08-26 08:58:07+00:00,"Great meeting this morning with President @AlsisiOfficial of Egypt at the Hôtel du Palais in Biarritz, France! #G7Summit",great meeting morning President @alsisiofficial Egypt Hôtel Palais Biarritz France G7Summit,7573,#G7Summit,@AlsisiOfficial,realDonaldTrump
1165869638779060224,2019-08-26 06:12:37+00:00,All Trump Haters and Lovers must watch. Thank you Steve Hilton!,Trump Haters Lovers watch thank Steve Hilton,28026,<UNK>,<UNK>,realDonaldTrump
1165865476192292864,2019-08-26 05:56:04+00:00,".@SteveHiltonx “The Democrats statements about Donald Trump are lies. Here are the Facts.” I will soon be posting the entire segment. Too much positive news, too many good things, to Tweet. PLEASE BE SURE TO WATCH! Thank you Steve Hilton for being a real pro and not being afraid!",.@SteveHiltonx Democrats statement Donald Trump lie fact soon post entire segment positive news good thing Tweet sure WATCH thank Steve Hilton real afraid,12507,<UNK>,@SteveHiltonx,realDonaldTrump
1165770908767621120,2019-08-25 23:40:18+00:00,Congratulations to Louisiana’s Champions. See you at the White House!,congratulation Louisiana Champions White House,11348,<UNK>,<UNK>,realDonaldTrump
1165768437353738240,2019-08-25 23:30:29+00:00,"My Stock Market gains must be judged from the day after the Election, November 9, 2016, where the Market went up big after the win, and because of the win. Had my opponent won, CRASH!",Stock Market gain judge Election November 2016 market go opponent crash,14567,<UNK>,<UNK>,realDonaldTrump
1165764325908180992,2019-08-25 23:14:08+00:00,"No, we actually had a very good and productive meeting. Nice!",actually good productive meeting nice,10928,<UNK>,<UNK>,realDonaldTrump
1165763483322834944,2019-08-25 23:10:47+00:00,"In France we are all laughing at how knowingly inaccurate the U.S. reporting of events and conversations at the G-7 is. These Leaders, and many others, are getting a major case study of Fake News at it’s finest! They’ve got it all wrong, from Iran, to China Tariffs, to Boris!",France laugh knowingly inaccurate U.S. reporting event conversation leader get major case study Fake News fine wrong Iran China Tariffs Boris,20105,<UNK>,<UNK>,realDonaldTrump
1165759158030725120,2019-08-25 22:53:36+00:00,A disgrace!,disgrace,11556,<UNK>,<UNK>,realDonaldTrump
1165706256096604166,2019-08-25 19:23:23+00:00,"Great meetings at the @G7 in Biarritz, France! #G7Biarritz",great meeting Biarritz France g7biarritz,7589,#G7Biarritz,@G7,realDonaldTrump
1165695030939402240,2019-08-25 18:38:47+00:00,Thank you Eric. So true!,thank Eric true,9886,<UNK>,<UNK>,realDonaldTrump
1165694542638505984,2019-08-25 18:36:51+00:00,"USMCA, make it bipartisan. Everybody wants it!",USMCA bipartisan everybody want,8015,<UNK>,<UNK>,realDonaldTrump
1165694074994581504,2019-08-25 18:34:59+00:00,"Jesse & Emma, Great News. Congratulations!!!!!",Jesse Emma Great News congratulation,6121,<UNK>,<UNK>,realDonaldTrump
1165692401320546309,2019-08-25 18:28:20+00:00,Happy Birthday Vince!,happy Birthday Vince,6451,<UNK>,<UNK>,realDonaldTrump
1165677808896507904,2019-08-25 17:30:21+00:00,"The question I was asked most today by fellow World Leaders, who think the USA is doing so well and is stronger than ever before, happens to be, “Mr. President, why does the American media hate your Country so much? Why are they rooting for it to fail?”",question ask today fellow World Leaders think strong happen President american medium hate country root fail,37218,<UNK>,<UNK>,realDonaldTrump
1165664682952163328,2019-08-25 16:38:12+00:00,"Big Trade Deal just agreed to with Prime Minister Abe of Japan. Will be great for our Farmers, Ranchers and more. Really big Corn purchase!",Trade Deal agree Prime Minister Japan great Farmers Ranchers corn purchase,14566,<UNK>,<UNK>,realDonaldTrump
1165663961062133761,2019-08-25 16:35:19+00:00,"So @donnabrazile gives Crooked Hillary the Questions, and now she’s on @FoxNews!",@donnabrazile give Crooked Hillary Questions @FoxNews,11748,<UNK>,@donnabrazile @FoxNews,realDonaldTrump
1165654684486389760,2019-08-25 15:58:28+00:00,Rasmussen at 50%. @MediaBuzzFNC &amp; @FoxNews are only getting worse! Now @donnabrazile &amp; others on Fox. Not what it used to be!,Rasmussen @MediaBuzzFNC @FoxNews get bad @donnabrazile,7835,<UNK>,@MediaBuzzFNC @FoxNews @donnabrazile,realDonaldTrump
1165652674705969152,2019-08-25 15:50:29+00:00,"Happy Birthday Regis, a truly special man!",happy Birthday Regis truly special,6158,<UNK>,<UNK>,realDonaldTrump
1165651928400838656,2019-08-25 15:47:31+00:00,Happy Birthday Sean!,happy Birthday Sean,11355,<UNK>,<UNK>,realDonaldTrump
1165535548766920704,2019-08-25 08:05:04+00:00,"Great working breakfast this morning with Prime Minister @BorisJohnson at the Hôtel du Palais in Biarritz, France! #G7Biarritz",great working breakfast morning Prime Minister @BorisJohnson Hôtel Palais Biarritz France g7biarritz,10169,#G7Biarritz,@BorisJohnson,realDonaldTrump
1165500375870427136,2019-08-25 05:45:18+00:00,Such False and Inaccurate reporting thus far on the G-7. The Fake News knows this but they can’t help themselves! Leaving now to have breakfast with Boris J.,False inaccurate report Fake News know help leave breakfast Boris,12861,<UNK>,<UNK>,realDonaldTrump
1165499461268836352,2019-08-25 05:41:40+00:00,"....bad Economic times, the worse the better, anything to make my Election more difficult to win. Well, we are having very good meetings, the Leaders are getting along very well, and our Country, economically, is doing great - the talk of the world!",Economic time bad well election difficult have good meeting leader get country economically great talk world,17080,<UNK>,<UNK>,realDonaldTrump
1165499459259772928,2019-08-25 05:41:39+00:00,"Before I arrived in France, the Fake and Disgusting News was saying that relations with the 6 others countries in the G-7 are very tense, and that the two days of meetings will be a disaster. Just like they are trying to force a Recession, they are trying to “will” America into..",arrive France Fake Disgusting News say relation country tense day meeting disaster like try force recession try America,20322,<UNK>,<UNK>,realDonaldTrump
1165400505222389766,2019-08-24 23:08:27+00:00,The Media is destroying the Free Press! Mark Levin. So True!,Media destroy Free Press Mark Levin true,16632,<UNK>,<UNK>,realDonaldTrump
1165396581836840961,2019-08-24 22:52:51+00:00,Thank you both. Sooo nice!,thank sooo nice,17293,<UNK>,<UNK>,realDonaldTrump
1165396410021437442,2019-08-24 22:52:10+00:00,"France and President @EmmanuelMacron have done a really great job thus far with a very important G-7. Lunch with Emmanuel was the best meeting we have yet had. Likewise, evening meeting with World Leaders went very well. Progress being made!",France President @EmmanuelMacron great important lunch Emmanuel good meeting likewise evening meeting World Leaders go progress,10437,<UNK>,@EmmanuelMacron,realDonaldTrump
1165395708595331077,2019-08-24 22:49:23+00:00,Our great Economy is the talk of everyone!,great economy talk,13654,<UNK>,<UNK>,realDonaldTrump
1165286432308695040,2019-08-24 15:35:10+00:00,North Carolina Governor Cooper Vetoed a Bill that would have required Sheriffs to cooperate with Ice. This is a terrible decision for the great people of North Carolina. He should reverse his decision and get back to the basics of fighting crime!,North Carolina Governor Cooper Vetoed bill require sheriff cooperate terrible decision great people North Carolina reverse decision basic fight crime,18434,<UNK>,<UNK>,realDonaldTrump
1165283849447845888,2019-08-24 15:24:54+00:00,"Looking forward to helping New York City and Governor @andrewcuomo complete the long anticipated, and partially built, Second Avenue Subway. Would be extended to East 125th Street in Harlem. Long in the making, they now have the team that can get it done!",look forward help York City Governor @andrewcuomo complete long anticipate partially build Second Avenue Subway extend East 125th Street Harlem long making team,8554,<UNK>,@andrewcuomo,realDonaldTrump
1165283265424629760,2019-08-24 15:22:35+00:00,Just had lunch with French President @EmmanuelMacron. Many good things are happening for both of our countries. Big weekend with other world leaders!,lunch french President @EmmanuelMacron good thing happen country weekend world leader,9686,<UNK>,@EmmanuelMacron,realDonaldTrump
1165281416206266368,2019-08-24 15:15:14+00:00,"“Face It, You Probably Got A Tax Cut!” This was a New York Times headline, and it is very true. If Republicans take back the House, and keep the Senate and Presidency, one of our first acts will be to approve a major middle income Tax Cut! Democrats only want to raise your taxes!",face probably York Times headline true Republicans House Senate Presidency act approve major middle income Democrats want raise taxis,19502,<UNK>,<UNK>,realDonaldTrump
1165277727123025920,2019-08-24 15:00:34+00:00,"....having fun. I was smiling as I looked up and around. The MANY reporters with me were smiling also. They knew the TRUTH...And yet when I saw the reporting, CNN, MSNBC and other Fake News outlets covered it as serious news & me thinking of myself as the Messiah. No more trust!",have smile look reporter smile know truth reporting MSNBC Fake News outlet cover news think Messiah trust,18621,<UNK>,<UNK>,realDonaldTrump
1165277725541765120,2019-08-24 15:00:34+00:00,"When I looked up to the sky and jokingly said “I am the chosen one,” at a press conference two days ago, referring to taking on Trade with China, little did I realize that the media would claim that I had a “Messiah complex.” They knew I was kidding, being sarcastic, and just....",look jokingly say choose press conference day refer take Trade China little realize medium claim Messiah complex know kid sarcastic,23476,<UNK>,<UNK>,realDonaldTrump
1165111122510237696,2019-08-24 03:58:32+00:00,"For all of the Fake News Reporters that don’t have a clue as to what the law is relative to Presidential powers, China, etc., try looking at the Emergency Economic Powers Act of 1977. Case closed!",Fake News Reporters clue relative presidential power China look Emergency Economic Powers 1977 case close,20551,<UNK>,<UNK>,realDonaldTrump
1165071131608571904,2019-08-24 01:19:38+00:00,"Other good polls also in fifties, despite only Fake News, and then phony polls by A.P., CNN, NBC and, as always, Fox, who were WAY OFF on 2016 Election!",good poll fifty despite Fake News phony poll A.P. 2016 election,10610,<UNK>,<UNK>,realDonaldTrump
1165068843443720193,2019-08-24 01:10:32+00:00,Disgraceful!,disgraceful,10759,<UNK>,<UNK>,realDonaldTrump
1165067836131336193,2019-08-24 01:06:32+00:00,Thank you Ivanka. Really Amazing!,thank Ivanka amazing,9134,<UNK>,<UNK>,realDonaldTrump
1165067335604023296,2019-08-24 01:04:33+00:00,Looking forward to being with great leaders in France! Leaving soon.,look forward great leader France leave soon,7508,<UNK>,<UNK>,realDonaldTrump
1165066714700230656,2019-08-24 01:02:05+00:00,Highest Condolences! Thank you V.P.,high Condolences thank V.P.,11186,<UNK>,<UNK>,realDonaldTrump
1165065918470414337,2019-08-24 00:58:55+00:00,Great going Harris!,great go Harris,5536,<UNK>,<UNK>,realDonaldTrump
1165064733785034754,2019-08-24 00:54:13+00:00,Great! He said MAGA country did it. So terrible!,great say MAGA country terrible,8797,<UNK>,<UNK>,realDonaldTrump
1165062760415354881,2019-08-24 00:46:22+00:00,"Thank you to @DiamondandSilk for the really nice words and thoughts on @LouDobbs, tonight hosted by Lou’s friend, @DavidAsmanfox. Great job by all. P.S. Check out these two great women on tour tomorrow night in NYC at the Marriott Marquis Hotel, Broadway. Have fun!",thank @DiamondandSilk nice word thought @loudobb tonight host friend @DavidAsmanfox great P.S. check great woman tour tomorrow night Marriott Marquis Hotel Broadway,9101,<UNK>,@DiamondandSilk @LouDobbs @DavidAsmanfox,realDonaldTrump
1165022004392681472,2019-08-23 22:04:25+00:00,"Just spoke with President @JairBolsonaro of Brazil. Our future Trade prospects are very exciting and our relationship is strong, perhaps stronger than ever before. I told him if the United States can help with the Amazon Rainforest fires, we stand ready to assist!",speak President @jairbolsonaro Brazil future Trade prospect exciting relationship strong strong tell United States help Amazon Rainforest fire stand ready assist,32760,<UNK>,@jairbolsonaro,realDonaldTrump
1165005930733473793,2019-08-23 21:00:33+00:00,"...Additionally, the remaining 300 BILLION DOLLARS of goods and products from China, that was being taxed from September 1st at 10%, will now be taxed at 15%. Thank you for your attention to this matter!",additionally remain billion dollar good product China tax September tax thank attention matter,15029,<UNK>,<UNK>,realDonaldTrump
1165005929831702529,2019-08-23 21:00:33+00:00,"...unfair Trading Relationship. China should not have put new Tariffs on 75 BILLION DOLLARS of United States product (politically motivated!). Starting on October 1st, the 250 BILLION DOLLARS of goods and products from China, currently being taxed at 25%, will be taxed at 30%...",unfair Trading Relationship China tariff billion dollar United States product politically motivated start October BILLION dollar good product China currently tax tax,13704,<UNK>,<UNK>,realDonaldTrump
1165005928996986881,2019-08-23 21:00:32+00:00,"....Sadly, past Administrations have allowed China to get so far ahead of Fair and Balanced Trade that it has become a great burden to the American Taxpayer. As President, I can no longer allow this to happen! In the spirit of achieving Fair Trade, we must Balance this very....",sadly past administration allow China ahead Fair Balanced Trade great burden American Taxpayer President longer allow happen spirit achieve Fair Trade balance,6851,<UNK>,<UNK>,realDonaldTrump
1165005927864512512,2019-08-23 21:00:32+00:00,"For many years China (and many other countries) has been taking advantage of the United States on Trade, Intellectual Property Theft, and much more. Our Country has been losing HUNDREDS OF BILLIONS OF DOLLARS a year to China, with no end in sight....",year China country take advantage United States Trade Intellectual Property Theft country lose HUNDREDS BILLIONS dollar year China sight,18560,<UNK>,<UNK>,realDonaldTrump
1164975929598316544,2019-08-23 19:01:20+00:00,"The Dow is down 573 points perhaps on the news that Representative Seth Moulton, whoever that may be, has dropped out of the 2020 Presidential Race!",point news Representative Seth Moulton drop 2020 Presidential Race,13509,<UNK>,<UNK>,realDonaldTrump
