id,created_at,original_text,clean_text,retweet_count,hashtags,mentions,original_author
1171193903581675524,2019-09-09 22:49:21+00:00,"Received an update on Air Force One at MCAS Cherry Point in North Carolina, regarding damage caused by Hurricane Dorian.",receive update Force MCAS Cherry Point North Carolina damage cause Hurricane Dorian,6047,<UNK>,<UNK>,realDonaldTrump
1171178388460978177,2019-09-09 21:47:41+00:00,"Departing MCAS Cherry Point in North Carolina for Fayetteville, North Carolina. This is amazing!",depart MCAS Cherry Point North Carolina Fayetteville North Carolina amazing,10215,<UNK>,<UNK>,realDonaldTrump
1171175113883934720,2019-09-09 21:34:41+00:00,Speaking to Governor @HenryMcMaster of South Carolina on my way to North Carolina for a big rally for Dan Bishop (@jdanbishop) running for Congress. Vote tomorrow! #NC09,speak Governor @HenryMcMaster South Carolina North Carolina rally Bishop @jdanbishop run Congress vote tomorrow nc09,6542,#NC09,@henrymcmaster @jdanbishop,realDonaldTrump
1171153468364451845,2019-09-09 20:08:40+00:00,To every one of the HEROES we recognized today — THANK YOU and God Bless You All!,HEROES recognize today thank Bless,14195,<UNK>,<UNK>,realDonaldTrump
1171120177196544000,2019-09-09 17:56:23+00:00,"We have been serving as policemen in Afghanistan, and that was not meant to be the job of our Great Soldiers, the finest on earth. Over the last four days, we have been hitting our Enemy harder than at any time in the last ten years!",serve policeman Afghanistan mean Great Soldiers fine earth day hit enemy hard time year,13518,<UNK>,<UNK>,realDonaldTrump
1171118516864454657,2019-09-09 17:49:47+00:00,"...the Economy, where there is NO Recession, much to the regret of the LameStream Media! They are working overtime to help the Democrats win in 2020, but that will NEVER HAPPEN, Americans are too smart!",Economy recession regret LameStream Media work overtime help Democrats 2020 happen Americans smart,9698,<UNK>,<UNK>,realDonaldTrump
1171118507712503813,2019-09-09 17:49:45+00:00,"...the look of turmoil in the White House, of which there is none. I view much of the media as simply an arm of the Democrat Party. They are corrupt, and they are extremely upset at how well our Country is doing under MY Leadership, including...",look turmoil White House view medium simply Democrat Party corrupt extremely upset country Leadership include,9556,<UNK>,<UNK>,realDonaldTrump
1171118506089361409,2019-09-09 17:49:44+00:00,"A lot of Fake News is being reported that I overruled the VP and various advisers on a potential Camp David meeting with the Taliban. This Story is False! I always think it is good to meet and talk, but in this case I decided not to. The Dishonest Media likes to create...",Fake News report overrule adviser potential Camp David meet Taliban story false think good meet talk case decide Dishonest Media like create,12292,<UNK>,<UNK>,realDonaldTrump
1171074780566622208,2019-09-09 14:55:59+00:00,"The Trump Administration has achieved more in the first 2 1/2 years of its existence than perhaps any administration in the history of our Country. We get ZERO media credit for what we have done, and are doing, but the people know, and that’s all that is important!",Trump Administration achieve year existence administration history country ZERO medium credit people know important,16170,<UNK>,<UNK>,realDonaldTrump
1171058875220541441,2019-09-09 13:52:47+00:00,"I had nothing to do with the decision of our great @VP Mike Pence to stay overnight at one of the Trump owned resorts in Doonbeg, Ireland. Mike’s family has lived in Doonbeg for many years, and he thought that during his very busy European visit, he would stop and see his family!",decision great Mike Pence stay overnight Trump own resort Doonbeg Ireland Mike family live Doonbeg year think busy european visit stop family,10875,<UNK>,@VP,realDonaldTrump
1171056605233852416,2019-09-09 13:43:46+00:00,"I know nothing about an Air Force plane landing at an airport (which I do not own and have nothing to do with) near Turnberry Resort (which I do own) in Scotland, and filling up with fuel, with the crew staying overnight at Turnberry (they have good taste!). NOTHING TO DO WITH ME",know Force plane landing airport near Turnberry Resort Scotland fill fuel crew stay overnight Turnberry good taste,14623,<UNK>,<UNK>,realDonaldTrump
1171051473607823360,2019-09-09 13:23:23+00:00,"..that this Administration has done. They don’t talk about the great economy, the big tax and regulation cuts, the rebuilding of the Military, “Choice” at our VA, our Vets, Judges and Supreme Court Justices, the Border Wall going up, lowest crime numbers, 2nd A, and so much more!",Administration talk great economy regulation cut rebuilding military Choice Vets Judges Supreme Court Justices Border Wall go low crime number,8601,<UNK>,<UNK>,realDonaldTrump
1171051472689270784,2019-09-09 13:23:22+00:00,"As bad as @CNN is, Comcast MSNBC is worse. Their ratings are also way down because they have lost all credibility. I believe their stories about me are not 93% negative, but actually 100% negative. They are incapable of saying anything positive, despite all of the great things...",@CNN Comcast MSNBC bad rating lose credibility believe story negative actually negative incapable say positive despite great thing,11710,<UNK>,@CNN,realDonaldTrump
1171046015106990081,2019-09-09 13:01:41+00:00,"...But most importantly, @CNN is bad for the USA. Their International Division spews bad information &amp; Fake News all over the globe. This is why foreign leaders are always asking me, “Why does the Media hate the U.S. sooo much?” It is a fraudulent shame, &amp; all comes from the top!",importantly @CNN International Division spew information Fake News globe foreign leader ask medium hate U.S. sooo fraudulent shame come,10906,<UNK>,@CNN,realDonaldTrump
1171046014234648576,2019-09-09 13:01:41+00:00,"Great news that an activist investor is now involved with AT&T. As the owner of VERY LOW RATINGS @CNN, perhaps they will now put a stop to all of the Fake News emanating from its non-credible “anchors.” Also, I hear that, because of its bad ratings, it is losing a fortune.....",great news activist investor involve at&t. owner rating @cnn stop Fake News emanate credible anchor hear rating lose fortune,11417,<UNK>,@CNN,realDonaldTrump
1171022839962644480,2019-09-09 11:29:36+00:00,"94% Approval Rating in the Republican Party, a record. Thank you!",Approval Rating Republican Party record thank,17170,<UNK>,<UNK>,realDonaldTrump
1171017507345506305,2019-09-09 11:08:24+00:00,"House Republicans should allow Chairs of Committees to remain for longer than 6 years. It forces great people, and real leaders, to leave after serving. The Dems have unlimited terms. While that has its own problems, it is a better way to go. Fewer people, in the end, will leave!",House Republicans allow Chairs Committees remain long year force great people real leader leave serve Dems unlimited term problem well few people leave,7709,<UNK>,<UNK>,realDonaldTrump
1171014997339713536,2019-09-09 10:58:26+00:00,"...but then he ran for Congress and won, only to lose his re-elect after I Tweeted my endorsement, on Election Day, for his opponent. But now take heart, he is back, and running for President of the United States. The Three Stooges, all badly failed candidates, will give it a go!",Congress lose elect tweet endorsement Election opponent heart run President United States Stooges badly fail candidate,11656,<UNK>,<UNK>,realDonaldTrump
1171014995452321792,2019-09-09 10:58:25+00:00,"When the former Governor of the Great State of South Carolina, @MarkSanford, was reported missing, only to then say he was away hiking on the Appalachian Trail, then was found in Argentina with his Flaming Dancer friend, it sounded like his political career was over. It was,....",Governor Great State South Carolina @marksanford report missing away hiking Appalachian Trail find Argentina flame Dancer friend sound like political career,12792,<UNK>,@MarkSanford,realDonaldTrump
1171013146078777344,2019-09-09 10:51:05+00:00,"North Carolina, vote for Dan Bishop tomorrow. We need him badly in Washington! His opponent is a far left Sanctuary Cities supporter.",North Carolina vote Bishop tomorrow need badly Washington opponent leave Sanctuary Cities supporter,14579,<UNK>,<UNK>,realDonaldTrump
1170897587387412480,2019-09-09 03:11:53+00:00,".....the importance or passage of Criminal Justice Reform. They only talk about the minor players, or people that had nothing to do with it...And the people that so desperately sought my help when everyone else had failed, all they talk about now is Impeaching President Trump!",importance passage Criminal Justice Reform talk minor player people people desperately seek help fail talk Impeaching President Trump,11628,<UNK>,<UNK>,realDonaldTrump
1170897586364006405,2019-09-09 03:11:53+00:00,"....musician @johnlegend, and his filthy mouthed wife, are talking now about how great it is - but I didn’t see them around when we needed help getting it passed. “Anchor”@LesterHoltNBC doesn’t even bring up the subject of President Trump or the Republicans when talking about....",musician @johnlegend filthy mouthed wife talk great need help get pass Anchor”@LesterHoltNBC bring subject President Trump Republicans talk,13617,<UNK>,@johnlegend @LesterHoltNBC,realDonaldTrump
1170897585336475648,2019-09-09 03:11:53+00:00,"....A man named @VanJones68, and many others, were profusely grateful (at that time!). I SIGNED IT INTO LAW, no one else did, &amp; Republicans deserve much credit. But now that it is passed, people that had virtually nothing to do with it are taking the praise. Guys like boring.....",name @VanJones68 profusely grateful time signed Republicans deserve credit pass people virtually take praise guy like boring,6101,<UNK>,@VanJones68,realDonaldTrump
1170897584510124032,2019-09-09 03:11:53+00:00,"When all of the people pushing so hard for Criminal Justice Reform were unable to come even close to getting it done, they came to me as a group and asked for my help. I got it done with a group of Senators & others who would never have gone for it. Obama couldn’t come close....",people push hard Criminal Justice Reform unable come close get come group ask help group Senators go Obama come close,16671,<UNK>,<UNK>,realDonaldTrump
1170786968889909249,2019-09-08 19:52:20+00:00,"Congratulations to @JudgeJeanine Pirro on having, again, the Number One Best Selling Book!",congratulation @JudgeJeanine Pirro have Number good Selling Book,12003,<UNK>,@JudgeJeanine,realDonaldTrump
1170782374843564034,2019-09-08 19:34:04+00:00,"Looking forward to being in the North Carolina tomorrow night. We’re having a BIG RALLY for a great guy, Dan Bishop. Strong on Crime, Borders, your Military and our Vets, we need Dan Bishop in Washington badly. His opponent is WEAK on Crime, Borders, and against your 2nd A.",look forward North Carolina tomorrow night have RALLY great Bishop strong Crime Borders military vet need Bishop Washington badly opponent WEAK Crime Borders,15309,<UNK>,<UNK>,realDonaldTrump
1170742727333568514,2019-09-08 16:56:32+00:00,WE ARE BUILDING THE WALL...,build WALL,21974,<UNK>,<UNK>,realDonaldTrump
1170548948135796736,2019-09-08 04:06:31+00:00,Leakin’ Lyin’ James Comey!,Leakin Lyin James Comey,15575,<UNK>,<UNK>,realDonaldTrump
1170469621348098049,2019-09-07 22:51:18+00:00,"....only made it worse! If they cannot agree to a ceasefire during these very important peace talks, and would even kill 12 innocent people, then they probably don’t have the power to negotiate a meaningful agreement anyway. How many more decades are they willing to fight?",bad agree ceasefire important peace talk kill innocent people probably power negotiate meaningful agreement decade willing fight,16815,<UNK>,<UNK>,realDonaldTrump
1170469619154530305,2019-09-07 22:51:18+00:00,"....an attack in Kabul that killed one of our great great soldiers, and 11 other people. I immediately cancelled the meeting and called off peace negotiations. What kind of people would kill so many in order to seemingly strengthen their bargaining position? They didn’t, they....",attack Kabul kill great great soldier people immediately cancel meeting call peace negotiation kind people kill order seemingly strengthen bargaining position,15326,<UNK>,<UNK>,realDonaldTrump
1170469618177236992,2019-09-07 22:51:17+00:00,"Unbeknownst to almost everyone, the major Taliban leaders and, separately, the President of Afghanistan, were going to secretly meet with me at Camp David on Sunday. They were coming to the United States tonight. Unfortunately, in order to build false leverage, they admitted to..",unbeknownst major Taliban leader separately President Afghanistan go secretly meet Camp David Sunday come United States tonight unfortunately order build false leverage admit,19889,<UNK>,<UNK>,realDonaldTrump
1170437809796255745,2019-09-07 20:44:54+00:00,"...FAKE NEWS. I would like very much to stop referring to this ridiculous story, but the LameStream Media just won’t let it alone. They always have to have the last word, even though they know they are defrauding & deceiving the public. The public knows that the Media is corrupt!",FAKE NEWS like stop refer ridiculous story LameStream Media word know defraud deceive public public know medium corrupt,12324,<UNK>,<UNK>,realDonaldTrump
1170437808894427140,2019-09-07 20:44:53+00:00,"The Failing New York Times stated, in an article written by Obama flunky Peter Baker (who lovingly wrote Obama book),”Even after the President forecast the storm to include Alabama.” THIS IS NOT TRUE. I said, VERY EARLY ON, that it MAY EVEN hit Alabama. A BIG DIFFERENCE.....","Failing York Times state article write Obama flunky Peter Baker lovingly write Obama book),”even President forecast storm include Alabama true say early Alabama DIFFERENCE",12716,<UNK>,<UNK>,realDonaldTrump
1170426165393334274,2019-09-07 19:58:37+00:00,Our Economy is doing great!!!!!,economy great,10907,<UNK>,<UNK>,realDonaldTrump
1170422093500026880,2019-09-07 19:42:27+00:00,"JOBS, JOBS, JOBS!",JOBS JOBS JOBS,13321,<UNK>,<UNK>,realDonaldTrump
1170353869949407232,2019-09-07 15:11:21+00:00,Congratulations to the GREAT Jerry West! https://www.instagram.com/p/B2HUw26BV6r/?igshid=vpd3yvmxjm7h,congratulation GREAT Jerry West,7741,<UNK>,<UNK>,realDonaldTrump
1170333046672936965,2019-09-07 13:48:36+00:00,"Russia and Ukraine just swapped large numbers of prisoners. Very good news, perhaps a first giant step to peace. Congratulations to both countries!",Russia Ukraine swap large number prisoner good news giant step peace congratulation country,13525,<UNK>,<UNK>,realDonaldTrump
1170324532562931713,2019-09-07 13:14:46+00:00,"“In 22 years of patrolling our Southern Border, I have never seen Mexico act like a true Border Security Partner until President Trump got involved, and now they are stepping up to the plate and doing what they need to do.” Brandon Judd, National Border Patrol",year patrol Southern Border see Mexico like true Border Security Partner President Trump involve step plate need Brandon Judd National Border Patrol,18828,<UNK>,<UNK>,realDonaldTrump
1170292743865810944,2019-09-07 11:08:27+00:00,"The Washington Post’s @PhilipRucker (Mr. Off the Record) &amp; @AshleyRParker, two nasty lightweight reporters, shouldn’t even be allowed on the grounds of the White House because their reporting is so DISGUSTING &amp; FAKE. Also, add the appointment of MANY Federal Judges this Summer!",Washington Post @PhilipRucker Record @AshleyRParker nasty lightweight reporter allow ground White House reporting DISGUSTING FAKE appointment Federal Judges summer,8688,<UNK>,@PhilipRucker @AshleyRParker,realDonaldTrump
1170288754520657920,2019-09-07 10:52:36+00:00,"I want to congratulate @senatemajldr Mitch McConnell and all Republicans. Today I signed the 160th Federal Judge to the Bench. Within a short period of time we will be at over 200 Federal Judges, including many in the Appellate Courts &amp; two great new U.S. Supreme Court Justices!",want congratulate @senatemajldr Mitch McConnell Republicans today sign 160th Federal Judge Bench short period time Federal Judges include Appellate Courts great U.S. Supreme Court Justices,16442,<UNK>,@senatemajldr,realDonaldTrump
1170285514324414464,2019-09-07 10:39:44+00:00,"....I would also like to thank “Papa” Doug Manchester, hopefully the next Ambassador to the Bahamas, for the incredible amount of time, money and passion he has spent on helping to bring safety to the Bahamas. Much work to be done by the Bahamian Government. We will help! @OANN",like thank papa Doug Manchester hopefully Ambassador Bahamas incredible time money passion spend help bring safety Bahamas work bahamian Government help @OANN,9760,<UNK>,@OANN,realDonaldTrump
1170285513376485378,2019-09-07 10:39:43+00:00,"Thank you to Bahamian Prime Minister Hubert Minnis for your very gracious and kind words in saying that without the help of the United States and me, their would have been many more casualties. I give all credit to FEMA, the U.S. Coast Guard, & the brave people of the Bahamas..",thank bahamian Prime Minister Hubert Minnis gracious kind word say help United States casualty credit FEMA U.S. Coast Guard brave people Bahamas,14928,<UNK>,<UNK>,realDonaldTrump
1170171081853931520,2019-09-07 03:05:01+00:00,"China just enacted a major stimulus plan. With all the Tariffs THEY are paying to the USA, Billions and Billions of Dollars, they need it! In the meantime, our Federal Reserve sits back and does NOTHING!",China enact major stimulus plan tariff pay Billions Billions Dollars need meantime Federal Reserve sit,14353,<UNK>,<UNK>,realDonaldTrump
1170166239483826176,2019-09-07 02:45:46+00:00,"PROMISES MADE, PROMISES KEPT!",promise promise KEPT,13935,<UNK>,<UNK>,realDonaldTrump
1170123710164013056,2019-09-06 23:56:47+00:00,"....that were not hit – and that are in good condition. Any cruise ship companies willing to act as stationary housing, etc., I am sure would be appreciated!",good condition cruise ship company willing stationary housing sure appreciate,8808,<UNK>,<UNK>,realDonaldTrump
1170123708696072192,2019-09-06 23:56:46+00:00,"The @USCG, @FEMA, and all others, along with other countries that have been helping, have been asked to move people in the badly hit sections of the Bahamas to other sections of the Bahamas....",@USCG @FEMA country help ask people badly section Bahamas section Bahamas,9150,<UNK>,@USCG @fema,realDonaldTrump
1170097018901020673,2019-09-06 22:10:43+00:00,“The Washington Post’s Lost Summer”,Washington Post Lost summer,7693,<UNK>,<UNK>,realDonaldTrump
1169992234382610432,2019-09-06 15:14:20+00:00,"“China is eating the Tariffs.” Billions pouring into USA. Targeted Patriot Farmers getting massive Dollars from the incoming Tariffs! Good Jobs Numbers, No Inflation(Fed). China having worst year in decades. Talks happening, good for all!",China eat Tariffs billion pour target Patriot Farmers get massive dollar incoming tariff Good Jobs Numbers inflation(fed China have bad year decade talk happen good,16106,<UNK>,<UNK>,realDonaldTrump
1169983251160731651,2019-09-06 14:38:38+00:00,The Economy is great. The only thing adding to “uncertainty” is the Fake News!,economy great thing add uncertainty Fake News,13912,<UNK>,<UNK>,realDonaldTrump
1169982535646031873,2019-09-06 14:35:48+00:00,"Great job by FEMA, Law Enforcement, First Responders, U.S. Coast Guard, and ALL! Keep going, we all appreciate what you are doing!",great FEMA Enforcement Responders U.S. Coast Guard go appreciate,9640,<UNK>,<UNK>,realDonaldTrump
1169981020634013696,2019-09-06 14:29:47+00:00,....partner should start playing it straight. It would be so much better for our Country!,partner start play straight well country,8127,<UNK>,<UNK>,realDonaldTrump
1169981019228913664,2019-09-06 14:29:46+00:00,"....This nonsense has never happened to another President. Four days of corrupt reporting, still without an apology. But there are many things that the Fake News Media has not apologized to me for, like the Witch Hunt, or SpyGate! The LameStream Media and their Democrat.....",nonsense happen President day corrupt reporting apology thing Fake News Media apologize like Witch Hunt SpyGate LameStream Media Democrat,9227,<UNK>,<UNK>,realDonaldTrump
1169981017794535432,2019-09-06 14:29:46+00:00,"The Fake News Media was fixated on the fact that I properly said, at the beginnings of Hurricane Dorian, that in addition to Florida & other states, Alabama may also be grazed or hit. They went Crazy, hoping against hope that I made a mistake (which I didn’t). Check out maps.....",Fake News Media fixate fact properly say beginning Hurricane Dorian addition Florida state Alabama graze go Crazy hope hope mistake check map,11012,<UNK>,<UNK>,realDonaldTrump
1169967054755172354,2019-09-06 13:34:17+00:00,Larry Kudlow on @Varneyco now!,Larry Kudlow @varneyco,4196,<UNK>,@Varneyco,realDonaldTrump
1169960993922981889,2019-09-06 13:10:12+00:00,"Our great @JudgeJeanine has just written a book that will add to the tremendous success of her last number one best seller. It’s called, “Radicals, Resistance, and Revenge, The Left’s Plot To Remake America.” It is a FANTASTIC book. Go get it! @foxandfriends",great @judgejeanine write book tremendous success number good seller call Radicals Resistance revenge left Plot remake America FANTASTIC book @foxandfriends,8992,<UNK>,@JudgeJeanine @foxandfriends,realDonaldTrump
1169956429366779904,2019-09-06 12:52:04+00:00,Great interview of Sarah Sanders by @foxandfriends. She is a terrific person with a great future!,great interview Sarah Sanders @foxandfriend terrific person great future,7989,<UNK>,@foxandfriends,realDonaldTrump
1169953150251556864,2019-09-06 12:39:02+00:00,Congratulations to @edhenry and his sister on a great success. What a wonderful thing to do!,congratulation @edhenry sister great success wonderful thing,6880,<UNK>,@edhenry,realDonaldTrump
1169948967947395072,2019-09-06 12:22:25+00:00,"I agree with @jimcramer, the Fed should lower rates. They were WAY too early to raise, and Way too late to cut - and big dose quantitative tightening didn’t exactly help either. Where did I find this guy Jerome? Oh well, you can’t win them all!",agree @jimcram lower rate early raise late dose quantitative tightening exactly help find Jerome,9073,<UNK>,@jimcramer,realDonaldTrump
1169948497241677824,2019-09-06 12:20:32+00:00,"DACA will be going before the Supreme Court. It is a document that even President Obama didn’t feel he had the legal right to sign - he signed it anyway! Rest assured that if the SC does what all say it must, based on the law, a bipartisan deal will be made to the benefit of all!",DACA go Supreme Court document President Obama feel legal right sign sign rest assure base bipartisan deal benefit,12770,<UNK>,<UNK>,realDonaldTrump
1169945441233985536,2019-09-06 12:08:24+00:00,"....President Obama never had the legal right to sign DACA, and he indicated so at the time of signing. But In any event, how can he have the right to sign and I don’t have the right to “unsigned.” Totally illegal document which would actually give the President new powers.",President Obama legal right sign DACA indicate time signing event right sign right unsigned totally illegal document actually President power,11484,<UNK>,<UNK>,realDonaldTrump
1169945440240001025,2019-09-06 12:08:24+00:00,....have the discretion to end the program that President Obama began in his discretion. That program was unlawful to begin with. I think it’s very unlikely that the SCOTUS is going to issue an order reinstating what it believes is an unlawful program. DACA Is unlawful.” .....,discretion program President Obama begin discretion program unlawful begin think unlikely SCOTUS go issue order reinstate believe unlawful program DACA unlawful,9696,<UNK>,<UNK>,realDonaldTrump
1169945439434674176,2019-09-06 12:08:23+00:00,"The Immigration Law Institute’s Christopher Hajec says, “The Supreme Court has to look st whether DACA is lawful. What they are looking at now is whether Trump’s recision of DACA is lawful. Must consider lawfulness of DACA itself. Looks very odd that President Trump doesn’t.....",Immigration Institute Christopher Hajec say Supreme Court look DACA lawful look Trump recision DACA lawful consider lawfulness DACA look President Trump,11255,<UNK>,<UNK>,realDonaldTrump
1169815875966210049,2019-09-06 03:33:33+00:00,"....that our economy is very strong. If the Fed would lower rates to where the bond market says they should be, then I really wouldn’t worry about a recession.” @jimcramer @JoeSquawk",economy strong lower rate bond market say worry recession @jimcramer @JoeSquawk,9459,<UNK>,@jimcramer @JoeSquawk,realDonaldTrump
1169815874988986369,2019-09-06 03:33:33+00:00,"“I think President Trump is set in his ways because he doesn’t see any weakening. I mean, look at the joblessness report today. What I’m surprised at is how strong the consumer is. I think the Chinese need it (a deal) more than we do. It’s statistical. I just think....",think President Trump way weakening mean look joblessness report today surprised strong consumer think Chinese need deal statistical think,11223,<UNK>,<UNK>,realDonaldTrump
1169782689257447424,2019-09-06 01:21:41+00:00,"Looking forward to watching @SarahHuckabee Sanders tomorrow morning on @FoxandFriends, by far the #1 rated show on Morning Cable at 8:30am. Sarah will be an incredible addition to @FoxNews!",look forward watch @SarahHuckabee sander tomorrow morning @FoxandFriends rate Morning Cable 8:30am Sarah incredible addition @FoxNews,11506,<UNK>,@SarahHuckabee @foxandfriends @FoxNews,realDonaldTrump
