id,created_at,original_text,clean_text,retweet_count,hashtags,mentions,original_author
1138412973649747968,2019-06-11 11:49:38+00:00,"....investigation in the Senate. They can talk to John Dean until the cows come home, we’re not doing anything in the Senate regarding the Mueller Report. We are going to harden our Infrastructure against 2020!” @LindseyGrahamSC",investigation Senate talk John Dean cow come home Senate Mueller Report go harden infrastructure 2020 @LindseyGrahamSC,12042,<UNK>,@LindseyGrahamSC,realDonaldTrump
1138412971846189056,2019-06-11 11:49:37+00:00,"“Mueller has spoken. He found No Collusion between the Trump Campaign and the Russians. The bottom line is what the Democrat House is doing is trying to destroy the Trump Presidency (which has been a tremendous success), and I can assure you that we’re done with the Mueller......",Mueller speak find Collusion Trump Campaign Russians line Democrat House try destroy Trump Presidency tremendous success assure Mueller,14466,<UNK>,<UNK>,realDonaldTrump
1138406809121755138,2019-06-11 11:25:08+00:00,"“Jerry Nadler’s Trump Bashing Show Is A Bust.” Headline, New York Post. @foxandfriends The Greatest Witch Hunt of all time continues. All crimes were by the other side, but the Committee refuses to even take a look. Deleting 33,000 Emails is the real Obstruction - and much more!","Jerry Nadler Trump Bashing bust Headline York Post @foxandfriend Greatest Witch Hunt time continue crime Committee refuse look delete 33,000 Emails real obstruction",13264,<UNK>,@foxandfriends,realDonaldTrump
1138404143222206464,2019-06-11 11:14:32+00:00,"New book just out, “The Real Deal, My Decade Fighting Battles and Winning Wars With Trump,” is really wonderful. It is written by two people who are very smart & know me well, George Sorial & Damian Bates, as opposed to all the books where the author has no clue who I am. ENJOY!",book Real Deal Decade fight Battles win war Trump wonderful write people smart know George Sorial Damian Bates oppose book author clue ENJOY,12759,<UNK>,<UNK>,realDonaldTrump
1138290077740740610,2019-06-11 03:41:17+00:00,#AmericaFIRST #MAGA🇺🇸,americafirst maga united_state,10564,#AmericaFIRST #MAGA,<UNK>,realDonaldTrump
1138219548979675138,2019-06-10 23:01:02+00:00,"Despite the Phony Witch Hunt, we will continue to MAKE AMERICA GREAT AGAIN! Thank you!!",despite Phony Witch Hunt continue AMERICA great thank,23248,<UNK>,<UNK>,realDonaldTrump
1138217562783830016,2019-06-10 22:53:08+00:00,"Congratulations to the 2019 Indianapolis 500 Winner @IMS, @SimonPagenaud and @Team_Penske! @IndyCar🏆🏁",congratulation 2019 Indianapolis Winner @im @SimonPagenaud @Team_Penske @IndyCar trophy::chequered_flag,8577,<UNK>,@IMS @simonpagenaud @Team_Penske @IndyCar,realDonaldTrump
1138156921901522945,2019-06-10 18:52:10+00:00,I have been briefed on the helicopter crash in New York City. Phenomenal job by our GREAT First Responders who are currently on the scene. THANK YOU for all you do 24/7/365! The Trump Administration stands ready should you need anything at all.,brief helicopter crash York City phenomenal GREAT Responders currently scene thank 24/7/365 Trump Administration stand ready need,15541,<UNK>,<UNK>,realDonaldTrump
1138148226853416962,2019-06-10 18:17:37+00:00,"Can’t believe they are bringing in John Dean, the disgraced Nixon White House Counsel who is a paid CNN contributor. No Collusion - No Obstruction! Democrats just want a do-over which they’ll never get!",believe bring John Dean disgraced Nixon White House Counsel pay contributor Collusion obstruction Democrats want,18482,<UNK>,<UNK>,realDonaldTrump
1138109362101268480,2019-06-10 15:43:11+00:00,Thank you @MarkLevinShow and John Eastman!,thank @MarkLevinShow John Eastman,11944,<UNK>,@marklevinshow,realDonaldTrump
1138040393033895936,2019-06-10 11:09:08+00:00,"When will the Failing New York Times admit that their front page story on the the new Mexico deal at the Border is a FRAUD and nothing more than a badly reported “hit job” on me, something that has been going on since the first day I announced for the presidency! Sick Journalism",Failing York Times admit page story Mexico deal Border fraud badly report go announce presidency Sick Journalism,18750,<UNK>,<UNK>,realDonaldTrump
1138030977521987584,2019-06-10 10:31:43+00:00,"....We do not anticipate a problem with the vote but, if for any reason the approval is not forthcoming, Tariffs will be reinstated!",anticipate problem vote reason approval forthcoming tariff reinstate,15171,<UNK>,<UNK>,realDonaldTrump
1138030976578310144,2019-06-10 10:31:43+00:00,"We have fully signed and documented another very important part of the Immigration and Security deal with Mexico, one that the U.S. has been asking about getting for many years. It will be revealed in the not too distant future and will need a vote by Mexico’s Legislative body!..",fully sign document important Immigration Security deal Mexico U.S. ask get year reveal distant future need vote Mexico legislative body,18970,<UNK>,<UNK>,realDonaldTrump
1138023190020730880,2019-06-10 10:00:46+00:00,"Now with our new deal, Mexico is doing more for the USA on Illegal Immigration than the Democrats. In fact, the Democrats are doing NOTHING, they want Open Borders, which means Illigal Immigration, Drugs and Crime.",deal Mexico Illegal Immigration Democrats fact Democrats want open Borders mean Illigal Immigration Drugs Crime,16217,<UNK>,<UNK>,realDonaldTrump
1137856192343105537,2019-06-09 22:57:11+00:00,"The Failing @nytimes story on Mexico and Illegal Immigration through our Southern Border has now been proven shockingly false and untrue, bad reporting, and the paper is embarrassed by it. The only problem is that they knew it was Fake News before it went out. Corrupt Media!",Failing @nytime story Mexico Illegal Immigration Southern Border prove shockingly false untrue reporting paper embarrassed problem know Fake News go corrupt medium,16640,<UNK>,@nytimes,realDonaldTrump
1137854625472765952,2019-06-09 22:50:57+00:00,"....No Obstruction. The Dems were devastated - after all this time and money spent ($40,000,000), the Mueller Report was a disaster for them. But they want a Redo, or Do Over. They are even bringing in @CNN sleazebag attorney John Dean. Sorry, no Do Overs - Go back to work!","Obstruction Dems devastate time money spend 40,000,000 Mueller Report disaster want Redo bring @CNN sleazebag attorney John Dean sorry over work",18328,<UNK>,@CNN,realDonaldTrump
1137854623337893890,2019-06-09 22:50:57+00:00,"For two years all the Democrats talked about was the Mueller Report, because they knew that it was loaded up with 13 Angry Democrat Trump Haters, later increased to 18. But despite the bias, when the Report came out, the findings were No Collusion and facts that led to........",year Democrats talk Mueller Report know load Angry Democrat Trump Haters later increase despite bias Report come finding Collusion fact,17881,<UNK>,<UNK>,realDonaldTrump
1137712485769863168,2019-06-09 13:26:08+00:00,"If President Obama made the deals that I have made, both at the Border and for the Economy, the Corrupt Media would be hailing them as Incredible, & a National Holiday would be immediately declared. With me, despite our record setting Economy and all that I have done, no credit!",President Obama deal Border economy corrupt medium hail incredible National Holiday immediately declare despite record set Economy credit,30163,<UNK>,<UNK>,realDonaldTrump
1137702218835136517,2019-06-09 12:45:21+00:00,"Twitter should let the banned Conservative Voices back onto their platform, without restriction. It’s called Freedom of Speech, remember. You are making a Giant Mistake!",twitter ban conservative Voices platform restriction call Freedom Speech remember make Giant Mistake,46370,<UNK>,<UNK>,realDonaldTrump
1137697507218264064,2019-06-09 12:26:37+00:00,".....there is not, we can always go back to our previous, very profitable, position of Tariffs - But I don’t believe that will be necessary. The Failing @nytimes, &amp; ratings challenged @CNN, will do anything possible to see our Country fail! They are truly The Enemy of the People!",previous profitable position Tariffs believe necessary Failing @nytime rating challenge @CNN possible country fail truly Enemy People,18010,<UNK>,@nytimes @CNN,realDonaldTrump
1137697506454835200,2019-06-09 12:26:37+00:00,".....not mentioned in yesterday press release, one in particular, were agreed upon. That will be announced at the appropriate time. There is now going to be great cooperation between Mexico & the USA, something that didn’t exist for decades. However, if for some unknown reason...",mention yesterday press release particular agree announce appropriate time go great cooperation Mexico exist decade unknown reason,13531,<UNK>,<UNK>,realDonaldTrump
1137697505683091461,2019-06-09 12:26:37+00:00,".....Mexico was not being cooperative on the Border in things we had, or didn’t have, and now I have full confidence, especially after speaking to their President yesterday, that they will be very cooperative and want to get the job properly done. Importantly, some things.....",Mexico cooperative Border thing confidence especially speak President yesterday cooperative want properly importantly thing,5538,<UNK>,<UNK>,realDonaldTrump
1137697504785588225,2019-06-09 12:26:37+00:00,"Another false report in the Failing @nytimes. We have been trying to get some of these Border Actions for a long time, as have other administrations, but were not able to get them, or get them in full, until our signed agreement with Mexico. Additionally, and for many years,....",false report Failing @nytime try Border Actions long time administration able sign agreement Mexico additionally year,17867,<UNK>,@nytimes,realDonaldTrump
1137572134409125890,2019-06-09 04:08:26+00:00,"I know it is not at all “Presidential” to hit back at the Corrupt Media, or people who work for the Corrupt Media, when they make false statements about me or the Trump Administration. Problem is, if you don’t hit back, people believe the Fake News is true. So we’ll hit back!",know presidential Corrupt medium people work Corrupt medium false statement Trump Administration problem people believe Fake News true,37279,<UNK>,<UNK>,realDonaldTrump
1137568536690343936,2019-06-09 03:54:08+00:00,"....other than to know he was, and is, a total Loser. When he makes statements about me, they are made up, he knows nothing!",know total Loser make statement know,9326,<UNK>,<UNK>,realDonaldTrump
1137568535977385994,2019-06-09 03:54:08+00:00,"Little @DonnyDeutsch, whose show, like his previous shoebiz tries, is a disaster, has been saying that I had been a friend of his. This is false. He, &amp; separately @ErinBurnett, used to BEG me to be on episodes of the Apprentice (both were bad), but that was it. Hardly knew him,..",little @DonnyDeutsch like previous shoebiz try disaster say friend false separately @ErinBurnett episode Apprentice hardly know,11444,<UNK>,@DonnyDeutsch @ErinBurnett,realDonaldTrump
1137515711167913984,2019-06-09 00:24:14+00:00,"Just watched the Great @Rick24Barry, Basketball Hall of Famer, on the @marklevinshow @FoxNews. A wonderful interview of a very smart and interesting guy by the man, Mark Levin, who has the number one bestselling book, Unfreedom of the Press. Two Winners!",watch Great @Rick24Barry Basketball Hall Famer @marklevinshow @foxnews wonderful interview smart interesting Mark Levin number bestselling book Unfreedom Press winner,9624,<UNK>,@Rick24Barry @marklevinshow @FoxNews,realDonaldTrump
1137500852778864645,2019-06-08 23:25:11+00:00,"Watched MSNBC this morning just to see what the opposition was saying about events of the past week. Such lies, almost everything they were saying was the opposite of the truth. Fake News! No wonder their ratings, along with CNN, are WAY DOWN. The hatred Comcast has is amazing!",watch MSNBC morning opposition say event past week lie say opposite truth Fake News wonder rating hatred Comcast amazing,21797,<UNK>,<UNK>,realDonaldTrump
1137363899420950530,2019-06-08 14:20:59+00:00,"I would like to thank the President of Mexico, Andres Manuel Lopez Obrador, and his foreign minister, Marcelo Ebrard, together with all of the many representatives of both the United States and Mexico, for working so long and hard to get our agreement on immigration completed!",like thank President Mexico Andres Manuel Lopez Obrador foreign minister Marcelo Ebrard representative United States Mexico work long hard agreement immigration complete,25342,<UNK>,<UNK>,realDonaldTrump
1137355469134151681,2019-06-08 13:47:29+00:00,Everyone very excited about the new deal with Mexico!,excited deal Mexico,17712,<UNK>,<UNK>,realDonaldTrump
1137354486698192896,2019-06-08 13:43:35+00:00,"Nervous Nancy Pelosi & the Democrat House are getting nothing done. Perhaps they could lead the way with the USMCA, the spectacular & very popular new Trade Deal that replaces NAFTA, the worst Trade Deal in the history of the U.S.A. Great for our Farmers, Manufacturers & Unions!",nervous Nancy Pelosi Democrat House get lead USMCA spectacular popular Trade Deal replace NAFTA bad Trade Deal history U.S.A. Great Farmers Manufacturers Unions,18211,<UNK>,<UNK>,realDonaldTrump
1137329348409778177,2019-06-08 12:03:41+00:00,MEXICO HAS AGREED TO IMMEDIATELY BEGIN BUYING LARGE QUANTITIES OF AGRICULTURAL PRODUCT FROM OUR GREAT PATRIOT FARMERS!,MEXICO agree IMMEDIATELY BEGIN buy large quantity agricultural product great patriot farmer,29525,<UNK>,<UNK>,realDonaldTrump
1137313896585474048,2019-06-08 11:02:17+00:00,"Mexico will try very hard, and if they do that, this will be a very successful agreement for both the United States and Mexico!",Mexico hard successful agreement United States Mexico,14821,<UNK>,<UNK>,realDonaldTrump
1137312170100875264,2019-06-08 10:55:26+00:00,"Brandon Judd, National Border Patrol Council: “That’s going to be a huge deal because Mexico will be using their strong Immigration Laws - A game changer. People no longer will be released into the U.S.” Also, 6000 Mexican Troops at their Southern Border. Currently there are few!",Brandon Judd National Border Patrol Council go huge deal Mexico strong Immigration Laws game changer People long release U.S. 6000 mexican troop Southern Border currently,14255,<UNK>,<UNK>,realDonaldTrump
1137310207401439232,2019-06-08 10:47:38+00:00,"While the reviews and reporting on our Border Immigration Agreement with Mexico have been very good, there has nevertheless been much false reporting (surprise!) by the Fake and Corrupt News Media, such as Comcast/NBC, CNN, @nytimes &amp; @washingtonpost. These “Fakers” are Bad News!",review report Border Immigration Agreement Mexico good false reporting surprise Fake Corrupt News Media Comcast @nytime @washingtonpost Fakers News,13614,<UNK>,@nytimes @washingtonpost,realDonaldTrump
1137155057667989511,2019-06-08 00:31:07+00:00,"....stem the tide of Migration through Mexico, and to our Southern Border. This is being done to greatly reduce, or eliminate, Illegal Immigration coming from Mexico and into the United States. Details of the agreement will be released shortly by the State Department. Thank you!",stem tide Migration Mexico Southern Border greatly reduce eliminate illegal Immigration come Mexico United States detail agreement release shortly State Department thank,33203,<UNK>,<UNK>,realDonaldTrump
1137155056044826626,2019-06-08 00:31:07+00:00,"I am pleased to inform you that The United States of America has reached a signed agreement with Mexico. The Tariffs scheduled to be implemented by the U.S. on Monday, against Mexico, are hereby indefinitely suspended. Mexico, in turn, has agreed to take strong measures to....",pleased inform United States America reach sign agreement Mexico Tariffs schedule implement U.S. Monday Mexico indefinitely suspend Mexico turn agree strong measure,48800,<UNK>,<UNK>,realDonaldTrump
1137112921991983105,2019-06-07 21:43:41+00:00,Dow Jones has best week of the year!,Jones good week year,17493,<UNK>,<UNK>,realDonaldTrump
1137052508231069696,2019-06-07 17:43:38+00:00,Heading back to D.C. Many great things are happening for our Country!,head D.C. great thing happen country,12366,<UNK>,<UNK>,realDonaldTrump
1137051097955102720,2019-06-07 17:38:01+00:00,"For all of the money we are spending, NASA should NOT be talking about going to the Moon - We did that 50 years ago. They should be focused on the much bigger things we are doing, including Mars (of which the Moon is a part), Defense and Science!",money spend NASA talk go Moon year focus big thing include Mars Moon Defense Science,24810,<UNK>,<UNK>,realDonaldTrump
1137048453173862400,2019-06-07 17:27:31+00:00,Democrats are incapable of doing a good and solid Immigration Bill!,Democrats incapable good solid Immigration Bill,14709,<UNK>,<UNK>,realDonaldTrump
1137045728344170496,2019-06-07 17:16:41+00:00,"If we are able to make the deal with Mexico, & there is a good chance that we will, they will begin purchasing Farm & Agricultural products at very high levels, starting immediately. If we are unable to make the deal, Mexico will begin paying Tariffs at the 5% level on Monday!",able deal Mexico good chance begin purchase Farm Agricultural product high level start immediately unable deal Mexico begin pay Tariffs level Monday,13144,<UNK>,<UNK>,realDonaldTrump
1137040975258198017,2019-06-07 16:57:48+00:00,...and have no intention of doing anything other than going on a fishing expedition to see if they can find anything on me - both illegal & unprecedented in U.S. history. There was no Collusion - Investigate the Investigators! Go to work on Drug Price Reductions & Infrastructure!,intention go fishing expedition find illegal unprecedented U.S. history Collusion investigate Investigators work Drug Price Reductions Infrastructure,18106,<UNK>,<UNK>,realDonaldTrump
1137040971311353856,2019-06-07 16:57:47+00:00,"Nervous Nancy Pelosi is a disgrace to herself and her family for having made such a disgusting statement, especially since I was with foreign leaders overseas. There is no evidence for such a thing to have been said. Nervous Nancy & Dems are getting Zero work done in Congress....",nervous Nancy Pelosi disgrace family have disgusting statement especially foreign leader overseas evidence thing say nervous Nancy Dems get zero work Congress,25743,<UNK>,<UNK>,realDonaldTrump
1137035722043547649,2019-06-07 16:36:55+00:00,"China is subsidizing its product in order that it can continue to be sold in the USA. Many firms are leaving China for other countries, including the United States, in order to avoid paying the Tariffs. No visible increase in costs or inflation, but U.S. is taking in Billions!",China subsidize product order continue sell firm leave China country include United States order avoid pay Tariffs visible increase cost inflation U.S. take billion,13648,<UNK>,<UNK>,realDonaldTrump
1137007514166255621,2019-06-07 14:44:50+00:00,HAPPY BIRTHDAY to our great @VP Mike Pence!,happy birthday great Mike Pence,13140,<UNK>,@VP,realDonaldTrump
1136901508493168640,2019-06-07 07:43:36+00:00,#DDay75thAnniversary #DDay75,dday75thanniversary DDay75,9169,#DDay75thAnniversary #DDay75,<UNK>,realDonaldTrump
1136890966533660674,2019-06-07 07:01:43+00:00,"“Mueller’s report was pure, political garbage!” @SeanHannity",Mueller report pure political garbage @seanhannity,13385,<UNK>,@seanhannity,realDonaldTrump
1136887902451982336,2019-06-07 06:49:32+00:00,John Solomon: Factual errors and major omissions in the Mueller Report show that it is totally biased against Trump.,John Solomon factual error major omission Mueller Report totally biased Trump,18177,<UNK>,<UNK>,realDonaldTrump
1136710407501037569,2019-06-06 19:04:14+00:00,#DDay75thAnniversary,DDay75thAnniversary,17965,#DDay75thAnniversary,<UNK>,realDonaldTrump
1136695960111931395,2019-06-06 18:06:50+00:00,"Just signed Disaster Aid Bill to help Americans who have been hit by recent catastrophic storms. So important for our GREAT American farmers and ranchers. Help for GA, FL, IA, NE, NC, and CA. Puerto Rico should love President Trump. Without me, they would have been shut out!",sign disaster Bill help Americans recent catastrophic storm important great american farmer rancher help Puerto Rico love President Trump shut,14273,<UNK>,<UNK>,realDonaldTrump
1136693141019549701,2019-06-06 17:55:38+00:00,"To the men who sit behind me, and to the boys who rest in the field before me: your example will never grow old. Your legend will never tire, and your spirit - brave, unyielding, and true - will NEVER DIE! #DDay75thAnniversary",boy rest field example grow legend tire spirit brave unyielding true DDay75thAnniversary,16196,#DDay75thAnniversary,<UNK>,realDonaldTrump
1136688317276348416,2019-06-06 17:36:28+00:00,"Today, we remember those who fell, and we honor all who fought, here in Normandy. They won back this ground for civilization. To more than 170 Veterans of the Second World War who join us today: You are among the very greatest Americans who will ever live! #DDay75thAnniversary",today remember fall honor fight Normandy ground civilization veteran Second World join today great Americans live DDay75thAnniversary,12742,#DDay75thAnniversary,<UNK>,realDonaldTrump
1136673237470011399,2019-06-06 16:36:32+00:00,So sorry to hear about the terrible accident involving our GREAT West Point Cadets. We mourn the loss of life and pray for the injured. God Bless them ALL!,sorry hear terrible accident involve great West Point Cadets mourn loss life pray injure Bless,16223,<UNK>,<UNK>,realDonaldTrump
1136601231906893824,2019-06-06 11:50:25+00:00,#DDay75thAnniversary,DDay75thAnniversary,12014,#DDay75thAnniversary,<UNK>,realDonaldTrump
1136537825300570112,2019-06-06 07:38:28+00:00,Heading over to Normandy to celebrate some of the bravest that ever lived. We are eternally grateful! #DDay75thAnniversary #DDay75,head Normandy celebrate brave live eternally grateful dday75thanniversary DDay75,17330,#DDay75thAnniversary #DDay75,<UNK>,realDonaldTrump
1136512359055462400,2019-06-06 05:57:16+00:00,A big and beautiful day today!,beautiful today,20375,<UNK>,<UNK>,realDonaldTrump
1136511992473300992,2019-06-06 05:55:49+00:00,"“The President has received glowing reviews from the British Media. Here at home, not so much. MSNBC Ramps up hateful coverage and promotes conspiracy theories during Trump’s trip to Europe.” @seanhannity The good news is that @maddow is dying in the ratings, along with @CNN!",President receive glow review british medium home MSNBC Ramps hateful coverage promote conspiracy theory Trump trip Europe @seanhannity good news @maddow die rating @CNN,16413,<UNK>,@seanhannity @maddow @CNN,realDonaldTrump
1136508110460325888,2019-06-06 05:40:23+00:00,#DDay75thAnniversary #DDay75,dday75thanniversary DDay75,16102,#DDay75thAnniversary #DDay75,<UNK>,realDonaldTrump
1136402984923852801,2019-06-05 22:42:39+00:00,"....talks with Mexico will resume tomorrow with the understanding that, if no agreement is reached, Tariffs at the 5% level will begin on Monday, with monthly increases as per schedule. The higher the Tariffs go, the higher the number of companies that will move back to the USA!",talk Mexico resume tomorrow understanding agreement reach tariff level begin Monday monthly increase schedule high Tariffs high number company,18090,<UNK>,<UNK>,realDonaldTrump
1136402982860312576,2019-06-05 22:42:39+00:00,"Immigration discussions at the White House with representatives of Mexico have ended for the day. Progress is being made, but not nearly enough! Border arrests for May are at 133,000 because of Mexico & the Democrats in Congress refusing to budge on immigration reform. Further...","immigration discussion White House representative Mexico end progress nearly border arrest 133,000 Mexico Democrats Congress refuse budge immigration reform",19188,<UNK>,<UNK>,realDonaldTrump
1136245995401072640,2019-06-05 12:18:50+00:00,"As we approach the 75th Anniversary of D-Day, we proudly commemorate those heroic and honorable patriots who gave their all for the cause of freedom during some of history’s darkest hours. #DDay75",approach 75th anniversary proudly commemorate heroic honorable patriot give cause freedom history dark hour DDay75,17847,#DDay75,<UNK>,realDonaldTrump
1136185948411191297,2019-06-05 08:20:14+00:00,"“House Republicans support the President on Tariffs with Mexico all the way, & that makes any measure the President takes on the Border totally Veto proof. Why wouldn’t you as Republicans support him when that will allow our President to make a better deal.” Thank you @GOPLeader",House Republicans support President Tariffs Mexico make measure President take Border totally veto proof Republicans support allow President well deal thank @gopleader,14805,<UNK>,@GOPLeader,realDonaldTrump
1136185163971407873,2019-06-05 08:17:07+00:00,"If the totally Corrupt Media was less corrupt, I would be up by 15 points in the polls based on our tremendous success with the economy, maybe Best Ever! If the Corrupt Media was actually fair, I would be up by 25 points. Nevertheless, despite the Fake News, we’re doing great!",totally corrupt Media corrupt point poll base tremendous success economy maybe good Corrupt Media actually fair point despite Fake News great,16960,<UNK>,<UNK>,realDonaldTrump
1136183958876692480,2019-06-05 08:12:19+00:00,"House Democrats, fresh off a Republican victory against them (in Federal Court) on the Wall, keep asking people to come and testify regarding the No Collusion Witch Hunt. They are very unhappy with the Mueller Report, especially with his corrective letter, & now want a Do Over!",House Democrats fresh republican victory Federal Court Wall ask people come testify Collusion Witch Hunt unhappy Mueller Report especially corrective letter want,12176,<UNK>,<UNK>,realDonaldTrump
