id,created_at,original_text,clean_text,retweet_count,hashtags,mentions,original_author
1189643818431406080,2019-10-30 20:42:43+00:00,"""The Democrats have been on this path for 3 years. The first headline I saw...before the President was sworn in was that the Impeachment process was beginning...so this is just further evidence that this is what they had in mind from the very beginning."" @senatemajldr",Democrats path year headline President swear Impeachment process begin evidence mind beginning @senatemajldr,17980,<UNK>,@senatemajldr,realDonaldTrump
1189638577866657794,2019-10-30 20:21:54+00:00,Thank you @GLFOP!,thank @GLFOP,9857,<UNK>,@GLFOP,realDonaldTrump
1189631565279760391,2019-10-30 19:54:02+00:00,"“Adam Schiff’s drive to impeach Trump based on opinions, deception and illusions – Not facts” @GreggJarrett",Adam Schiff drive impeach Trump base opinion deception illusion fact @GreggJarrett,16939,<UNK>,@GreggJarrett,realDonaldTrump
1189630486886395906,2019-10-30 19:49:44+00:00,We will be having a big rally for Governor @MattBevin on Monday night in Kentucky. Get your tickets today! https://www.donaldjtrump.com/events/ky-lex-2019-nov/?utm_medium=web&amp;utm_source=djt_web&amp;utm_content=rally_list,have rally Governor @MattBevin Monday night Kentucky ticket today,11610,<UNK>,@MattBevin,realDonaldTrump
1189614078534311936,2019-10-30 18:44:32+00:00,"....Your current Governor, John Bel Edwards, has done a poor job with economic development (last in nation) and auto insurance (highest in nation) wants to raise your taxes BIG - vote for Eddie starting Saturday!",current Governor John Edwards poor economic development nation auto insurance highest nation want raise taxis vote Eddie start Saturday,9254,<UNK>,<UNK>,realDonaldTrump
1189614076743376897,2019-10-30 18:44:32+00:00,"Early voting in Louisiana for a man who will be a Great Governor, @EddieRispone, on Saturday, November 2nd. He will get your Auto Insurance and Taxes way down. He will protect your Military, Vets, Second Amendment and Energy....",early voting Louisiana Great Governor @EddieRispone Saturday November Auto Insurance Taxes protect military Vets Second Amendment Energy,13979,<UNK>,@EddieRispone,realDonaldTrump
1189601417469841409,2019-10-30 17:54:14+00:00,AMERICAN HERO!,AMERICAN HERO,78779,<UNK>,<UNK>,realDonaldTrump
1189592785311223815,2019-10-30 17:19:56+00:00,"Thank you @GM, @FiatChrysler_NA, @Toyota, and @GloblAutomkrs for standing with us for Better, Cheaper, Safer Cars for Americans. California has treated the Auto Industry very poorly for many years, harming Workers and Consumers. We are fixing this problem!",thank @FiatChrysler_NA @Toyota @GloblAutomkrs stand Better cheap Safer car Americans California treat Auto Industry poorly year harm Workers Consumers fix problem,11317,<UNK>,@GM @FiatChrysler_NA @Toyota @GloblAutomkrs,realDonaldTrump
1189591905740513280,2019-10-30 17:16:26+00:00,"...our Military, 2nd Amendment, Energy, and so many other things that the Democrats don’t care about. Please stop the Dems from hurting a very good and hard-working man! http://www.StandTallWithMike.com",Military Amendment Energy thing Democrats care stop Dems hurt good hard work,9574,<UNK>,<UNK>,realDonaldTrump
1189591903941152769,2019-10-30 17:16:26+00:00,"My friend Mike @GovDunleavy of the Great State of Alaska, is being treated very unfairly by the Democrats because he is doing an unbelievable job and fulfilling every one of his promises. Now they are trying to Recall him because his agenda is the Economy, Jobs, and protecting...",friend Mike @GovDunleavy Great State Alaska treat unfairly Democrats unbelievable fulfil promise try recall agenda Economy Jobs protecting,13407,<UNK>,@GovDunleavy,realDonaldTrump
1189555451274379265,2019-10-30 14:51:35+00:00,"....the United States Military. Congress needs to do its work. We need to fund our Armed Forces.” @senatemajldr Mitch McConnell. The Dems are a lost cause. In 2020, we need a big, beautiful WIN (all three)! #MAGA",United States Military Congress need work need fund Armed Forces @senatemajldr Mitch McConnell Dems lost cause 2020 need beautiful maga,12539,#MAGA,@senatemajldr,realDonaldTrump
1189555450485837825,2019-10-30 14:51:34+00:00,“Our Country cannot afford for the Democrats in Congress to take a one year vacation from any productive legislation just because they would rather obsess over Impeachment. ISIS & other radical terrorists are not going to hit the pause button because Democrats won’t fund......,country afford Democrats Congress year vacation productive legislation obsess Impeachment ISIS radical terrorist go pause button Democrats fund,18566,<UNK>,<UNK>,realDonaldTrump
1189550716186177536,2019-10-30 14:32:46+00:00,"“Precisely the same program that the Democrats are trying to Impeach President Trump for supposedly slow walking, tomorrow, right here in the Senate, they (the Dems) say they’re going to filibuster for the exact same program.” @senatemajldr Mitch McConnell. Do Nothing Democrats!",precisely program Democrats try Impeach President Trump supposedly slow walking tomorrow right Senate Dems go filibuster exact program @senatemajldr Mitch McConnell Democrats,12589,<UNK>,@senatemajldr,realDonaldTrump
1189527179425730560,2019-10-30 12:59:14+00:00,Yesterday’s Never Trumper witness could find NO Quid Pro Quo in the Transcript of the phone call. There were many people listening to the call. How come they (including the President of Ukraine) found NOTHING wrong with it. Witch Hunt!,yesterday Trumper witness find Quid Transcript phone people listen come include President Ukraine find wrong witch Hunt,19963,<UNK>,<UNK>,realDonaldTrump
1189518901991923712,2019-10-30 12:26:21+00:00,A Federal Judge is allowing the Nick Sandman libel suit to move forward against the thoroughly disgusting Washington Post (which is no longer available at the White House!). He could now have a good chance of winning. Go Nick!,Federal Judge allow Nick Sandman libel suit forward thoroughly disgusting Washington Post long available White House good chance win Nick,23633,<UNK>,<UNK>,realDonaldTrump
1189516638103703552,2019-10-30 12:17:21+00:00,“It does appear it has to do with Nancy Pelosi retaining her Speakership in the next Congress. She would like that so she’s going to put it to a vote because that’s what her political left really wants.” @SteveDoocy @foxandfriends A disgraceful use of Impeachment. Will backfire!,appear Nancy Pelosi retain speakership Congress like go vote political left want @SteveDoocy @foxandfriend disgraceful Impeachment backfire,14687,<UNK>,@SteveDoocy @foxandfriends,realDonaldTrump
1189506762904395776,2019-10-30 11:38:06+00:00,The Greatest Economy in American History!,great Economy american history,22429,<UNK>,<UNK>,realDonaldTrump
1189505265151991809,2019-10-30 11:32:09+00:00,".....the call with the Ukrainian President was a totally appropriate one. As he said, “No Pressure.” This Impeachment nonsense is just a continuation of the Witch Hunt Hoax, which has been going on since before I even got elected. Rupublicans, go with Substance and close it out!",ukrainian President totally appropriate say pressure Impeachment nonsense continuation Witch Hunt Hoax go elect rupublican Substance close,9394,<UNK>,<UNK>,realDonaldTrump
1189505264376000512,2019-10-30 11:32:09+00:00,"Republicans are very unified and energized in our fight on the Impeachment Hoax with the Do Nothing Democrats, and now are starting to go after the Substance even more than the very infair Process because just a casual reading of the Transcript leads EVERYBODY to see that.....",republican unified energize fight Impeachment Hoax Democrats start Substance infair Process casual reading Transcript lead EVERYBODY,12243,<UNK>,<UNK>,realDonaldTrump
1189198831193411585,2019-10-29 15:14:30+00:00,"Nervous Nancy Pelosi is doing everything possible to destroy the Republican Party. Our Polls show that it is going to be just the opposite. The Do Nothing Dems will lose many seats in 2020. They have a Death Wish, led by a corrupt politician, Adam Schiff!",nervous Nancy Pelosi possible destroy Republican Party poll go opposite Dems lose seat 2020 Death Wish corrupt politician Adam Schiff,29996,<UNK>,<UNK>,realDonaldTrump
1189198697059553285,2019-10-29 15:13:58+00:00,"“Over in Europe and Japan they have NEGATIVE RATES. They get paid to borrow money. Don’t we have to follow our competitors?” @Varneyco Yes we do. The Fed doesn’t have a clue! We have unlimited potential, only held back by the Federal Reserve. But we are winning anyway!",Europe Japan NEGATIVE rate pay borrow money follow competitor @Varneyco clue unlimited potential hold Federal Reserve win,14425,<UNK>,@Varneyco,realDonaldTrump
1189183301233233920,2019-10-29 14:12:47+00:00,Consumer Confidence number very good. Housing sales in September up nicely. Economy Rocks!,consumer confidence number good housing sale September nicely economy rock,12588,<UNK>,<UNK>,realDonaldTrump
1189173602500911105,2019-10-29 13:34:15+00:00,"A great new book just out, “The Plot Against the President. The True Story Of How Congressman Devin Nunez Uncovered the Biggest Political Scandal In U.S. History.” Shows very bad and corrupt people on the other side. Check it out!",great book Plot President True Story Congressman Devin Nunez uncover big political scandal U.S. history show corrupt people check,17463,<UNK>,<UNK>,realDonaldTrump
1189172468159864832,2019-10-29 13:29:44+00:00,Just confirmed that Abu Bakr al-Baghdadi’s number one replacement has been terminated by American troops. Most likely would have taken the top spot - Now he is also Dead!,confirm Bakr Baghdadi number replacement terminate american troop likely take spot dead,46324,<UNK>,<UNK>,realDonaldTrump
1189170102832377857,2019-10-29 13:20:20+00:00,"95% Approval Rating in the Republican Party, a record. Thank you!",Approval Rating Republican Party record thank,22092,<UNK>,<UNK>,realDonaldTrump
1189167309455331328,2019-10-29 13:09:14+00:00,"Supposedly, according to the Corrupt Media, the Ukraine call “concerned” today’s Never Trumper witness. Was he on the same call that I was? Can’t be possible! Please ask him to read the Transcript of the call. Witch Hunt!",supposedly accord Corrupt medium Ukraine concern today Trumper witness possible read Transcript Witch Hunt,18397,<UNK>,<UNK>,realDonaldTrump
1189161824614277120,2019-10-29 12:47:27+00:00,"How many more Never Trumpers will be allowed to testify about a perfectly appropriate phone call when all anyone has to do is READ THE TRANSCRIPT! I knew people were listening in on the call (why would I say something inappropriate?), which was fine with me, but why so many?",Trumpers allow testify perfectly appropriate phone READ TRANSCRIPT know people listen inappropriate fine,22165,<UNK>,<UNK>,realDonaldTrump
1189156179173433344,2019-10-29 12:25:01+00:00,"The Do Nothing Democrats are working hard to make everyone forget the Best Economy Ever, the monumental weekend raid, Tax Cuts, the Rebuilding of our Military, etc. The Impeachment Hoax is a disgrace. Read the transcript!",Democrats work hard forget good Economy monumental weekend raid Cuts rebuilding military Impeachment Hoax disgrace read transcript,15912,<UNK>,<UNK>,realDonaldTrump
1189154764359196672,2019-10-29 12:19:23+00:00,"Where’s the Whistleblower? Just read the Transcript, everything else is made up garbage by Shifty Schiff and the Never Trumpers!",Whistleblower read Transcript garbage Shifty Schiff Trumpers,16722,<UNK>,<UNK>,realDonaldTrump
1189146892292313088,2019-10-29 11:48:07+00:00,A great book by a great guy. Get it now!,great book great,8003,<UNK>,<UNK>,realDonaldTrump
1189146007310913536,2019-10-29 11:44:36+00:00,"Correct, a total scam!",Correct total scam,8590,<UNK>,<UNK>,realDonaldTrump
1189145407361814528,2019-10-29 11:42:13+00:00,Why are people that I never even heard of testifying about the call. Just READ THE CALL TRANSCRIPT AND THE IMPEACHMENT HOAX IS OVER! Ukrain said NO PRESSURE.,people hear testify read TRANSCRIPT IMPEACHMENT HOAX Ukrain say PRESSURE,12113,<UNK>,<UNK>,realDonaldTrump
1189030619755495425,2019-10-29 04:06:05+00:00,"“This is a big win for America, and also for President Trump.” @nypost",America President Trump @nypost,9367,<UNK>,@nypost,realDonaldTrump
1189028602052042752,2019-10-29 03:58:04+00:00,"The only crimes in the Impeachment Hoax were committed by Shifty Adam Schiff, when he totally made up my phone conversation with the Ukrainian President and read it to Congress, together with numerous others on Shifty’s side. Schiff should be Impeached, and worse!",crime Impeachment Hoax commit Shifty Adam Schiff totally phone conversation ukrainian President read Congress numerous Shifty schiff impeach bad,19722,<UNK>,<UNK>,realDonaldTrump
1189026689860489216,2019-10-29 03:50:28+00:00,"“There is no underlying crime in that transcript.” @IngrahamAngle 100% correct, and the Whistleblower disappeared after I released the transcript of the call. Where is the Whistleblower? That is why this is now called the Impeachment Hoax! The Do Nothing Dems are Doing Nothing!",underlying crime transcript @ingrahamangle correct Whistleblower disappear release transcript Whistleblower call Impeachment Hoax dem,15382,<UNK>,@IngrahamAngle,realDonaldTrump
1189023754912964608,2019-10-29 03:38:48+00:00,"“Americans know by now that the Impeachment inquiry is just another hoax and silent coup to remove the President from office.” J.J. Crovatto Don’t worry J.J., Schiff is a leaker & corrupt politician who made up what I said on the call in order to hurt the Republican Party & me!",Americans know Impeachment inquiry hoax silent coup remove President office J.J. Crovatto worry J.J. Schiff leaker corrupt politician say order hurt Republican Party,16211,<UNK>,<UNK>,realDonaldTrump
1188929062611361792,2019-10-28 21:22:32+00:00,"Can you believe that Shifty Adam Schiff, the biggest leaker in D.C., and a corrupt politician, is upset that we didn’t inform him before we raided and killed the #1 terrorist in the WORLD!? Wouldn’t be surprised if the Do Nothing Democrats Impeach me over that! DRAIN THE SWAMP!!",believe Shifty Adam Schiff big leaker D.C. corrupt politician upset inform raid kill terrorist world surprised Democrats Impeach drain swamp,34532,<UNK>,<UNK>,realDonaldTrump
1188909031403900928,2019-10-28 20:02:56+00:00,"We have declassified a picture of the wonderful dog (name not declassified) that did such a GREAT JOB in capturing and killing the Leader of ISIS, Abu Bakr al-Baghdadi!",declassify picture wonderful declassify great capture kill Leader ISIS Bakr Baghdadi,117913,<UNK>,<UNK>,realDonaldTrump
1188862744067481603,2019-10-28 16:59:00+00:00,An AMAZING CHAMPION. Great going Tiger! @TigerWoods,amazing champion great go Tiger @TigerWoods,8384,<UNK>,@TigerWoods,realDonaldTrump
1188861523655045124,2019-10-28 16:54:09+00:00,THANK YOU #IACP2019!,thank IACP2019,10631,#IACP2019,<UNK>,realDonaldTrump
1188813055108374533,2019-10-28 13:41:34+00:00,"The S&P just hit an ALL TIME HIGH. This is a big win for jobs, 401-K’s, and, frankly, EVERYONE! Our Country is doing great. Even killed long sought ISIS murderer, Al-Baghdadi. We are stronger than ever before, with GREAT upward potential. Enjoy!",time HIGH job 401-K frankly Country great kill long seek ISIS murderer Baghdadi strong GREAT upward potential enjoy,28465,<UNK>,<UNK>,realDonaldTrump
1188567275391127552,2019-10-27 21:24:55+00:00,Thank you to @MarthaRaddatz and @TerryMoran for a job well done!,thank @martharaddatz @TerryMoran,19286,<UNK>,@MarthaRaddatz @TerryMoran,realDonaldTrump
1188400389697212416,2019-10-27 10:21:46+00:00,"As Diwali commences, @FLOTUS Melania and I wish those observing the Festival of Lights a blessed and happy celebration! #HappyDiwali",Diwali commence @FLOTUS Melania wish observe Festival Lights blessed happy celebration HappyDiwali,25656,#HappyDiwali,@FLOTUS,realDonaldTrump
1188264965930700801,2019-10-27 01:23:39+00:00,Something very big has just happened!,happen,67390,<UNK>,<UNK>,realDonaldTrump
1188190202851926019,2019-10-26 20:26:34+00:00,"....Matt has my Complete and Total Endorsement, and always has. GET OUT and VOTE on November 5th for your GREAT Governor, @MattBevin!",Matt Complete Total Endorsement vote November GREAT Governor @mattbevin,11262,<UNK>,@MattBevin,realDonaldTrump
1188190202004754432,2019-10-26 20:26:34+00:00,"Governor @MattBevin has done a wonderful job for the people of Kentucky! He continues to protect your very important Second Amendment. Matt is Strong on Crime and the Border, he Loves our Great Vets and Military....",Governor @MattBevin wonderful people Kentucky continue protect important Second Amendment Matt strong Crime Border love great Vets military,13853,<UNK>,@MattBevin,realDonaldTrump
1188188568654696448,2019-10-26 20:20:04+00:00,"....He loves our Military and supports our Vets! Democrat Jim Hood will never give us his vote, is anti-Trump and pro-Crooked Hillary. Get out and VOTE for Tate Reeves on November 5th. He has my Complete and Total Endorsement!",love military support Vets Democrat Hood vote anti trump crooked Hillary vote Tate Reeves November Complete Total Endorsement,12282,<UNK>,<UNK>,realDonaldTrump
1188188567773822977,2019-10-26 20:20:04+00:00,"MISSISSIPPI! There is a VERY important election for Governor on November 5th. I need you to get out and VOTE for our Great Republican nominee, @TateReeves. Tate is Strong on Crime, tough on Illegal Immigration, and will protect your Second Amendment....",MISSISSIPPI important election Governor November need vote great republican nominee @tatereeves Tate strong Crime tough Illegal Immigration protect Second Amendment,17427,<UNK>,@tatereeves,realDonaldTrump
1188187872114946054,2019-10-26 20:17:18+00:00,"....Our Republican candidate @EddieRispone is a successful conservative businessman who will stand with me to create jobs and protect your Second Amendment. GET OUT AND VOTE for Eddie, the next Governor of the GREAT State of Louisiana!",republican candidate @EddieRispone successful conservative businessman stand create job protect Second Amendment vote Eddie Governor GREAT State Louisiana,13196,<UNK>,@EddieRispone,realDonaldTrump
1188187870877618176,2019-10-26 20:17:18+00:00,"LOUISIANA! Extreme Democrat John Bel Edwards has sided with Nancy Pelosi and Chuck Schumer to support Sanctuary Cities, High Taxes, and Open Borders. He is crushing Louisiana’s economy and your Second Amendment rights....",LOUISIANA Extreme Democrat John Edwards side Nancy Pelosi Chuck Schumer support Sanctuary Cities High Taxes open Borders crush Louisiana economy Second Amendment right,20181,<UNK>,<UNK>,realDonaldTrump
1188103745525243904,2019-10-26 14:43:01+00:00,Where’s the Whistleblower?,Whistleblower,25343,<UNK>,<UNK>,realDonaldTrump
1188103311653769216,2019-10-26 14:41:18+00:00,"The Fake Washington Post keeps doing phony stories, with zero sources, that I am concerned with the Impeachment scam. I am not because I did nothing wrong. It is the other side, including Schiff and his made up story, that are concerned. Witch Hunt continues!",Fake Washington Post keep phony story zero source concern Impeachment scam wrong include Schiff story concern Witch Hunt continue,24178,<UNK>,<UNK>,realDonaldTrump
1188091546513616897,2019-10-26 13:54:33+00:00,"My Administration is fighting hard to end the Opioid Crisis. Join with us by disposing unused or expired prescription medications at over 4,000 locations across this great Country. Find a location TODAY from 10am-2pm at http://TakeBackDay.DEA.gov. #TakeBackDay","Administration fight hard Opioid Crisis join dispose unused expire prescription medication 4,000 location great country find location today 10am-2pm takebackday",13064,#TakeBackDay,<UNK>,realDonaldTrump
1188067370478309378,2019-10-26 12:18:29+00:00,....,,12409,<UNK>,<UNK>,realDonaldTrump
1188067369501052929,2019-10-26 12:18:28+00:00,"....greatly help the African American community (and all other communities), and which was unable to get done in past administrations despite a tremendous desire for it. This and best unemployment numbers EVER is more than Kamala will EVER be able to do for African Americans!",greatly help african american community community unable past administration despite tremendous desire good unemployment number Kamala able African Americans,15289,<UNK>,<UNK>,realDonaldTrump
1188067368620167168,2019-10-26 12:18:28+00:00,"Badly failing presidential candidate @KamalaHarris will not go to a very wonderful largely African American event today because yesterday I recieved a major award, at the same event, for being able to produce &amp; sign into law major Criminal Justice Reform legislation, which will..",badly fail presidential candidate @KamalaHarris wonderful largely african american event today yesterday recieve major award event able produce sign major Criminal Justice Reform legislation,22934,<UNK>,@KamalaHarris,realDonaldTrump
1188058730685972480,2019-10-26 11:44:09+00:00,The Ukraine investigation is just as Corrupt and Fake as all of the other garbage that went on before it. Even Shifty Schiff got caught cheating when he made up what I said on the call!,Ukraine investigation corrupt fake garbage go Shifty Schiff catch cheat say,18164,<UNK>,<UNK>,realDonaldTrump
1188054937839775744,2019-10-26 11:29:04+00:00,"....We should all work together to clean up these hazardous waste and homeless sites before the whole city rots away. Very bad and dangerous conditions, also severely impacting the Pacific Ocean and water supply. Pelosi must work on this mess and turn her District around!",work clean hazardous waste homeless site city rot away dangerous condition severely impact Pacific Ocean water supply Pelosi work mess turn district,17657,<UNK>,<UNK>,realDonaldTrump
1188054936942198784,2019-10-26 11:29:04+00:00,"I can’t believe that Nancy Pelosi’s District in San Francisco is in such horrible shape that the City itself is in violation of many sanitary & environmental orders, causing it to owe the Federal Government billions of dollars - and all she works on is Impeachment.....",believe Nancy Pelosi District Francisco horrible shape City violation sanitary environmental order cause Federal Government billion dollar work impeachment,28069,<UNK>,<UNK>,realDonaldTrump
1188053446215323650,2019-10-26 11:23:09+00:00,"“Not a single American citizen has been charged with anything related to Russian Collusion, not one person.” @TuckerCarlson It was all an illegal Witch Hunt!",single american citizen charge relate Russian Collusion person @TuckerCarlson illegal witch hunt,16267,<UNK>,@TuckerCarlson,realDonaldTrump
1188052969813614592,2019-10-26 11:21:15+00:00,"Had a beautiful dinner last night at Camp David in celebration of the 10th Wedding Anniversary of Ivanka and Jared. Attended by a small number of family and friends, it could not have been nicer. Camp David is a special place. Cost of the event will be totally paid for by me!",beautiful dinner night Camp David celebration 10th Wedding Anniversary Ivanka Jared attend small number family friend nice Camp David special place cost event totally pay,21472,<UNK>,<UNK>,realDonaldTrump
1188048259627081728,2019-10-26 11:02:32+00:00,...Thank you @foxandfriends! Hopefully this is just the beginning of a massive story of injustice and treason. You will never learn this from the corrupt LameStream Media who get Pulitzer Prizes for reporting the story totally wrong. The ones who report it right get only RESPECT!,thank @foxandfriend hopefully beginning massive story injustice treason learn corrupt LameStream medium Pulitzer Prizes report story totally wrong one report right respect,14916,<UNK>,@foxandfriends,realDonaldTrump
1188048258255540224,2019-10-26 11:02:32+00:00,"..the President when Flynn had been cleared of everything long before that. The DOJ is withholding a lot of evidence & information, as are Clapper & Brennan & all of the people who participated in the complete setup of Michael Flynn.”(Terrible!) Sidney Powell. This is a disgrace!",President Flynn clear long withhold evidence information Clapper Brennan people participate complete setup Michael Flynn ”(Terrible Sidney Powell disgrace,14717,<UNK>,<UNK>,realDonaldTrump
1188048257177587712,2019-10-26 11:02:32+00:00,"....They exonerated him completely of being an agent of Russia (Recently Crooked Hillary charged Tulsi Gabbard & Jill Stein with the same thing-SICK), and yet Mr. Comey still runs to the White House on February 14 and conjures up the Obstruction of Justice narrative against.....",exonerate completely agent Russia recently Crooked Hillary charge Tulsi Gabbard Jill Stein thing SICK Comey run White House February conjure Obstruction Justice narrative,8768,<UNK>,<UNK>,realDonaldTrump
1188048255797608449,2019-10-26 11:02:31+00:00,“General Michael Flynn’s attorney is demanding that charges be immediately dropped after they found that FBI Agents manipulated records against him. They say that James Clapper told a reporter to “take a kill shot at Flynn. This has been a complete setup of Michael Flynn....,General Michael Flynn attorney demand charge immediately drop find Agents manipulate record James Clapper tell reporter kill shoot Flynn complete setup Michael Flynn,29289,<UNK>,<UNK>,realDonaldTrump
1187936868299608065,2019-10-26 03:39:54+00:00,"My Administration is fighting hard to end the Opioid Crisis. Join with us by disposing unused or expired prescription medications at over 4,000 locations across this great Country. Find a location TOMORROW, October 26th from 10am-2pm at http://TakeBackDay.DEA.gov. #TakeBackDay","Administration fight hard Opioid Crisis join dispose unused expire prescription medication 4,000 location great country find location tomorrow October 26th 10am-2pm takebackday",12307,#TakeBackDay,<UNK>,realDonaldTrump
