id,created_at,original_text,clean_text,retweet_count,hashtags,mentions,original_author
1255105998471249923,2020-04-28 12:06:03+00:00,"We are doing far more, and better, Testing than any other country in the world, and yet the media does nothing but complain. No matter how good a job is done, the same as with the Ventilators, they will never say we are doing a great job, they will only viciously gripe!",well testing country world media complain matter good Ventilators great viciously gripe,36718,<UNK>,<UNK>,realDonaldTrump
1254967193420402696,2020-04-28 02:54:29+00:00,Because Shifty is a crooked politician!,Shifty crooked politician,27961,<UNK>,<UNK>,realDonaldTrump
1254877727804600321,2020-04-27 20:58:59+00:00,I will be having a White House Press Conference today at 5:30 P.M. Thank you!,have White House Press Conference today 5:30 P.M. thank,15139,<UNK>,<UNK>,realDonaldTrump
1254782650679615492,2020-04-27 14:41:11+00:00,"Why should the people and taxpayers of America be bailing out poorly run states (like Illinois, as example) and cities, in all cases Democrat run and managed, when most of the other states are not looking for bailout help? I am open to discussing anything, but just asking?",people taxpayer America bail poorly state like Illinois example city case Democrat manage state look bailout help open discuss ask,44230,<UNK>,<UNK>,realDonaldTrump
1254769296280031232,2020-04-27 13:48:07+00:00,"FAKE NEWS, THE ENEMY OF THE PEOPLE!",FAKE NEWS enemy PEOPLE,76214,<UNK>,<UNK>,realDonaldTrump
1254767509460234243,2020-04-27 13:41:01+00:00,"There has never been, in the history of our Country, a more vicious or hostile Lamestream Media than there is right now, even in the midst of a National Emergency, the Invisible Enemy!",history country vicious hostile Lamestream medium right midst National Emergency Invisible Enemy,44602,<UNK>,<UNK>,realDonaldTrump
1254747293414305792,2020-04-27 12:20:41+00:00,"Blame the Democrats for any “lateness” in your Enhanced Unemployment Insurance. I wanted the money to be paid directly, they insisted it be paid by states for distribution. I told them this would happen, especially with many states which have old computers.",blame Democrats lateness Enhanced Unemployment Insurance want money pay directly insist pay state distribution tell happen especially state computer,41136,<UNK>,<UNK>,realDonaldTrump
1254586604360011776,2020-04-27 01:42:10+00:00,So true!,true,25370,<UNK>,<UNK>,realDonaldTrump
1254577575449497602,2020-04-27 01:06:17+00:00,"American citizens! We were long ahead of Dems, who were all against the BAN.",american citizen long ahead Dems,15179,<UNK>,<UNK>,realDonaldTrump
1254575880510287872,2020-04-27 00:59:33+00:00,Great!,great,11346,<UNK>,<UNK>,realDonaldTrump
1254566538725797888,2020-04-27 00:22:26+00:00,They are one of the worst in the “news” business. Total slime balls!,bad news business total slime ball,13452,<UNK>,<UNK>,realDonaldTrump
1254565907399139328,2020-04-27 00:19:55+00:00,"They asked me to be at West Point on June 13th., & I will be there!",ask West Point June 13th,12711,<UNK>,<UNK>,realDonaldTrump
1254564582020059136,2020-04-27 00:14:39+00:00,"Laura, just another Fake News Report!",Laura Fake News Report,9459,<UNK>,<UNK>,realDonaldTrump
1254544354603143168,2020-04-26 22:54:17+00:00,"Does anybody get the meaning of what a so-called Noble (not Nobel) Prize is, especially as it pertains to Reporters and Journalists? Noble is defined as, “having or showing fine personal qualities or high moral principles and ideals.” Does sarcasm ever work?",anybody meaning call Noble Nobel Prize especially pertain Reporters Journalists Noble define have show fine personal quality high moral principle ideal sarcasm work,30673,<UNK>,<UNK>,realDonaldTrump
1254529069733105665,2020-04-26 21:53:32+00:00,"Reports that H.H.S. Secretary @AlexAzar is going to be “fired” by me are Fake News. The Lamestream Media knows this, but they are desperate to create the perception of chaos &amp; havoc in the minds of the public. They never even called to ask. Alex is doing an excellent job!",report H.H.S. Secretary @AlexAzar go fire Fake News Lamestream Media know desperate create perception chaos havoc mind public call Alex excellent,21871,<UNK>,@AlexAzar,realDonaldTrump
1254520891863678977,2020-04-26 21:21:03+00:00,"....fraud @donnabrazile (and others who are even worse). Chris Wallace is nastier to Republicans than even Deface the Nation or Sleepy Eyes. The people who are watching @FoxNews, in record numbers (thank you President Trump), are angry. They want an alternative now. So do I!",fraud @donnabrazile bad Chris Wallace nasty Republicans Deface Nation Sleepy eye people watch @foxnews record number thank President Trump angry want alternative,16459,<UNK>,@donnabrazile @FoxNews,realDonaldTrump
1254520890991218691,2020-04-26 21:21:02+00:00,....Even the Radical Left Do Nothing Democrats laughed at the Fox suggestion. No respect for the people running @FoxNews. But Fox keeps on plugging to try and become politically correct. They put RINO Paul Ryan on their Board. They hire “debate questions to Crooked Hillary”....,Radical Left Democrats laugh suggestion respect people run @foxnews keep plug politically correct RINO Paul Ryan Board hire debate question Crooked Hillary,12953,<UNK>,@FoxNews,realDonaldTrump
1254520889212837890,2020-04-26 21:21:02+00:00,".@FoxNews just doesn’t get what’s happening! They are being fed Democrat talking points, and they play them without hesitation or research. They forgot that Fake News @CNN &amp; MSDNC wouldn’t let @FoxNews participate, even a little bit, in the poor ratings Democrat Debates.....",.@FoxNews happen Democrat talk point play hesitation research forget Fake News @cnn MSDNC @FoxNews participate little poor rating Democrat Debates,22661,<UNK>,@FoxNews @CNN @FoxNews,realDonaldTrump
1254477491642732552,2020-04-26 18:28:35+00:00,"....schedule and eating habits, written by a third rate reporter who knows nothing about me. I will often be in the Oval Office late into the night & read & see that I am angrily eating a hamburger & Diet Coke in my bedroom. People with me are always stunned. Anything to demean!",schedule eat habit write rate reporter know Oval Office late night read angrily eat hamburger Diet Coke bedroom People stunned demean,18302,<UNK>,<UNK>,realDonaldTrump
1254477490678104064,2020-04-26 18:28:35+00:00,"I work from early in the morning until late at night, haven’t left the White House in many months (except to launch Hospital Ship Comfort) in order to take care of Trade Deals, Military Rebuilding etc., and then I read a phony story in the failing @nytimes about my work....",work early morning late night leave White House month launch Hospital Ship Comfort order care Trade Deals Military Rebuilding read phony story failing @nytime work,28460,<UNK>,@nytimes,realDonaldTrump
1254475682723307520,2020-04-26 18:21:24+00:00,"The people that know me and know the history of our Country say that I am the hardest working President in history. I don’t know about that, but I am a hard worker and have probably gotten more done in the first 3 1/2 years than any President in history. The Fake News hates it!",people know know history country hard work President history know hard worker probably get year President history Fake News hate,48866,<UNK>,<UNK>,realDonaldTrump
1254465783821934595,2020-04-26 17:42:04+00:00,".@CardinalDolan Thank you for a great call yesterday with Catholic Leaders, and a great Service today from @StPatsNYC!",.@CardinalDolan thank great yesterday Catholic Leaders great Service today @StPatsNYC,9065,<UNK>,@CardinalDolan @StPatsNYC,realDonaldTrump
1254441783523762182,2020-04-26 16:06:42+00:00,"Happy Birthday to Melania, our great First Lady!",happy birthday Melania great Lady,61448,<UNK>,<UNK>,realDonaldTrump
1254215201911644163,2020-04-26 01:06:20+00:00,Had a great call with Catholic Leaders and Educators earlier today. I will be online tomorrow at 10:15 A.M. (Eastern) for Sunday Mass celebrated by @CardinalDolan at St. Patrick’s Cathedral (@StPatsNYC) in New York City. Join me: https://saintpatrickscathedral.org/live,great Catholic Leaders Educators early today online tomorrow 10:15 A.M. Eastern Sunday Mass celebrate @CardinalDolan Patrick Cathedral @stpatsnyc York City join,16307,<UNK>,@CardinalDolan @StPatsNYC,realDonaldTrump
1254174221481246721,2020-04-25 22:23:30+00:00,"I never said the pandemic was a Hoax! Who would say such a thing? I said that the Do Nothing Democrats, together with their Mainstream Media partners, are the Hoax. They have been called out & embarrassed on this, even admitting they were wrong, but continue to spread the lie!",say pandemic Hoax thing say Democrats Mainstream Media partner Hoax call embarrassed admit wrong continue spread,54832,<UNK>,<UNK>,realDonaldTrump
1254172638307586049,2020-04-25 22:17:13+00:00,"Remember, the Cure can’t be worse than the problem itself. Be careful, be safe, use common sense!",remember cure bad problem careful safe common sense,56794,<UNK>,<UNK>,realDonaldTrump
1254168730898173953,2020-04-25 22:01:41+00:00,"What is the purpose of having White House News Conferences when the Lamestream Media asks nothing but hostile questions, & then refuses to report the truth or facts accurately. They get record ratings, & the American people get nothing but Fake News. Not worth the time & effort!",purpose have White House News Conferences Lamestream Media ask hostile question refuse report truth fact accurately record rating american people Fake News worth time effort,50235,<UNK>,<UNK>,realDonaldTrump
1254145835450933249,2020-04-25 20:30:42+00:00,"Was just informed that the Fake News from the Thursday White House Press Conference had me speaking & asking questions of Dr. Deborah Birx. Wrong, I was speaking to our Laboratory expert, not Deborah, about sunlight etc. & the CoronaVirus. The Lamestream Media is corrupt & sick!",inform Fake News Thursday White House Press Conference speak ask question Deborah Birx wrong speak laboratory expert Deborah sunlight CoronaVirus Lamestream Media corrupt sick,39581,<UNK>,<UNK>,realDonaldTrump
