id,created_at,original_text,clean_text,retweet_count,hashtags,mentions,original_author
1197324462703538181,2019-11-21 01:22:51+00:00,Poll: Trump leads top 2020 Democrats in Wisconsin https://thehill.com/homenews/campaign/471335-poll-trump-leads-top-democratic-opponents-in-wisconsin.,poll trump lead 2020 Democrats Wisconsin,13730,<UNK>,<UNK>,realDonaldTrump
1197321672841318400,2019-11-21 01:11:46+00:00,"“All four of Gordon Sondland’s lawyers are Democrat Donors.” @TuckerCarlson Despite this, big win today for Republicans!",Gordon Sondland lawyer Democrat Donors @tuckercarlson despite today Republicans,15828,<UNK>,@TuckerCarlson,realDonaldTrump
1197319631158988800,2019-11-21 01:03:39+00:00,"Watch @TuckerCarlson, @seanhannity, @IngrahamAngle. Big News! @FoxNews",watch @TuckerCarlson @seanhannity @ingrahamangle News @foxnews,9404,<UNK>,@TuckerCarlson @seanhannity @IngrahamAngle @FoxNews,realDonaldTrump
1197316106236481539,2019-11-21 00:49:39+00:00,https://twitter.com/realDonaldTrump/status/1197293250115014656,,16678,<UNK>,<UNK>,realDonaldTrump
1197298118330474498,2019-11-20 23:38:10+00:00,"If this were a prizefight, they’d stop it!",prizefight stop,22314,<UNK>,<UNK>,realDonaldTrump
1197293250115014656,2019-11-20 23:18:50+00:00,Today I opened a major Apple Manufacturing plant in Texas that will bring high paying jobs back to America. Today Nancy Pelosi closed Congress because she doesn’t care about American Workers!,today open major Apple Manufacturing plant Texas bring high pay job America today Nancy Pelosi close Congress care American Workers,30192,<UNK>,<UNK>,realDonaldTrump
1197229247930097664,2019-11-20 19:04:30+00:00,I WANT NOTHING!,want,15545,<UNK>,<UNK>,realDonaldTrump
1197227388683206656,2019-11-20 18:57:07+00:00,"....”I WANT NOTHING! I WANT NOTHING! I WANT NO QUID PRO QUO! TELL PRESIDENT ZELENSKY TO DO THE RIGHT THING!” Later, Ambassador Sondland said that I told him, “Good, go tell the truth!” This Witch Hunt must end NOW. So bad for our Country!",want want want quid TELL PRESIDENT ZELENSKY right thing later Ambassador Sondland say tell good tell truth Witch Hunt country,17715,<UNK>,<UNK>,realDonaldTrump
1197227384878927873,2019-11-20 18:57:06+00:00,"Impeachment Witch Hunt is now OVER! Ambassador Sondland asks U.S. President (me): “What do you want from Ukraine? I keep hearing all these different ideas & theories. What do you want? It was a very abrupt conversation. He was not in a good mood. He (the President) just said,”...",impeachment Witch Hunt Ambassador Sondland ask U.S. President want Ukraine hear different idea theory want abrupt conversation good mood President say,22605,<UNK>,<UNK>,realDonaldTrump
1197224490192629760,2019-11-20 18:45:36+00:00,We join families of Kevin King & Tim Weeks in celebrating their release from Taliban captivity. Thanks to President Ghani for his courageous support. Let’s hope this leads to more good things on the peace front like a ceasefire that will help end this long war. Proud of my team!,join family Kevin King Weeks celebrate release Taliban captivity thank President Ghani courageous support hope lead good thing peace like ceasefire help long proud team,12948,<UNK>,<UNK>,realDonaldTrump
1197144925034418176,2019-11-20 13:29:26+00:00,"Nancy Pelosi will go down as the least productive Speaker of the House in history. She is dominated by AOC Plus 3 and the Radical Left. Mexico and Canada, after waiting for 6 months to be approved, are ready to flee - and who can blame them? Too bad!",Nancy Pelosi productive Speaker House history dominate plus Radical Left Mexico Canada wait month approve ready flee blame,25766,<UNK>,<UNK>,realDonaldTrump
1197131856963129344,2019-11-20 12:37:30+00:00,“White House Confidence Grows As Hearings Wear On.” @WashTimes This is just an attempted takedown of the Republican Party by the Do Nothing Democrats. It will never work. #2020,White House Confidence grow hearing wear @WashTimes attempt takedown Republican Party Democrats work 2020,14881,<UNK>,@WashTimes,realDonaldTrump
1197129443187318786,2019-11-20 12:27:55+00:00,The three year Hoax continues!,year Hoax continue,12163,<UNK>,<UNK>,realDonaldTrump
1197128659192164357,2019-11-20 12:24:48+00:00,True. Great job @RepMikeTurner!,true great @repmiketurner,10199,<UNK>,@RepMikeTurner,realDonaldTrump
1197128156341248001,2019-11-20 12:22:48+00:00,Read the transcripts!,read transcript,11118,<UNK>,<UNK>,realDonaldTrump
1197014949341646848,2019-11-20 04:52:58+00:00,Thank you Tennessee!,thank Tennessee,14952,<UNK>,<UNK>,realDonaldTrump
1196977794183499776,2019-11-20 02:25:19+00:00,"Congressman Van Drew (D-NJ): We’ve spent millions of Dollars, in my opinion, tons of money, tons of time, tons of hurt, fracturing the Nation apart. I haven’t seen this to be a good thing.”",Congressman Drew spend million Dollars opinion ton money ton time ton hurt fracture Nation apart see good thing,18224,<UNK>,<UNK>,realDonaldTrump
1196958035127783427,2019-11-20 01:06:48+00:00,"A great day for Republicans, a great day for our Country!",great Republicans great country,26084,<UNK>,<UNK>,realDonaldTrump
1196943910624538625,2019-11-20 00:10:41+00:00,"I agree, but in the end we will win and save our Country from certain destruction!",agree save country certain destruction,20070,<UNK>,<UNK>,realDonaldTrump
1196791181163847682,2019-11-19 14:03:47+00:00,NASDAQ UP 27% THIS YEAR ALONE!,NASDAQ year,18173,<UNK>,<UNK>,realDonaldTrump
1196658170984357888,2019-11-19 05:15:15+00:00,"Nancy Pelosi just stated that “it is dangerous to let the voters decide Trump’s fate.” @FoxNews In other words, she thinks I’m going to win and doesn’t want to take a chance on letting the voters decide. Like Al Green, she wants to change our voting system. Wow, she’s CRAZY!",Nancy Pelosi state dangerous voter decide Trump fate @foxnews word think go want chance let voter decide like Green want change voting system CRAZY,39033,<UNK>,@FoxNews,realDonaldTrump
1196634663743361025,2019-11-19 03:41:50+00:00,The Do Nothing Democrats have disgraced our great Country!,Democrats disgrace great country,17234,<UNK>,<UNK>,realDonaldTrump
1196632739266596865,2019-11-19 03:34:12+00:00,"At my meeting with Jay Powell this morning, I protested fact that our Fed Rate is set too high relative to the interest rates of other competitor countries. In fact, our rates should be lower than all others (we are the U.S.). Too strong a Dollar hurting manufacturers & growth!",meeting Powell morning protest fact Rate high relative interest rate competitor country fact rate low U.S. strong Dollar hurt manufacturer growth,16644,<UNK>,<UNK>,realDonaldTrump
1196577458583195651,2019-11-18 23:54:32+00:00,Mark Levin speaking one week after I took office. This was always a planned COUP and the Radical Left Democrats will suffer at the polls in 2020!,Mark Levin speak week take office plan coup radical Left Democrats suffer poll 2020,22976,<UNK>,<UNK>,realDonaldTrump
1196540711086243841,2019-11-18 21:28:30+00:00,GREAT NEWS! #MAGA #KAG,GREAT NEWS MAGA,14509,#MAGA #KAG,<UNK>,realDonaldTrump
1196532586853650434,2019-11-18 20:56:13+00:00,THANK YOU! #MAGA #KAG,thank MAGA,13626,#MAGA #KAG,<UNK>,realDonaldTrump
1196514729767899137,2019-11-18 19:45:16+00:00,https://www.donaldjtrump.com/events/sunrise-fl-nov-26-2019,,11582,<UNK>,<UNK>,realDonaldTrump
1196459630060359686,2019-11-18 16:06:19+00:00,“Congressman Van Drew (D-NJ) SLAMS Democrats for ‘fracturing the Nation’ with Impeachment probe. ‘We already know how it’s going to end.” @FoxNews,Congressman Drew slams Democrats fracture Nation Impeachment probe know go @foxnews,17219,<UNK>,@FoxNews,realDonaldTrump
1196458467982270464,2019-11-18 16:01:42+00:00,"Just finished a very good & cordial meeting at the White House with Jay Powell of the Federal Reserve. Everything was discussed including interest rates, negative interest, low inflation, easing, Dollar strength & its effect on manufacturing, trade with China, E.U. & others, etc.",finish good cordial meeting White House Powell Federal Reserve discuss include interest rate negative interest inflation easing Dollar strength effect manufacturing trade China E.U.,15768,<UNK>,<UNK>,realDonaldTrump
1196425928768929792,2019-11-18 13:52:24+00:00,"....that I testify about the phony Impeachment Witch Hunt. She also said I could do it in writing. Even though I did nothing wrong, and don’t like giving credibility to this No Due Process Hoax, I like the idea & will, in order to get Congress focused again, strongly consider it!",testify phony Impeachment Witch Hunt say writing wrong like give credibility Process Hoax like idea order Congress focus strongly consider,12453,<UNK>,<UNK>,realDonaldTrump
1196425921802178560,2019-11-18 13:52:22+00:00,"Our Crazy, Do Nothing (where’s USMCA, infrastructure, lower drug pricing & much more?) Speaker of the House, Nervous Nancy Pelosi, who is petrified by her Radical Left knowing she will soon be gone (they & Fake News Media are her BOSS), suggested on Sunday’s DEFACE THE NATION....",Crazy USMCA infrastructure low drug pricing Speaker House Nervous Nancy Pelosi petrify Radical Left know soon go Fake News Media BOSS suggest Sunday deface nation,18374,<UNK>,<UNK>,realDonaldTrump
1196405099741896705,2019-11-18 12:29:38+00:00,"Never has the Republican Party been so united as it is now. 95% A.R. This is a great fraud being played out against the American people by the Fake News Media & their partner, the Do Nothing Democrats. The rules are rigged by Pelosi & Schiff, but we are winning, and we will win!",Republican Party united A.R. great fraud play american people Fake News Media partner Democrats rule rig Pelosi Schiff win,27292,<UNK>,<UNK>,realDonaldTrump
1196271720392511489,2019-11-18 03:39:38+00:00,"“All they do is bring up witnesses who didn’t witness anything.” @KatrinaPierson @SteveHiltonx Nothing matters except the two transcripts of the presidential calls, and the statement of no pressure put out by Ukraine!",bring witness witness @KatrinaPierson @SteveHiltonx matter transcript presidential call statement pressure Ukraine,15843,<UNK>,@KatrinaPierson @SteveHiltonx,realDonaldTrump
1196256729471827968,2019-11-18 02:40:04+00:00,“The Impeachment started before he even became President.” @greggutfeld @FoxNews,Impeachment start President @greggutfeld @foxnews,17780,<UNK>,@greggutfeld @FoxNews,realDonaldTrump
1196159184431177729,2019-11-17 20:12:27+00:00,Where is the Fake Whistleblower?,Fake Whistleblower,24536,<UNK>,<UNK>,realDonaldTrump
1196158097628303361,2019-11-17 20:08:08+00:00,"Republicans & others must remember, the Ukrainian President and Foreign Minister both said that there was no pressure placed on them whatsoever. Also, they didn’t even know the money wasn’t paid, and got the money with no conditions. But why isn’t Germany, France (Europe) paying?",Republicans remember ukrainian President Foreign Minister say pressure place whatsoever know money pay money condition Germany France Europe pay,15653,<UNK>,<UNK>,realDonaldTrump
1196156991682568193,2019-11-17 20:03:44+00:00,"The Crazed, Do Nothing Democrats are turning Impeachment into a routine partisan weapon. That is very bad for our Country, and not what the Founders had in mind!!!!",Crazed Democrats turn Impeachment routine partisan weapon country founder mind,16545,<UNK>,<UNK>,realDonaldTrump
1196155347117002752,2019-11-17 19:57:12+00:00,"Tell Jennifer Williams, whoever that is, to read BOTH transcripts of the presidential calls, & see the just released ststement from Ukraine. Then she should meet with the other Never Trumpers, who I don’t know & mostly never even heard of, & work out a better presidential attack!",tell Jennifer Williams read transcript presidential call release ststement Ukraine meet Trumpers know hear work well presidential attack,15744,<UNK>,<UNK>,realDonaldTrump
1196153477099085824,2019-11-17 19:49:47+00:00,"Paul Krugman of @nytimes has been wrong about me from the very beginning. Anyone who has followed his “words of wisdom” has lost a great deal of money. Paul, just concede the game, say I was right, and lets start a brand new game!",Paul Krugman @nytime wrong beginning follow word wisdom lose great deal money Paul concede game right let start brand game,9482,<UNK>,@nytimes,realDonaldTrump
1196152913174958080,2019-11-17 19:47:32+00:00,Schiff is a Corrupt Politician!,Schiff corrupt politician,13721,<UNK>,<UNK>,realDonaldTrump
1196148537525977088,2019-11-17 19:30:09+00:00,".@SteveScalise blew the nasty &amp; obnoxious Chris Wallace (will never be his father, Mike!) away on Chris’s lowest rated (unless I’m on) morning show. This kind of dumb and unfair interview would never have happened in the @FoxNews past. Great job Steve!",.@SteveScalise blow nasty obnoxious Chris Wallace father Mike away Chris low rate morning kind dumb unfair interview happen @FoxNews past great Steve,15320,<UNK>,@SteveScalise @FoxNews,realDonaldTrump
1196134600227078144,2019-11-17 18:34:46+00:00,Thanks Eric!,thanks Eric,10405,<UNK>,<UNK>,realDonaldTrump
1196121686728466434,2019-11-17 17:43:27+00:00,"Paul Krugman has called me wrong from day one. People at the Failing New York Times are very angry at him for having “missed” by soooo much. Paul, match over!",Paul Krugman call wrong People Failing York Times angry have miss soooo Paul match,8992,<UNK>,<UNK>,realDonaldTrump
1196113831283613696,2019-11-17 17:12:14+00:00,"I agree Katrina, Pam Bondi is a great woman!",agree Katrina Bondi great woman,4659,<UNK>,<UNK>,realDonaldTrump
1196109916769005569,2019-11-17 16:56:41+00:00,The Do Nothing Dems are now doing even less - and soooo much work to be done!,Dems soooo work,14603,<UNK>,<UNK>,realDonaldTrump
1196108650584125441,2019-11-17 16:51:39+00:00,"Joe Ricketts, one of our Country’s most successful businessmen, including being the owner of the Chicago Cubs, has just written a great new book, THE HARDER YOU WORK, THE LUCKIER YOU GET. So true! Much can be learned from Joe. Go get the book!",Ricketts country successful businessman include owner Chicago Cubs write great book HARDER work LUCKIER true learn book,7784,<UNK>,<UNK>,realDonaldTrump
1196105359355711488,2019-11-17 16:38:34+00:00,A BIG difference!,difference,5985,<UNK>,<UNK>,realDonaldTrump
1196097712925691906,2019-11-17 16:08:11+00:00,"Our great Farmers will recieve another major round of “cash,” compliments of China Tariffs, prior to Thanksgiving. The smaller farms and farmers will be big beneficiaries. In the meantime, and as you may have noticed, China is starting to buy big again. Japan deal DONE. Enjoy!",great farmer recieve major round cash compliment China Tariffs prior Thanksgiving small farm farmer beneficiary meantime notice China start Japan deal enjoy,22803,<UNK>,<UNK>,realDonaldTrump
1196081088260722688,2019-11-17 15:02:08+00:00,".@MariaBartiromo has a GREAT show going on right now, 10:00 A.M. Fantastic guests talk about the Fake Impeachment! @FoxNews",.@MariaBartiromo great go right 10:00 A.M. fantastic guest talk Fake Impeachment @foxnews,6890,<UNK>,@MariaBartiromo @FoxNews,realDonaldTrump
1196080086686011398,2019-11-17 14:58:09+00:00,"Mr. Chairman, Joe Biden may be Sleepy and Very Slow, but he is not a “rabid dog.” He is actually somewhat better than that, but I am the only one who can get you where you have to be. You should act quickly, get the deal done. See you soon!",Chairman Biden Sleepy slow rabid actually somewhat well quickly deal soon,12305,<UNK>,<UNK>,realDonaldTrump
1196067863070674947,2019-11-17 14:09:35+00:00,"Dowd never understood the pulse of the Republican Party, present or past. He’s just a 3rd rate hit job for Fake News @ABC!",dowd understand pulse Republican Party present past rate Fake News @abc,8338,<UNK>,@ABC,realDonaldTrump
1196063349844430849,2019-11-17 13:51:39+00:00,A new Republican Star is born. Great going @EliseStefanik!,Republican Star bear great going @elisestefanik,18271,<UNK>,@EliseStefanik,realDonaldTrump
1196061212833923072,2019-11-17 13:43:09+00:00,Thank you Pete. Our great warfighters must be allowed to fight. I would not have done this for Sgt. Bergdahl or Chelsea Manning!,thank Pete great warfighter allow fight Bergdahl Chelsea Manning,12515,<UNK>,<UNK>,realDonaldTrump
1195931893998456832,2019-11-17 05:09:17+00:00,Visited a great family of a young man under major surgery at the amazing Walter Reed Medical Center. Those are truly some of the best doctors anywhere in the world. Also began phase one of my yearly physical. Everything very good (great!). Will complete next year.,visit great family young major surgery amazing Walter Reed Medical Center truly good doctor world begin phase yearly physical good great complete year,16135,<UNK>,<UNK>,realDonaldTrump
1195775733932707840,2019-11-16 18:48:46+00:00,True!,true,13522,<UNK>,<UNK>,realDonaldTrump
1195774605010636801,2019-11-16 18:44:16+00:00,Congratulations Kimberley. Great book!,Congratulations Kimberley great book,7787,<UNK>,<UNK>,realDonaldTrump
1195773067261292547,2019-11-16 18:38:10+00:00,"“I mean, come on. The Democrats are doing focus groups to try and figure out what words to use to move the needle. The Democrats know this is political and they’re just trying to drag Trump’s name into the mud!” Lisa Booth @foxandfriends Thank you Lisa!",mean come Democrats focus group figure word needle Democrats know political try drag Trump Lisa Booth @foxandfriend thank Lisa,17082,<UNK>,@foxandfriends,realDonaldTrump
1195762921470607361,2019-11-16 17:57:51+00:00,"“Triggered,” a great book by my son, Don. Now number one on @NYTIMES LIST. Keep it there for a while!",trigger great book number @NYTIMES LIST,11737,<UNK>,@nytimes,realDonaldTrump
1195727879780360193,2019-11-16 15:38:36+00:00,"....and Taylor, dismissing everybody involved from the Obama holdover days trying to undermine Trump, getting rid of those people, dismissing them, this is what it looks like. It was never going to be claen, they were never going to sit by idly and just let Trump do this!” Rush L",Taylor dismiss everybody involve Obama holdover day try undermine Trump get people dismiss look like go claen go idly Trump Rush,12078,<UNK>,<UNK>,realDonaldTrump
1195727871765073921,2019-11-16 15:38:34+00:00,"“My support for Donald Trump has never been greater than it is right now. It is paramountly obvious watching this, these people have to go. You elected Donald Trump to drain the Swamp, well, dismissing people like Yovanovitch is what that looks like. Dismissing people like Kent..",support Donald Trump great right paramountly obvious watch people elect Donald Trump drain swamp dismiss people like Yovanovitch look like dismiss people like Kent,16403,<UNK>,<UNK>,realDonaldTrump
1195722806274736129,2019-11-16 15:18:27+00:00,"Dow hits 28,000 - FIRST TIME EVER, HIGHEST EVER! Gee, Pelosi & Schitt have a good idea, “lets Impeach the President.” If something like that ever happened, it would lead to the biggest FALL in Market History. It’s called a Depression, not a Recession! So much for 401-K’s & Jobs!","hit 28,000 TIME HIGHEST Pelosi Schitt good idea let Impeach President like happen lead big FALL market history call Depression recession 401-K Jobs",26026,<UNK>,<UNK>,realDonaldTrump
1195700944845049857,2019-11-16 13:51:34+00:00,"LOUISIANA, VOTE @EddieRispone TODAY! He will be a great governor!",louisiana vote @eddierispone today great governor,13651,<UNK>,@EddieRispone,realDonaldTrump
1195690037461094407,2019-11-16 13:08:14+00:00,Good morning Louisiana! Polls are open at 7AM. Get out and VOTE for @EddieRispone to be your next Gov! He will get your taxes and auto insurance (highest in Country!) way down. Loves our Military &amp; Vets. Will protect your 2A. Find your polling place below:,good morning Louisiana poll open vote @EddieRispone taxis auto insurance high country love Military vet protect find polling place,16237,<UNK>,@EddieRispone,realDonaldTrump
1195531896433848320,2019-11-16 02:39:50+00:00,#NewHoaxSameSwamp,newhoaxsameswamp,30792,#NewHoaxSameSwamp,<UNK>,realDonaldTrump
1195495876631957504,2019-11-16 00:16:42+00:00,THANK YOU! #MAGA #KAG,thank MAGA,14165,#MAGA #KAG,<UNK>,realDonaldTrump
1195464209594830854,2019-11-15 22:10:52+00:00,https://twitter.com/realDonaldTrump/status/1195379578358960128,,16094,<UNK>,<UNK>,realDonaldTrump
1195389486659776512,2019-11-15 17:13:57+00:00,....A double standard like never seen before in the history of our Country?,double standard like see history country,18562,<UNK>,<UNK>,realDonaldTrump
1195389483664990208,2019-11-15 17:13:56+00:00,"So they now convict Roger Stone of lying and want to jail him for many years to come. Well, what about Crooked Hillary, Comey, Strzok, Page, McCabe, Brennan, Clapper, Shifty Schiff, Ohr & Nellie, Steele & all of the others, including even Mueller himself? Didn’t they lie?....",convict Roger Stone lie want jail year come Crooked Hillary Comey Strzok Page McCabe Brennan Clapper Shifty Schiff Nellie Steele include Mueller,42995,<UNK>,<UNK>,realDonaldTrump
1195379578358960128,2019-11-15 16:34:35+00:00,"Stock Market up big. New and Historic Record. Job, jobs, jobs!",Stock Market Historic Record job job,19180,<UNK>,<UNK>,realDonaldTrump
1195376390054580225,2019-11-15 16:21:55+00:00,"We have vacancies in various departments because we do not want or need as many people as past administrations (and save great cost), and also, the Democrats delay the approval process to levels unprecedented in the history of our Country!",vacancy department want need people past administration save great cost Democrats delay approval process level unprecedented history country,19771,<UNK>,<UNK>,realDonaldTrump
1195360243708047366,2019-11-15 15:17:45+00:00,"Another Record Stock Market, 21 times this year, despite an ongoing, & totally unfounded, Witch Hunt, & a Democrat Party that would love to see a nice, big, juicy recession. In actuality, the potential for the United States is unlimited. We will power through the Do Nothing Dems!",Record Stock Market time year despite ongoing totally unfounded Witch Hunt Democrat Party love nice juicy recession actuality potential United States unlimited power Dems,16018,<UNK>,<UNK>,realDonaldTrump
1195356211937468417,2019-11-15 15:01:44+00:00,"....They call it “serving at the pleasure of the President.” The U.S. now has a very strong and powerful foreign policy, much different than proceeding administrations. It is called, quite simply, America First! With all of that, however, I have done FAR more for Ukraine than O.",serve pleasure President U.S. strong powerful foreign policy different proceed administration call simply America Ukraine,15918,<UNK>,<UNK>,realDonaldTrump
1195356198347956224,2019-11-15 15:01:40+00:00,"Everywhere Marie Yovanovitch went turned bad. She started off in Somalia, how did that go? Then fast forward to Ukraine, where the new Ukrainian President spoke unfavorably about her in my second phone call with him. It is a U.S. President’s absolute right to appoint ambassadors.",Marie Yovanovitch go turn start Somalia fast forward Ukraine ukrainian President speak unfavorably second phone U.S. President absolute right appoint ambassador,29352,<UNK>,<UNK>,realDonaldTrump
1195337873882583042,2019-11-15 13:48:52+00:00,"......filth pouring into the Pacific Ocean is rapidly becoming an environmental hazard, is getting NOTHING DONE. She is a Do Nothing Democrat as Speaker, and will hopefully not be in that position very long. Approve USMCA, which has been sitting on her desk for months!",filth pour Pacific Ocean rapidly environmental hazard get Democrat Speaker hopefully position long approve USMCA sit desk month,14460,<UNK>,<UNK>,realDonaldTrump
1195337867989573632,2019-11-15 13:48:50+00:00,"The Impeachment Witch Hunt should be over with the statement made last night by the President and Foreign Minister of Ukraine. Nervous Nancy Pelosi, who should be home cleaning up the dangerous & disgusting Slum she is making of her District in San Francisco, where even the......",Impeachment Witch Hunt statement night President Foreign Minister Ukraine Nervous Nancy Pelosi home clean dangerous disgusting Slum make District Francisco,17864,<UNK>,<UNK>,realDonaldTrump
1195202838361624577,2019-11-15 04:52:17+00:00,"....Ambassador Sondland did not tell us, and certainly did not tell me, about a connection between the assistance and the investigation.” THE FAKE IMPEACHMENT INQUIRY IS NOW DEAD!",Ambassador Sondland tell certainly tell connection assistance investigation FAKE IMPEACHMENT INQUIRY DEAD,15549,<UNK>,<UNK>,realDonaldTrump
1195202834645405698,2019-11-15 04:52:16+00:00,"Democrats must apologize to USA: Ukrainian Foreign Minister Vadym Prystaiko said that “United States Ambassador Gordon Sondland did NOT link financial military assistance to a request for Ukraine to open up an investigation into former V.P. Joe Biden & his son, Hunter Biden.....",democrat apologize ukrainian Foreign Minister Vadym Prystaiko say United States Ambassador Gordon Sondland link financial military assistance request Ukraine open investigation V.P. Biden Hunter Biden,20302,<UNK>,<UNK>,realDonaldTrump
1195187992270270464,2019-11-15 03:53:17+00:00,"This Saturday, the eyes of history are looking at the people of Louisiana. If you want to defend your values, your jobs, and your freedom, then you need to REPLACE Radical Liberal John Bel Edwards with a true Louisiana Patriot: @EddieRispone! #GeauxVote",Saturday eye history look people Louisiana want defend value job freedom need replace Radical Liberal John Edwards true Louisiana Patriot @EddieRispone GeauxVote,16500,#GeauxVote,@EddieRispone,realDonaldTrump
