id,created_at,original_text,clean_text,retweet_count,hashtags,mentions,original_author
1292880134022795266,2020-08-10 17:46:59+00:00,"My friend, Congressman @TomEmmer, is doing a tremendous job for the people of Minnesota! He strongly supports our brave Law Enforcement &amp; National Guard, fights for our Vets and works hard to Cut your Taxes! Tom has my Complete and Total Endorsement! #MN06",friend Congressman @TomEmmer tremendous people Minnesota strongly support brave Enforcement National Guard fight vet work hard taxis Complete Total Endorsement mn06,6893,#MN06,@tomemmer,realDonaldTrump
1292880004183920641,2020-08-10 17:46:28+00:00,"Congressman @PeteStauber fights for the hard-working people of Northeastern Minnesota! A former professional hockey player, Pete knows how to win. He stands for Law Enforcement, Small Business and our Vets. Pete has my Complete and Total Endorsement! #MN08",congressman @PeteStauber fight hard work people Northeastern Minnesota professional hockey player Pete know stand Enforcement Small Business Vets Pete Complete Total Endorsement MN08,7021,#MN08,@PeteStauber,realDonaldTrump
1292879824210595842,2020-08-10 17:45:45+00:00,"Congressman Jim Hagedorn (@JimHagedornMN) is an incredible advocate for Minnesota! He fights for our Farmers, Vets and Small Businesses, and he strongly defends your Second Amendment! Jim has my Complete and Total Endorsement! #MN01",Congressman Hagedorn @JimHagedornMN incredible advocate Minnesota fight Farmers Vets Small Businesses strongly defend Second Amendment Complete Total Endorsement MN01,6380,#MN01,@JimHagedornMN,realDonaldTrump
1292879715775250432,2020-08-10 17:45:19+00:00,"Congratulations on your big primary win, Governor @MikeParson! You have my Complete and Total Endorsement! #MOGOV",congratulation primary Governor @MikeParson Complete Total Endorsement MOGOV,7064,#MOGOV,@mikeparson,realDonaldTrump
1292879622145814529,2020-08-10 17:44:57+00:00,Vote for Michelle – a real winner! #MN07,vote Michelle real winner MN07,8724,#MN07,<UNK>,realDonaldTrump
1292877984488198147,2020-08-10 17:38:26+00:00,CONGRATS to General Dynamic’s Bath Iron Works & Local S6 on reaching a tentative agreement after the long strike. GD builds GREAT Arleigh-Burke destroyers. Super boost for Maine Economy. Glad to have helped. I’ve done a lot for Maine!,CONGRATS General Dynamic Bath Iron Works Local reach tentative agreement long strike build GREAT Arleigh burke destroyer super boost Maine Economy glad help Maine,8394,<UNK>,<UNK>,realDonaldTrump
1292873531382992901,2020-08-10 17:20:44+00:00,The student-athletes have been working too hard for their season to be cancelled. #WeWantToPlay,student athlete work hard season cancel wewanttoplay,34685,#WeWantToPlay,<UNK>,realDonaldTrump
1292872318562205699,2020-08-10 17:15:55+00:00,"We have narrowed the Presidential Nomination Acceptance Speech, to be delivered on the final night of the Convention (Thursday), to two locations - The Great Battlefield of Gettysburg, Pennsylvania, and the White House, Washington, D.C. We will announce the decision soon!",narrow Presidential Nomination Acceptance Speech deliver final night Convention Thursday location great Battlefield Gettysburg Pennsylvania White House Washington D.C. announce decision soon,26123,<UNK>,<UNK>,realDonaldTrump
1292838130526158848,2020-08-10 15:00:04+00:00,Thank you to Senator Bill Cassidy of Louisiana for his very smart words on the just signed Executive Orders!,thank Senator Bill Cassidy Louisiana smart word sign Executive Orders,15503,<UNK>,<UNK>,realDonaldTrump
1292837084152107010,2020-08-10 14:55:55+00:00,"Portland, which is out of control, should finally, after almost 3 months, bring in the National Guard. The Mayor and Governor are putting people’s lives at risk. They will be held responsible. The Guard is ready to act immediately. The Courthouse is secured by Homeland!",Portland control finally month bring National Guard Mayor Governor put people life risk hold responsible Guard ready immediately Courthouse secure Homeland,30043,<UNK>,<UNK>,realDonaldTrump
1292832946077007886,2020-08-10 14:39:28+00:00,"RINO Ben Sasse, who needed my support and endorsement in order to get the Republican nomination for Senate from the GREAT State of Nebraska, has, now that he’s got it (Thank you President T), gone rogue, again. This foolishness plays right into the hands of the Radical Left Dems!",RINO Sasse need support endorsement order republican nomination Senate GREAT State Nebraska thank President go rogue foolishness play right hand radical Left Dems,22646,<UNK>,<UNK>,realDonaldTrump
1292810574603202565,2020-08-10 13:10:34+00:00,"So now Schumer and Pelosi want to meet to make a deal. Amazing how it all works, isn’t it. Where have they been for the last 4 weeks when they were “hardliners”, and only wanted BAILOUT MONEY for Democrat run states and cities that are failing badly? They know my phone number!",Schumer Pelosi want meet deal amazing work week hardliner want BAILOUT MONEY Democrat state city fail badly know phone number,54671,<UNK>,<UNK>,realDonaldTrump
1292638186842337281,2020-08-10 01:45:34+00:00,".@Scaramucci, who just made a fool of himself as he got taken apart by @SteveHiltonx, only lasted 11 days in his favorite of all time Administration, before being fired for, again, making a fool of himself. Anthony is a loser who begged to come back. I said “No Thanks”.",.@Scaramucci fool take apart @SteveHiltonx last day favorite time Administration fire make fool Anthony loser beg come say thanks,24935,<UNK>,@Scaramucci @SteveHiltonx,realDonaldTrump
1292628590425759747,2020-08-10 01:07:26+00:00,"This is Fake News by the failing @nytimes &amp; bad ratings @CNN. Never suggested it although, based on all of the many things accomplished during the first 3 1/2 years, perhaps more than any other Presidency, sounds like a good idea to me!",Fake News failing @nytime rating @cnn suggest base thing accomplish year Presidency sound like good idea,30496,<UNK>,@nytimes @CNN,realDonaldTrump
1292190319845478402,2020-08-08 20:05:54+00:00,Major News Conference in Ten Minutes!,Major News Conference Minutes,22152,<UNK>,<UNK>,realDonaldTrump
1292181029541879812,2020-08-08 19:28:59+00:00,"Sleepy Joe Biden just agreed with the Radical Left Democrats to raise Taxes by Three Trillion Dollars. Everyone will pay - Will kill your Stocks, 401k’s, and the ECONOMY. BIG CRASH! #MAGA",Sleepy Biden agree Radical Left Democrats raise taxis Trillion Dollars kill stock 401k ECONOMY CRASH maga,45336,#MAGA,<UNK>,realDonaldTrump
1291871370197041152,2020-08-07 22:58:31+00:00,"Big wins in Tennessee and Kansas! Congratulations to @BillHagertyTN and @RogerMarshallMD. They love our Country and they love their Great States. Strong on Crime, Military, our Vets and the Second Amendment. They have my Complete and Total Endorsement!",win Tennessee Kansas congratulation @BillHagertyTN @RogerMarshallMD love country love Great States strong Crime Military vet Second Amendment Complete Total Endorsement,16468,<UNK>,@BillHagertyTN @RogerMarshallMD,realDonaldTrump
1291864911509938176,2020-08-07 22:32:51+00:00,"I will be doing a news conference on the ChinaVirus, the just announced very good economic numbers, and the improving economy, at 7pm from Bedminster, New Jersey. Also, the subject of the Beirut, Lebanon catastrophe will be discussed.",news conference ChinaVirus announce good economic number improve economy Bedminster Jersey subject Beirut Lebanon catastrophe discuss,25159,<UNK>,<UNK>,realDonaldTrump
1291864496571666438,2020-08-07 22:31:12+00:00,"...We will be having a conference call on Sunday with President Macron, leaders of Lebanon, and leaders from various other parts of the world. Everyone wants to help!",have conference Sunday President Macron leader Lebanon leader part world want help,10097,<UNK>,<UNK>,realDonaldTrump
1291864495648890881,2020-08-07 22:31:12+00:00,"...At 3pm this afternoon, spoke to President Aoun of Lebanon to inform him that 3 large aircraft are on the way, loaded up with Medical Supplies, Food and Water. Also, First Responders, Technicians, Doctors, and Nurses on the way...",afternoon speak President Aoun Lebanon inform large aircraft load medical Supplies Food Water Responders Technicians doctor nurse,12925,<UNK>,<UNK>,realDonaldTrump
1291864494608732170,2020-08-07 22:31:11+00:00,"Had a lengthy discussion this morning with President Macron of France concerning numerous subjects, but in particular the catastrophic event which took place in Beirut, Lebanon...",lengthy discussion morning President Macron France concern numerous subject particular catastrophic event take place Beirut Lebanon,15542,<UNK>,<UNK>,realDonaldTrump
1291842540023558146,2020-08-07 21:03:57+00:00,Pelosi and Schumer only interested in Bailout Money for poorly run Democrat cities and states. Nothing to do with China Virus! Want one trillion dollars. No interest. We are going a different way!,Pelosi Schumer interested Bailout Money poorly Democrat city state China Virus want trillion dollar interest go different,42375,<UNK>,<UNK>,realDonaldTrump
1291732831102803968,2020-08-07 13:48:00+00:00,Great Jobs Numbers!,Great Jobs Numbers,32255,<UNK>,<UNK>,realDonaldTrump
1291722355471941633,2020-08-07 13:06:23+00:00,"After yesterday’s statement, Sleepy Joe Biden is no longer worthy of the Black Vote!",yesterday statement Sleepy Biden long worthy Black Vote,40577,<UNK>,<UNK>,realDonaldTrump
1291718731224305670,2020-08-07 12:51:59+00:00,"This is the biggest political crime and scandal in American history. Hopefully, for the good of our Country, it is coming soon!",big political crime scandal american history hopefully good country come soon,25185,<UNK>,<UNK>,realDonaldTrump
1291718043261968385,2020-08-07 12:49:15+00:00,Thank you!,thank,13658,<UNK>,<UNK>,realDonaldTrump
1291713214066184192,2020-08-07 12:30:03+00:00,"I called the politicization of the China Virus by the Radical Left Democrats a Hoax, not the China Virus itself. Everybody knows this except for the Fake and very Corrupt Media!",call politicization China Virus radical Left Democrats Hoax China Virus everybody know fake corrupt medium,37336,<UNK>,<UNK>,realDonaldTrump
1291535003466096641,2020-08-07 00:41:55+00:00,https://twitter.com/WhiteHouse/status/1291480470828572672,,22193,<UNK>,<UNK>,realDonaldTrump
1291494244943908865,2020-08-06 21:59:57+00:00,WE will WIN Ohio even bigger than we did in 2016 — MAGA is stronger than ever before!,Ohio big 2016 MAGA strong,45505,<UNK>,<UNK>,realDonaldTrump
1291435765575176192,2020-08-06 18:07:34+00:00,"Just like Radical Left New York is trying to destroy the NRA, if Biden becomes President your GREAT SECOND AMENDMENT doesn’t have a chance. Your guns will be taken away, immediately and without notice. No police, no guns!",like Radical Left York try destroy Biden President great second AMENDMENT chance gun take away immediately notice police gun,43459,<UNK>,<UNK>,realDonaldTrump
1291421560658472960,2020-08-06 17:11:08+00:00,Joe Biden: ‘Unlike the African American Community ... the Latino Community Is an Incredibly Diverse Community‘ https://www.breitbart.com/politics/2020/08/06/joe-biden-unlike-the-african-american-community-the-latino-community-is-an-incredibly-diverse-community-nabj/ via @BreitbartNews. Wow! Joe Biden just lost the entire African American community. What a “dumb” thing to say!,Biden unlike african American Community Latino Community incredibly diverse community @breitbartnew Biden lose entire african american community dumb thing,26654,<UNK>,@BreitbartNews,realDonaldTrump
1291416662059544576,2020-08-06 16:51:40+00:00,Just departed for the Great State of Ohio!,depart Great State Ohio,11799,<UNK>,<UNK>,realDonaldTrump
1291402819287814145,2020-08-06 15:56:39+00:00,"Upon departing the Oval Office for Ohio, I’ve notified my staff to continue working on an Executive Order with respect to Payroll Tax Cut, Eviction Protections, Unemployment Extensions, and Student Loan Repayment Options.",depart Oval Office Ohio notify staff continue work Executive order respect Payroll Eviction Protections Unemployment Extensions Student Loan Repayment Options,34262,<UNK>,<UNK>,realDonaldTrump
1291339436727382016,2020-08-06 11:44:48+00:00,"How can voters be sending in Ballots starting, in some cases, one month before the First Presidential Debate. Move the First Debate up. A debate, to me, is a Public Service. Joe Biden and I owe it to the American People!",voter send ballot start case month Presidential Debate debate debate Public Service Biden American People,48597,<UNK>,<UNK>,realDonaldTrump
1291228757437579264,2020-08-06 04:25:00+00:00,Two wonderful people!,wonderful people,23006,<UNK>,<UNK>,realDonaldTrump
1291224128427642882,2020-08-06 04:06:36+00:00,"Sally Yates is either lying or grossly incompetent. It is not possible she could have known so little about Dirty Cop James Comey (and others) from her high position in the Department of “Justice”. The political Crime of the Century, and she had no idea what they were doing?",Sally Yates lie grossly incompetent possible know little Dirty James Comey high position Department Justice political Crime Century idea,29182,<UNK>,<UNK>,realDonaldTrump
1291220257416282115,2020-08-06 03:51:13+00:00,"A very big CONGRATULATIONS to the great @seanhannity on having the Number One Book on the Planet, “Live Free Or Die”. The book is fantastic, and so true. Keep Sean Number One!",congratulation great @seanhannity have Number Book planet live free book fantastic true sean Number,19655,<UNK>,@seanhannity,realDonaldTrump
1291166830946656259,2020-08-06 00:18:55+00:00,“Cities across the Nation that are run by Democrats are in shambles.” Matt Walsh @TuckerCarlson,city nation democrat shamble Matt Walsh @TuckerCarlson,30670,<UNK>,@TuckerCarlson,realDonaldTrump
1291144294259200000,2020-08-05 22:49:22+00:00,"Congressman Scott DesJarlais (@tndesjarlais) has been a tremendous advocate for Tennessee! One of my earliest supporters, he fights for our Military, Vets, Law Enforcement and the Second Amendment! Scott has my Complete and Total Endorsement! #TN04",Congressman Scott DesJarlais @tndesjarlais tremendous advocate Tennessee early supporter fight military Vets Enforcement Second Amendment Scott Complete Total Endorsement TN04,9714,#TN04,@tndesjarlais,realDonaldTrump
1291117659086561280,2020-08-05 21:03:32+00:00,DRAIN THE SWAMP!,drain swamp,120284,<UNK>,<UNK>,realDonaldTrump
1291074236992323590,2020-08-05 18:10:59+00:00,"BIG NEWS! The Political Crime of the Century is unfolding. ObamaBiden illegally spied on the Trump Campaign, both before and after the election. Treason!",NEWS Political Crime Century unfold ObamaBiden illegally spy Trump Campaign election Treason,39036,<UNK>,<UNK>,realDonaldTrump
1291073985107693568,2020-08-05 18:09:59+00:00,"Every time you see a negative Big Pharma commercial against me remember, it means your drug prices are coming way down!",time negative Pharma commercial remember mean drug price come,41344,<UNK>,<UNK>,realDonaldTrump
1291061635348680704,2020-08-05 17:20:55+00:00,https://twitter.com/TeamTrump/status/1290980559519395840/video/1,,10957,<UNK>,<UNK>,realDonaldTrump
1291015075541786624,2020-08-05 14:15:54+00:00,"Sally Yates has zero credibility. She was a part of the greatest political crime of the Century, and ObamaBiden knew EVERYTHING! Sally Yates leaked the General Flynn conversation? Ask her under oath. Republicans should start playing the Democrats game!",Sally Yates zero credibility great political crime Century ObamaBiden know Sally Yates leak General Flynn conversation oath Republicans start play Democrats game,34753,<UNK>,<UNK>,realDonaldTrump
1291012543419482113,2020-08-05 14:05:50+00:00,".@CNN has no sources on the Task Force. Their “sources” are made up, pure fiction! Jim Acosta is a Fake reporter!",.@CNN source Task Force source pure fiction Acosta fake reporter,32310,<UNK>,@CNN,realDonaldTrump
1290967953542909952,2020-08-05 11:08:39+00:00,"Nevada has ZERO infrastructure for Mail-In Voting. It will be a corrupt disaster if not ended by the Courts. It will take months, or years, to figure out. Florida has built a great infrastructure, over years, with two great Republican Governors. Florida, send in your Ballots!",Nevada ZERO infrastructure Mail voting corrupt disaster end Courts month year figure Florida build great infrastructure year great republican Governors Florida send ballot,21309,<UNK>,<UNK>,realDonaldTrump
1290958442857926656,2020-08-05 10:30:52+00:00,MAKE AMERICA GREAT AGAIN!,AMERICA great,63210,<UNK>,<UNK>,realDonaldTrump
1290957656321073152,2020-08-05 10:27:44+00:00,I will be interviewed on @foxandfriends at 7:30 A.M. Enjoy!,interview @foxandfriend 7:30 A.M. Enjoy,11232,<UNK>,@foxandfriends,realDonaldTrump
1290956691488612358,2020-08-05 10:23:54+00:00,"NASA was Closed & Dead until I got it going again. Now it is the most vibrant place of its kind on the Planet...And we have Space Force to go along with it. We have accomplished more than any Administration in first 3 1/2 years. Sorry, but it all doesn’t happen with Sleepy Joe!",NASA close dead go vibrant place kind planet Space Force accomplish Administration year sorry happen Sleepy,14586,<UNK>,<UNK>,realDonaldTrump
1290954271140216833,2020-08-05 10:14:17+00:00,"For those that thought I wasn’t into the Environment, this is the biggest bill ever passed, by far. I wonder if this will silence the Fake News? Probably not!",think Environment big bill pass wonder silence Fake News probably,19878,<UNK>,<UNK>,realDonaldTrump
1290952940602130437,2020-08-05 10:09:00+00:00,A great race run by Roger against a very tough and smart opponent. Roger loves Kansas and will represent it incredibly well. He has my Complete and Total Endorsement. Will be a Big Win on November 3rd. This is not the opponent the Democrats wanted!,great race Roger tough smart opponent Roger love Kansas represent incredibly Complete Total Endorsement November opponent Democrats want,9086,<UNK>,<UNK>,realDonaldTrump
1290949993600294913,2020-08-05 09:57:17+00:00,"There is TREMENDOUS Lawlessness in America’s Liberal Cities. Would be so easy to stop but they have a clouded vision of what should be done. They are indoctrinated with a philosophy which will never work, a philosophy which would destroy America. Portland would be the norm!",TREMENDOUS Lawlessness America Liberal Cities easy stop clouded vision indoctrinate philosophy work philosophy destroy America Portland norm,27742,<UNK>,<UNK>,realDonaldTrump
1290784892469555201,2020-08-04 23:01:14+00:00,Great meeting today with the CoronaVirus Task Force in the Oval Office. Stay informed at: http://CoronaVirus.gov.,great meeting today CoronaVirus Task Force Oval Office stay informed,12475,<UNK>,<UNK>,realDonaldTrump
1290741980813824005,2020-08-04 20:10:43+00:00,"THE WALL STREET JOURNAL “Trump Wins in Portland” “Something big has changed in Portland, Ore. After weeks of chaos and flames outside the city’s federal courthouse, the past few days have seen the violence subside dramatically. What happened?” William McGurn @WSJ",WALL STREET JOURNAL trump Wins Portland change Portland Oregon week chaos flame outside city federal courthouse past day see violence subside dramatically happen William McGurn @wsj,20249,<UNK>,@WSJ,realDonaldTrump
1290730748132167681,2020-08-04 19:26:05+00:00,I am deeply saddened by the tragic loss of eight Marines and one Sailor during a training exercise off the coast of California. Our prayers are with their families. I thank them for the brave service their loved ones gave to our Nation. #SemperFidelis,deeply sadden tragic loss Marines sailor training exercise coast California prayer family thank brave service love one give Nation SemperFidelis,34453,#SemperFidelis,<UNK>,realDonaldTrump
1290727631114166272,2020-08-04 19:13:42+00:00,"Today we celebrated the passage of landmark legislation that will preserve America’s majestic natural wonders, priceless historic treasures, grand national monuments, and glorious national parks. It was my great honor to sign the Great American Outdoors Act into law! #HR1957",today celebrate passage landmark legislation preserve America majestic natural wonder priceless historic treasure grand national monument glorious national park great honor sign Great American Outdoors HR1957,15931,#HR1957,<UNK>,realDonaldTrump
1290692768675901440,2020-08-04 16:55:10+00:00,"Whether you call it Vote by Mail or Absentee Voting, in Florida the election system is Safe and Secure, Tried and True. Florida’s Voting system has been cleaned up (we defeated Democrats attempts at change), so in Florida I encourage all to request a Ballot & Vote by Mail! #MAGA",vote Mail Absentee Voting Florida election system safe secure Tried true Florida voting system clean defeat Democrats attempt change Florida encourage request Ballot vote Mail maga,22210,#MAGA,<UNK>,realDonaldTrump
1290648990242004992,2020-08-04 14:01:13+00:00,"Big Pharma is taking ads against me because I am MASSIVELY lowering your drug prices, which is obviously not good for them. Medicare premiums will also be going down. I am the first President to take them on. Don’t fall for their false ads. Biden plan is for very big increases!",Pharma take MASSIVELY lower drug price obviously good Medicare premium go President fall false biden plan increase,36940,<UNK>,<UNK>,realDonaldTrump
1290638211354693632,2020-08-04 13:18:23+00:00,Happy 230th Birthday @USCG!! https://twitter.com/uscg/status/1290631068945543170,happy 230th birthday @USCG,12194,<UNK>,@USCG,realDonaldTrump
1290623558461411333,2020-08-04 12:20:09+00:00,People are not happy that players are not standing for our National Anthem!,People happy player stand National Anthem,47290,<UNK>,<UNK>,realDonaldTrump
1290488364362170371,2020-08-04 03:22:56+00:00,OPEN THE SCHOOLS!!!,open school,79320,<UNK>,<UNK>,realDonaldTrump
1290308363872538624,2020-08-03 15:27:41+00:00,"My visits last week to Texas and Florida had massive numbers of cheering people gathered along the roads and highways, thousands and thousands, even bigger (by far) than the crowds of 2016. Saw no Biden supporters, and yet some in the Fake News said it was an equal number. Sad!",visit week Texas Florida massive number cheer people gather road highway thousand thousand big crowd 2016 Biden supporter Fake News say equal number,26368,<UNK>,<UNK>,realDonaldTrump
1290283634130214913,2020-08-03 13:49:25+00:00,"RECORD HIGH NASDAQ! It would all come crashing down, including your Jobs, Stocks, and 401k’s, if Sleepy Joe ever became President. China and others would own us!!!",RECORD HIGH NASDAQ come crash include job stock 401k Sleepy President China,34876,<UNK>,<UNK>,realDonaldTrump
1290282508303716352,2020-08-03 13:44:56+00:00,"So Crazy Nancy Pelosi said horrible things about Dr. Deborah Birx, going after her because she was too positive on the very good job we are doing on combatting the China Virus, including Vaccines & Therapeutics. In order to counter Nancy, Deborah took the bait & hit us. Pathetic!",Crazy Nancy Pelosi say horrible thing Deborah Birx go positive good combat China Virus include Vaccines Therapeutics order counter Nancy Deborah take bait pathetic,26052,<UNK>,<UNK>,realDonaldTrump
1290270589945430016,2020-08-03 12:57:35+00:00,"Wow! Really bad TV Ratings for Morning Joe (@JoeNBC). @foxandfriends doing great, leading all others by far. @CNN not a factor!!!",rating Morning @JoeNBC @foxandfriend great lead @CNN factor,15805,<UNK>,@JoeNBC @foxandfriends @CNN,realDonaldTrump
1290261807282757632,2020-08-03 12:22:41+00:00,96% Approval Rating in the Republican Party. 50% in new Rasmussen Poll (higher than Obama at this point in time). Thank you!,Approval Rating Republican Party Rasmussen Poll high Obama point time thank,29722,<UNK>,<UNK>,realDonaldTrump
1290257055534551043,2020-08-03 12:03:48+00:00,Cases up because of BIG Testing! Much of our Country is doing very well. Open the Schools!,case testing country open school,33182,<UNK>,<UNK>,realDonaldTrump
1290253369404092417,2020-08-03 11:49:09+00:00,FAKE NEWS IS THE ENEMY OF THE PEOPLE!,FAKE NEWS enemy PEOPLE,86313,<UNK>,<UNK>,realDonaldTrump
1290252674777133057,2020-08-03 11:46:24+00:00,"With the exception of New York & a few other locations, we’ve done MUCH better than most other Countries in dealing with the China Virus. Many of these countries are now having a major second wave. The Fake News is working overtime to make the USA (& me) look as bad as possible!",exception York location well country deal China Virus country have major second wave Fake News work overtime look possible,23786,<UNK>,<UNK>,realDonaldTrump
1290250416278532096,2020-08-03 11:37:25+00:00,"In an illegal late night coup, Nevada’s clubhouse Governor made it impossible for Republicans to win the state. Post Office could never handle the Traffic of Mail-In Votes without preparation. Using Covid to steal the state. See you in Court!",illegal late night coup Nevada clubhouse Governor impossible Republicans state Post Office handle Traffic Mail vote preparation Covid steal state Court,37858,<UNK>,<UNK>,realDonaldTrump
1290011585587666946,2020-08-02 19:48:23+00:00,"....and ruined. The Federal Government must again seek the Death Penalty in a do-over of that chapter of the original trial. Our Country cannot let the appellate decision stand. Also, it is ridiculous that this process is taking so long!",ruin Federal Government seek Death Penalty chapter original trial country appellate decision stand ridiculous process take long,18227,<UNK>,<UNK>,realDonaldTrump
