id,created_at,original_text,clean_text,retweet_count,hashtags,mentions,original_author
1193131455796404224,2019-11-09 11:41:21+00:00,"Fake News is reporting that I am talking to Mark Burnett about doing a big show, perhaps The Apprentice, after the presidency, which I would assume they mean in 5 years. This is not true, never had such a conversation, don’t even have time to think about it. False reporting!",Fake News report talk Mark Burnett Apprentice presidency assume mean year true conversation time think false reporting,19814,<UNK>,<UNK>,realDonaldTrump
1193030111383228416,2019-11-09 04:58:38+00:00,"“Mark Levin blasts Adam Schiff, claims 'the law is on the president's side' on Ukraine”",Mark Levin blast Adam Schiff claim president Ukraine,12273,<UNK>,<UNK>,realDonaldTrump
1192854195625316352,2019-11-08 17:19:37+00:00,I will be announcing the winners of the #MAGACHALLENGE and inviting them to the @WhiteHouse to meet with me and perform. Good luck!,announce winner MAGACHALLENGE invite @whitehouse meet perform good luck,23340,#MAGACHALLENGE,@WhiteHouse,realDonaldTrump
1192594646691729408,2019-11-08 00:08:15+00:00,STATEMENT FROM PRESIDENT DONALD J. TRUMP,statement PRESIDENT DONALD TRUMP,28633,<UNK>,<UNK>,realDonaldTrump
1192467617140924417,2019-11-07 15:43:29+00:00,Stock Market up big today. A New Record. Enjoy!,Stock Market today Record enjoy,17876,<UNK>,<UNK>,realDonaldTrump
1192467215360102401,2019-11-07 15:41:53+00:00,The Radical Left Dems and LameStream Media are just trying to make it hard for Republicans and me to win in 2020. The new Impeachment Hoax is already turning against them!,radical Left Dems LameStream medium try hard Republicans 2020 Impeachment Hoax turn,16237,<UNK>,<UNK>,realDonaldTrump
1192463709400117250,2019-11-07 15:27:57+00:00,"The Amazon Washington Post and three lowlife reporters, Matt Zapotosky, Josh Dawsey, and Carol Leonnig, wrote another Fake News story, without any sources (pure fiction), about Bill Barr & myself. We both deny this story, which they knew before they wrote it. A garbage newspaper!",Amazon Washington Post lowlife reporter Matt Zapotosky Josh Dawsey Carol Leonnig write Fake News story source pure fiction Bill Barr deny story know write garbage newspaper,21436,<UNK>,<UNK>,realDonaldTrump
1192461425358385154,2019-11-07 15:18:53+00:00,THANK YOU! #MAGA,thank maga,13372,#MAGA,<UNK>,realDonaldTrump
1192460764235419654,2019-11-07 15:16:15+00:00,"It was just explained to me that for next weeks Fake Hearing (trial) in the House, as they interview Never Trumpers and others, I get NO LAWYER & NO DUE PROCESS. It is a Pelosi, Schiff, Scam against the Republican Party and me. This Witch Hunt should not be allowed to proceed!",explain week fake hearing trial House interview Trumpers LAWYER PROCESS Pelosi Schiff scam Republican Party Witch Hunt allow proceed,32232,<UNK>,<UNK>,realDonaldTrump
1192454569936216065,2019-11-07 14:51:38+00:00,“What did Hunter Biden do for the money?” @SenJohnKennedy A very good question. He and Sleepy Joe must testify!,Hunter Biden money @SenJohnKennedy good question Sleepy testify,13919,<UNK>,@SenJohnKennedy,realDonaldTrump
1192441715984089088,2019-11-07 14:00:34+00:00,"Based on the information released last night about the Fake Whistleblowers attorney, the Impeachment Hoax should be ended IMMEDIATELY! There is no case, except against the other side!",base information release night Fake Whistleblowers attorney Impeachment Hoax end IMMEDIATELY case,22765,<UNK>,<UNK>,realDonaldTrump
1192438540363276290,2019-11-07 13:47:57+00:00,Read the Transcript!,read Transcript,17759,<UNK>,<UNK>,realDonaldTrump
1192438178747170816,2019-11-07 13:46:30+00:00,"The degenerate Washington Post MADE UP the story about me asking Bill Barr to hold a news conference. Never happened, and there were no sources!",degenerate Washington Post story ask Bill Barr hold news conference happen source,15113,<UNK>,<UNK>,realDonaldTrump
1192418595323682817,2019-11-07 12:28:41+00:00,Bill Barr did not decline my request to talk about Ukraine. The story was a Fake Washington Post con job with an “anonymous” source that doesn’t exist. Just read the Transcript. The Justice Department already ruled that the call was good. We don’t have freedom of the press!,Bill Barr decline request talk Ukraine story Fake Washington Post anonymous source exist read Transcript Justice Department rule good freedom press,21506,<UNK>,<UNK>,realDonaldTrump
1192333300683198464,2019-11-07 06:49:46+00:00,"Just returned to the @WhiteHouse after a great evening in Monroe, Louisiana with a massive turnout of Great American Patriots. With early voting underway until Sat, find your polling location below &amp; go vote for your next #LAgov, @EddieRispone! #GeauxVote➡️https://vote.donaldjtrump.com/",return @whitehouse great evening Monroe Louisiana massive turnout Great American Patriots early voting underway find polling location vote LAgov @EddieRispone GeauxVote right_arrow_selector,11519,#LAgov #GeauxVote,@WhiteHouse @EddieRispone,realDonaldTrump
1192307862204108800,2019-11-07 05:08:41+00:00,"....The LameStream Media, which is The Enemy of the People, is working overtime with made up stories in order to drive dissension and distrust!",LameStream Media Enemy People work overtime story order drive dissension distrust,11638,<UNK>,<UNK>,realDonaldTrump
1192307858366271490,2019-11-07 05:08:40+00:00,"The story in the Amazon Washington Post, of course picked up by Fake News CNN, saying “President Trump asked for AG Barr to host a news conference clearing him on Ukraine,” is totally untrue and just another FAKE NEWS story with anonymous sources that don’t exist....",story Amazon Washington Post course pick Fake News say President Trump ask Barr host news conference clear Ukraine totally untrue FAKE NEWS story anonymous source exist,15801,<UNK>,<UNK>,realDonaldTrump
1192307362331119617,2019-11-07 05:06:41+00:00,"Years ago, when Media was legitimate, people known as “Fact Checkers” would always call to check and see if a story was accurate. Nowadays they don’t use “Fact Checkers” anymore, they just write whatever they want!",year Media legitimate people know Fact Checkers check story accurate nowadays Fact Checkers anymore write want,22424,<UNK>,<UNK>,realDonaldTrump
1192284746815922176,2019-11-07 03:36:49+00:00,"LOUISIANA! Early voting is underway until Saturday, it’s time to get out and VOTE to REPLACE Radical Liberal Democrat John Bel Edwards with a great new REPUBLICAN Governor, @EddieRispone! #GeauxVote POLL FINDER: https://vote.donaldjtrump.com/",LOUISIANA early voting underway Saturday time vote replace Radical Liberal Democrat John Edwards great REPUBLICAN Governor @EddieRispone GeauxVote POLL finder,9499,#GeauxVote,@EddieRispone,realDonaldTrump
1192229368057085952,2019-11-06 23:56:46+00:00,"A great evening last night in Kentucky and Mississippi for the Republican Party with 13 BIG WINS, including a Governorship in Mississippi. Congratulations to everyone!",great evening night Kentucky Mississippi Republican Party win include Governorship Mississippi congratulation,12038,<UNK>,<UNK>,realDonaldTrump
1192198480267218945,2019-11-06 21:54:02+00:00,"Thanks to many of you here today, my Administration and Republicans in Congress have now confirmed 157 FEDERAL JUDGES who will uphold our Constitution AS WRITTEN, a profoundly historic milestone and a truly momentous achievement!",thank today Administration Republicans Congress confirm federal judge uphold Constitution WRITTEN profoundly historic milestone truly momentous achievement,17245,<UNK>,<UNK>,realDonaldTrump
1192173803171983362,2019-11-06 20:15:58+00:00,"....Also talked about their Border with Syria, the eradication of terrorism, the ending of hostilities with the Kurds, and many other topics. Look forward to seeing President Erdogan next Wednesday, November 13th at the @WhiteHouse!",talk border Syria eradication terrorism ending hostility Kurds topic look forward see President Erdogan Wednesday November 13th @whitehouse,9049,<UNK>,@WhiteHouse,realDonaldTrump
1192173801502588928,2019-11-06 20:15:58+00:00,Just had a very good call with President @RTErdogan of Turkey. He informed me that they have captured numerous ISIS fighters that were reported to have escaped during the conflict – including a wife and sister of terrorist killer al Baghdadi….,good President @rterdogan Turkey inform capture numerous ISIS fighter report escape conflict include wife sister terrorist killer Baghdadi,14590,<UNK>,@RTErdogan,realDonaldTrump
1192157303753125888,2019-11-06 19:10:25+00:00,"Just had a meeting with top representatives from Egypt, Ethiopia, and Sudan to help solve their long running dispute on the Grand Ethiopian Renaissance Dam, one of the largest in the world, currently being built. The meeting went well and discussions will continue during the day!",meeting representative Egypt Ethiopia Sudan help solve long running dispute Grand Ethiopian Renaissance large world currently build meeting go discussion continue,11289,<UNK>,<UNK>,realDonaldTrump
1192071660494565377,2019-11-06 13:30:06+00:00,Stock Markets (all three) hit another ALL TIME & HISTORIC HIGH yesterday! You are sooo lucky to have me as your President (just kidding!). Spend your money well!,Stock Markets TIME HISTORIC HIGH yesterday sooo lucky President kid spend money,27945,<UNK>,<UNK>,realDonaldTrump
1192068562682368002,2019-11-06 13:17:47+00:00,"Thank you to Kurt Volker, U.S. Envoy to Ukraine, who said in his Congressional Testimony, just released, “You asked what conversations did I have about that quid pro quo, et cetra. NONE, because I didn’t know there was a quid pro quo.” Witch Hunt!",thank Kurt Volker U.S. Envoy Ukraine say Congressional Testimony release ask conversation quid cetra know quid Witch Hunt,20053,<UNK>,<UNK>,realDonaldTrump
1192065660593029120,2019-11-06 13:06:15+00:00,"“Based on the things I’ve seen, the Democrats have no case, or a weak case, at best. I don’t think there are, or will be, well founded articles of Impeachment here.” Robert Wray, respected former prosecutor. It is a phony scam by the Do Nothing Dems! @foxandfriends",base thing see Democrats case weak case good think found article Impeachment Robert Wray respect prosecutor phony scam Dems @foxandfriends,14142,<UNK>,@foxandfriends,realDonaldTrump
1192062007324938240,2019-11-06 12:51:44+00:00,"Based on the Kentucky results, Mitch McConnell @senatemajldr will win BIG in Kentucky next year!",base Kentucky result Mitch McConnell @senatemajldr Kentucky year,11233,<UNK>,@senatemajldr,realDonaldTrump
1191947934734176257,2019-11-06 05:18:27+00:00,Great going Tate!,great go Tate,9207,<UNK>,<UNK>,realDonaldTrump
1191947091461001216,2019-11-06 05:15:06+00:00,"Our big Kentucky Rally on Monday night had a massive impact on all of the races. The increase in Governors race was at least 15 points, and maybe 20! Will be in Louisiana for @EddieRispone on Wednesday night. Big Rally!",Kentucky Rally Monday night massive impact race increase Governors race point maybe Louisiana @eddierispone Wednesday night Rally,11632,<UNK>,@EddieRispone,realDonaldTrump
1191942342879666178,2019-11-06 04:56:14+00:00,A lot of winning in Kentucky. Check out the numbers.,win Kentucky check number,7748,<UNK>,<UNK>,realDonaldTrump
1191941077646876672,2019-11-06 04:51:12+00:00,Congratulations to @tatereeves on winning Governor of the Great State of Mississippi. Our big Rally on Friday night moved the numbers from a tie to a big WIN. Great reaction under pressure Tate!,congratulation @tatereeve win Governor Great State Mississippi Rally Friday night move number great reaction pressure Tate,11474,<UNK>,@tatereeves,realDonaldTrump
1191937709364928513,2019-11-06 04:37:49+00:00,"#ElectionNight Won 5 out of 6 elections in Kentucky, including 5 great candidates that I spoke for and introduced last night. @MattBevin picked up at least 15 points in last days, but perhaps not enough (Fake News will blame Trump!). Winning in Mississippi Governor race!",ElectionNight election Kentucky include great candidate speak introduce night @MattBevin pick point day Fake News blame Trump win Mississippi Governor race,12105,#ElectionNight,@MattBevin,realDonaldTrump
1191907734687498241,2019-11-06 02:38:43+00:00,"Great going Daniel, proud of you!",great go Daniel proud,12589,<UNK>,<UNK>,realDonaldTrump
1191883585034297344,2019-11-06 01:02:45+00:00,95% Approval Rating in the Republican Party. Thank you!,Approval Rating Republican Party thank,22793,<UNK>,<UNK>,realDonaldTrump
1191818006738939905,2019-11-05 20:42:10+00:00,"KENTUCKY! #KYGov Get out today and VOTE for @MattBevin and the entire Republican ticket! MISSISSIPPI! #MSGov Get out today and VOTE for @TateReeves and the entire Republican ticket! Polls are open for a few more hours, find your location below!",KENTUCKY KYGov today vote @mattbevin entire republican ticket MISSISSIPPI MSGov today vote @tatereeve entire republican ticket poll open hour find location,9927,#KYGov #MSGov,@MattBevin @tatereeves,realDonaldTrump
1191791823645229056,2019-11-05 18:58:07+00:00,Thank you so much CLUB 45. You are truly Great Americans. See you in Florida!,thank CLUB truly great Americans Florida,15460,<UNK>,<UNK>,realDonaldTrump
1191767071249616897,2019-11-05 17:19:46+00:00,KENTUCKY! Get out today and VOTE for @MattBevin and the entire Republican ticket! MISSISSIPPI! Get out today and VOTE for @TateReeves and the entire Republican ticket! #VoteOnNov5 #ElectionDay Find your polling location below! https://vote.donaldjtrump.com/,KENTUCKY today vote @mattbevin entire republican ticket MISSISSIPPI today vote @tatereeve entire republican ticket VoteOnNov5 ElectionDay find polling location,10791,#VoteOnNov5 #ElectionDay,@MattBevin @tatereeves,realDonaldTrump
1191762155022012416,2019-11-05 17:00:14+00:00,A very good start! Please all work hard to get a final deal.,good start work hard final deal,8548,<UNK>,<UNK>,realDonaldTrump
1191718159583240192,2019-11-05 14:05:24+00:00,"So sad to see what is happening in New York where Governor Cuomo & Mayor DeBlasio are letting out 900 Criminals, some hardened & bad, onto the sidewalks of our rapidly declining, because of them, city. The Radical Left Dems are killing our cities. NYPD Commissioner is resigning!",happen York Governor Cuomo Mayor DeBlasio let Criminals hardened sidewalk rapidly decline city radical Left Dems kill city NYPD Commissioner resign,24124,<UNK>,<UNK>,realDonaldTrump
1191716558713868288,2019-11-05 13:59:03+00:00,FIND YOUR POLLING LOCATION HERE! https://vote.donaldjtrump.com/,find polling location,9983,<UNK>,<UNK>,realDonaldTrump
1191708902041227264,2019-11-05 13:28:37+00:00,"This is the time for Mexico, with the help of the United States, to wage WAR on the drug cartels and wipe them off the face of the earth. We merely await a call from your great new president!",time Mexico help United States wage drug cartel wipe face earth merely await great president,43426,<UNK>,<UNK>,realDonaldTrump
1191708086140047361,2019-11-05 13:25:23+00:00,"....monsters, the United States stands ready, willing & able to get involved and do the job quickly and effectively. The great new President of Mexico has made this a big issue, but the cartels have become so large and powerful that you sometimes need an army to defeat an army!",monster United States stand ready willing able involve quickly effectively great President Mexico issue cartel large powerful need army defeat army,17504,<UNK>,<UNK>,realDonaldTrump
1191708046126399488,2019-11-05 13:25:13+00:00,"A wonderful family and friends from Utah got caught between two vicious drug cartels, who were shooting at each other, with the result being many great American people killed, including young children, and some missing. If Mexico needs or requests help in cleaning out these.....",wonderful family friend Utah catch vicious drug cartel shoot result great american people kill include young child miss Mexico need request help clean,20995,<UNK>,<UNK>,realDonaldTrump
1191701295951949825,2019-11-05 12:58:24+00:00,"“The Impeachment Hoax has fired up voters in Kentucky, Mississippi and Louisiana.” @foxandfriends",Impeachment Hoax fire voter Kentucky Mississippi Louisiana @foxandfriend,13722,<UNK>,@foxandfriends,realDonaldTrump
1191698487697649670,2019-11-05 12:47:14+00:00,Fantastic being in the Great State of Kentucky last night. Vote for Matt Bevin NOW! @MattBevin One of Best Governors in U.S. He will never let you down!,fantastic Great State Kentucky night vote Matt Bevin @mattbevin Best Governors U.S.,10559,<UNK>,@MattBevin,realDonaldTrump
1191689078393262080,2019-11-05 12:09:51+00:00,The Do Nothing Dems have gone Radical Left Crazy. The can’t get anything done!,Dems go radical Left Crazy,7113,<UNK>,<UNK>,realDonaldTrump
1191687950360358913,2019-11-05 12:05:22+00:00,"Virginia, with all of the massive amount of defense and other work I brought to you, and with everything planned, go out and vote Republican today. I know the Dems are saying that they have your vote locked up, but that would mean a long slide down. VOTE REPUBLICAN TODAY!",Virginia massive defense work bring plan vote republican today know Dems say vote lock mean long slide vote REPUBLICAN TODAY,18040,<UNK>,<UNK>,realDonaldTrump
1191537655592431616,2019-11-05 02:08:09+00:00,Vote for Sean Spicer on Dancing with the Stars. He is a great and very loyal guy who is working very hard! #MAGA,vote Sean Spicer Dancing star great loyal work hard maga,12608,#MAGA,<UNK>,realDonaldTrump
1191409674656059392,2019-11-04 17:39:36+00:00,"My son, @DonaldJTrumpJr is coming out with a new book, “Triggered: How the Left Thrives on Hate and Wants to Silence Us” – available tomorrow, November 5th! A great new book that I highly recommend for ALL to read. Go order it today!",@DonaldJTrumpJr come book trigger left thrive Hate want silence available tomorrow November great book highly recommend read order today,24224,<UNK>,@DonaldJTrumpJr,realDonaldTrump
1191371996459884549,2019-11-04 15:09:53+00:00,All-Time High for Stock Market and all the Fake News wants to talk about is the Impeachment Hoax!,Time High Stock Market Fake News want talk Impeachment Hoax,18918,<UNK>,<UNK>,realDonaldTrump
1191367365260394499,2019-11-04 14:51:29+00:00,Read the Transcript!,read Transcript,17710,<UNK>,<UNK>,realDonaldTrump
1191367354892128261,2019-11-04 14:51:26+00:00,"Big Rally in Kentucky TONIGHT for a man who has worked really hard & done a GREAT job, Gov @MattBevin. Kentucky is having the best economic year ever under Matt’s leadership. He is a fantastic guy who loves our Military, our Vets and our 2A. Vote Tuesday! https://www.donaldjtrump.com/events/ky-lex-2019-nov/",Rally Kentucky TONIGHT work hard great @mattbevin Kentucky have good economic year Matt leadership fantastic love military vet Vote Tuesday,12246,<UNK>,@MattBevin,realDonaldTrump
1191360002352652288,2019-11-04 14:22:13+00:00,"....I don’t like him using my name to build his consulting company, or whatever. Please advise his clients and Administration officials accordingly.",like build consult company advise client Administration official accordingly,9264,<UNK>,<UNK>,realDonaldTrump
1191359986900840453,2019-11-04 14:22:09+00:00,"Many people say they know me, claiming to be “best friends” and really close etc., when I don’t know these people at all. This happens, I suppose, to all who become President. With that being stated, I don’t know, to the best of my knowledge, a man named Michael Esposito.....",people know claim good friend close know people happen suppose President state know good knowledge name Michael Esposito,12521,<UNK>,<UNK>,realDonaldTrump
1191350738536083459,2019-11-04 13:45:24+00:00,Stock Market hits RECORD HIGH. Spend your money well!,Stock Market hit record HIGH spend money,21638,<UNK>,<UNK>,realDonaldTrump
1191342959695933441,2019-11-04 13:14:30+00:00,“There is no Whistleblower. There is someone with an agenda against Donald Trump. What he was blowing the whistle on didn’t happen. We have the transcript of the call. This is all a farce and no Republican should forget that.” @dbongino @foxandfriends,Whistleblower agenda Donald Trump blow whistle happen transcript farce Republican forget @dbongino @foxandfriends,16711,<UNK>,@dbongino @foxandfriends,realDonaldTrump
1191338937387757568,2019-11-04 12:58:31+00:00,95% Approval Rating in the Republican Party. Thank you!,Approval Rating Republican Party thank,19739,<UNK>,<UNK>,realDonaldTrump
1191337006615482368,2019-11-04 12:50:51+00:00,The Whistleblower gave false information & dealt with corrupt politician Schiff. He must be brought forward to testify. Written answers not acceptable! Where is the 2nd Whistleblower? He disappeared after I released the transcript. Does he even exist? Where is the informant? Con!,Whistleblower give false information deal corrupt politician Schiff bring forward testify write answer acceptable Whistleblower disappear release transcript exist informant,24027,<UNK>,<UNK>,realDonaldTrump
1191325883774189568,2019-11-04 12:06:39+00:00,What I said on the phone call with the Ukrainian President is “perfectly” stated. There is no reason to call witnesses to analyze my words and meaning. This is just another Democrat Hoax that I have had to live with from the day I got elected (and before!). Disgraceful!,say phone ukrainian President perfectly state reason witness analyze word meaning Democrat Hoax live elect disgraceful,19346,<UNK>,<UNK>,realDonaldTrump
1191322448718966784,2019-11-04 11:53:00+00:00,"Mark Levin, a great lawyer and scholar, said last night on his @marklevinshow, that all you have to do is read the transcript of the call, you do not need Never Trumpers or other witnesses to say what it means or says. It is plainly and very well stated for all to see. Witch Hunt",Mark Levin great lawyer scholar say night @marklevinshow read transcript need Trumpers witness mean say plainly stated witch Hunt,16401,<UNK>,@marklevinshow,realDonaldTrump
1191318856683413504,2019-11-04 11:38:43+00:00,Great! But how do you know it was a “mistweet?” May be something with deep meaning!,great know mistweet deep meaning,20717,<UNK>,<UNK>,realDonaldTrump
1191222515030470657,2019-11-04 05:15:54+00:00,"Louisiana, get out and Vote Early for @EddieRispone as your next Governor. Lower Taxes and car insurance. Will protect your 2nd Amendment. John Bel Edwards is always fighting our MAGA Agenda. Wants to raise your taxes and car insurance to the sky. Vote for Republican Eddie R!",Louisiana vote early @EddieRispone Governor low taxis insurance protect Amendment John Edwards fight MAGA Agenda want raise taxis insurance vote Republican Eddie,12948,<UNK>,@EddieRispone,realDonaldTrump
1191218806468820994,2019-11-04 05:01:09+00:00,"Great Republican Geary Higgins has my complete and total Endorsement for Virginia Senate, 13th District. He is strong on Crime, the Border, our Military, Cutting Taxes, and protecting your 2nd Amendment. Dem John Bell will take your guns & raise your taxes. Vote for Geary Higgins",Great Republican Geary Higgins complete total Endorsement Virginia Senate 13th District strong Crime Border military cut Taxes protect Amendment John Bell gun raise taxis vote Geary Higgins,13390,<UNK>,<UNK>,realDonaldTrump
1191208147173679104,2019-11-04 04:18:48+00:00,"@marklevinshow Mark Levin: “We ought to talk about the substance of this phone call. We have the call, I don’t know what we need witnesses for? Can’t we read English? Do I need a Whistleblower to tell me what I’m reading? Do I need a Lt. C. to tell me? NO.” So plain and simple!",@marklevinshow Mark Levin ought talk substance phone know need witness read English need Whistleblower tell read need tell plain simple,6578,<UNK>,@marklevinshow,realDonaldTrump
1191202113847746561,2019-11-04 03:54:50+00:00,Good point!,good point,9877,<UNK>,<UNK>,realDonaldTrump
