id,created_at,original_text,clean_text,retweet_count,hashtags,mentions,original_author
1195136338510499840,2019-11-15 00:28:02+00:00,Getting ready to land in Louisiana to do Rally with Great Republican @EddieRispone for Governor. He will get your taxes and auto insurance (highest in Country!) way down. Loves our Military &amp; Vets. Will protect your 2nd Amendment. VOTE SATURDAY!,get ready land Louisiana Rally Great Republican @EddieRispone Governor taxis auto insurance high country love Military vet protect Amendment VOTE SATURDAY,12121,<UNK>,@EddieRispone,realDonaldTrump
1195122975713812481,2019-11-14 23:34:56+00:00,"....We send our deepest condolences to the families and friends of those tragically lost, and we pray for the speedy recovery of the wounded.",send deep condolence family friend tragically lose pray speedy recovery wound,7690,<UNK>,<UNK>,realDonaldTrump
1195122972098359297,2019-11-14 23:34:55+00:00,"We continue to monitor the terrible events at Saugus High School in Santa Clarita, California through our ongoing communications with Local, State, and Federal Authorities....",continue monitor terrible event Saugus High School Santa Clarita California ongoing communication Local State Federal Authorities,9325,<UNK>,<UNK>,realDonaldTrump
1195003306558607360,2019-11-14 15:39:25+00:00,Where’s the Fake Whistleblower?,Fake Whistleblower,27261,<UNK>,<UNK>,realDonaldTrump
1195000551500632065,2019-11-14 15:28:28+00:00,"....that the House Democrats have done since she’s become Speaker, other than chase Donald Trump.” This Impeachment Hoax is such a bad precedent and sooo bad for our Country!",House Democrats Speaker chase Donald Trump Impeachment Hoax precedent sooo country,9806,<UNK>,<UNK>,realDonaldTrump
1195000511625355265,2019-11-14 15:28:18+00:00,"....anywhere, so we’ve now had 3 years of the Democrats chasing Donald Trump. Nancy Pelosi’s worried about the American voter looking for someone to blame for that eventually. Look at her own story in the House. What have they done? The average American can’t identify anything...",year Democrats chase Donald Trump Nancy Pelosi worry american voter look blame eventually look story House average American identify,9595,<UNK>,<UNK>,realDonaldTrump
1195000499080175623,2019-11-14 15:28:15+00:00,".@DanHenninger WSJ: Nancy Pelosi had it right the first time when she did not want to go down the Impeachment path. Make it a voting issue. But no, the Left insisted on raising this to the gravity of a constitutional crisis &amp; Impeachment. The hearings suggested it’s not going...",.@DanHenninger Nancy Pelosi right time want Impeachment path voting issue Left insist raise gravity constitutional crisis Impeachment hearing suggest go,12537,<UNK>,@DanHenninger,realDonaldTrump
1194990643338268672,2019-11-14 14:49:05+00:00,“That hearing was about a policy dispute.” Robert Ray. “Regular people watching this cannot conclude that the President of the United States can be impeached.” @Varneyco,hearing policy dispute Robert regular people watch conclude President United States impeach @Varneyco,10726,<UNK>,@Varneyco,realDonaldTrump
1194987817077805061,2019-11-14 14:37:52+00:00,“Neither one of the Democrat star witnesses at the Impeachment hearings could point out an impeachable offense. That’s the result!” @Varneyco @FoxBusiness,Democrat star witness Impeachment hearing point impeachable offense result @Varneyco @foxbusiness,11210,<UNK>,@Varneyco @FoxBusiness,realDonaldTrump
1194986487588311040,2019-11-14 14:32:35+00:00,Walmart announces great numbers. No impact from Tariffs (which are contributing $Billions to our Treasury). Inflation low (do you hear that Powell?)!,Walmart announce great number impact Tariffs contribute billion Treasury inflation hear Powell,17209,<UNK>,<UNK>,realDonaldTrump
1194974293911887873,2019-11-14 13:44:07+00:00,"Hit New Stock Market record again yesterday, the 20th time this year, with GREAT potential for the future. USA is where the action is. Companies and jobs are coming back like never before!",Stock Market record yesterday 20th time year great potential future action company job come like,19790,<UNK>,<UNK>,realDonaldTrump
1194946652223746048,2019-11-14 11:54:17+00:00,".@RepRatcliffe asked the two “star” witnesses, “where is the impeachable event in that call?” Both stared straight ahead with a blank look on their face, remained silent, & were unable to answer the question. That would be the end of a case run by normal people! - but not Shifty!",.@RepRatcliffe ask star witness impeachable event stare straight ahead blank look face remain silent unable answer question case normal people Shifty,22399,<UNK>,<UNK>,realDonaldTrump
1194824072011698176,2019-11-14 03:47:12+00:00,"Wow! Was just told that my son’s book, “Triggered,” is Number One on The New York Times Bestseller List. Congratulations Don!",tell book trigger Number York Times Bestseller List Congratulations,24143,<UNK>,<UNK>,realDonaldTrump
1194820401035124738,2019-11-14 03:32:36+00:00,Thank you @FranklinGraham. It is a time of “shame” for our Country. The Democrats know what they are doing is wrong!,thank @FranklinGraham time shame country Democrats know wrong,12597,<UNK>,@franklingraham,realDonaldTrump
1194608581590564865,2019-11-13 13:30:55+00:00,READ THE TRANSCRIPT!,read TRANSCRIPT,21260,<UNK>,<UNK>,realDonaldTrump
1194608482793795584,2019-11-13 13:30:31+00:00,NEVER TRUMPERS!,trumper,11290,<UNK>,<UNK>,realDonaldTrump
1194605373573009408,2019-11-13 13:18:10+00:00,"....any laws or did anything wrong, and they have to move away from quid pro quo because there was no quid, and there was no quo. Ukraine got it’s money (3 weeks early), and there was no investigation.” @CharlesHurt @foxandfriends",law wrong away quid quid Ukraine money week early investigation @CharlesHurt @foxandfriends,9135,<UNK>,@CharlesHurt @foxandfriends,realDonaldTrump
1194605364240670725,2019-11-13 13:18:08+00:00,"...the most powerful tool the legislative branch has, Impeachment, & they’ve turned it into a political cudgel, which is not at all what the Founders intended. When you hear Schiff use all these words like quid pro quo, it is because they can’t specify that Donald Trump broke..",powerful tool legislative branch Impeachment turn political cudgel founder intend hear Schiff word like quid specify Donald Trump break,9329,<UNK>,<UNK>,realDonaldTrump
1194605354484715520,2019-11-13 13:18:05+00:00,"“Nancy Pelosi cares more about power than she does about principle. She did not want to go down this road. She realizes this is a huge loser for Democrats. The Founders envisioned the worst people being in politics, yet they couldn’t envision this. You have these people taking...",Nancy Pelosi care power principle want road realize huge loser Democrats Founders envision bad people politic envision people take,14225,<UNK>,<UNK>,realDonaldTrump
1194588645673619457,2019-11-13 12:11:42+00:00,The Democrats have stacked the deck against President Trump and the Republicans. They have leaked out everything. @SteveDoocy @foxandfriends,Democrats stack deck President Trump Republicans leak @SteveDoocy @foxandfriends,11567,<UNK>,@SteveDoocy @foxandfriends,realDonaldTrump
1194586470050349056,2019-11-13 12:03:03+00:00,"“Millions of Americans will see what a partisan sham this whole thing is.” Rush Limbaugh @foxandfriends Also, why is corrupt politician Schiff allowed to hand over cross examination to a high priced outside lawyer. Did that lawyer ever work for me, which would be a conflict?",million Americans partisan sham thing Rush Limbaugh @foxandfriend corrupt politician Schiff allow hand cross examination high price outside lawyer lawyer work conflict,18901,<UNK>,@foxandfriends,realDonaldTrump
1194458301033074688,2019-11-13 03:33:45+00:00,"....to hurt Donald Trump and we, the people that support him. The Left has never accepted the results of the 2016 Election. They never saw this coming. This is not just about President Trump. They hate everyone he is representing.” @seanhannity @FoxNews Sean the amazing warrior!",hurt Donald Trump people support Left accept result 2016 Election come President Trump hate represent @seanhannity @FoxNews Sean amazing warrior,12282,<UNK>,@seanhannity @FoxNews,realDonaldTrump
1194458299720175616,2019-11-13 03:33:45+00:00,"....This is a phony showtrial. There is zero due process, none. It is yet another fraudulent hoax conspiracy theory. It is another Witch Hunt. This is what the Socialist Doemocrat Party has become. There’s not one thing the Democrats have done in the past 3 years except try...",phony showtrial zero process fraudulent hoax conspiracy theory Witch Hunt Socialist Doemocrat Party thing Democrats past year,12108,<UNK>,<UNK>,realDonaldTrump
1194458296146702336,2019-11-13 03:33:44+00:00,"“The circus is coming to town. The corrupt, compromised, coward & congenital liar Adam Schiff Show on Capital Hill, brought to you by his raging psychotic Democrats & the top allies in the Media Mob. Everything you’re going to see in the next two weeks is rigged.....",circus come town corrupt compromised coward congenital liar Adam Schiff Capital Hill bring rage psychotic Democrats ally Media go week rig,22278,<UNK>,<UNK>,realDonaldTrump
1194428178514743301,2019-11-13 01:34:03+00:00,"“This ridiculous Impeachment is a travesty, it’s not an inquiry. Just read the transcript.” @LouDobbs",ridiculous Impeachment travesty inquiry read transcript @LouDobbs,16598,<UNK>,@LouDobbs,realDonaldTrump
1194415355592093698,2019-11-13 00:43:06+00:00,"DACA recipients with arrest records: 53,792! That is a very large proportion of the total. @LouDobbs Not good, but we will be able to make a deal with the Dems!","DACA recipient arrest record 53,792 large proportion total @LouDobbs good able deal Dems",15615,<UNK>,@LouDobbs,realDonaldTrump
1194279077546483714,2019-11-12 15:41:35+00:00,A total Impeachment Scam by the Do Nothing Democrats!,total Impeachment Scam Democrats,19461,<UNK>,<UNK>,realDonaldTrump
1194219655717642240,2019-11-12 11:45:28+00:00,"Many of the people in DACA, no longer very young, are far from “angels.” Some are very tough, hardened criminals. President Obama said he had no legal right to sign order, but would anyway. If Supreme Court remedies with overturn, a deal will be made with Dems for them to stay!",people DACA long young angel tough hardened criminal President Obama say legal right sign order Supreme Court remedy overturn deal dem stay,18751,<UNK>,<UNK>,realDonaldTrump
1194216506403545088,2019-11-12 11:32:57+00:00,Economy is BOOMING. Seems set to have yet another record day!,economy boom record,19340,<UNK>,<UNK>,realDonaldTrump
1194216106300444672,2019-11-12 11:31:21+00:00,"I will be releasing the transcript of the first, and therefore more important, phone call with the Ukrainian President before week’s end!",release transcript important phone ukrainian President week,18978,<UNK>,<UNK>,realDonaldTrump
1194214569591394304,2019-11-12 11:25:15+00:00,"....Ukrainian energy company, and more millions taken from China, and now reports of other companies and countries also giving him big money, are certainly looking very corrupt (to put it mildly!) to me. Both Bidens should be forced to testify in this No Due Process Scam!",ukrainian energy company million take China report company country give money certainly look corrupt mildly biden force testify Process Scam,11308,<UNK>,<UNK>,realDonaldTrump
1194214568001724416,2019-11-12 11:25:15+00:00,".....”no pressure” put on him to investigate Sleepy Joe Biden even though, as President, I have an “obligation” to look into corruption, and Biden’s actions, on tape, about firing the prosecutor, and his son’s taking millions of dollars, with no knowledge or talent, from a.....",pressure investigate Sleepy Biden President obligation look corruption Biden action tape fire prosecutor take million dollar knowledge talent,10443,<UNK>,<UNK>,realDonaldTrump
1194214553053253632,2019-11-12 11:25:11+00:00,"Why is such a focus put on 2nd and 3rd hand witnesses, many of whom are Never Trumpers, or whose lawyers are Never Trumpers, when all you have to do is read the phone call (transcript) with the Ukrainian President and see first hand? He and others also stated that there was.....",focus hand witness Trumpers lawyer Trumpers read phone transcript ukrainian President hand state,15183,<UNK>,<UNK>,realDonaldTrump
1194089337887109126,2019-11-12 03:07:37+00:00,A great try by @seanspicer. We are all proud of you!,great @seanspicer proud,9717,<UNK>,@seanspicer,realDonaldTrump
1194056520427810816,2019-11-12 00:57:13+00:00,"“This isn’t about Ukraine. This isn’t about Impeachment. This is about subverting Democracy!” @BillOReilly So true, and led by angry and dishonest people who hate themselves, and must hate our Country!",Ukraine Impeachment subvert democracy @BillOReilly true angry dishonest people hate hate country,17991,<UNK>,@BillOReilly,realDonaldTrump
1194041680019755010,2019-11-11 23:58:15+00:00,....want that to be an impeachable offense? Good luck with that!” @JesseBWatters @FoxNews,want impeachable offense good luck @JesseBWatters @foxnews,9574,<UNK>,@JesseBWatters @FoxNews,realDonaldTrump
1194041674739208192,2019-11-11 23:58:14+00:00,"“The President has until September 30th to give this aid to Ukraine. He gets it out on September 11th., 3 weeks before the deadline. So, we give our ally aid, and Joe Biden is not investigated. Remember that, they get the aid and we get nothing in return. The Democrats....",President September 30th Ukraine get September 11th week deadline ally Biden investigate remember return Democrats,14149,<UNK>,<UNK>,realDonaldTrump
1194037811932016640,2019-11-11 23:42:53+00:00,"Schiff and the Dems have created this whole thing, they reverse engineer it. They’ve been vowing to impeach for three years. Why should we listen to them? Why should we want to?” @greggutfeld @FoxNews",schiff Dems create thing reverse engineer vow impeach year listen want @greggutfeld @foxnews,15117,<UNK>,@greggutfeld @FoxNews,realDonaldTrump
1194035922066714625,2019-11-11 23:35:22+00:00,"In order to continue being the most Transparent President in history, I will be releasing sometime this week the Transcript of the first, and therefore most important, phone call I had with the President of Ukraine. I am sure you will find it tantalizing!",order continue transparent President history release week Transcript important phone President Ukraine sure find tantalize,29316,<UNK>,<UNK>,realDonaldTrump
1194033162936102912,2019-11-11 23:24:24+00:00,"Just like Schiff fabricated my phone call, he will fabricate the transcripts that he is making and releasing!",like Schiff fabricate phone fabricate transcript make release,18197,<UNK>,<UNK>,realDonaldTrump
1194031678395686912,2019-11-11 23:18:30+00:00,"Schiff is giving Republicans NO WITNESSES, NO LAWYER & NO DUE PROCESS! It is a totally one sided Witch Hunt. This can’t be making the Democrats look good. Such a farce!",Schiff give Republicans WITNESSES LAWYER PROCESS totally side Witch Hunt make Democrats look good farce,22107,<UNK>,<UNK>,realDonaldTrump
1194014474375761924,2019-11-11 22:10:09+00:00,Read the Transcript. It is PERFECT!,read Transcript PERFECT,16784,<UNK>,<UNK>,realDonaldTrump
1193991769244999682,2019-11-11 20:39:55+00:00,To think I signed the Whistleblower Protection Act!,think sign Whistleblower Protection,11921,<UNK>,<UNK>,realDonaldTrump
1193988426233712642,2019-11-11 20:26:38+00:00,Where is the Whistleblower who gave so much false information? Must testify along with Schiff and others!,Whistleblower give false information testify Schiff,21652,<UNK>,<UNK>,realDonaldTrump
1193897574899634176,2019-11-11 14:25:38+00:00,"“The Chinese say (about Trump’s Trade War & Tariffs), ‘he brought us to the table.’ This is the most prosperous economy the world has ever seen, and it’s going to be a very prosperous economy.” Jamie Dimon on @60Minutes Thank you President Trump &amp; the Republican Party!",Chinese Trump Trade Tariffs bring table prosperous economy world see go prosperous economy Jamie Dimon @60minutes thank President Trump Republican Party,12333,<UNK>,@60Minutes,realDonaldTrump
1193896275093184512,2019-11-11 14:20:28+00:00,"Shifty Adam Schiff will only release doctored transcripts. We haven’t even seen the documents and are restricted from (get this) having a lawyer. Republicans should put out their own transcripts! Schiff must testify as to why he MADE UP a statement from me, and read it to all!",Shifty Adam Schiff release doctored transcript see document restrict have lawyer republican transcript Schiff testify statement read,23034,<UNK>,<UNK>,realDonaldTrump
1193894144747429889,2019-11-11 14:12:00+00:00,"The lawyer for the Whistleblower takes away all credibility from this big Impeachment Scam! It should be ended and the Whistleblower, his lawyer and Corrupt politician Schiff should be investigared for fraud!",lawyer Whistleblower take away credibility Impeachment Scam end Whistleblower lawyer corrupt politician Schiff investigare fraud,17527,<UNK>,<UNK>,realDonaldTrump
1193893631616270336,2019-11-11 14:09:57+00:00,"So with one Rally by me at the end of the campaign, I lift the poll numbers of Kentucky Governor Matt Bevin by 19 points, he just misses, every other Republican in the Commonwealth wins big, and the Fake News blames me for a bad night! OK! By the way, Mississippi won everything!",rally campaign lift poll number Kentucky Governor Matt Bevin point miss Republican Commonwealth win Fake News blame night Mississippi,13318,<UNK>,<UNK>,realDonaldTrump
1193891291953807360,2019-11-11 14:00:40+00:00,"Will be meeting with representatives of the Vaping industry, together with medical professionals and individual state representatives, to come up with an acceptable solution to the Vaping and E-cigarette dilemma. Children’s health & safety, together with jobs, will be a focus!",meet representative Vaping industry medical professional individual state representative come acceptable solution Vaping cigarette dilemma child health safety job focus,12074,<UNK>,<UNK>,realDonaldTrump
1193886728790171649,2019-11-11 13:42:32+00:00,HAPPY VETERANS DAY!,happy veterans,27356,<UNK>,<UNK>,realDonaldTrump
1193852154060197895,2019-11-11 11:25:08+00:00,https://twitter.com/BillWhiteNY/status/1193843654647058433,,12081,<UNK>,<UNK>,realDonaldTrump
1193736163237994497,2019-11-11 03:44:14+00:00,https://twitter.com/WhiteHouse/status/1193581836691226625,,9615,<UNK>,<UNK>,realDonaldTrump
1193716405771931650,2019-11-11 02:25:43+00:00,"A great new book just out, “The Plot Against the President. The True Story Of How Congressman Devin Nunes Uncovered the Biggest Political Scandal In U.S. History.” Shows very bad and corrupt people on the other side. Check it out!",great book Plot President True Story Congressman Devin Nunes uncover big political scandal U.S. history show corrupt people check,11119,<UNK>,<UNK>,realDonaldTrump
1193716259944304646,2019-11-11 02:25:09+00:00,"If Iran is able to turn over to the U.S. kidnapped former FBI Agent Robert A. Levinson, who has been missing in Iran for 12 years, it would be a very positive step. At the same time, upon information & belief, Iran is, & has been, enriching uranium. THAT WOULD BE A VERY BAD STEP!",Iran able turn U.S. kidnap Agent Robert Levinson miss Iran year positive step time information belief Iran enrich uranium step,16782,<UNK>,<UNK>,realDonaldTrump
1193712096137109504,2019-11-11 02:08:36+00:00,https://www.donaldjtrump.com/events/bossier-city-la-2019-nov-djt/,,9075,<UNK>,<UNK>,realDonaldTrump
1193665354729431040,2019-11-10 23:02:52+00:00,".@NikkiHaley is out with a new book, “With All Due Respect” this week. Make sure you order your copy today, or stop by one of her book tour stops to get a copy and say hello. Good luck Nikki!",.@NikkiHaley book respect week sure order copy today stop book tour stop copy hello good luck Nikki,11759,<UNK>,@NikkiHaley,realDonaldTrump
1193615188311912449,2019-11-10 19:43:31+00:00,"The call to the Ukrainian President was PERFECT. Read the Transcript! There was NOTHING said that was in any way wrong. Republicans, don’t be led into the fools trap of saying it was not perfect, but is not impeachable. No, it is much stronger than that. NOTHING WAS DONE WRONG!",ukrainian President PERFECT read Transcript say wrong Republicans fool trap say perfect impeachable strong wrong,20449,<UNK>,<UNK>,realDonaldTrump
1193605807369269248,2019-11-10 19:06:15+00:00,"“There’s nothing there! I’m trying to let the House know that they’re dividing America for no good reason. We’ve got a lot of things we should be doing, like lowering drug costs & getting a trade deal with Mexico and Canada.” @LindseyGrahamSC The Do Nothing Dems have gone crazy!",try House know divide America good reason thing like lower drug cost get trade deal Mexico Canada @LindseyGrahamSC Dems go crazy,17826,<UNK>,@LindseyGrahamSC,realDonaldTrump
1193603788898263041,2019-11-10 18:58:14+00:00,"Corrupt politician Adam Schiff wants people from the White House to testify in his and Pelosi’s disgraceful Witch Hunt, yet he will not allow a White House lawyer, nor will he allow ANY of our requested witnesses. This is a first in due process and Congressional history!",corrupt politician Adam Schiff want people White House testify Pelosi disgraceful Witch Hunt allow White House lawyer allow request witness process congressional history,24851,<UNK>,<UNK>,realDonaldTrump
1193377531828805632,2019-11-10 03:59:10+00:00,Make America Great Again!,America Great,19150,<UNK>,<UNK>,realDonaldTrump
1193375035324547072,2019-11-10 03:49:14+00:00,Such an amazing game & place!,amazing game place,17291,<UNK>,<UNK>,realDonaldTrump
1193358534286757888,2019-11-10 02:43:40+00:00,https://twitter.com/realDonaldTrump/status/1193327464308625409,,13089,<UNK>,<UNK>,realDonaldTrump
1193350200066101249,2019-11-10 02:10:33+00:00,“He is not a Whistleblower. He is a deepstater. Let the President do the job he was elected to do.” @JudgeJeanine,Whistleblower deepstater President elect @JudgeJeanine,14485,<UNK>,@JudgeJeanine,realDonaldTrump
1193346708782112768,2019-11-10 01:56:41+00:00,Such GREAT people!,great people,11142,<UNK>,<UNK>,realDonaldTrump
1193343223810248704,2019-11-10 01:42:50+00:00,Great!,great,5551,<UNK>,<UNK>,realDonaldTrump
1193342176329007105,2019-11-10 01:38:40+00:00,Thank you Andrew. Meadow was watching and is so proud of her great father and family!,thank Andrew Meadow watch proud great father family,5767,<UNK>,<UNK>,realDonaldTrump
1193339284746428416,2019-11-10 01:27:11+00:00,Thank you Terrence!,thank Terrence,16977,<UNK>,<UNK>,realDonaldTrump
1193328925742469120,2019-11-10 00:46:01+00:00,But the Fake News will never show this. Thank you!,Fake News thank,10164,<UNK>,<UNK>,realDonaldTrump
1193327464308625409,2019-11-10 00:40:13+00:00,Thank you to LSU and Alabama for a great game!,thank Alabama great game,17375,<UNK>,<UNK>,realDonaldTrump
1193326075138297857,2019-11-10 00:34:41+00:00,Totally!,totally,6893,<UNK>,<UNK>,realDonaldTrump
1193320428883845121,2019-11-10 00:12:15+00:00,A terrible lie. How can she do such a thing?,terrible thing,13703,<UNK>,<UNK>,realDonaldTrump
1193317958254239744,2019-11-10 00:02:26+00:00,Thank you Lee and David!,thank David,5781,<UNK>,<UNK>,realDonaldTrump
1193249691741216768,2019-11-09 19:31:10+00:00,95% Approval Rating in the Republican Party. Thank you! #MAGA #KAG2020,Approval Rating Republican Party thank MAGA KAG2020,12905,#MAGA #KAG2020,<UNK>,realDonaldTrump
1193248307402797056,2019-11-09 19:25:40+00:00,....Whatever happened to the so-called “informer” to Whistleblower #1? Seems to have disappeared after I released the Transcript of the call. Shouldn’t he be on the list to testify? Witch Hunt!,happen call informer Whistleblower disappear release Transcript list testify witch Hunt,16655,<UNK>,<UNK>,realDonaldTrump
1193239922926178304,2019-11-09 18:52:21+00:00,"I recommend that Nervous Nancy Pelosi (who backed up Schiff’s lie), Shifty Adam Schiff, Sleepy Joe Biden, the Whistleblower (who miraculously disappeared after I released the transcript of the call), the 2nd Whistleblower (who also disappeared), & the I.G., be part of the list!",recommend Nervous Nancy Pelosi back Schiff Shifty Adam Schiff Sleepy Biden Whistleblower miraculously disappear release transcript Whistleblower disappear I.G. list,22512,<UNK>,<UNK>,realDonaldTrump
1193224005827940352,2019-11-09 17:49:06+00:00,PRESIDENTIAL HARASSMENT!,PRESIDENTIAL HARASSMENT,22701,<UNK>,<UNK>,realDonaldTrump
1193200357243080704,2019-11-09 16:15:08+00:00,"But the Witch Hunt continues. After 3 years of relentless attacks against the Republican Party & me, the Do Nothing Dems are losers for America!",Witch Hunt continue year relentless attack Republican Party Dems loser America,14452,<UNK>,<UNK>,realDonaldTrump
1193192673429131264,2019-11-09 15:44:36+00:00,Bringing the word “Nationalism” back into the mainstream - great job by Rich Lowry! Very important book.,bring word Nationalism mainstream great Rich Lowry important book,10087,<UNK>,<UNK>,realDonaldTrump
1193190844012122113,2019-11-09 15:37:20+00:00,"Just finished reading my son Donald’s just out new book, “Triggered.” It is really good! He, along with many of us, was very unfairly treated. But we all fight back, and we always win!",finish read Donald book trigger good unfairly treat fight,28555,<UNK>,<UNK>,realDonaldTrump
1193136605067911168,2019-11-09 12:01:48+00:00,We will win big!,,8225,<UNK>,<UNK>,realDonaldTrump
1193136346438746113,2019-11-09 12:00:47+00:00,True!,true,7502,<UNK>,<UNK>,realDonaldTrump
1193132809986203649,2019-11-09 11:46:43+00:00,"Good luck Vince, this will be great!",good luck Vince great,4200,<UNK>,<UNK>,realDonaldTrump
