id,created_at,original_text,clean_text,retweet_count,hashtags,mentions,original_author
1290011569657610240,2020-08-02 19:48:20+00:00,"Rarely has anybody deserved the death penalty more than the Boston Bomber, Dzhokhar Tsarnaev. The court agreed that this “was one of the worst domestic terrorist attacks since the 9/11 atrocities”. Yet the appellate court tossed out the death sentence. So many lives lost....",rarely anybody deserve death penalty Boston Bomber Dzhokhar Tsarnaev court agree bad domestic terrorist attack 9/11 atrocity appellate court toss death sentence life lose,31632,<UNK>,<UNK>,realDonaldTrump
1290002828203667458,2020-08-02 19:13:35+00:00, https://twitter.com/realDonaldTrump/status/1289999271664787463,,18876,<UNK>,<UNK>,realDonaldTrump
1289999271664787463,2020-08-02 18:59:28+00:00,Astronauts complete first splashdown in 45 years. Very exciting!,astronaut complete splashdown year exciting,33526,<UNK>,<UNK>,realDonaldTrump
1289997897723863040,2020-08-02 18:54:00+00:00,Great to have NASA Astronauts return to Earth after very successful two month mission. Thank you to all!,great NASA astronaut return Earth successful month mission thank,30488,<UNK>,<UNK>,realDonaldTrump
1289894127778377728,2020-08-02 12:01:39+00:00,"When you see the Drug Companies taking massive television ads against me, forget what they say (which is false), YOU KNOW THAT DRUG PRICES ARE COMING DOWN, BIG. Favored Nations Clause means USA will pay the lowest price of any nation in the World. Never done before. Watch!!!",Drug Companies take massive television forget false know drug price come Favored Nations Clause mean low price nation World watch,46592,<UNK>,<UNK>,realDonaldTrump
1289887533250351110,2020-08-02 11:35:27+00:00,"Big China Virus breakouts all over the World, including nations which were thought to have done a great job. The Fake News doesn’t report this. USA will be stronger than ever before, and soon!",China Virus breakout World include nation think great Fake News report strong soon,21078,<UNK>,<UNK>,realDonaldTrump
1289877179791110144,2020-08-02 10:54:19+00:00,"Was in the Great State of Texas this week and explained that the Radical Left Do Nothing Democrats, headed up by their great leader, Sleepy Joe Biden (who never leaves his basement), are strongly against “Oil, Gas, Guns, & God”. Must be tough to win Texas on that platform!",Great State Texas week explain Radical Left Democrats head great leader Sleepy Biden leave basement strongly Guns tough Texas platform,22000,<UNK>,<UNK>,realDonaldTrump
1289873585318899712,2020-08-02 10:40:02+00:00,"Madison is a star who loves the USA and his Great State, North Carolina. Will fight for Military, Vets, 2nd Amendment, Lower Taxes & Regulations. He is a winner who has my Complete & Total Endorsement!",Madison star love Great State North Carolina fight Military Vets Amendment Lower Taxes Regulations winner Complete Total Endorsement,8337,<UNK>,<UNK>,realDonaldTrump
1289870016272166913,2020-08-02 10:25:51+00:00,That’s because it is mostly FAKE NEWS!,FAKE NEWS,11529,<UNK>,<UNK>,realDonaldTrump
1289863070836121601,2020-08-02 09:58:15+00:00,Hunter - Meadow is proud of you. So am I. Congratulations!,Hunter Meadow proud Congratulations,6896,<UNK>,<UNK>,realDonaldTrump
1289858922690621440,2020-08-02 09:41:46+00:00,This is outrageous. Must be met with immediate litigation! @GOPChairwoman,outrageous immediate litigation @GOPChairwoman,18284,<UNK>,@GOPChairwoman,realDonaldTrump
1289776166174248960,2020-08-02 04:12:55+00:00,Death penalty! He killed and badly wounded many. Justice!,death penalty kill badly wound justice,23557,<UNK>,<UNK>,realDonaldTrump
1289741750680993794,2020-08-02 01:56:10+00:00,MAKE AMERICA GREAT AGAIN!,AMERICA great,71297,<UNK>,<UNK>,realDonaldTrump
1289734620347473920,2020-08-02 01:27:50+00:00,"Congressman Blaine Luetkemeyer (@LuetkemeyerB) is doing a terrific job for Missouri! As a Small Businessman, he helped us Lower your Taxes, Strengthen our Military, and Defend your Second Amendment. Blaine has my Complete and Total Endorsement! #MO03",Congressman Blaine Luetkemeyer @luetkemeyerb terrific Missouri Small Businessman help lower taxis strengthen military defend Second Amendment Blaine Complete Total Endorsement MO03,4726,#MO03,@LuetkemeyerB,realDonaldTrump
1289734596846731265,2020-08-02 01:27:44+00:00,"Congresswoman Vicky Hartzler (@VickyH4Congress) works hard for the people of Missouri! She strongly supports our incredible Military and Vets, protects American Farmers, and fights for Life. Vicky has my Complete and Total Endorsement! #MO04",Congresswoman Vicky Hartzler @VickyH4Congress work hard people Missouri strongly support incredible military vet protect American Farmers fight Life Vicky Complete Total Endorsement mo04,4202,#MO04,@VickyH4Congress,realDonaldTrump
1289734578815381504,2020-08-02 01:27:40+00:00,"Congressman Sam Graves is doing an incredible job for Missouri! He fights for American Energy Independence, defends your Second Amendment, and he’ll help us rebuild our nation’s Infrastructure. Sam has my Complete and Total Endorsement! #MO06",Congressman Graves incredible Missouri fight American Energy Independence defend Second Amendment help rebuild nation infrastructure Complete Total Endorsement mo06,5100,#MO06,<UNK>,realDonaldTrump
1289734560863854593,2020-08-02 01:27:36+00:00,"Congressman Billy Long (@auctnr1) fully supports our America First agenda! He strongly supports our WALL, protects our Vets, and defends Life and your Second Amendment. Billy has my Complete and Total Endorsement! #MO07",Congressman Billy Long @auctnr1 fully support America agenda strongly support WALL protect Vets defend life Second Amendment Billy Complete Total Endorsement mo07,3733,#MO07,@auctnr1,realDonaldTrump
1289734544426442752,2020-08-02 01:27:32+00:00,"Congressman Dan Newhouse (@Newhouse4Rep) is doing a phenomenal job for Washington State! He is Strong on the Economy and Law Enforcement, and he works hard to preserve your State’s beautiful Public Lands. Dan has my Complete and Total Endorsement! #WA04",Congressman Newhouse @Newhouse4Rep phenomenal Washington State strong Economy Enforcement work hard preserve state beautiful Public Lands Complete Total Endorsement wa04,3684,#WA04,@Newhouse4Rep,realDonaldTrump
1289734528043372547,2020-08-02 01:27:28+00:00,"Cathy McMorris Rodgers (@TeamCMR) has been a tremendous advocate for the people of Washington State! She supports our Military and Vets, and protects your State’s incredible Natural Resources. Cathy has my Complete and Total Endorsement! #WA05",Cathy McMorris Rodgers @TeamCMR tremendous advocate people Washington State support military Vets protect state incredible Natural Resources Cathy Complete Total Endorsement wa05,3613,#WA05,@TeamCMR,realDonaldTrump
1289734510964281345,2020-08-02 01:27:24+00:00,"Congressman Jason Smith (@JasonSmithMO) is a conservative warrior for Missouri! He helped us Cut your Taxes, Build the Wall, and he stands strongly with me against the Radical Left! Jason has my Complete and Total Endorsement! #MO08",Congressman Jason Smith @JasonSmithMO conservative warrior Missouri help taxis build Wall stand strongly Radical Left Jason Complete Total Endorsement mo08,3885,#MO08,@JasonSmithMO,realDonaldTrump
1289734498561617920,2020-08-02 01:27:21+00:00,"Dale Crafts (@DaleCraftsME) will be a tremendous Congressman for Maine! An experienced businessman, Dale knows how to Create Jobs. He loves our Vets and Military, and he will always defend your Second Amendment. Dale has my Complete and Total Endorsement!",Dale Crafts @DaleCraftsME tremendous Congressman Maine experienced businessman Dale know create Jobs love Vets Military defend Second Amendment Dale Complete Total Endorsement,4086,<UNK>,@DaleCraftsME,realDonaldTrump
1289731760838721536,2020-08-02 01:16:28+00:00,Big flare ups in Europe. Fake News USA doesn’t like talking about this!,flare Europe Fake News like talk,8678,<UNK>,<UNK>,realDonaldTrump
1289674638285447168,2020-08-01 21:29:29+00:00,"“Biden to raise taxes by 3 Trillion Dollars.” Actually, it will be much more than that, and much of it on nonsense. Markets and your 401k’s will CRASH. Jobs will disappear!",biden raise taxis Trillion Dollars actually nonsense market 401k CRASH job disappear,30197,<UNK>,<UNK>,realDonaldTrump
1289657702608547840,2020-08-01 20:22:11+00:00,"Very excited to see @SeanHannity’s long awaited new book, 'Live Free or Die: America (and the World) on the Brink' which will be released on Tuesday, August 4th. Sean is a Great American Patriot. Make sure to get your copy today!",excited @seanhannity long await book live free America World Brink release Tuesday August Sean Great American Patriot sure copy today,15069,<UNK>,@seanhannity,realDonaldTrump
1289656445261119490,2020-08-01 20:17:11+00:00,"A great new book, “Defender in Chief: Donald Trump's Fight for Presidential Power”, written by celebrated constitutional scholar, John Yoo, is now available. Thanks so much John – greatly appreciate your support and words of wisdom!",great book Defender Chief Donald Trump Fight Presidential Power write celebrated constitutional scholar John available thank John greatly appreciate support word wisdom,8798,<UNK>,<UNK>,realDonaldTrump
1289646330361470977,2020-08-01 19:37:00+00:00,"I actually agree with this. Too much income disparity. Changes must be made, and soon!",actually agree income disparity change soon,28117,<UNK>,<UNK>,realDonaldTrump
1289644402906763265,2020-08-01 19:29:20+00:00,"Peggy Noonan, a “Concast” MSDNC @WSJ puppet, doesn’t have a clue, and hasn’t for many years. Never got the “Trump thing”. She plays right into the hands of the stupid people!",Peggy Noonan Concast MSDNC @wsj puppet clue year trump thing play right hand stupid people,12982,<UNK>,@WSJ,realDonaldTrump
1289639829810999297,2020-08-01 19:11:10+00:00,Payroll Tax Cut plus Dollars!,Payroll plus Dollars,31465,<UNK>,<UNK>,realDonaldTrump
1289636367283232768,2020-08-01 18:57:24+00:00,"Jake, this wasn’t a Trump Rally, but rather a very successful gathering of the great Sheriffs and Law Enforcement (of Florida) who gave me their unequivocal ENDORSEMENT. No Defund the Police here. Best Wishes!",Jake Trump Rally successful gathering great Sheriffs Enforcement Florida give unequivocal ENDORSEMENT defund Police good wish,18096,<UNK>,<UNK>,realDonaldTrump
1289633359681839105,2020-08-01 18:45:27+00:00,"Wrong! We have more cases because we have tested far more than any other country, 60,000,000. If we tested less, there would be less cases. How did Italy, France & Spain do? Now Europe sadly has flare ups. Most of our governors worked hard & smart. We will come back STRONG! ::","wrong case test country 60,000,000 test case Italy France Spain Europe sadly flare governor work hard smart come STRONG",20399,<UNK>,<UNK>,realDonaldTrump
1289408673324777472,2020-08-01 03:52:38+00:00,Homeland Security is not leaving Portland until local police complete cleanup of Anarchists and Agitators!,Homeland Security leave Portland local police complete cleanup Anarchists Agitators,34962,<UNK>,<UNK>,realDonaldTrump
1289407195029762049,2020-08-01 03:46:45+00:00,Obama worked harder for Hillary Clinton and the losing Clinton Campaign than she worked for herself! Now he’s working with Sleepy Joe - will be same result. MAGA is energized like never before!,Obama work hard Hillary Clinton lose Clinton Campaign work work Sleepy result MAGA energize like,38597,<UNK>,<UNK>,realDonaldTrump
1289397528639791104,2020-08-01 03:08:21+00:00,We have more Cases because we do more Testing. It’s Lamestream Media Gold!,case testing lamestream medium gold,35459,<UNK>,<UNK>,realDonaldTrump
1289358246541553664,2020-08-01 00:32:15+00:00,"We beat Obama 4 years ago, he worked harder than Crooked Hillary, and we’ll do it again!",beat Obama year work hard Crooked Hillary,29067,<UNK>,<UNK>,realDonaldTrump
1289353615224668160,2020-08-01 00:13:51+00:00,"I’m with you all the way, thank you!",thank,26600,<UNK>,<UNK>,realDonaldTrump
1289312630608465920,2020-07-31 21:31:00+00:00,"I am thrilled to be back in my home state of Florida—and honored to receive the endorsement of dozens of incredible Florida Sheriffs, THANK YOU! #LESM",thrilled home state Florida honor receive endorsement dozen incredible Florida Sheriffs thank LESM,22393,#LESM,<UNK>,realDonaldTrump
1289284178127646720,2020-07-31 19:37:56+00:00,"The Democrats are holding back the $1,200 to $3,400 (family of four) checks that were ready to be sent out!","Democrats hold 1,200 3,400 family check ready send",61666,<UNK>,<UNK>,realDonaldTrump
1289283987718828032,2020-07-31 19:37:11+00:00,Very disappointed in @SenSchumer for blocking the temporary extension of the $600 unemployment benefits. The Do Nothing Democrats are more interested in playing politics than in helping our deserving people. DRAIN THE SWAMP ON NOVEMBER 3RD!,disappointed @senschumer block temporary extension unemployment benefit Democrats interested play politic help deserve people drain swamp NOVEMBER,37907,<UNK>,@SenSchumer,realDonaldTrump
1289283091635122176,2020-07-31 19:33:37+00:00,"Pelosi & Schumer blocked desperately needed unemployment payments, which is so terrible, especially since they fully understand that it was not the workers fault that they are unemployed, it’s the fault of China!",Pelosi Schumer block desperately need unemployment payment terrible especially fully understand worker fault unemployed fault China,41995,<UNK>,<UNK>,realDonaldTrump
1289282585718190080,2020-07-31 19:31:36+00:00,"Pelosi & Schumer have no interest in making a deal that is good for our Country and our People. All they want is a trillion dollars, and much more, for their Radical Left Governed States, most of which are doing very badly. It is called a BAILOUT for many years of bad Dem Mgmt!",Pelosi Schumer interest make deal good country People want trillion dollar Radical Left Governed States badly call bailout year Mgmt,26385,<UNK>,<UNK>,realDonaldTrump
1289275972919816192,2020-07-31 19:05:20+00:00,".@BillHagertyTN, an outstanding man and one of the best Ambassadors ever (Japan), is running an excellent campaign for the Senate. He loves Tennessee and loves our Country. We need him badly in Washington. He has my Complete and Total Endorsement!",.@BillHagertyTN outstanding good ambassador Japan run excellent campaign Senate love Tennessee love country need badly Washington Complete Total Endorsement,13634,<UNK>,@BillHagertyTN,realDonaldTrump
1289275311272521728,2020-07-31 19:02:42+00:00,"We just got 50% in Rasmussen, and much higher in our internal polls. We are doing a new ad campaign on Sleepy Joe Biden that will be out on Monday. He has been brought even further LEFT than Crazy Bernie Sanders ever thought possible. By the way, Bernie’s people love me on Trade!",Rasmussen high internal poll campaign Sleepy Biden Monday bring left Crazy Bernie Sanders think possible Bernie people love Trade,23742,<UNK>,<UNK>,realDonaldTrump
1289260338135699456,2020-07-31 18:03:12+00:00,"Great job by Jim Jordan, and also some very good statements by Tony Fauci. Big progress being made!",great Jordan good statement Tony Fauci progress,19285,<UNK>,<UNK>,realDonaldTrump
1289201326375804930,2020-07-31 14:08:43+00:00,".....Our massive testing capability, rather than being praised, is used by the Lamestream Media and their partner, the Do Nothing Radical Left Democrats, as a point of scorn. This testing, and what we have so quickly done, is used as a Fake News weapon. Sad!",massive testing capability praise Lamestream Media partner Radical Left Democrats point scorn testing quickly Fake News weapon,19313,<UNK>,<UNK>,realDonaldTrump
1289201322588241920,2020-07-31 14:08:42+00:00,"Somebody please tell Congressman Clyburn, who doesn’t have a clue, that the chart he put up indicating more CASES for the U.S. than Europe, is because we do MUCH MORE testing than any other country in the World. If we had no testing, or bad testing, we would show very few CASES..",somebody tell Congressman Clyburn clue chart indicate case U.S. Europe testing country World testing testing case,33003,<UNK>,<UNK>,realDonaldTrump
1288981002849865728,2020-07-30 23:33:13+00:00,Great to spend time with Mike Singletary while going to Texas. He’s one of the greatest football players ever — A strong man and a really good person. Great being with you Mike!,great spend time Mike Singletary go Texas great football player strong good person great Mike,21231,<UNK>,<UNK>,realDonaldTrump
1288968970331213830,2020-07-30 22:45:25+00:00,"My Administration has been focused on finding treatments for Coronavirus. If you’ve recovered from Coronavirus, donate your plasma today to help SAVE LIVES! Together, we will beat the Virus! 🌐http://Coronavirus.gov",Administration focus find treatment Coronavirus recover Coronavirus donate plasma today help save lives beat Virus globe_with_meridian,17543,<UNK>,<UNK>,realDonaldTrump
1288966119676616704,2020-07-30 22:34:05+00:00,"As the Wall goes up, illegal crossings go down. This past week we built over 10 miles of Wall at our Southern Border. We now have 256 miles of NEW Wall and we are on track to have 300 miles completed by the end of August!",Wall go illegal crossing past week build mile Wall Southern Border mile Wall track mile complete August,31575,<UNK>,<UNK>,realDonaldTrump
1288933202812456968,2020-07-30 20:23:17+00:00,"We are going to WIN the 2020 Election, BIG! #MAGA",go 2020 Election maga,84580,#MAGA,<UNK>,realDonaldTrump
1288933078287745024,2020-07-30 20:22:47+00:00,"Must know Election results on the night of the Election, not days, months, or even years later!",know election result night Election day month year later,38628,<UNK>,<UNK>,realDonaldTrump
1288932940337090561,2020-07-30 20:22:14+00:00,"Glad I was able to get the very dishonest LameStream Media to finally start talking about the RISKS to our Democracy from dangerous Universal Mail-In-Voting (not Absentee Voting, which I totally support!).",Glad able dishonest LameStream Media finally start talk risk democracy dangerous Universal Mail Voting Absentee Voting totally support,28378,<UNK>,<UNK>,realDonaldTrump
1288907923914137604,2020-07-30 18:42:50+00:00,"...the phone with his amazing wife Gloria, daughter, Melanie, and son Vincent to express my deepest condolences to the entire family. @FLOTUS Melania and I loved Herman Cain, a great man. Herman, Rest In Peace!",phone amazing wife Gloria daughter Melanie Vincent express deep condolence entire family @FLOTUS Melania love Herman Cain great Herman Rest peace,22833,<UNK>,@FLOTUS,realDonaldTrump
1288907916020461569,2020-07-30 18:42:48+00:00,"My friend Herman Cain, a Powerful Voice of Freedom and all that is good, passed away this morning. Herman had an incredible career and was adored by everyone that ever met him, especially me. He was a very special man, an American Patriot, and great friend. I just got off...",friend Herman Cain powerful Voice Freedom good pass away morning Herman incredible career adore especially special American Patriot great friend,31268,<UNK>,<UNK>,realDonaldTrump
1288843391065882629,2020-07-30 14:26:24+00:00,"Support Patio Pizza and its wonderful owner, Guy Caligiuri, in St. James, Long Island (N.Y.). Great Pizza!!! @Varneyco",Support Patio Pizza wonderful owner Caligiuri James Long Island New York Great Pizza @Varneyco,24647,<UNK>,@Varneyco,realDonaldTrump
1288832830773100544,2020-07-30 13:44:26+00:00,"Drug prices will soon be lowered massively. Big Pharma (Drug Companies) are advertising against me like crazy because lower prices mean less profit. When you watch a Fake Ad, just think lower drug prices!!!",drug price soon lower massively Pharma Drug Companies advertise like crazy low price mean profit watch Fake think low drug price,35035,<UNK>,<UNK>,realDonaldTrump
1288826742539464707,2020-07-30 13:20:15+00:00,"Kate Brown, Governor of Oregon, isn’t doing her job. She must clear out, and in some cases arrest, the Anarchists & Agitators in Portland. If she can’t do it, the Federal Government will do it for her. We will not be leaving until there is safety!",Kate Brown Governor Oregon clear case arrest Anarchists Agitators Portland Federal Government leave safety,29396,<UNK>,<UNK>,realDonaldTrump
1288818160389558273,2020-07-30 12:46:09+00:00,"With Universal Mail-In Voting (not Absentee Voting, which is good), 2020 will be the most INACCURATE & FRAUDULENT Election in history. It will be a great embarrassment to the USA. Delay the Election until people can properly, securely and safely vote???",Universal Mail voting Absentee Voting good 2020 inaccurate FRAUDULENT election history great embarrassment delay election people properly securely safely vote,62033,<UNK>,<UNK>,realDonaldTrump
1288815049604292610,2020-07-30 12:33:47+00:00,"Major China Virus flare ups in many of the countries that the Fake News was touting as doing so well. Some of these countries are now a disaster. Lamestream Media doesn’t want to report this. Also, highly inaccurate numbers being reported by many other countries!!! @WSJ",Major China Virus flare country Fake News tout country disaster Lamestream Media want report highly inaccurate number report country @wsj,22596,<UNK>,@WSJ,realDonaldTrump
1288809157722877952,2020-07-30 12:10:22+00:00,"Mail-In Voting is already proving to be a catastrophic disaster. Even testing areas are way off. The Dems talk of foreign influence in voting, but they know that Mail-In Voting is an easy way for foreign countries to enter the race. Even beyond that, there’s no accurate count!",mail voting prove catastrophic disaster testing area Dems talk foreign influence voting know Mail voting easy foreign country enter race accurate count,30791,<UNK>,<UNK>,realDonaldTrump
1288620254130626561,2020-07-29 23:39:44+00:00,"Germany pays Russia billions of dollars a year for Energy, and we are supposed to protect Germany from Russia. What’s that all about? Also, Germany is very delinquent in their 2% fee to NATO. We are therefore moving some troops out of Germany!",Germany pay Russia billion dollar year Energy suppose protect Germany Russia Germany delinquent NATO move troop Germany,46853,<UNK>,<UNK>,realDonaldTrump
1288616496638255105,2020-07-29 23:24:48+00:00,Check out this Mail-In Voting experiment by a local news station!,check mail voting experiment local news station,60215,<UNK>,<UNK>,realDonaldTrump
1288602262567153664,2020-07-29 22:28:15+00:00,"New York Mail-In voting is in a disastrous state of condition. Votes from many weeks ago are missing - a total mess. They have no idea what is going on. Rigged Election. I told you so. Same thing would happen, but on massive scale, with USA. Fake News refuses to report!",York Mail voting disastrous state condition vote week miss total mess idea go rig Election tell thing happen massive scale Fake News refuse report,39551,<UNK>,<UNK>,realDonaldTrump
1288599151349923840,2020-07-29 22:15:53+00:00,".@FoxNews reported incorrectly what the Federal Government is doing with respect to Portland. We are demanding that the Governor &amp; Mayor do their job or we will do it for them. To complicated to discuss in a Tweet, but bad reporting by Fox (possibly on purpose!). @DHSgov",.@FoxNews report incorrectly Federal Government respect Portland demand Governor Mayor complicate discuss Tweet reporting possibly purpose @dhsgov,28958,<UNK>,@FoxNews @DHSgov,realDonaldTrump
1288564391735066625,2020-07-29 19:57:46+00:00,Great to be in Texas!,great Texas,29604,<UNK>,<UNK>,realDonaldTrump
1288520310531272708,2020-07-29 17:02:36+00:00,"...do not stop the Crime and Violence from the Anarchists and Agitators immediately, the Federal Government will go in and do the job that local law enforcement was supposed to do!",stop Crime violence Anarchists Agitators immediately Federal Government local enforcement suppose,13597,<UNK>,<UNK>,realDonaldTrump
1288520300250923014,2020-07-29 17:02:33+00:00,"If the Federal Government and its brilliant Law Enforcement (Homeland) didn’t go into Portland one week ago, there would be no Portland -- It would be burned and beaten to the ground. If the Mayor and Governor...",Federal Government brilliant Enforcement Homeland Portland week Portland burn beat ground Mayor Governor,19298,<UNK>,<UNK>,realDonaldTrump
1288519484823810048,2020-07-29 16:59:19+00:00,Just landed in the Great State of Texas!,land Great State Texas,9896,<UNK>,<UNK>,realDonaldTrump
1288519158368481280,2020-07-29 16:58:01+00:00,"I was on Air Force One flying to the Great State of Texas, where I just landed. It is AMAZING in watching @FoxNews how different they are from four years ago. Not even watchable. They totally forgot who got them where they are!",Force fly Great State Texas land amazing watch @foxnews different year watchable totally forget,23420,<UNK>,@FoxNews,realDonaldTrump
1288511210543964162,2020-07-29 16:26:26+00:00,"...With Biden, drug prices will quadruple! After many years, the game is finally up for Big Pharma, and they’re NOT HAPPY about it! Please understand that when you see their negative ads!",Biden drug price quadruple year game finally Pharma happy understand negative,15874,<UNK>,<UNK>,realDonaldTrump
1288511206790111233,2020-07-29 16:26:25+00:00,"The drug companies are spending millions of dollars in advertising against me, only because I am lowering drug prices massively, 50% and more! Biden and Obama said they would do this for eight years, but never did...",drug company spend million dollar advertising lower drug price massively Biden Obama say year,32030,<UNK>,<UNK>,realDonaldTrump
1288509572223651840,2020-07-29 16:19:56+00:00,"...Your housing prices will go up based on the market, and crime will go down. I have rescinded the Obama-Biden AFFH Rule. Enjoy!",housing price base market crime rescind Obama Biden AFFH Rule enjoy,27200,<UNK>,<UNK>,realDonaldTrump
