id,created_at,original_text,clean_text,retweet_count,hashtags,mentions,original_author
1185899575669919745,2019-10-20 12:44:26+00:00,The WALL is making a very big difference. Even Dems in area are happy!,WALL make difference dem area happy,17364,<UNK>,<UNK>,realDonaldTrump
1185747939257397248,2019-10-20 02:41:53+00:00,"So now Crooked Hillary is at it again! She is calling Congresswoman Tulsi Gabbard “a Russian favorite,” and Jill Stein “a Russian asset.” As you may have heard, I was called a big Russia lover also (actually, I do like Russian people. I like all people!). Hillary’s gone Crazy!",Crooked Hillary call Congresswoman Tulsi Gabbard russian favorite Jill Stein russian asset hear call Russia lover actually like russian people like people Hillary go crazy,32979,<UNK>,<UNK>,realDonaldTrump
1185738277376184320,2019-10-20 02:03:29+00:00,Never give up. We are doing GREAT! We are WINNING!,GREAT win,18711,<UNK>,<UNK>,realDonaldTrump
1185735579327193093,2019-10-20 01:52:46+00:00,"....Therefore, based on both Media & Democrat Crazed and Irrational Hostility, we will no longer consider Trump National Doral, Miami, as the Host Site for the G-7 in 2020. We will begin the search for another site, including the possibility of Camp David, immediately. Thank you!",base Media Democrat Crazed Irrational Hostility long consider Trump National Doral Miami Host Site 2020 begin search site include possibility Camp David immediately thank,15647,<UNK>,<UNK>,realDonaldTrump
1185726931611852802,2019-10-20 01:18:24+00:00,".....its own 50 to 70 unit building. Would set up better than other alternatives. I announced that I would be willing to do it at NO PROFIT or, if legally permissible, at ZERO COST to the USA. But, as usual, the Hostile Media & their Democrat Partners went CRAZY!",unit building well alternative announce willing profit legally permissible ZERO cost usual Hostile Media Democrat Partners go CRAZY,18983,<UNK>,<UNK>,realDonaldTrump
1185726930764611589,2019-10-20 01:18:24+00:00,"I thought I was doing something very good for our Country by using Trump National Doral, in Miami, for hosting the G-7 Leaders. It is big, grand, on hundreds of acres, next to MIAMI INTERNATIONAL AIRPORT, has tremendous ballrooms & meeting rooms, and each delegation would have...",think good country Trump National Doral Miami host Leaders grand hundred acre MIAMI INTERNATIONAL AIRPORT tremendous ballroom meeting room delegation,18747,<UNK>,<UNK>,realDonaldTrump
1185699151708901376,2019-10-19 23:28:01+00:00,“The President never told me to withhold any money until the Ukrainians did anything related to the server. The only reason we were holding the money was because of concern about LACK OF SUPPORT FROM OTHER NATIONS and CONCERNS OVER CORRUPTION.” Yesterday’s Mick Mulvaney statement,President tell withhold money Ukrainians relate server reason hold money concern LACK support nation concerns corruption yesterday Mick Mulvaney statement,18120,<UNK>,<UNK>,realDonaldTrump
1185683791639187459,2019-10-19 22:26:59+00:00,See you there!,,7820,<UNK>,<UNK>,realDonaldTrump
1185665748800299009,2019-10-19 21:15:17+00:00,https://www.donaldjtrump.com/events/ms-2019-nov-tupelo/,,12134,<UNK>,<UNK>,realDonaldTrump
1185643744932106240,2019-10-19 19:47:51+00:00,"Crooked Hillary Clinton just called the respected environmentalist and Green Party candidate, Jill Stein, a “Russian Asset.” They need a Green Party more than ever after looking at the Democrats disastrous environmental program!",Crooked Hillary Clinton call respected environmentalist Green Party candidate Jill Stein Russian Asset need Green Party look Democrats disastrous environmental program,18584,<UNK>,<UNK>,realDonaldTrump
1185637489471565824,2019-10-19 19:23:00+00:00,It is ONLY about this!,,19587,<UNK>,<UNK>,realDonaldTrump
1185635727645839363,2019-10-19 19:16:00+00:00,"Just another FAKE SUPPRESSION POLL, this time from @FoxNews, of course!",fake suppression POLL time @FoxNews course,8617,<UNK>,@FoxNews,realDonaldTrump
1185610478325784577,2019-10-19 17:35:40+00:00,.@RepMcClintock Thank you Tom. Great interview on @TeamCavuto! @FoxNews,.@RepMcClintock thank great interview @TeamCavuto @foxnews,5268,<UNK>,@RepMcClintock @TeamCavuto @FoxNews,realDonaldTrump
1185607384963661825,2019-10-19 17:23:22+00:00,A Great Book by Kimberley Strassel!,great Book Kimberley Strassel,6149,<UNK>,<UNK>,realDonaldTrump
1185601988811284483,2019-10-19 17:01:56+00:00,"“I don’t see anything that constitutes an Impeachable offense - Nothing here rises to the level of Impeachment. The Democrats are making a mistake with this secrecy.” Kenn Starr, former Special Prosecutor",constitute impeachable offense rise level Impeachment Democrats make mistake secrecy Kenn Starr Special prosecutor,14093,<UNK>,<UNK>,realDonaldTrump
1185586107653804033,2019-10-19 15:58:49+00:00,Thank you very much. Working hard!,thank work hard,9527,<UNK>,<UNK>,realDonaldTrump
1185585875318644737,2019-10-19 15:57:54+00:00,I agree!,agree,11525,<UNK>,<UNK>,realDonaldTrump
1185580161305059328,2019-10-19 15:35:12+00:00,Texas is great!,Texas great,9277,<UNK>,<UNK>,realDonaldTrump
1185577234641379328,2019-10-19 15:23:34+00:00,There has never been a greater fraud on Congress. Shifty Schiff is Corrupt. Go Andy!,great fraud Congress Shifty Schiff corrupt Andy,13917,<UNK>,<UNK>,realDonaldTrump
1185574689156059141,2019-10-19 15:13:27+00:00,"Such a disgrace that the Do Nothing Democrats are doing just as their name suggests, Doing Nothing! USMCA anyone?",disgrace Democrats suggest USMCA,15779,<UNK>,<UNK>,realDonaldTrump
1185534210196627456,2019-10-19 12:32:36+00:00,#StopTheCoup,StopTheCoup,26776,#StopTheCoup,<UNK>,realDonaldTrump
1185389914470473729,2019-10-19 02:59:13+00:00,"Susan Rice, who was a disaster to President Obama as National Security Advisor, is now telling us her opinion on what to do in Syria. Remember RED LINE IN THE SAND? That was Obama. Millions killed! No thanks Susan, you were a disaster.",Susan Rice disaster President Obama National Security Advisor tell opinion Syria remember LINE SAND Obama million kill thank Susan disaster,30569,<UNK>,<UNK>,realDonaldTrump
1185379196203421696,2019-10-19 02:16:38+00:00,"Pelosi and Impeachment - There have already been 3 Votes, and they’ve all failed miserably. Here’s why there may not be a fourth - 137 Democrats voted against on the last vote.” @JasonChaffetz @seanhannity Many of those voting in favor will be beaten in 2020!",Pelosi Impeachment Votes fail miserably fourth Democrats vote vote @JasonChaffetz @seanhannity vote favor beat 2020,15381,<UNK>,@JasonChaffetz @seanhannity,realDonaldTrump
1185375708559876098,2019-10-19 02:02:46+00:00,"Congressman Michael McCaul, “Schiff’s inquiry defies Democracy.” @FoxNews @seanhannity",Congressman Michael McCaul schiff inquiry defy Democracy @foxnews @seanhannity,9423,<UNK>,@FoxNews @seanhannity,realDonaldTrump
1185374394350215169,2019-10-19 01:57:33+00:00,"“Because the House has already voted against the Impeachment Proceeding, the current inquiry is totally invalid. The current sham of a so-called investigation is nothing more than an unconstitutional power grab. It needs to end.” @JasonChaffetz @seanhannity Corrupt Adam Schiff",House vote Impeachment Proceeding current inquiry totally invalid current sham call investigation unconstitutional power grab need @JasonChaffetz @seanhannity Corrupt Adam schiff,16491,<UNK>,@JasonChaffetz @seanhannity,realDonaldTrump
1185367080780156930,2019-10-19 01:28:29+00:00,"Corrupt Congressman Adam Schiff is angry that Ambassadors that he thought would be good for his fraudulent Witch Hunt, are turning out to be good for me - some really good! He’s got all meetings locked down, no transparency, only his illegal leaks. A very dishonest sleazebag!",Corrupt Congressman Adam Schiff angry Ambassadors think good fraudulent Witch Hunt turn good good meeting lock transparency illegal leak dishonest sleazebag,26991,<UNK>,<UNK>,realDonaldTrump
1185339160858648576,2019-10-18 23:37:33+00:00,REPUBLICANS MUST STICK TOGETHER AND FIGHT!,republican STICK FIGHT,22475,<UNK>,<UNK>,realDonaldTrump
1185336214049689600,2019-10-18 23:25:50+00:00,"Think of how many lives we saved in Syria and Turkey by getting a ceasefire yesterday. Thousands and thousands, and maybe many more!",think life save Syria Turkey get ceasefire yesterday thousand thousand maybe,17411,<UNK>,<UNK>,realDonaldTrump
1185277957436248065,2019-10-18 19:34:21+00:00,"....He is also my friend! At the same time, I am pleased to nominate Deputy Secretary Dan Brouillette to be the new Secretary of Energy. Dan’s experience in the sector is unparalleled. A total professional, I have no doubt that Dan will do a great job!",friend time pleased nominate Deputy Secretary Brouillette Secretary Energy experience sector unparalleled total professional doubt great,9541,<UNK>,<UNK>,realDonaldTrump
1185277956551254018,2019-10-18 19:34:20+00:00,I want to thank Secretary of Energy Rick Perry for the outstanding job he has done. He will be leaving at the end of the year to pursue other interests. Rick was a great Governor of Texas and a great Secretary of Energy....,want thank Secretary Energy Rick Perry outstanding leave year pursue interest Rick great Governor Texas great Secretary Energy,12028,<UNK>,<UNK>,realDonaldTrump
1185221926991609862,2019-10-18 15:51:42+00:00,"Can you believe I am doing this important work for our Country, and have to deal with Corrupt Adam Schiff and the Do Nothing Democrats at the same time? It was not intended to be this way for a President!",believe important work country deal Corrupt Adam Schiff Democrats time intend President,29916,<UNK>,<UNK>,realDonaldTrump
1185220552254017537,2019-10-18 15:46:14+00:00,DEFEAT TERRORISM!,DEFEAT TERRORISM,15124,<UNK>,<UNK>,realDonaldTrump
1185219643432230913,2019-10-18 15:42:37+00:00,"....I have just been notified that some European Nations are now willing, for the first time, to take the ISIS Fighters that came from their nations. This is good news, but should have been done after WE captured them. Anyway, big progress being made!!!!",notify European Nations willing time ISIS Fighters come nation good news capture progress,12779,<UNK>,<UNK>,realDonaldTrump
1185219642668867585,2019-10-18 15:42:37+00:00,".....this thinking years ago. Instead, it was always held together with very weak bandaids, & in an artificial manner. There is good will on both sides & a really good chance for success. The U.S. has secured the Oil, & the ISIS Fighters are double secured by Kurds & Turkey....",thinking year instead hold weak bandaid artificial manner good side good chance success U.S. secure ISIS Fighters double secure Kurds Turkey,10680,<UNK>,<UNK>,realDonaldTrump
1185219641972539392,2019-10-18 15:42:37+00:00,"Just spoke to President @RTErdogan of Turkey. He told me there was minor sniper and mortar fire that was quickly eliminated. He very much wants the ceasefire, or pause, to work. Likewise, the Kurds want it, and the ultimate solution, to happen. Too bad there wasn’t.....",speak President @rterdogan Turkey tell minor sniper mortar fire quickly eliminate want ceasefire pause work likewise Kurds want ultimate solution happen,14747,<UNK>,@RTErdogan,realDonaldTrump
1185181219086127105,2019-10-18 13:09:56+00:00,The USA!,,11430,<UNK>,<UNK>,realDonaldTrump
1185037614685904896,2019-10-18 03:39:18+00:00,"Democrats are now the party of high taxes, high crime, open borders, late-term abortion, socialism, and blatant corruption. The Republican Party is the party of the American Worker, the American Family, and the American Dream! #KAG2020",Democrats party high taxis high crime open border late term abortion socialism blatant corruption Republican Party party American Worker American Family American Dream KAG2020,27690,#KAG2020,<UNK>,realDonaldTrump
1185029472132698113,2019-10-18 03:06:57+00:00,"Tonight, we forcefully condemn the blatant corruption of the Democrat Party, the Fake News Media, and the rogue bureaucrats of the Deep State. The only message these radicals will understand is a crushing defeat on November 3, 2020! #KAG2020",tonight forcefully condemn blatant corruption Democrat Party Fake News Media rogue bureaucrat Deep State message radical understand crush defeat November 2020 KAG2020,20554,#KAG2020,<UNK>,realDonaldTrump
1185026994993451008,2019-10-18 02:57:07+00:00,"The radical left tolerates no dissent, it permits no opposition, it accepts no compromise, and it has absolutely no respect for the will of the American People. They are coming after me, because I am fighting for YOU! #TrumpRallyDallas #KAG2020",radical left tolerate dissent permit opposition accept compromise absolutely respect American People come fight trumprallydalla KAG2020,20842,#TrumpRallyDallas #KAG2020,<UNK>,realDonaldTrump
1185019331018665985,2019-10-18 02:26:39+00:00,"Thank you Dallas, Texas - I love you! #TrumpRallyDallas #KAG2020",thank Dallas Texas love trumprallydalla KAG2020,17809,#TrumpRallyDallas #KAG2020,<UNK>,realDonaldTrump
1184987864125321216,2019-10-18 00:21:37+00:00,"Just arrived at the American Airlines Center in Dallas, Texas. Will be out shortly as we wait for more of you to get in! #TRUMP2020",arrive American Airlines Center Dallas Texas shortly wait TRUMP2020,20695,#TRUMP2020,<UNK>,realDonaldTrump
1184973040150614016,2019-10-17 23:22:43+00:00,"See you soon Dallas, Texas!",soon Dallas Texas,12154,<UNK>,<UNK>,realDonaldTrump
1184895160871571456,2019-10-17 18:13:15+00:00,"This is a great day for civilization. I am proud of the United States for sticking by me in following a necessary, but somewhat unconventional, path. People have been trying to make this “Deal” for many years. Millions of lives will be saved. Congratulations to ALL!",great civilization proud United States stick follow necessary somewhat unconventional path People try deal year million life save congratulation,32874,<UNK>,<UNK>,realDonaldTrump
1184892687587012608,2019-10-17 18:03:25+00:00,This deal could NEVER have been made 3 days ago. There needed to be some “tough” love in order to get it done. Great for everybody. Proud of all!,deal day need tough love order great everybody proud,20444,<UNK>,<UNK>,realDonaldTrump
1184884179751731200,2019-10-17 17:29:37+00:00,Great news out of Turkey. News Conference shortly with @VP and @SecPompeo. Thank you to @RTErdogan. Millions of lives will be saved!,great news Turkey News Conference shortly @SecPompeo thank @rterdogan million life save,23386,<UNK>,@VP @SecPompeo @RTErdogan,realDonaldTrump
1184877410946187264,2019-10-17 17:02:43+00:00,"This number, based on the Economy & how well our Country is doing, would potentially be 75% if not for the Fake News & Phony Witch Hunt. 95% Approval Rating in the Republican Party!",number base Economy country potentially Fake News Phony Witch Hunt Approval Rating Republican Party,15914,<UNK>,<UNK>,realDonaldTrump
1184848482844250113,2019-10-17 15:07:46+00:00,As the Witch Hunt continues!,Witch Hunt continue,11979,<UNK>,<UNK>,realDonaldTrump
1184820057001598976,2019-10-17 13:14:49+00:00,The Greatest Witch Hunt in American History!,Greatest Witch Hunt american history,13797,<UNK>,<UNK>,realDonaldTrump
1184815052546809862,2019-10-17 12:54:55+00:00,"My warmest condolences to the family and many friends of Congressman Elijah Cummings. I got to see first hand the strength, passion and wisdom of this highly respected political leader. His work and voice on so many fronts will be very hard, if not impossible, to replace!",warm condolence family friend Congressman Elijah Cummings hand strength passion wisdom highly respected political leader work voice front hard impossible replace,15353,<UNK>,<UNK>,realDonaldTrump
1184799768964456448,2019-10-17 11:54:12+00:00,This is the real story. Thank you Jim!,real story thank,14599,<UNK>,<UNK>,realDonaldTrump
1184690356027297793,2019-10-17 04:39:26+00:00,"I am the only person who can fight for the safety of our troops & bring them home from the ridiculous & costly Endless Wars, and be scorned. Democrats always liked that position, until I took it. Democrats always liked Walls, until I built them. Do you see what’s happening here?",person fight safety troop bring home ridiculous costly Endless Wars scorn Democrats like position take Democrats like wall build happen,34432,<UNK>,<UNK>,realDonaldTrump
1184687862090010624,2019-10-17 04:29:31+00:00,"“About 500,000 human beings were killed in Syria while Barack Obama was president & leading for a “political settlement” to that civil war. Media has been more outraged in the last 72 hours over our Syria policy than they were at any point during 7 years of slaughter.” BuckSexton","500,000 human being kill Syria Barack Obama president lead political settlement civil Media outraged hour Syria policy point year slaughter BuckSexton",38627,<UNK>,<UNK>,realDonaldTrump
1184638812150009858,2019-10-17 01:14:36+00:00,"Hope all House Republicans, and honest House Democrats, will vote to CENSURE Rep. Adam Schiff tomorrow for his brazen and unlawful act of fabricating (making up) a totally phony conversation with the Ukraine President and U.S. President, me. Most have never seen such a thing!",hope House Republicans honest House Democrats vote CENSURE Rep. Adam Schiff tomorrow brazen unlawful fabricating make totally phony conversation Ukraine President U.S. President see thing,28375,<UNK>,<UNK>,realDonaldTrump
1184637926212341760,2019-10-17 01:11:05+00:00,"Years of BAD GOVERNMENT, such a sorry thing to see!",year GOVERNMENT sorry thing,15387,<UNK>,<UNK>,realDonaldTrump
1184634725677314050,2019-10-17 00:58:22+00:00,"“What has happened here with the Anthony Wiener laptop, the Server, all of the Emails between Huma Abedin and Hillary Clinton, the deleted Clinton Emails - what is going on?” @LouDobbs Joe D &amp; Victoria T!",happen Anthony Wiener laptop Server Emails Huma Abedin Hillary Clinton delete Clinton Emails go @LouDobbs Victoria,25014,<UNK>,@LouDobbs,realDonaldTrump
1184631273454817280,2019-10-17 00:44:39+00:00,"THANK YOU you Dallas, Texas. See you tomorrow night at the American Airlines Center! #TRUMP2020",thank Dallas Texas tomorrow night American Airlines Center TRUMP2020,18814,#TRUMP2020,<UNK>,realDonaldTrump
1184623216742014977,2019-10-17 00:12:38+00:00,"“This President is the most patriotic President I’ve seen in many years. He is going to do what is good for Americans.” Congressman Brian Babin, Texas. Thank you Brian!",President patriotic President see year go good Americans Congressman Brian Babin Texas thank Brian,16498,<UNK>,<UNK>,realDonaldTrump
1184620202480193537,2019-10-17 00:00:40+00:00,"Nancy Pelosi needs help fast! There is either something wrong with her “upstairs,” or she just plain doesn’t like our great Country. She had a total meltdown in the White House today. It was very sad to watch. Pray for her, she is a very sick person!",Nancy Pelosi need help fast wrong upstairs plain like great country total meltdown White House today watch pray sick person,43330,<UNK>,<UNK>,realDonaldTrump
1184600576245583873,2019-10-16 22:42:40+00:00,"The Do Nothing Democrats, Pelosi and Schumer stormed out of the Cabinet Room!",Democrats Pelosi Schumer storm Cabinet Room,16060,<UNK>,<UNK>,realDonaldTrump
1184597281808498688,2019-10-16 22:29:35+00:00,Nervous Nancy's unhinged meltdown!,Nervous Nancy unhinged meltdown,27453,<UNK>,<UNK>,realDonaldTrump
1184595335794036737,2019-10-16 22:21:51+00:00,Do you think they like me?,think like,26612,<UNK>,<UNK>,realDonaldTrump
1184594674541121537,2019-10-16 22:19:13+00:00,"I’m fighting for the American people, but the Democrats’ sole focus is fighting against ME with their fraudulent Witch Hunt. Go to http://StopTheMadness.GOP and tell Democrats in Congress that Enough is Enough!",fight american people Democrats sole focus fight fraudulent Witch Hunt tell Democrats Congress,19757,<UNK>,<UNK>,realDonaldTrump
1184579045138337794,2019-10-16 21:17:07+00:00,FAKE NEWS!,FAKE NEWS,40247,<UNK>,<UNK>,realDonaldTrump
1184576819309228034,2019-10-16 21:08:16+00:00,"THANK YOU, WORKING HARD!",thank WORKING HARD,15531,<UNK>,<UNK>,realDonaldTrump
1184540536134406144,2019-10-16 18:44:06+00:00,"Guatemala, Honduras & El Salvador have all signed historic Asylum Cooperation Agreements and are working to end the scourge of human smuggling. To further accelerate this progress, the U.S. will shortly be approving targeted assistance in the areas of law enforcement & security.",Guatemala Honduras Salvador sign historic Asylum Cooperation Agreements work scourge human smuggling accelerate progress U.S. shortly approve target assistance area enforcement security,18032,<UNK>,<UNK>,realDonaldTrump
1184530879999348739,2019-10-16 18:05:43+00:00,"Senator Rand Paul just wrote a great book, “The Case Against Socialism” which is now out. Highly recommended – as America was founded on LIBERTY & INDEPENDENCE – not government coercion, domination & control. We were born free, and will stay free, as long as I am your President!",Senator Rand Paul write great book Case Socialism highly recommend America found LIBERTY INDEPENDENCE government coercion domination control bear free stay free long President,21873,<UNK>,<UNK>,realDonaldTrump
1184435422346305537,2019-10-16 11:46:25+00:00,"Republicans are totally deprived of their rights in this Impeachment Witch Hunt. No lawyers, no questions, no transparency! The good news is that the Radical Left Dems have No Case. It is all based on their Fraud and Fabrication!",Republicans totally deprive right Impeachment Witch Hunt lawyer question transparency good news radical Left Dems case base Fraud Fabrication,19772,<UNK>,<UNK>,realDonaldTrump
1184431250066624512,2019-10-16 11:29:50+00:00,"Our record Economy would CRASH, just like in 1929, if any of those clowns became President!",record economy crash like 1929 clown President,26309,<UNK>,<UNK>,realDonaldTrump
1184430253541859328,2019-10-16 11:25:52+00:00,"95% Approval Rating in the Republican Party. Thank you! Just won two Congressional Seats in North Carolina, & a Governors runoff in Louisiana, which Republicans should now win! Because of Impeachment Fraud, we will easily take back the House, add in the Senate, & again win Pres!",Approval Rating Republican Party thank Congressional Seats North Carolina Governors runoff Louisiana Republicans Impeachment Fraud easily House Senate pre,23510,<UNK>,<UNK>,realDonaldTrump
1184427310935609345,2019-10-16 11:14:11+00:00,“What is happening to President Trump with Impeachment is a Constitutional Travesty.” @GrahamLedger The likes of which we have never seen before. It is Adam Schiff and Nancy Pelosi who should be impeached for fraud!,happen President Trump Impeachment Constitutional Travesty @GrahamLedger like see Adam Schiff Nancy Pelosi impeach fraud,17943,<UNK>,@GrahamLedger,realDonaldTrump
1184426268177129472,2019-10-16 11:10:02+00:00,You would think there is NO WAY that any of the Democrat Candidates that we witnessed last night could possibly become President of the United States. Now you see why they have no choice but to push a totally illegal & absurd Impeachment of one of the most successful Presidents!,think Democrat Candidates witness night possibly President United States choice push totally illegal absurd Impeachment successful president,24988,<UNK>,<UNK>,realDonaldTrump
1184308485237948416,2019-10-16 03:22:00+00:00,We now have the greatest Economy in history!,great economy history,33192,<UNK>,<UNK>,realDonaldTrump
1184307214623875072,2019-10-16 03:16:57+00:00,A great group of Champions!,great group Champions,8162,<UNK>,<UNK>,realDonaldTrump
1184306888864874496,2019-10-16 03:15:40+00:00,Looks good to me!,look good,19318,<UNK>,<UNK>,realDonaldTrump
1184293357755011072,2019-10-16 02:21:54+00:00,".... It also brings Shifty’s fraudulent MADE UP CALL, which he read to the United States Congress pretending it to be the words of President Trump, which they were not! Nancy Pelosi is involved in this fraud in that she confirmed his fraudulent words on @GMA, and much more!",bring Shifty fraudulent read United States Congress pretend word President Trump Nancy Pelosi involve fraud confirm fraudulent word @GMA,12411,<UNK>,@GMA,realDonaldTrump
1184293357121613824,2019-10-16 02:21:54+00:00,"Shifty Adam Schiff wants to rest his entire case on a Whistleblower who he now says can’t testify, & the reason he can’t testify is that he is afraid to do so because his account of the Presidential telephone call is a fraud & totally different from the actual transcribed call...",Shifty Adam Schiff want rest entire case Whistleblower say testify reason testify afraid account presidential telephone fraud totally different actual transcribed,18568,<UNK>,<UNK>,realDonaldTrump
1184236083346919425,2019-10-15 22:34:18+00:00,https://twitter.com/realDonaldTrump/status/1184198558007869440,,11354,<UNK>,<UNK>,realDonaldTrump
1184198558007869440,2019-10-15 20:05:12+00:00,"The @StLouisBlues amazing comeback reminds us to never give up – and never lose faith. When you work hard, support each other, believe in yourself, and give it everything you’ve got, victory is always within reach! #STLBlues",@stlouisblue amazing comeback remind lose faith work hard support believe victory reach stlblue,13375,#STLBlues #STLBlues,@StLouisBlues,realDonaldTrump
1184196970212139010,2019-10-15 19:58:53+00:00,Congratulations @StLouisBlues!,congratulation @stlouisblue,7981,<UNK>,@StLouisBlues,realDonaldTrump
1184168291775995904,2019-10-15 18:04:56+00:00,"Now that we have found out that @CNN is a virtual fraud, rumor has it that Jeff Zucker will be resigining momentarily?",find @CNN virtual fraud rumor Jeff Zucker resigine momentarily,29675,<UNK>,@CNN,realDonaldTrump
