id,created_at,original_text,clean_text,retweet_count,hashtags,mentions,original_author
1262183198827712512,2020-05-18 00:48:19+00:00,100% correct!,correct,37743,<UNK>,<UNK>,realDonaldTrump
1262180792714833927,2020-05-18 00:38:45+00:00,Watch @marklevinshow tonight on @FoxNews. He covers the Russia Hoax and all of the other criminality that came from the Obama Administration They got caught! A repeat later in evening. Really something.,watch @marklevinshow tonight @FoxNews cover Russia Hoax criminality come Obama Administration catch repeat later evening,19811,<UNK>,@marklevinshow @FoxNews,realDonaldTrump
1262158573720801281,2020-05-17 23:10:28+00:00,I think that is a great compliment. Thank you James!,think great compliment thank James,42904,<UNK>,<UNK>,realDonaldTrump
1262158229359992833,2020-05-17 23:09:06+00:00,"They, and the Lamestream Media (including Jake), have spent 3 1/2 years illegally smearing me. They got caught!",Lamestream Media include Jake spend year illegally smear catch,16144,<UNK>,<UNK>,realDonaldTrump
1262156808497631234,2020-05-17 23:03:27+00:00,The most incompetent and corrupt administration in U.S. history!,incompetent corrupt administration U.S. history,15557,<UNK>,<UNK>,realDonaldTrump
1262156409128583168,2020-05-17 23:01:52+00:00,A CNN Faker!,Faker,28904,<UNK>,<UNK>,realDonaldTrump
1262155040107704328,2020-05-17 22:56:25+00:00,"The number of Coronavirus cases is strongly trending downward throughout the United States, with few exceptions. Very good news, indeed!",number Coronavirus case strongly trend downward United States exception good news,35214,<UNK>,<UNK>,realDonaldTrump
1262130147387494401,2020-05-17 21:17:31+00:00,Wall is going up fast. 184 miles as of today!,Wall go fast mile today,18232,<UNK>,<UNK>,realDonaldTrump
1262128676889604098,2020-05-17 21:11:40+00:00,Hard to believe considering the Lamestream Media is totally corrupt. The people understand!,hard believe consider Lamestream Media totally corrupt people understand,12513,<UNK>,<UNK>,realDonaldTrump
1262126976812359681,2020-05-17 21:04:55+00:00,"A great guy, a great book!",great great book,8882,<UNK>,<UNK>,realDonaldTrump
1262107694686769154,2020-05-17 19:48:17+00:00,Fake Journalism. So bad for our Country!,Fake Journalism country,13880,<UNK>,<UNK>,realDonaldTrump
1262102825607352320,2020-05-17 19:28:57+00:00,"The Obama Administration is turning out to be one of the most corrupt and incompetent in U.S. history. Remember, he and Sleepy Joe are the reasons I am in the White House!!!",Obama Administration turn corrupt incompetent U.S. history remember Sleepy reason White House,61915,<UNK>,<UNK>,realDonaldTrump
1262024041797386240,2020-05-17 14:15:53+00:00,Thank you very much to our beautiful “boaters.” I will never let you down! #MAGA,thank beautiful boater maga,29950,#MAGA,<UNK>,realDonaldTrump
1262020427582451717,2020-05-17 14:01:31+00:00,"Doing REALLY well, medically, on solving the CoronaVirus situation (Plague!). It will happen!",medically solve CoronaVirus situation Plague happen,29622,<UNK>,<UNK>,realDonaldTrump
1261998478005280768,2020-05-17 12:34:18+00:00,....May Phyllis Rest In Peace. Warmest condolences to her beloved family!!!,Phyllis rest Peace warm condolence beloved family,7836,<UNK>,<UNK>,realDonaldTrump
1261998476566675456,2020-05-17 12:34:18+00:00,"Phyllis George was a great person and a true pioneer for women in television. The NFL could not have made a better “pick” when they choose Phyllis to be the first woman to represent them. Also, a wonderful First Lady of Kentucky as the wife of Gov. John Y. Brown....",Phyllis George great person true pioneer woman television well pick choose Phyllis woman represent wonderful Lady Kentucky wife Gov. John Brown,12688,<UNK>,<UNK>,realDonaldTrump
1261993163188830210,2020-05-17 12:13:11+00:00,Great Rally and fantastic job on @ffweekend this morning. It is all happening! #MAGA,great Rally fantastic @ffweekend morning happen maga,11118,#MAGA,@ffweekend,realDonaldTrump
1261883806170206210,2020-05-17 04:58:38+00:00,I will be interviewed by @MariaBartiromo at 10:00 A.M. on @FoxNews. Thank you!,interview @MariaBartiromo 10:00 A.M. @FoxNews thank,18313,<UNK>,@MariaBartiromo @FoxNews,realDonaldTrump
1261793147069366279,2020-05-16 22:58:23+00:00,".....are therefore given massive advantages over The United States, and everyone else? Prior to the Plague floating in from China, our Economy was blowing everybody away, the best of any country, EVER. We will be there again, and soon!",give massive advantage United States prior Plague float China economy blow everybody away good country soon,24855,<UNK>,<UNK>,realDonaldTrump
1261793132020224005,2020-05-16 22:58:20+00:00,"Why is it that China, for decades, and with a population much bigger than ours, is paying a tiny fraction of $’s to The World Health Organization, The United Nations and, worst of all, The World Trade Organization, where they are considered a so-called “developing country” and...",China decade population big pay tiny fraction World Health Organization United Nations bad World Trade Organization consider call develop country,39164,<UNK>,<UNK>,realDonaldTrump
1261786833790414853,2020-05-16 22:33:18+00:00,Doing a GREAT job!,great,30873,<UNK>,<UNK>,realDonaldTrump
1261786535281786883,2020-05-16 22:32:07+00:00,Thank you!,thank,11932,<UNK>,<UNK>,realDonaldTrump
1261751862027595776,2020-05-16 20:14:20+00:00,OBAMAGATE!,OBAMAGATE,84641,<UNK>,<UNK>,realDonaldTrump
1261681866077343744,2020-05-16 15:36:12+00:00,"This is true. I say it all the time. The Republicans must play by the same rules, or die! Wow Mollie, you are good.",true time Republicans play rule Mollie good,21861,<UNK>,<UNK>,realDonaldTrump
1261680811746701312,2020-05-16 15:32:01+00:00,"Really sad, but even “sadder”, watch flunky @Lawrence CRY when I whipped his mind &amp; he was FORCED to apologize to me over Apprentice fees. Even Psycho Cold Case Joe Scarborough (bad ratings) beat him up, on air, unmercifully. Find tapes &amp; play (5 years back?).",sad watch flunky @lawrence whip mind forced apologize apprentice fee Psycho Cold Case Scarborough rating beat unmercifully find tape play year,11386,<UNK>,@Lawrence,realDonaldTrump
1261675184181907456,2020-05-16 15:09:39+00:00,Amazing!,amazing,13277,<UNK>,<UNK>,realDonaldTrump
1261673660319965189,2020-05-16 15:03:36+00:00,One of a kind!,kind,11994,<UNK>,<UNK>,realDonaldTrump
1261668048018321410,2020-05-16 14:41:17+00:00,America is proud of Ron Johnson. He never gives up!,America proud Johnson give,9256,<UNK>,<UNK>,realDonaldTrump
1261667055079755776,2020-05-16 14:37:21+00:00,Is the NFL watching?,watch,9421,<UNK>,<UNK>,realDonaldTrump
1261651008398282754,2020-05-16 13:33:35+00:00,People can’t get enough of this. Great people!,People great people,26480,<UNK>,<UNK>,realDonaldTrump
1261650261862383616,2020-05-16 13:30:37+00:00,"We’ve done a GREAT job on Covid response, making all Governors look good, some fantastic (and that’s OK), but the Lamestream Media doesn’t want to go with that narrative, and the Do Nothing Dems talking point is to say only bad about “Trump”. I made everybody look good, but me!",great covid response make Governors look good fantastic Lamestream Media want narrative Dems talking point trump everybody look good,25582,<UNK>,<UNK>,realDonaldTrump
1261645083704729600,2020-05-16 13:10:02+00:00,"95% Approval Rating in Republican Party. 51% Plus, overall. But you NEVER read or see this in the Fake News Media. Always hearing bad, made up numbers on how badly I’m doing. Lamestream Media is unhinged and CORRUPT!",Approval Rating Republican Party Plus overall read Fake News Media hear number badly Lamestream Media unhinged CORRUPT,17848,<UNK>,<UNK>,realDonaldTrump
1261641710226100225,2020-05-16 12:56:38+00:00,Mexico must take control of this very big problem!,Mexico control problem,13873,<UNK>,<UNK>,realDonaldTrump
1261640314709774338,2020-05-16 12:51:05+00:00,"Lou, this is just one of numerous concepts being considered under which we would pay 10% of what we have been paying over many years, matching much lower China payments. Have not made final decision. All funds are frozen. Thanks!",numerous concept consider pay year match low China payment final decision fund freeze thank,10576,<UNK>,<UNK>,realDonaldTrump
1261632414734004225,2020-05-16 12:19:42+00:00,“Scandal has defined the Obama Administration.” @LisaMarieBoothe @ffweekend,scandal define Obama Administration @lisamarieboothe @ffweekend,24865,<UNK>,@LisaMarieBoothe @ffweekend,realDonaldTrump
1261606781979168771,2020-05-16 10:37:51+00:00,So true!,true,13110,<UNK>,<UNK>,realDonaldTrump
1261605295299715073,2020-05-16 10:31:56+00:00,Happy Birthday Tom!,happy Birthday,7255,<UNK>,<UNK>,realDonaldTrump
1261514269822201856,2020-05-16 04:30:14+00:00,Hello to India!,hello India,28020,<UNK>,<UNK>,realDonaldTrump
1261512626028318720,2020-05-16 04:23:42+00:00,I’ll do it again!,,30787,<UNK>,<UNK>,realDonaldTrump
1261511702253916160,2020-05-16 04:20:02+00:00,My Hero. New York’s Finest!,Hero York Finest,12041,<UNK>,<UNK>,realDonaldTrump
1261500227493801984,2020-05-16 03:34:26+00:00,"Another Fake Whistleblower. Republicans must do something about these terrible people, and now!",Fake Whistleblower Republicans terrible people,16010,<UNK>,<UNK>,realDonaldTrump
1261470041221902338,2020-05-16 01:34:29+00:00,“FAKE NEWS IS NOT ESSENTIAL!”,FAKE news ESSENTIAL,30027,<UNK>,<UNK>,realDonaldTrump
1261373283536175104,2020-05-15 19:10:00+00:00,Such a wonderful reception yesterday in Pennsylvania. Thank you! #MAGA,wonderful reception yesterday Pennsylvania thank maga,38203,#MAGA,<UNK>,realDonaldTrump
1261368451555360774,2020-05-15 18:50:48+00:00,I am proud to announce that the United States will donate ventilators to our friends in India. We stand with India and @narendramodi during this pandemic. We’re also cooperating on vaccine development. Together we will beat the invisible enemy!,proud announce United States donate ventilator friend India stand India @narendramodi pandemic cooperate vaccine development beat invisible enemy,76854,<UNK>,@narendramodi,realDonaldTrump
1261362777517678593,2020-05-15 18:28:15+00:00,Today I was presented with the brand new @SpaceForceDoD flag in the Oval Office. I will take Great Pride in displaying it at the @WhiteHouse!,today present brand @SpaceForceDoD flag Oval Office Great Pride display @whitehouse,19401,<UNK>,@SpaceForceDoD @WhiteHouse,realDonaldTrump
1261304214317301761,2020-05-15 14:35:33+00:00,Chicago’s @CTA has big federal resources heading its way to keep the transit system operational and to keep people moving where they need to go. $817M will aid in the economic recovery — buy Made in the USA!,Chicago @CTA federal resource head transit system operational people move need economic recovery,12677,<UNK>,@cta,realDonaldTrump
1261302802296561668,2020-05-15 14:29:56+00:00,"I am proud to announce that @NJTransit will receive $1.4B in CARES Act funding to assist in their continued operations and to keep people moving in the NY/NJ area! The LARGEST single Federal transit grant to New Jersey Transit ever. Together, we will prevail!",proud announce @njtransit receive 1.4b CARES funding assist continue operation people move area LARGEST single Federal transit grant Jersey Transit prevail,11966,<UNK>,@NJTRANSIT,realDonaldTrump
1261270085244792832,2020-05-15 12:19:56+00:00,"....Likewise, the @nytimes and @washingtonpost are a disgrace to journalism. They are all Fake News, and they know it better than anyone else. History is unfolding, and it is not a pretty picture for “journalism”.",likewise @nytime @washingtonpost disgrace journalism Fake News know well history unfold pretty picture journalism,20786,<UNK>,@nytimes @washingtonpost,realDonaldTrump
1261270084644896768,2020-05-15 12:19:56+00:00,"Thank you to @foxandfriends for covering, supremely, the greatest political scandal in the history of the United States, OBAMAGATE. Fake News @CNN and Concast’s own MSDNC are only trying to make their 3 year Con Job just go away. They are embarrassed and don’t know what to do....",thank @foxandfriend covering supremely great political scandal history United States OBAMAGATE Fake News @cnn Concast MSDNC try year away embarrassed know,35210,<UNK>,@foxandfriends @CNN,realDonaldTrump
1261142428565876736,2020-05-15 03:52:40+00:00,It’s about time!,time,15336,<UNK>,<UNK>,realDonaldTrump
1261142015175245830,2020-05-15 03:51:01+00:00,GREAT!,great,14241,<UNK>,<UNK>,realDonaldTrump
1261138690929295361,2020-05-15 03:37:49+00:00,Where is the 302? It is missing. Was it stolen or destroyed? General Flynn is being persecuted! #OBAMAGATE,miss steal destroy General Flynn persecute OBAMAGATE,46607,#OBAMAGATE,<UNK>,realDonaldTrump
1261126114799468549,2020-05-15 02:47:51+00:00,"Thank you to all of my great Keyboard Warriors. You are better, and far more brilliant, than anyone on Madison Avenue (Ad Agencies). There is nobody like you!",thank great Keyboard Warriors well brilliant Madison Avenue Agencies like,64952,<UNK>,<UNK>,realDonaldTrump
1261117927060844545,2020-05-15 02:15:18+00:00,Thank you. My great honor!,thank great honor,12219,<UNK>,<UNK>,realDonaldTrump
1261117493189529600,2020-05-15 02:13:35+00:00,Thanks. You are very cool!,thanks cool,33642,<UNK>,<UNK>,realDonaldTrump
1261079096404123648,2020-05-14 23:41:00+00:00,"Great work @Owens_Minor! On behalf of the American People, THANK YOU! https://twitter.com/WhiteHouse/status/1261021018258395137",great work @owens_minor behalf American People thank,11944,<UNK>,@Owens_Minor,realDonaldTrump
1260987576300625920,2020-05-14 17:37:20+00:00,"Just landed in Pennsylvania, see everyone soon!",land Pennsylvania soon,11979,<UNK>,<UNK>,realDonaldTrump
1260984775524769798,2020-05-14 17:26:13+00:00,"On my way, see you soon!",soon,8492,<UNK>,<UNK>,realDonaldTrump
1260981100806934528,2020-05-14 17:11:36+00:00,On my way to PENNSYLVANIA!,PENNSYLVANIA,12619,<UNK>,<UNK>,realDonaldTrump
1260951768395063298,2020-05-14 15:15:03+00:00,I am proud to announce the first $500M of $3.9B in CARES Act transit funding headed to the NY Metropolitan Transportation Authority. Important funding to keep transit systems clean and operating to get people back to work! Spend it wisely! @NYGovCuomo @NYCMayor,proud announce 3.9b CARES transit funding head Metropolitan Transportation Authority important funding transit system clean operate people work spend wisely @NYGovCuomo @nycmayor,14725,<UNK>,@NYGovCuomo @NYCMayor,realDonaldTrump
1260938381254701060,2020-05-14 14:21:51+00:00,"If I were a Senator or Congressman, the first person I would call to testify about the biggest political crime and scandal in the history of the USA, by FAR, is former President Obama. He knew EVERYTHING. Do it @LindseyGrahamSC, just do it. No more Mr. Nice Guy. No more talk!",Senator Congressman person testify big political crime scandal history President Obama know @LindseyGrahamSC Nice talk,57320,<UNK>,@LindseyGrahamSC,realDonaldTrump
1260919777301798912,2020-05-14 13:07:56+00:00,"Good numbers coming out of States that are opening. America is getting its life back! Vaccine work is looking VERY promising, before end of year. Likewise, other solutions!",good number come States open America get life vaccine work look promising year likewise solution,27581,<UNK>,<UNK>,realDonaldTrump
1260913802423476224,2020-05-14 12:44:11+00:00,22-O in my endorsements of Congressional Candidates this season. California & Wisconsin won big on Tuesday. Thank you to all of those very brilliant Voters. You will not be disappointed!,22-o endorsement congressional candidate season California Wisconsin Tuesday thank brilliant voter disappoint,22909,<UNK>,<UNK>,realDonaldTrump
1260912207027675136,2020-05-14 12:37:51+00:00,"I don’t know the so-called Whistleblower Rick Bright, never met him or even heard of him, but to me he is a disgruntled employee, not liked or respected by people I spoke to and who, with his attitude, should no longer be working for our government!",know call Whistleblower Rick Bright hear disgruntle employee like respect people speak attitude longer work government,26744,<UNK>,<UNK>,realDonaldTrump
1260905587912646656,2020-05-14 12:11:33+00:00,"The Great State of Wisconsin, home to Tom Tiffany’s big Congressional Victory on Tuesday, was just given another win. Its Democrat Governor was forced by the courts to let the State Open. The people want to get on with their lives. The place is bustling!",Great State Wisconsin home Tiffany Congressional Victory Tuesday give Democrat Governor force court State open people want life place bustling,24987,<UNK>,<UNK>,realDonaldTrump
1260735992727769096,2020-05-14 00:57:38+00:00,OBAMAGATE!,OBAMAGATE,94558,<UNK>,<UNK>,realDonaldTrump
1260735788133814272,2020-05-14 00:56:49+00:00,Proud of Mike!,proud Mike,17009,<UNK>,<UNK>,realDonaldTrump
1260735521246019584,2020-05-14 00:55:46+00:00,First time in 22 years. Mike will be a GREAT CONGRESSMAN!,time year Mike great congressman,20306,<UNK>,<UNK>,realDonaldTrump
1260734981984354304,2020-05-14 00:53:37+00:00,Intel chief releases info on ‘unmasking’ of Flynn to Capitol Hill https://politi.co/3dIYUDa via @politico,Intel chief release info unmask Flynn Capitol Hill @politico,15668,<UNK>,@politico,realDonaldTrump
1260595662091100161,2020-05-13 15:40:01+00:00,"THANK YOU, WORKING HARD! #MAGA",thank WORKING HARD maga,27867,#MAGA,<UNK>,realDonaldTrump
1260578860992737285,2020-05-13 14:33:15+00:00,"As I have said for a long time, dealing with China is a very expensive thing to do. We just made a great Trade Deal, the ink was barely dry, and the World was hit by the Plague from China. 100 Trade Deals wouldn’t make up the difference - and all those innocent lives lost!",say long time deal China expensive thing great Trade Deal barely World Plague China trade deal difference innocent life lose,42979,<UNK>,<UNK>,realDonaldTrump
1260574760930545666,2020-05-13 14:16:58+00:00,"When the so-called “rich guys” speak negatively about the market, you must always remember that some are betting big against it, and make a lot of money if it goes down. Then they go positive, get big publicity, and make it going up. They get you both ways. Barely legal?",call rich guy speak negatively market remember bet money go positive publicity go way barely legal,44132,<UNK>,<UNK>,realDonaldTrump
1260562505845354497,2020-05-13 13:28:16+00:00,Obama was always wrong!,Obama wrong,41328,<UNK>,<UNK>,realDonaldTrump
1260561967573602321,2020-05-13 13:26:07+00:00,Does anybody believe this man? Caught!,anybody believe catch,31026,<UNK>,<UNK>,realDonaldTrump
1260559055988408321,2020-05-13 13:14:33+00:00,“Newly released documents show Schiff knew all along there was no proof of Russia-Trump collusion.” Wall Street Journal,newly release document Schiff know proof Russia Trump collusion Wall Street Journal,46122,<UNK>,<UNK>,realDonaldTrump
1260554985881964546,2020-05-13 12:58:23+00:00,"Big Congressional win in California for Mike Garcia, taking back a seat from the Democrats. This is the first time in many years that a California Dem seat has flipped back to a Republican. Also, Tom Tiffany beat his Democrat rival BIG in Wisconsin. Two great Congressional WINS!",congressional California Mike Garcia take seat Democrats time year California seat flip Republican Tiffany beat Democrat rival Wisconsin great congressional win,36921,<UNK>,<UNK>,realDonaldTrump
1260412811840311296,2020-05-13 03:33:26+00:00,"Women for Trump co-chair: Biden might not be 'ultimate nominee,' and Dems engaging in 'elder abuse'",woman trump chair biden ultimate nominee Dems engage elder abuse,14151,<UNK>,<UNK>,realDonaldTrump
1260407831137828865,2020-05-13 03:13:38+00:00,Fake @PulitzerPrizes must be taken back. These “journalists” got everything wrong. Give them to the real journalists who got it right!,fake @pulitzerprizes take journalist wrong real journalist right,21808,<UNK>,@PulitzerPrizes,realDonaldTrump
1260406413102321670,2020-05-13 03:08:00+00:00,Shifty Schiff exposed!,Shifty Schiff expose,33234,<UNK>,<UNK>,realDonaldTrump
1260400362344906759,2020-05-13 02:43:58+00:00,"Big News: Tom Tiffany of the Great State of Wisconsin has just become Congressman Tom Tiffany. He will do a FANTASTIC job for the people of Wisconsin, and the United States. Congratulations!",News Tiffany Great State Wisconsin Congressman Tiffany fantastic people Wisconsin United States congratulation,28708,<UNK>,<UNK>,realDonaldTrump
1260206276216266754,2020-05-12 13:52:44+00:00,"As long as other countries are receiving the benefits of Negative Rates, the USA should also accept the “GIFT”. Big numbers!",long country receive benefit Negative Rates accept GIFT number,18466,<UNK>,<UNK>,realDonaldTrump
1260203080076931072,2020-05-12 13:40:02+00:00,"California should let Tesla & @elonmusk open the plant, NOW. It can be done Fast &amp; Safely!",California Tesla @elonmusk open plant fast safely,38651,<UNK>,@elonmusk,realDonaldTrump
1260199923968081920,2020-05-12 13:27:29+00:00,"Crude Oil prices going up as Saudi Arabia cuts production levels. Our great Energy Companies, with millions of JOBS, are starting to look very good again. At the same time, gasoline prices at record lows (like a big Tax Cut). The BEST of all Worlds. “Transition To Greatness”",Crude price go Saudi Arabia cut production level great Energy Companies million JOBS start look good time gasoline price record low like best world Transition Greatness,21734,<UNK>,<UNK>,realDonaldTrump
1260185657395339266,2020-05-12 12:30:48+00:00,"Wisconsin, please get out NOW and vote for Tom Tiffany for Congress. A great guy!",Wisconsin vote Tiffany Congress great,24117,<UNK>,<UNK>,realDonaldTrump
1260185030967676928,2020-05-12 12:28:19+00:00,"Looking forward to being in Allentown, Pennsylvania, on Thursday. I love the State, and for very good reason!",look forward Allentown Pennsylvania Thursday love state good reason,19304,<UNK>,<UNK>,realDonaldTrump
1260177007490600960,2020-05-12 11:56:26+00:00,"Remember this, every Governor who has sky high approval on their handling of the Coronavirus, and I am happy for them all, could in no way have gotten those numbers, or had that success, without me and the Federal Governments help. From Ventilators to Testing, we made it happen!",remember Governor high approval handling Coronavirus happy get number success Federal Governments help Ventilators testing happen,23145,<UNK>,<UNK>,realDonaldTrump
1260174133935124481,2020-05-12 11:45:01+00:00,"So interesting to see all of these people I beat so badly, pundits & consultants that never had a chance, telling me how to run for office. Many are Republicans who should LOVE our 280 new Judges, rebuilt Military, 2A, great V.A. Low Taxes, etc. Just don’t like that I beat them!",interesting people beat badly pundit consultant chance tell office Republicans love Judges rebuild Military great V.A. Taxes like beat,19160,<UNK>,<UNK>,realDonaldTrump
1260171664865796097,2020-05-12 11:35:12+00:00,"Our Testing is the BEST in the World, by FAR! Numbers are coming down in most parts of our Country, which wants to open and get going again. It is happening, safely!",testing best World number come part country want open go happen safely,16169,<UNK>,<UNK>,realDonaldTrump
1260170754496311296,2020-05-12 11:31:35+00:00,The American People are WARRIORS!,american People warriors,42090,<UNK>,<UNK>,realDonaldTrump
1260169616510386176,2020-05-12 11:27:04+00:00,TRANSITION TO GREATNESS,transition GREATNESS,31236,<UNK>,<UNK>,realDonaldTrump
1260169167665270787,2020-05-12 11:25:17+00:00,"96% APPROVAL RATING IN THE REPUBLICAN PARTY. THANK YOU! We will win against a tired, exhausted man, Sleepy Joe Biden, in November.",APPROVAL rating REPUBLICAN PARTY thank tired exhausted Sleepy Biden November,22438,<UNK>,<UNK>,realDonaldTrump
1260167707741368320,2020-05-12 11:19:28+00:00,"Asian Americans are VERY angry at what China has done to our Country, and the World. Chinese Americans are the most angry of all. I don’t blame them!",Asian Americans angry China country World Chinese Americans angry blame,37005,<UNK>,<UNK>,realDonaldTrump
1260166181513842688,2020-05-12 11:13:25+00:00,More than all other countries together!,country,9504,<UNK>,<UNK>,realDonaldTrump
1260162910283849728,2020-05-12 11:00:25+00:00,"Remember, get out and Vote for Mike Garcia in CA25. A really big deal for our Country!",remember vote Mike Garcia CA25 deal country,23594,<UNK>,<UNK>,realDonaldTrump
1260161295019630592,2020-05-12 10:54:00+00:00,When will they open a Cold Case on the Psycho Joe Scarborough matter in Florida. Did he get away with murder? Some people think so. Why did he leave Congress so quietly and quickly? Isn’t it obvious? What’s happening now? A total nut job!,open Cold Case Psycho Scarborough matter Florida away murder people think leave Congress quietly quickly obvious happen total,29215,<UNK>,<UNK>,realDonaldTrump
1260158343756341249,2020-05-12 10:42:16+00:00,"Ratings way down, show sucks!",rating suck,11501,<UNK>,<UNK>,realDonaldTrump
1260156226224128000,2020-05-12 10:33:51+00:00,OBAMAGATE makes Watergate look small time!,OBAMAGATE make Watergate look small time,22017,<UNK>,<UNK>,realDonaldTrump
1260155683443441664,2020-05-12 10:31:42+00:00,Sleepy Eyes fails again!,sleepy Eyes fail,8465,<UNK>,<UNK>,realDonaldTrump
1260155210498015232,2020-05-12 10:29:49+00:00,Big news!,news,20597,<UNK>,<UNK>,realDonaldTrump
1260155029253771264,2020-05-12 10:29:06+00:00,Fake Journalists!,fake journalist,19289,<UNK>,<UNK>,realDonaldTrump
1260154672268148736,2020-05-12 10:27:41+00:00,"A great time to have strong Borders, and we now have the strongest Borders in our history. 182 miles of Border Wall already built! Dems want Open Borders, let EVERYONE IN. No thanks!",great time strong Borders strong border history mile Border Wall build dem want open Borders thank,12028,<UNK>,<UNK>,realDonaldTrump
