id,created_at,original_text,clean_text,retweet_count,hashtags,mentions,original_author
1260152775389962240,2020-05-12 10:20:08+00:00,"Then we must be very careful. Crazy Nancy would be a total disaster, and the USA will never be a Communist Country!",careful crazy Nancy total disaster Communist country,16004,<UNK>,<UNK>,realDonaldTrump
1260152460942991360,2020-05-12 10:18:53+00:00,ColdCaseJoe!,ColdCaseJoe,9739,<UNK>,<UNK>,realDonaldTrump
1260051164206333954,2020-05-12 03:36:22+00:00,"The Lamestream Media is truly out of control. Look how they work (conspire!) together. They are the Enemy of the People, but don’t worry, we will WIN in November!",Lamestream Media truly control look work conspire Enemy People worry November,25427,<UNK>,<UNK>,realDonaldTrump
1260037290111520768,2020-05-12 02:41:14+00:00,Interestingly!,interestingly,14718,<UNK>,<UNK>,realDonaldTrump
1260032616780034049,2020-05-12 02:22:40+00:00,OBAMAGATE!,OBAMAGATE,52519,<UNK>,<UNK>,realDonaldTrump
1259970551965196288,2020-05-11 22:16:03+00:00,"Vote @MikeGarcia2020 by May 12th! His opponent @ChristyforCA25 voted to fire teachers, and cut their salaries while bumping up her pay. Now she’s mocking our Great Vets! We need Navy Fighter Pilot Mike Garcia in #CA25!",vote @MikeGarcia2020 12th opponent @ChristyforCA25 vote fire teacher salary bump mock great Vets need Navy Fighter Pilot Mike Garcia CA25,10641,#CA25,@MikeGarcia2020 @ChristyforCA25,realDonaldTrump
1259969843169763328,2020-05-11 22:13:14+00:00,"....He is Strong on Crime, the Border, and Second Amendment. Tom has deep roots in Wisconsin, is a big Tax Cutter, and will help me DRAIN THE SWAMP! Tom has my Complete and Total Endorsement. Vote for Tom Tiffany!",strong Crime Border Second Amendment deep root Wisconsin Cutter help drain swamp Complete Total Endorsement vote Tiffany,7620,<UNK>,<UNK>,realDonaldTrump
1259969842305740800,2020-05-11 22:13:14+00:00,"Tom Tiffany (@TomTiffanyWI) is a Great Advocate for the incredible people of Wisconsin (WI07). We need Tom in Congress to help us Make America Great Again! He will Fight for Small Business, supports our Incredible Farmers, Loves our Military and our Vets....",Tiffany @tomtiffanywi Great Advocate incredible people Wisconsin WI07 need Congress help America Great fight Small Business support incredible Farmers love military vet,12808,<UNK>,@TomTiffanyWI,realDonaldTrump
1259923890664615936,2020-05-11 19:10:38+00:00,"Congressman Adrian Smith is a strong fighter for Nebraska. He fights for your Second Amendment, defends our Borders, strengthens our Military and loves our Vets! Adrian has my Complete and Total Endorsement! #NE03",Congressman Adrian Smith strong fighter Nebraska fight Second Amendment defend Borders strengthen military love vet Adrian Complete Total Endorsement NE03,11398,#NE03,<UNK>,realDonaldTrump
1259923781826592768,2020-05-11 19:10:12+00:00,"Congressman Jeff Fortenberry (@SupportFortNE) is a great advocate for Nebraska. He fights for Farmers, Small Businesses and our incredible Vets and Military. Jeff has my Complete and Total Endorsement! #NE01",Congressman Jeff Fortenberry @SupportFortNE great advocate Nebraska fight Farmers Small Businesses incredible vet military Jeff Complete Total Endorsement ne01,7672,#NE01,@supportfortNE,realDonaldTrump
1259923682887073792,2020-05-11 19:09:48+00:00,"Congressman @DonJBacon is doing a tremendous job for Nebraska! He served our Country as an Air Force General, and now he serves our Vets, Farmers, and Small Businesses. Strongly supports the Second Amendment. Don has my Complete &amp; Total Endorsement! #NE02",congressman @DonJBacon tremendous Nebraska serve Country Force General serve Vets Farmers Small Businesses strongly support Second Amendment Complete Total Endorsement ne02,8339,#NE02,@DonJBacon,realDonaldTrump
1259868955319173122,2020-05-11 15:32:20+00:00,"THE ENEMY OF THE PEOPLE. Sadly, our Lamestream Media is TOTALLY CORRUPT!",enemy PEOPLE sadly Lamestream Media TOTALLY CORRUPT,26255,<UNK>,<UNK>,realDonaldTrump
1259867421676109824,2020-05-11 15:26:15+00:00,"Because it was OBAMAGATE, and he and Sleepy Joe led the charge. The most corrupt administration in U.S. history!",OBAMAGATE Sleepy charge corrupt administration U.S. history,43269,<UNK>,<UNK>,realDonaldTrump
1259866337029038080,2020-05-11 15:21:56+00:00,"He should be FIRED by Concast. If done by a Republican, would be “prosecuted”. @AjitPaiFCC",fire Concast Republican prosecute @AjitPaiFCC,14151,<UNK>,@AjitPaiFCC,realDonaldTrump
1259852886068076545,2020-05-11 14:28:29+00:00,.@WashTimes “FBI Went Rogue In Pursuit Of Trump”,.@WashTimes go Rogue Pursuit Trump,24942,<UNK>,@WashTimes,realDonaldTrump
1259852364326014978,2020-05-11 14:26:25+00:00,"The great people of Pennsylvania want their freedom now, and they are fully aware of what that entails. The Democrats are moving slowly, all over the USA, for political purposes. They would wait until November 3rd if it were up to them. Don’t play politics. Be safe, move quickly!",great people Pennsylvania want freedom fully aware entail Democrats move slowly political purpose wait November play politic safe quickly,32772,<UNK>,<UNK>,realDonaldTrump
1259849944216846337,2020-05-11 14:16:48+00:00,OBAMAGATE makes Watergate look small time!,OBAMAGATE make Watergate look small time,76813,<UNK>,<UNK>,realDonaldTrump
1259844948960120833,2020-05-11 13:56:57+00:00,"Coronavirus numbers are looking MUCH better, going down almost everywhere. Big progress being made!",Coronavirus number look better go progress,32161,<UNK>,<UNK>,realDonaldTrump
1259843806049992704,2020-05-11 13:52:24+00:00,"Dems are trying to steal the Mike Garcia Congressional Race in California. Republicans, get out and VOTE for your terrific candidate, ASAP!",dem try steal Mike Garcia Congressional Race California Republicans vote terrific candidate ASAP,28308,<UNK>,<UNK>,realDonaldTrump
1259842012632821767,2020-05-11 13:45:17+00:00,"Great credit being given for our Coronavirus response, except in the Fake News. They are a disgrace to America!",great credit give Coronavirus response Fake News disgrace America,28454,<UNK>,<UNK>,realDonaldTrump
1259837779237842954,2020-05-11 13:28:27+00:00,"@FCC THIS IS A DISGRACE, EVEN WORSE THAN @NBC USUALLY IS, WHICH IS REALLY BAD. SLEEPY EYES MUST BE FIRED!",@FCC disgrace bad @nbc USUALLY sleepy eye fire,1809,<UNK>,@FCC @nbc,realDonaldTrump
1259831370429407232,2020-05-11 13:02:59+00:00,OBAMAGATE!,OBAMAGATE,33530,<UNK>,<UNK>,realDonaldTrump
1259675040314003459,2020-05-11 02:41:47+00:00,Sleepy Eyes Chuck Todd should be FIRED by “Concast” (NBC) for this fraud. He knew exactly what he was doing. Public Airwaves = Fake News! @AjitPaiFCC @FCC,sleepy eye Chuck Todd fire Concast fraud know exactly Public Airwaves Fake News @AjitPaiFCC @fcc,23770,<UNK>,@AjitPaiFCC @FCC,realDonaldTrump
1259667289252790275,2020-05-11 02:10:59+00:00,"He got caught, OBAMAGATE!",catch OBAMAGATE,64638,<UNK>,<UNK>,realDonaldTrump
1259666162134200325,2020-05-11 02:06:31+00:00,Thank you!,thank,31026,<UNK>,<UNK>,realDonaldTrump
1259625738858303490,2020-05-10 23:25:53+00:00,".@CBS and their show, @60Minutes, are doing everything within their power, which is far less today than it was in the past, to defend China and the horrible Virus pandemic that was inflicted on the USA and the rest of the World. I guess they want to do business in China!",.@CBS @60minutes power today past defend China horrible Virus pandemic inflict rest World guess want business China,29397,<UNK>,@CBS @60Minutes,realDonaldTrump
1259563409739309057,2020-05-10 19:18:13+00:00,This book is a MUST BUY!,book,12014,<UNK>,<UNK>,realDonaldTrump
1259561821289226248,2020-05-10 19:11:54+00:00,OBAMAGATE!,OBAMAGATE,102062,<UNK>,<UNK>,realDonaldTrump
1259541473651032071,2020-05-10 17:51:03+00:00,.@brianstelter is just a poor man’s lapdog for AT&amp;T!,.@brianstelter poor lapdog AT&amp;T,13517,<UNK>,@brianstelter,realDonaldTrump
1259538752327897092,2020-05-10 17:40:14+00:00,"Wow, this is BIG!",,19286,<UNK>,<UNK>,realDonaldTrump
1259538466263773185,2020-05-10 17:39:06+00:00,Thank you!,thank,46526,<UNK>,<UNK>,realDonaldTrump
1259530309781118980,2020-05-10 17:06:41+00:00,"More Fake News, this time from Jimmy Kimmel’s last place show!",Fake News time Jimmy Kimmel place,14817,<UNK>,<UNK>,realDonaldTrump
1259496351748014081,2020-05-10 14:51:45+00:00,Thank you to Eli Lake!,thank Lake,10476,<UNK>,<UNK>,realDonaldTrump
1259493483733270530,2020-05-10 14:40:21+00:00,"The biggest political crime in American history, by far!",big political crime american history,22282,<UNK>,<UNK>,realDonaldTrump
1259455786482311168,2020-05-10 12:10:33+00:00,HAPPY MOTHER’S DAY!,HAPPY MOTHER,48002,<UNK>,<UNK>,realDonaldTrump
1259454594981203968,2020-05-10 12:05:49+00:00,Congratulations to Officer John Catanzara for being elected President of the Chicago Police Union. He always “Gets the Job Done”. #MAGA @foxandfriends,congratulation Officer John Catanzara elect President Chicago Police Union get MAGA @foxandfriend,9716,#MAGA,@foxandfriends,realDonaldTrump
1259451044834217984,2020-05-10 11:51:43+00:00,True!,true,10876,<UNK>,<UNK>,realDonaldTrump
1259450673151836160,2020-05-10 11:50:14+00:00,Thank you Mike!,thank Mike,7203,<UNK>,<UNK>,realDonaldTrump
1259450328048709633,2020-05-10 11:48:52+00:00,"We are getting great marks for the handling of the CoronaVirus pandemic, especially the very early BAN of people from China, the infectious source, entering the USA. Compare that to the Obama/Sleepy Joe disaster known as H1N1 Swine Flu. Poor marks, bad polls - didn’t have a clue!",get great mark handling CoronaVirus pandemic especially early people China infectious source enter compare Obama Sleepy disaster know H1N1 Swine poor mark poll clue,25620,<UNK>,<UNK>,realDonaldTrump
1259450009734516736,2020-05-10 11:47:36+00:00,"When are the Fake Journalists, who received unwarranted Pulitzer Prizes for Russia, Russia, Russia, and the Impeachment Scam, going to turn in their tarnished awards so they can be given to the real journalists who got it right. I’ll give you the names, there are plenty of them!",Fake Journalists receive unwarranted Pulitzer Prizes Russia Russia Russia Impeachment Scam go turn tarnished award give real journalist right name plenty,31411,<UNK>,<UNK>,realDonaldTrump
1259449352201830400,2020-05-10 11:44:59+00:00,A great man for Washington! Will Drain the Swamp!,great Washington drain swamp,8697,<UNK>,<UNK>,realDonaldTrump
1259449226465083394,2020-05-10 11:44:29+00:00,So great to see our Country starting to open up again!,great country start open,11844,<UNK>,<UNK>,realDonaldTrump
1259439270818992128,2020-05-10 11:04:56+00:00,...And we caught them and their illegal activities!,catch illegal activity,20881,<UNK>,<UNK>,realDonaldTrump
1259200118714183680,2020-05-09 19:14:37+00:00,"Governor @GavinNewsom of California won’t let restaurants, beaches and stores open, but he installs a voting booth system in a highly Democrat area (supposed to be mail in ballots only) because our great candidate, @MikeGarcia2020, is winning by a lot. CA25 Rigged Election!",Governor @GavinNewsom California restaurant beach store open install voting booth system highly Democrat area suppose mail ballot great candidate @MikeGarcia2020 win CA25 Rigged Election,27835,<UNK>,@GavinNewsom @MikeGarcia2020,realDonaldTrump
1259198107029508096,2020-05-09 19:06:38+00:00,"Starting early next week, at my order, the USA will be purchasing, from our Farmers, Ranchers & Specialty Crop Growers, 3 Billion Dollars worth of Dairy, Meat & Produce for Food Lines & Kitchens. “FARMERS TO FAMILY FOOD BOX” Great news for all! @SecretarySonny @ZippyDuvall",start early week order purchase Farmers Ranchers Specialty Crop Growers billion Dollars worth Dairy Meat Produce Food Lines Kitchens farmer FAMILY food great news @SecretarySonny @ZippyDuvall,30255,<UNK>,@SecretarySonny @ZippyDuvall,realDonaldTrump
1259194224555298816,2020-05-09 18:51:12+00:00,"Why is it that all of the political pundits & consultants that I beat so easily & badly, people that charged their clients far more than their services were worth, have become so totally “unhinged” when it come to your favorite President, me. These people are stone cold crazy!",political pundit consultant beat easily badly people charge client service worth totally unhinged come favorite President people stone cold crazy,25898,<UNK>,<UNK>,realDonaldTrump
1259183305301340163,2020-05-09 18:07:49+00:00,...And many more!,,14049,<UNK>,<UNK>,realDonaldTrump
1259155620713975810,2020-05-09 16:17:48+00:00,CA25 is a Rigged Election. Trying to steal it from @MikeGarcia2020. @GavinNewsom must act now!,CA25 Rigged Election try steal @MikeGarcia2020 @GavinNewsom,21595,<UNK>,@MikeGarcia2020 @GavinNewsom,realDonaldTrump
1259153410756153350,2020-05-09 16:09:01+00:00,TRANSITION TO GREATNESS!,transition GREATNESS,36929,<UNK>,<UNK>,realDonaldTrump
1259149331761954822,2020-05-09 15:52:49+00:00,"Mike has my complete & total endorsement. We need him badly in Washington. A great fighter pilot & hero, & a brilliant Annapolis grad, Mike will never let you down. Mail in ballots, & check that they are counted!",Mike complete total endorsement need badly Washington great fighter pilot hero brilliant Annapolis grad Mike mail ballot check count,16497,<UNK>,<UNK>,realDonaldTrump
1259147372984180736,2020-05-09 15:45:02+00:00,"So in California, the Democrats, who fought like crazy to get all mail in only ballots, and succeeded, have just opened a voting booth in the most Democrat area in the State. They are trying to steal another election. It’s all rigged out there. These votes must not count. SCAM!",California Democrats fight like crazy mail ballot succeed open voting booth Democrat area State try steal election rig vote count SCAM,39536,<UNK>,<UNK>,realDonaldTrump
1258876999461933058,2020-05-08 21:50:40+00:00,"Vote @MikeGarcia2020 by May 12th! His opponent @ChristyforCA25 voted to fire teachers, and cut their salaries while bumping up her pay. Now she’s mocking our Great Vets! We need Navy Fighter Pilot Mike Garcia in #CA25!",vote @MikeGarcia2020 12th opponent @ChristyforCA25 vote fire teacher salary bump mock great Vets need Navy Fighter Pilot Mike Garcia CA25,11624,#CA25,@MikeGarcia2020 @ChristyforCA25,realDonaldTrump
1258876897519419394,2020-05-08 21:50:15+00:00,"....He is Strong on Crime, the Border, and Second Amendment. Tom has deep roots in Wisconsin, is a big Tax Cutter, and will help me DRAIN THE SWAMP! Tom has my Complete and Total Endorsement. Vote for Tom Tiffany!",strong Crime Border Second Amendment deep root Wisconsin Cutter help drain swamp Complete Total Endorsement vote Tiffany,8224,<UNK>,<UNK>,realDonaldTrump
1258876896542101504,2020-05-08 21:50:15+00:00,"Tom Tiffany (@TomTiffanyWI) is a Great Advocate for the incredible people of Wisconsin (WI07). We need Tom in Congress to help us Make America Great Again! He will Fight for Small Business, supports our Incredible Farmers, Loves our Military and our Vets....",Tiffany @tomtiffanywi Great Advocate incredible people Wisconsin WI07 need Congress help America Great fight Small Business support incredible Farmers love military vet,13499,<UNK>,@TomTiffanyWI,realDonaldTrump
1258803460394360833,2020-05-08 16:58:27+00:00,....must read for anybody looking for U.S. Security and Protection. Go get it now and make Tom a Top Best Seller — he deserves it!,read anybody look U.S. Security Protection Best Seller deserve,10838,<UNK>,<UNK>,realDonaldTrump
1258803459303890946,2020-05-08 16:58:26+00:00,"Retired Ice Director Tom Homan knows more about the Border and Border Security than anyone. He’s a tough guy, but a good guy - and as smart as they come. His new book, “Defend The Border and Save Lives: Solving Our Most Important Humanitarian and Security Crisis” is a....",Retired Director Homan know Border Border Security tough good smart come book defend Border Save life solve important humanitarian Security Crisis,21216,<UNK>,<UNK>,realDonaldTrump
1258720717258006530,2020-05-08 11:29:39+00:00,DRAIN THE SWAMP!,drain swamp,65671,<UNK>,<UNK>,realDonaldTrump
1258717838849847298,2020-05-08 11:18:13+00:00,"Yesterday was a BIG day for Justice in the USA. Congratulations to General Flynn, and many others. I do believe there is MUCH more to come! Dirty Cops and Crooked Politicians do not go well together!",yesterday Justice congratulation General Flynn believe come Dirty Cops Crooked politician,47755,<UNK>,<UNK>,realDonaldTrump
1258716204832825344,2020-05-08 11:11:43+00:00,I will be interviewed on @foxandfriends at 8:00 A.M. Enjoy!,interview @foxandfriend 8:00 A.M. Enjoy,11584,<UNK>,@foxandfriends,realDonaldTrump
1258546186014748673,2020-05-07 23:56:08+00:00,https://twitter.com/realDonaldTrump/status/1258432889303248896,,19086,<UNK>,<UNK>,realDonaldTrump
1258465767751856130,2020-05-07 18:36:34+00:00,"Today, @FLOTUS celebrates the two year anniversary of #BeBest, her initiative dedicated to bringing awareness to issues that impact the lives of children. Congratulations, and thank you! https://www.whitehouse.gov/briefings-statements/first-lady-melania-trump-celebrates-second-anniversary-best/",today @FLOTUS celebrate year anniversary BeBest initiative dedicate bring awareness issue impact life child congratulation thank,12557,#BeBest,@FLOTUS,realDonaldTrump
1258448363281952768,2020-05-07 17:27:25+00:00,"....are getting caught doing very evil things, and Republicans should take note. This was grave misconduct by the Obama Justice Department! @GovChristie",get catch evil thing Republicans note grave misconduct Obama Justice Department @GovChristie,17882,<UNK>,@GovChristie,realDonaldTrump
1258448362409426944,2020-05-07 17:27:25+00:00,"Congratulations to former Governor of New Jersey, Chris Christie, and all others involved, on a complete and total exoneration (with a 9-0 vote by the U.S. Supreme Court) on the Obama DOJ Scam referred to as “Bridgegate.” The Democrats....",congratulation Governor Jersey Chris Christie involve complete total exoneration vote U.S. Supreme Court Obama Scam refer Bridgegate Democrats,28846,<UNK>,<UNK>,realDonaldTrump
1258432889303248896,2020-05-07 16:25:56+00:00,"As you know, I designated this day to be a National Day of Prayer. As our Nation heals, our Spirit has never been Stronger!",know designate National Prayer Nation heal Spirit strong,26550,<UNK>,<UNK>,realDonaldTrump
1258053124893347841,2020-05-06 15:16:53+00:00,The Fake News has reached an all time high!,Fake News reach time high,54529,<UNK>,<UNK>,realDonaldTrump
1258020241063510018,2020-05-06 13:06:13+00:00,"....to it, as appropriate. The Task Force will also be very focused on Vaccines & Therapeutics. Thank you!",appropriate Task Force focused Vaccines Therapeutics thank,11235,<UNK>,<UNK>,realDonaldTrump
1258020228006584320,2020-05-06 13:06:09+00:00,"....gloves, gowns etc. are now plentiful. The last four Governors teleconference calls have been conclusively strong. Because of this success, the Task Force will continue on indefinitely with its focus on SAFETY & OPENING UP OUR COUNTRY AGAIN. We may add or subtract people ....",gloves gown plentiful Governors teleconference call conclusively strong success Task Force continue indefinitely focus SAFETY OPENING COUNTRY subtract people,11775,<UNK>,<UNK>,realDonaldTrump
1258020211883638786,2020-05-06 13:06:06+00:00,"....produced in the thousands, and we have many to spare. We are helping other countries which are desperate for them. Likewise, after having been left little, we are now doing more testing than all other countries combined, and with superior tests. Face masks & shields,....",produce thousand spare help country desperate likewise have leave little testing country combine superior test face mask shield,5118,<UNK>,<UNK>,realDonaldTrump
1258020179692445697,2020-05-06 13:05:58+00:00,"The White House CoronaVirus Task Force, headed by Vice President Mike Pence, has done a fantastic job of bringing together vast highly complex resources that have set a high standard for others to follow in the future. Ventilators, which were few & in bad shape, are now being....",White House CoronaVirus Task Force head Vice President Mike Pence fantastic bring vast highly complex resource high standard follow future ventilator shape,20315,<UNK>,<UNK>,realDonaldTrump
1257873257732214784,2020-05-06 03:22:09+00:00,Thank you @Honeywell!,thank @Honeywell,16610,<UNK>,@honeywell,realDonaldTrump
1257793742540386304,2020-05-05 22:06:11+00:00,"I was thrilled to be back in the Great State of Arizona with the incredible, patriotic, and hardworking men and women of @Honeywell!",thrilled Great State Arizona incredible patriotic hardworking woman @Honeywell,11374,<UNK>,@honeywell,realDonaldTrump
1257768408256409601,2020-05-05 20:25:31+00:00,Will be doing a major interview tonight at 6:30 P.M. Eastern with @DavidMuir on @ABCWorldNews Tonight.,major interview tonight 6:30 P.M. Eastern @davidmuir @abcworldnew tonight,12599,<UNK>,@DavidMuir @ABCWorldNews,realDonaldTrump
1257753237790158848,2020-05-05 19:25:14+00:00,"On #NationalTeacherDay, we recognize the countless men and women who dedicate their lives to instilling character, integrity, and knowledge in the hearts and minds of our Nation’s students, thank you!",NationalTeacherDay recognize countless woman dedicate life instill character integrity knowledge heart mind nation student thank,9678,#NationalTeacherDay,<UNK>,realDonaldTrump
1257744763832299520,2020-05-05 18:51:34+00:00,Getting ready to land in the Great State of Arizona!,get ready land Great State Arizona,12114,<UNK>,<UNK>,realDonaldTrump
1257744456591130624,2020-05-05 18:50:20+00:00,"Wow! Congratulations to Greg Gutfeld, a one time Trump Hater who has come all the way home. His Ratings easily beat no talent Stephen Colbert, nice guy Jimmy Fallon, and wacko “last placer” Jimmy Kimmel. Greg built his show from scratch, and did a great job in doing so. @FoxNews",congratulation Greg Gutfeld time Trump Hater come home rating easily beat talent Stephen Colbert nice Jimmy Fallon wacko placer Jimmy Kimmel Greg build scratch great @foxnews,29316,<UNK>,@FoxNews,realDonaldTrump
1257741326650470400,2020-05-05 18:37:54+00:00,"Well run States should not be bailing out poorly run States, using CoronaVirus as the excuse! The elimination of Sanctuary Cities, Payroll Taxes, and perhaps Capital Gains Taxes, must be put on the table. Also lawsuit indemnification & business deductions for restaurants & ent.",States bail poorly States CoronaVirus excuse elimination Sanctuary Cities Payroll Taxes Capital Gains Taxes table lawsuit indemnification business deduction restaurant,30221,<UNK>,<UNK>,realDonaldTrump
1257736426206031874,2020-05-05 18:18:26+00:00,"Most of the money raised by the RINO losers of the so-called “Lincoln Project”, goes into their own pockets. With what I’ve done on Judges, Taxes, Regulations, Healthcare, the Military, Vets (Choice!) & protecting our great 2A, they should love Trump. Problem is, I BEAT THEM ALL!",money raise RINO loser call Lincoln Project go pocket Judges Taxes Regulations Healthcare military Vets Choice protect great love Trump problem BEAT,18496,<UNK>,<UNK>,realDonaldTrump
1257725719469158401,2020-05-05 17:35:53+00:00,Remember this? Happy #CincoDeMayo!,remember happy cincodemayo,18906,#CincoDeMayo,<UNK>,realDonaldTrump
1257715551729676289,2020-05-05 16:55:29+00:00,"The Do Nothing Democrats and their leader, the Fake News Lamestream Media, are doing everything possible to hurt and disparage our Country. No matter what we do or say, no matter how big a win, they report that it was a loss, or not good enough. The Enemy of the People!",Democrats leader Fake News Lamestream Media possible hurt disparage country matter matter report loss good Enemy People,31601,<UNK>,<UNK>,realDonaldTrump
1257714716492722176,2020-05-05 16:52:10+00:00,"For the constant criticism from the Do Nothing Democrats and their Fake News partners, here is the newest chart on our great testing “miracle"" compared to other countries. Dems and LameStream Media should be proud of the USA, instead of always ripping us down!",constant criticism Democrats Fake News partner new chart great testing miracle compare country Dems LameStream Media proud instead rip,21403,<UNK>,<UNK>,realDonaldTrump
1257659682816241665,2020-05-05 13:13:29+00:00,"Governors should let roads and highway construction begin before heavy traffic starts, which will be soon. Some Governors never stopped, which proved to be very smart. They built and fixed roads during long no traffic periods. Also, saved big dollars!",governor road highway construction begin heavy traffic start soon Governors stop prove smart build fix road long traffic period save dollar,25525,<UNK>,<UNK>,realDonaldTrump
1257651144739950593,2020-05-05 12:39:33+00:00,Heading to Arizona!,head Arizona,15838,<UNK>,<UNK>,realDonaldTrump
1257650279740301314,2020-05-05 12:36:07+00:00,Oil prices moving up nicely as demand begins again!,price move nicely demand begin,25569,<UNK>,<UNK>,realDonaldTrump
1257649628327153664,2020-05-05 12:33:32+00:00,Exciting to see our Country starting to open up again!,exciting country start open,15100,<UNK>,<UNK>,realDonaldTrump
1257532114666508291,2020-05-05 04:46:34+00:00,"....lost for Evan “McMuffin” McMullin (to me). Steve Schmidt & Reed Galvin lost for John McCain, Romney’s campaign manager (?) lost big to “O”, & Jennifer Horn got thrown out of the New Hampshire Republican Party. They’re all LOSERS, but Abe Lincoln, Republican, is all smiles!",lose Evan McMuffin McMullin Steve Schmidt Reed Galvin lose John McCain Romney campaign manager lose Jennifer Horn throw Hampshire Republican Party loser Lincoln Republican smile,12980,<UNK>,<UNK>,realDonaldTrump
