id,created_at,original_text,clean_text,retweet_count,hashtags,mentions,original_author
1134107544681455616,2019-05-30 14:41:24+00:00,“Comey and Brennan are turning on each other.” @kilmeade,Comey Brennan turn @kilmeade,13051,<UNK>,@kilmeade,realDonaldTrump
1134092525218590721,2019-05-30 13:41:43+00:00,"Congressman John Ratcliffe, “The Trump Campaign clearly did not conspire or collude.” @FoxNews",Congressman John Ratcliffe Trump Campaign clearly conspire collude @foxnews,12325,<UNK>,@FoxNews,realDonaldTrump
1134066372584062976,2019-05-30 11:57:47+00:00,"....say he fought back against this phony crime that didn’t exist, this horrendous false accusation, and he shouldn’t fight back, he should just sit back and take it. Could this be Obstruction? No, Mueller didn’t find Obstruction either. Presidential Harassment!",fight phony crime exist horrendous false accusation fight obstruction Mueller find obstruction presidential Harassment,19003,<UNK>,<UNK>,realDonaldTrump
1134066371510378501,2019-05-30 11:57:47+00:00,"Russia, Russia, Russia! That’s all you heard at the beginning of this Witch Hunt Hoax...And now Russia has disappeared because I had nothing to do with Russia helping me to get elected. It was a crime that didn’t exist. So now the Dems and their partner, the Fake News Media,.....",Russia Russia Russia hear beginning Witch Hunt Hoax Russia disappear Russia help elect crime exist Dems partner Fake News Media,23230,<UNK>,<UNK>,realDonaldTrump
1134057302821150722,2019-05-30 11:21:45+00:00,"The Greatest Presidential Harassment in history. After spending $40,000,000 over two dark years, with unlimited access, people, resources and cooperation, highly conflicted Robert Mueller would have brought charges, if he had ANYTHING, but there were no charges to bring!","Greatest Presidential Harassment history spend 40,000,000 dark year unlimited access people resource cooperation highly conflict Robert Mueller bring charge charge bring",21618,<UNK>,<UNK>,realDonaldTrump
1133900762709463040,2019-05-30 00:59:43+00:00,"I was not informed about anything having to do with the Navy Ship USS John S. McCain during my recent visit to Japan. Nevertheless, @FLOTUS and I loved being with our great Military Men and Women - what a spectacular job they do!",inform have Navy Ship John McCain recent visit Japan @FLOTUS love great Military Women spectacular,17147,<UNK>,@FLOTUS,realDonaldTrump
1133897476497448960,2019-05-30 00:46:39+00:00,"Great show tonight @seanhannity, you really get it (9:00 P.M. @FoxNews), that’s why you’re Number One (by far)! Also, please tell Mark Levin congrats on having the Number One book!",great tonight @seanhannity 9:00 P.M. @FoxNews number tell Mark Levin congrat have Number book,13228,<UNK>,@seanhannity @FoxNews,realDonaldTrump
1133893813611782144,2019-05-30 00:32:06+00:00,How do you impeach a Republican President for a crime that was committed by the Democrats? WITCH-HUNT!,impeach republican President crime commit Democrats witch HUNT,38756,<UNK>,<UNK>,realDonaldTrump
1133759237136494592,2019-05-29 15:37:21+00:00,"Nothing changes from the Mueller Report. There was insufficient evidence and therefore, in our Country, a person is innocent. The case is closed! Thank you.",change Mueller Report insufficient evidence country person innocent case closed thank,32653,<UNK>,<UNK>,realDonaldTrump
1133699637678870528,2019-05-29 11:40:31+00:00,"...If Alabama does not elect a Republican to the Senate in 2020, many of the incredible gains that we have made during my Presidency may be lost, including our Pro-Life victories. Roy Moore cannot win, and the consequences will be devastating....Judges and Supreme Court Justices!",Alabama elect Republican Senate 2020 incredible gain Presidency lose include life victory Moore consequence devastating Judges Supreme Court Justices,17518,<UNK>,<UNK>,realDonaldTrump
1133699631857262593,2019-05-29 11:40:30+00:00,"Republicans cannot allow themselves to again lose the Senate seat in the Great State of Alabama. This time it will be for Six Years, not just Two. I have NOTHING against Roy Moore, and unlike many other Republican leaders, wanted him to win. But he didn’t, and probably won’t.....",republican allow lose Senate seat Great State Alabama time year Moore unlike republican leader want probably,18266,<UNK>,<UNK>,realDonaldTrump
1133531809118076929,2019-05-29 00:33:37+00:00,THANK YOU JAPAN!🇺🇸🇯🇵,thank japan!:united_states::japan,57134,<UNK>,<UNK>,realDonaldTrump
1133529099530571777,2019-05-29 00:22:51+00:00,Back from Japan after a very successful trip. Big progress on MANY fronts. A great country with a wonderful leader in Prime Minister Abe!,Japan successful trip progress front great country wonderful leader Prime Minister,16864,<UNK>,<UNK>,realDonaldTrump
1133492876296511491,2019-05-28 21:58:55+00:00,"I was actually sticking up for Sleepy Joe Biden while on foreign soil. Kim Jong Un called him a “low IQ idiot,” and many other things, whereas I related the quote of Chairman Kim as a much softer “low IQ individual.” Who could possibly be upset with that?",actually stick Sleepy Biden foreign soil Jong call idiot thing relate quote Chairman soft individual possibly upset,22608,<UNK>,<UNK>,realDonaldTrump
1133484222423941120,2019-05-28 21:24:32+00:00,Just spoke to Governor @AsaHutchinson of the Great State of Arkansas to inform him that FEMA and the Federal Government will do whatever is necessary to help out with what has turned out to be Record Flooding. Asa and local officials are doing a great job!,speak Governor @AsaHutchinson Great State Arkansas inform FEMA Federal Government necessary help turn Record Flooding local official great,10301,<UNK>,@AsaHutchinson,realDonaldTrump
1133457998586818561,2019-05-28 19:40:20+00:00,.@GovMikeDeWine just updated me on the devastation from the many tornadoes that struck Ohio early this morning. My Administration fully supports the people of the great State of Ohio as they begin the cleanup and recovery.,.@GovMikeDeWine update devastation tornado strike Ohio early morning Administration fully support people great State Ohio begin cleanup recovery,10208,<UNK>,@GovMikeDeWine,realDonaldTrump
1133457412428640256,2019-05-28 19:38:00+00:00,Storms overnight across Ohio and many other States were very dangerous and damaging. My team continues to update me with reports from emergency managers in the States affected. Listen to your local officials and be resilient. We are with you!,storm overnight Ohio States dangerous damaging team continue update report emergency manager States affect listen local official resilient,13169,<UNK>,<UNK>,realDonaldTrump
1133352140431216640,2019-05-28 12:39:41+00:00,GOD BLESS THE USA🇺🇸,BLESS United_States,30905,<UNK>,<UNK>,realDonaldTrump
1133284566632787969,2019-05-28 08:11:10+00:00,Spoke with @GovStitt of Oklahoma last night from Japan because of the devastating tornadoes. Told him that @FEMA and the federal government are fully behind him and the great people of Oklahoma.,speak @GovStitt Oklahoma night Japan devastating tornado tell @FEMA federal government fully great people Oklahoma,11300,<UNK>,@GovStitt @fema,realDonaldTrump
1133170167641460736,2019-05-28 00:36:35+00:00,Can’t wait to see you all soon!,wait soon,17019,<UNK>,<UNK>,realDonaldTrump
1133145260018819072,2019-05-27 22:57:37+00:00,"I will be making two stops this morning in Japan to visit with our Great Military, then a quick stop in Alaska and back to D.C. Meetings with Prime Minister Abe went very well, and getting to spend time with the new Emperor and Empress of Japan was a great honor!",make stop morning Japan visit Great Military quick stop Alaska D.C. Meetings Prime Minister go get spend time Emperor Empress Japan great honor,14806,<UNK>,<UNK>,realDonaldTrump
1133139717069910017,2019-05-27 22:35:35+00:00,"Anyone associated with the 1994 Crime Bill will not have a chance of being elected. In particular, African Americans will not be able to vote for you. I, on the other hand, was responsible for Criminal Justice Reform, which had tremendous support, & helped fix the bad 1994 Bill!",associate 1994 Crime Bill chance elect particular african Americans able vote hand responsible Criminal Justice Reform tremendous support help 1994 Bill,19360,<UNK>,<UNK>,realDonaldTrump
1133119875272994816,2019-05-27 21:16:45+00:00,"....Super Predator was the term associated with the 1994 Crime Bill that Sleepy Joe Biden was so heavily involved in passing. That was a dark period in American History, but has Sleepy Joe apologized? No!",Super Predator term associate 1994 Crime Bill Sleepy Biden heavily involved pass dark period American History Sleepy apologize,18498,<UNK>,<UNK>,realDonaldTrump
1133031322912473093,2019-05-27 15:24:52+00:00,Hoping things will work out with Israel's coalition formation and Bibi and I can continue to make the alliance between America and Israel stronger than ever. A lot more to do!,hope thing work Israel coalition formation Bibi continue alliance America Israel strong,16067,<UNK>,<UNK>,realDonaldTrump
1133009099212247042,2019-05-27 13:56:34+00:00,Liz Cheney: Statements by agents investigating Trump 'could well be treason',Cheney statement agent investigate Trump treason,15558,<UNK>,<UNK>,realDonaldTrump
1132994153317588992,2019-05-27 12:57:10+00:00,#MemorialDay🇺🇸,MemorialDay United_States,17656,#MemorialDay,<UNK>,realDonaldTrump
1132937986427957248,2019-05-27 09:13:59+00:00,The Dems are getting NOTHING done in Congress! They only want a Do-Over on Mueller!,Dems get Congress want Mueller,15288,<UNK>,<UNK>,realDonaldTrump
1132937098753789952,2019-05-27 09:10:27+00:00,"Impeach for what, having created perhaps the greatest Economy in our Country’s history, rebuilding our Military, taking care of our Vets (Choice), Judges, Best Jobs Numbers Ever, and much more? Dems are Obstructionists!",impeach have create great economy country history rebuild Military take care vet Choice Judges good Jobs Numbers dem obstructionist,20915,<UNK>,<UNK>,realDonaldTrump
1132933851133534210,2019-05-27 08:57:33+00:00,".@ianbremmer now admits that he MADE UP “a completely ludicrous quote,” attributing it to me. This is what’s going on in the age of Fake News. People think they can say anything and get away with it. Really, the libel laws should be changed to hold Fake News Media accountable!",.@ianbremmer admit completely ludicrous quote attribute go Fake News People think away libel law change hold Fake News Media accountable,21119,<UNK>,@ianbremmer,realDonaldTrump
1132850794359922688,2019-05-27 03:27:31+00:00,"Great evening last night, thank you!",great evening night thank,15017,<UNK>,<UNK>,realDonaldTrump
1132750329408364544,2019-05-26 20:48:18+00:00,"Congratulations to the Great (and my friend) Roger Penske on winning his 18th (UNBELIEVABLE!) Indianapolis 500. I am in Japan, very early in the morning, but I got to watch Simon drive one of the greatest races in the history of the sport. I will see them both, & TEAM, at the WH!",congratulation great friend Roger Penske win 18th UNBELIEVABLE Indianapolis Japan early morning watch Simon drive great race history sport TEAM,18313,<UNK>,<UNK>,realDonaldTrump
1132630743321055232,2019-05-26 12:53:07+00:00,"The Great Patriots of Rolling Thunder WILL be coming back to Washington, D.C. next year, & hopefully for many years to come. It is where they want to be, & where they should be. Have a wonderful time today. Thank you to our great men & women of the Pentagon for working it out!",great Patriots Rolling Thunder come Washington D.C. year hopefully year come want wonderful time today thank great woman Pentagon work,21645,<UNK>,<UNK>,realDonaldTrump
1132627475333304321,2019-05-26 12:40:07+00:00,“Why doesn’t the press apologize to President Trump for the Russian Collusion Delusion?” @marklevinshow @JudgeJeanine How about the Dems also?,press apologize President Trump russian Collusion Delusion @marklevinshow @judgejeanine Dems,17939,<UNK>,@marklevinshow @JudgeJeanine,realDonaldTrump
1132623971139112960,2019-05-26 12:26:12+00:00,Thank you @JPN_PMO @AbeShinzo! #POTUSinJapan🇺🇸🇯🇵,thank @JPN_PMO @AbeShinzo potusinjapan United_States::Japan,47537,#POTUSinJapan,@JPN_PMO @AbeShinzo,realDonaldTrump
1132614380103843840,2019-05-26 11:48:05+00:00,"Tonight in Tokyo, Japan at the Ryōgoku Kokugikan Stadium, it was my great honor to present the first-ever U.S. President’s Cup to Sumo Grand Champion Asanoyama. Congratulations! A great time had by all, thank you @AbeShinzo!!",tonight Tokyo Japan Ryōgoku Kokugikan Stadium great honor present U.S. President Sumo Grand Champion Asanoyama congratulation great time thank @AbeShinzo,21808,<UNK>,@AbeShinzo,realDonaldTrump
1132506435848495104,2019-05-26 04:39:09+00:00,Great progress being made in our Trade Negotiations with Japan. Agriculture and beef heavily in play. Much will wait until after their July elections where I anticipate big numbers!,great progress Trade Negotiations Japan agriculture beef heavily play wait July election anticipate number,18797,<UNK>,<UNK>,realDonaldTrump
1132506111884636160,2019-05-26 04:37:52+00:00,Great fun and meeting with Prime Minister @AbeShinzo. Numerous Japanese officials told me that the Democrats would rather see the United States fail than see me or the Republican Party succeed - Death Wish!,great meet Prime Minister @AbeShinzo numerous japanese official tell Democrats United States fail Republican Party succeed death wish,15068,<UNK>,@AbeShinzo,realDonaldTrump
1132498578629222400,2019-05-26 04:07:56+00:00,"Great morning of golf with Prime Minister @AbeShinzo at Mobara Country Club in Chiba, Japan!",great morning golf Prime Minister @abeshinzo Mobara Country Club Chiba Japan,18694,<UNK>,@AbeShinzo,realDonaldTrump
1132459370816708608,2019-05-26 01:32:08+00:00,"North Korea fired off some small weapons, which disturbed some of my people, and others, but not me. I have confidence that Chairman Kim will keep his promise to me, & also smiled when he called Swampman Joe Biden a low IQ individual, & worse. Perhaps that’s sending me a signal?",North Korea fire small weapon disturb people confidence Chairman promise smile call Swampman Biden individual bad send signal,18419,<UNK>,<UNK>,realDonaldTrump
1132444714047664129,2019-05-26 00:33:54+00:00,"Going to play golf right now with @AbeShinzo. Japan loves the game. Tremendous fans of @JackNicklaus, @TigerWoods, and @PhilMickelson — I said what about @GaryPlayer, they said we love Gary too!",go play golf right @abeshinzo Japan love game tremendous fan @jacknicklaus @TigerWoods @philmickelson say @garyplayer say love Gary,10553,<UNK>,@AbeShinzo @jacknicklaus @TigerWoods @PhilMickelson @garyplayer,realDonaldTrump
1132386783898013697,2019-05-25 20:43:42+00:00,"In addition to great incompetence and corruption, The Smollett case in Chicago is also about a Hate Crime. Remember, “MAGA COUNTRY DID IT!” That turned out to be a total lie, had nothing to do with “MAGA COUNTRY.” Serious stuff, and not even an apology to millions of people!",addition great incompetence corruption Smollett case Chicago Hate Crime remember MAGA COUNTRY turn total maga COUNTRY stuff apology million people,26024,<UNK>,<UNK>,realDonaldTrump
1132374746912493569,2019-05-25 19:55:52+00:00,"Thank you John, so nice!",thank John nice,17986,<UNK>,<UNK>,realDonaldTrump
1132369575033606149,2019-05-25 19:35:19+00:00,"Another activist Obama appointed judge has just ruled against us on a section of the Southern Wall that is already under construction. This is a ruling against Border Security and in favor of crime, drugs and human trafficking. We are asking for an expedited appeal!",activist Obama appoint judge rule section Southern Wall construction ruling Border Security favor crime drug human trafficking ask expedite appeal,22204,<UNK>,<UNK>,realDonaldTrump
1132191737160589312,2019-05-25 07:48:39+00:00,Getting ready to land in Japan with First Lady Melania. We look forward to seeing everyone soon!🇺🇸🇯🇵,get ready land Japan Lady Melania look forward see soon!:United_States::Japan,14988,<UNK>,<UNK>,realDonaldTrump
1132187724830482433,2019-05-25 07:32:43+00:00,"Can’t believe that Rolling Thunder would be given a hard time with permits in Washington, D.C. They are great Patriots who I have gotten to know and see in action. They love our Country and love our Flag. If I can help, I will!",believe Rolling Thunder give hard time permit Washington D.C. great patriot get know action love country love flag help,20397,<UNK>,<UNK>,realDonaldTrump
1132184674829082624,2019-05-25 07:20:36+00:00,Democrat Senator Mark Warner is acting and talking like he is in total control of the Senate Intelligence Committee. Their is nothing bipartisan about him. He should not be allowed to take “command” of that Committee. Too important! Remember when he spoke to the Russian jokester?,Democrat Senator Mark Warner act talk like total control Senate Intelligence Committee bipartisan allow command Committee important remember speak russian jokester,14606,<UNK>,<UNK>,realDonaldTrump
1132178835665895424,2019-05-25 06:57:23+00:00,"The real trade war began 30 years ago, and we lost. This is a bright new Age, the Age of Enlightenment. We don’t lose anymore!",real trade begin year lose bright Enlightenment lose anymore,16280,<UNK>,<UNK>,realDonaldTrump
1132083465720016896,2019-05-25 00:38:25+00:00,"In Alaska with our GREAT TROOPS, departing shortly for Japan!",Alaska great TROOPS depart shortly Japan,22770,<UNK>,<UNK>,realDonaldTrump
1132038993682419712,2019-05-24 21:41:43+00:00,".....The Dems want a second shot at Bob Mueller, are very unhappy with the No Collusion Report. They should not be allowed to play this game any longer - no second chances - must get back to work. So bad for our Country!",Dems want second shot Mueller unhappy Collusion Report allow play game long second chance work country,14924,<UNK>,<UNK>,realDonaldTrump
1132027626489430016,2019-05-24 20:56:32+00:00,....(with many more to come) and 2 Supreme Court Justices - we are getting into record territory! Thank you all and have a great Memorial Day Weekend.,come Supreme Court Justices get record territory thank great Memorial Weekend,13358,<UNK>,<UNK>,realDonaldTrump
1132027622597128192,2019-05-24 20:56:31+00:00,"Mitch McConnell and our Republican Senators have been very solid and strong. We have accomplished a great deal together, in particular with our Courts, 107 Federal Judges....",Mitch McConnell republican Senators solid strong accomplish great deal particular Courts Federal Judges,15157,<UNK>,<UNK>,realDonaldTrump
1131998750354731008,2019-05-24 19:01:48+00:00,"Departed the @WhiteHouse and am now on Air Force One with the First Lady heading to Japan and looking forward to honoring, on behalf of the United States, His Majesty, the Emperor of Japan. I will also be discussing Trade and Military with my friend, Prime Minister @AbeShinzo.",depart @WhiteHouse Force Lady head Japan look forward honor behalf United States Majesty Emperor Japan discuss Trade Military friend Prime Minister @AbeShinzo,16746,<UNK>,@WhiteHouse @AbeShinzo,realDonaldTrump
1131983310668746752,2019-05-24 18:00:27+00:00,Just spoke to Prime Minister @NarendraModi where I congratulated him on his big political victory. He is a great man and leader for the people of India - they are lucky to have him!,speak Prime Minister @NarendraModi congratulate political victory great leader people India lucky,40681,<UNK>,@narendramodi,realDonaldTrump
1131975977444052992,2019-05-24 17:31:18+00:00,"Congratulations to Tom Cotton - his book, “Sacred Duty: A Solider’s Tour at Arlington National Cemetery” just hit the best sellers list. I was at @ArlingtonNatl yesterday &amp; the people there were so grateful for Tom’s inspiring portrait of “The Old Guard.” Great job @TomCottonAR!",congratulation Cotton book sacred Duty solider Tour Arlington National Cemetery good seller list @ArlingtonNatl yesterday people grateful inspire portrait Guard great @tomcottonar,9678,<UNK>,@ArlingtonNatl @TomCottonAR,realDonaldTrump
1131901353872244736,2019-05-24 12:34:47+00:00,"I don’t know why the Radical Left Democrats want Bob Mueller to testify when he just issued a 40 Million Dollar Report that states, loud & clear & for all to hear, No Collusion and No Obstruction (how do you Obstruct a NO crime?) Dems are just looking for trouble and a Do-Over!",know radical Left Democrats want Mueller testify issue Million Dollar Report state loud clear hear Collusion Obstruction obstruct crime dem look trouble,19409,<UNK>,<UNK>,realDonaldTrump
1131897618265776128,2019-05-24 12:19:56+00:00,"“If they try to Impeach President Trump, who has done nothing wrong (No Collusion), they will end up getting him re-elected” @LindseyGrahamSC Impeachment is for High Crimes and Misdemeanors. There were no High Crimes and Misdemeanors, except for those committed by the other side!",Impeach President Trump wrong Collusion get elect @LindseyGrahamSC impeachment High Crimes Misdemeanors High Crimes Misdemeanors commit,24919,<UNK>,@LindseyGrahamSC,realDonaldTrump
1131769241651302401,2019-05-24 03:49:49+00:00,"“Intelligence Agencies were used against an American President.” @DevinNunes @ShannonBream @FoxNews This should NEVER happen to a President again! Dems are furious at Robert Mueller for his findings - NO COLLUSION, NO OBSTRUCTION. Now they should go back to work and legislate!",Intelligence Agencies american President @devinnunes @shannonbream @foxnews happen President dem furious Robert Mueller finding COLLUSION obstruction work legislate,17613,<UNK>,@DevinNunes @ShannonBream @FoxNews,realDonaldTrump
1131764098289602560,2019-05-24 03:29:22+00:00,"When is Twitter going to allow the very popular Conservative Voices that it has so viciously shut down, back into the OPEN? IT IS TIME!",Twitter go allow popular conservative Voices viciously shut OPEN TIME,33075,<UNK>,<UNK>,realDonaldTrump
1131761681850347520,2019-05-24 03:19:46+00:00,"Wow! CNN Ratings are WAY DOWN, record lows. People are getting tired of so many Fake Stories and Anti-Trump lies. Chris Cuomo was rewarded for lowest morning ratings with a prime time spot - which is failing badly and not helping the dumbest man on television, Don Lemon!",rating record low People get tired fake Stories anti trump lie Chris Cuomo reward low morning rating prime time spot fail badly help dumb television Lemon,21511,<UNK>,<UNK>,realDonaldTrump
1131731395209060352,2019-05-24 01:19:25+00:00,71% of Voters rate the Economy as Excellent or Good. The highest number in more than 18 years! @QuinnipiacPoll,voter rate economy Excellent good high number year @QuinnipiacPoll,14894,<UNK>,@QuinnipiacPoll,realDonaldTrump
1131728912835383300,2019-05-24 01:09:33+00:00,“PELOSI STAMMERS THROUGH NEWS CONFERENCE”,PELOSI STAMMERS NEWS CONFERENCE,27025,<UNK>,<UNK>,realDonaldTrump
1131721440905105410,2019-05-24 00:39:52+00:00,“Nancy Pelosi should not be out there doing the kinds of things she is doing. She will diminish herself and her membership. She cannot put a subject with a predicate in the same sentence. What’s going on?” Ed Rollins @GreggJarrett @LouDobbs,Nancy Pelosi kind thing diminish membership subject predicate sentence go Rollins @GreggJarrett @LouDobbs,14525,<UNK>,@GreggJarrett @LouDobbs,realDonaldTrump
1131716324751826949,2019-05-24 00:19:32+00:00,"....Today’s action will help ensure that all Americans learn the truth about the events that occurred, and the actions that were taken, during the last Presidential election and will restore confidence in our public institutions.” @PressSec",today action help ensure Americans learn truth event occur action take presidential election restore confidence public institution @PressSec,23328,<UNK>,@PressSec,realDonaldTrump
1131716323485073409,2019-05-24 00:19:32+00:00,"....during the 2016 Presidential election. The Attorney General has also been delegated full and complete authority to declassify information pertaining to this investigation, in accordance with the long-established standards for handling classified information....",2016 presidential election Attorney General delegate complete authority declassify information pertain investigation accordance long establish standard handle classified information,19230,<UNK>,<UNK>,realDonaldTrump
1131716322369392646,2019-05-24 00:19:32+00:00,"“Today, at the request and recommendation of the Attorney General of the United States, President Donald J. Trump directed the intelligence community to quickly and fully cooperate with the Attorney General’s investigation into surveillance activities....",today request recommendation Attorney General United States President Donald Trump direct intelligence community quickly fully cooperate Attorney General investigation surveillance activity,29472,<UNK>,<UNK>,realDonaldTrump
1131715618573623296,2019-05-24 00:16:44+00:00,"@FoxNews Poll: A majority of Americans want the Democrats to stop investigating President Trump. The Mueller Report said very strongly NO COLLUSION, which led to NO OBSTRUCTION. The Dems can’t get over 2016 or the conclusive Mueller findings. They are now the Do Nothing Party!",@foxnews Poll majority Americans want Democrats stop investigate President Trump Mueller Report say strongly COLLUSION OBSTRUCTION Dems 2016 conclusive Mueller finding Party,2823,<UNK>,@FoxNews,realDonaldTrump
1131714257308012545,2019-05-24 00:11:19+00:00,"The U.S. Senate has just approved a 19 Billion Dollar Disaster Relief Bill, with my total approval. Great!",U.S. Senate approve billion Dollar Disaster Relief Bill total approval great,10807,<UNK>,<UNK>,realDonaldTrump
1131705087762620418,2019-05-23 23:34:53+00:00,We will never forget our fallen HEROES. It was our great honor to be with you today! #FlagsIn,forget fall HEROES great honor today flagsin,12300,#FlagsIn,<UNK>,realDonaldTrump
