id,created_at,original_text,clean_text,retweet_count,hashtags,mentions,original_author
1191201586590171136,2019-11-04 03:52:44+00:00,We won’t Steve!,Steve,11147,<UNK>,<UNK>,realDonaldTrump
1191160243784433665,2019-11-04 01:08:27+00:00,Don’t miss this show!,miss,8510,<UNK>,<UNK>,realDonaldTrump
1191158055397969920,2019-11-04 00:59:45+00:00,"False stories are being reported that a few Republican Senators are saying that President Trump may have done a quid pro quo, but it doesn’t matter, there is nothing wrong with that, it is not an impeachable event. Perhaps so, but read the transcript, there is no quid pro quo!",false story report republican Senators say President Trump quid matter wrong impeachable event read transcript quid,19744,<UNK>,<UNK>,realDonaldTrump
1191155326743195648,2019-11-04 00:48:55+00:00,"....should give their own transcripts of the interviews to contrast with Schiff’s manipulated propaganda. House Republicans must have nothing to do with Shifty’s rendition of those interviews. He is a proven liar, leaker & freak who is really the one who should be impeached!",transcript interview contrast Schiff manipulate propaganda House Republicans Shifty rendition interview proven liar leaker freak impeach,12609,<UNK>,<UNK>,realDonaldTrump
1191155312084082688,2019-11-04 00:48:51+00:00,"If Shifty Adam Schiff, who is a corrupt politician who fraudulently made up what I said on the “call,” is allowed to release transcripts of the Never Trumpers & others that are & were interviewed, he will change the words that were said to suit the Dems purposes. Republicans...",Shifty Adam Schiff corrupt politician fraudulently say allow release transcript Trumpers interview change word say suit Dems purpose Republicans,17166,<UNK>,<UNK>,realDonaldTrump
1191088472997744640,2019-11-03 20:23:15+00:00,"Virginia has the best Unemployment and Economic numbers in the history of the State. If the Democrats get in, those numbers will go rapidly in the other direction. On Tuesday, Vote Republican!",Virginia good Unemployment economic number history State Democrats number rapidly direction Tuesday Vote Republican,17625,<UNK>,<UNK>,realDonaldTrump
1191087187443490818,2019-11-03 20:18:09+00:00,"I hope everyone in the Great State of Virginia will get out and VOTE on Tuesday in all of the local and state elections to send a signal to D.C. that you want lower taxes, a strong Military, Border & 2nd Amendment, great healthcare, and must take care of our Vets. VOTE REPUBLICAN",hope Great State Virginia vote Tuesday local state election send signal D.C. want low taxis strong Military Border Amendment great healthcare care vet VOTE REPUBLICAN,21379,<UNK>,<UNK>,realDonaldTrump
1191083920282050560,2019-11-03 20:05:10+00:00,"The Fake News Media is working hard so that information about the Whistleblower’s identity, which may be very bad for them and their Democrat partners, never reaches the Public.",Fake News Media work hard information Whistleblower identity Democrat partner reach Public,18203,<UNK>,<UNK>,realDonaldTrump
1191058382695927808,2019-11-03 18:23:41+00:00,"The Democrats are Fixers, and they are working overtime to FIX the Impeachment “Process” in order to hurt the Republican Party and me. Nancy Pelosi should instead Fix her broken District and Corrupt Adam should clean up & manage the California forests which are always burning!",Democrats Fixers work overtime Impeachment Process order hurt Republican Party Nancy Pelosi instead broken District Corrupt Adam clean manage California forest burn,19099,<UNK>,<UNK>,realDonaldTrump
1191033582053052416,2019-11-03 16:45:08+00:00,Fake News!,Fake News,10478,<UNK>,<UNK>,realDonaldTrump
1191032782274748416,2019-11-03 16:41:58+00:00,The Angry Majority!,Angry Majority,15431,<UNK>,<UNK>,realDonaldTrump
1191032506105024512,2019-11-03 16:40:52+00:00,"Many people listened to my phone call with the Ukrainian President while it was being made. I never heard any complaints. The reason is that it was totally appropriate, I say perfect. Republicans have never been more unified, and my Republican Approval Rating is now 95%!",people listen phone ukrainian President hear complaint reason totally appropriate perfect Republicans unified Republican Approval Rating,18268,<UNK>,<UNK>,realDonaldTrump
1191028762252439552,2019-11-03 16:25:59+00:00,....and FEDERAL CONTRACTOR SPIES stories. The finest law enforcement on the planet could not have shown a ROADMAP like that which was produced by you. @OANN should be VERY proud of this great work. I wish more people were seeking the facts and the truth. Keep it up!,federal contractor spy story fine enforcement planet show ROADMAP like produce @OANN proud great work wish people seek fact truth,10179,<UNK>,@OANN,realDonaldTrump
1191028748818116608,2019-11-03 16:25:56+00:00,"Thank you to @OANN for the absolutely incredible Special Report narrated by @PearsonSharp. Seldom do the American people get to see journalistic work of this quality. Now it would be great if the legitimate sections of law enforcement would study your SMEARS, SPIES AND LIES....",thank @OANN absolutely incredible Special Report narrate @PearsonSharp seldom american people journalistic work quality great legitimate section enforcement study smear spy lie,13499,<UNK>,@OANN @PearsonSharp,realDonaldTrump
1191025740046716933,2019-11-03 16:13:59+00:00,“Morrison testifies he saw nothing wrong with the Trump call.” @OANN,Morrison testify wrong trump @OANN,11184,<UNK>,@OANN,realDonaldTrump
1191007379212648448,2019-11-03 15:01:01+00:00,"....Matt has been a GREAT Governor. Kentucky (I Love You!), please be sure to vote for Matt Bevin on TUESDAY. Matt will never let you down, and we have to send a strong signal to Nancy Pelosi and the Radical Left Democrats. See you on Monday night, VOTE TUESDAY!!!",Matt great governor Kentucky love sure vote Matt Bevin TUESDAY Matt send strong signal Nancy Pelosi radical Left Democrats Monday night VOTE TUESDAY,9383,<UNK>,<UNK>,realDonaldTrump
1191007372673720321,2019-11-03 15:01:00+00:00,Walking into Madison Square Garden last night with @danawhite for the big @UFC Championship fight was a little bit like walking into a Trump Rally. Plenty of MAGA &amp; KAG present. Great energy. Fantastic job Dana! Heading to D.C. and then to Kentucky for a big @MattBevin Rally...,walk Madison Square Garden night @danawhite @UFC Championship fight little like walk Trump Rally plenty MAGA present great energy fantastic Dana head D.C. Kentucky @MattBevin Rally,13172,<UNK>,@danawhite @ufc @MattBevin,realDonaldTrump
1191001547901194242,2019-11-03 14:37:51+00:00,Great fight Champ!,great fight Champ,18264,<UNK>,<UNK>,realDonaldTrump
1191000516580519937,2019-11-03 14:33:45+00:00,"The Whistleblower got it sooo wrong that HE must come forward. The Fake News Media knows who he is but, being an arm of the Democrat Party, don’t want to reveal him because there would be hell to pay. Reveal the Whistleblower and end the Impeachment Hoax!",Whistleblower sooo wrong come forward Fake News Media know Democrat Party want reveal hell reveal Whistleblower Impeachment Hoax,24638,<UNK>,<UNK>,realDonaldTrump
1190995042107887616,2019-11-03 14:12:00+00:00,"....putting these massive, and many, fires out. Great firefighters! Also, open up the ridiculously closed water lanes coming down from the North. Don’t pour it out into the Pacific Ocean. Should be done immediately. California desperately needs water, and you can have it now!",put massive fire great firefighter open ridiculously close water lane come North pour Pacific Ocean immediately California desperately need water,12910,<UNK>,<UNK>,realDonaldTrump
1190995035703185408,2019-11-03 14:11:58+00:00,"..Every year, as the fire’s rage & California burns, it is the same thing-and then he comes to the Federal Government for $$$help. No more. Get your act together Governor. You don’t see close to the level of burn in other states...But our teams are working well together in.....",year fire rage California burn thing come Federal Government help Governor close level burn state team work,12419,<UNK>,<UNK>,realDonaldTrump
1190995034163892226,2019-11-03 14:11:58+00:00,"The Governor of California, @GavinNewsom, has done a terrible job of forest management. I told him from the first day we met that he must “clean” his forest floors regardless of what his bosses, the environmentalists, DEMAND of him. Must also do burns and cut fire stoppers.....",Governor California @GavinNewsom terrible forest management tell clean forest floor regardless boss environmentalist DEMAND burn fire stopper,20317,<UNK>,@GavinNewsom,realDonaldTrump
1190756985433657344,2019-11-02 22:26:03+00:00,Didn’t he pick the Whistleblower?,pick Whistleblower,15643,<UNK>,<UNK>,realDonaldTrump
1190737940940574720,2019-11-02 21:10:22+00:00,A giant Scam!,giant scam,14610,<UNK>,<UNK>,realDonaldTrump
1190735767955529728,2019-11-02 21:01:44+00:00,Schiff will change the transcripts just like he fraudulently made up the phone call. He is a corrupt politician!,Schiff change transcript like fraudulently phone corrupt politician,17241,<UNK>,<UNK>,realDonaldTrump
1190734818595758085,2019-11-02 20:57:58+00:00,The Whistleblower has disappeared. Where is the Whistleblower?,Whistleblower disappear Whistleblower,28672,<UNK>,<UNK>,realDonaldTrump
1190734151479103490,2019-11-02 20:55:19+00:00,"Big Rally in Kentucky on Monday night for a man who has worked really hard & done a GREAT job, Governor @MattBevin. Kentucky is having the best economic year ever under Matt’s leadership. He is a fantastic guy who loves our Military, our Vets and our 2nd Amendment. Vote Tuesday!",Rally Kentucky Monday night work hard great Governor @MattBevin Kentucky have good economic year Matt leadership fantastic love military vet Amendment vote Tuesday,13862,<UNK>,@MattBevin,realDonaldTrump
1190694747716886528,2019-11-02 18:18:44+00:00,"Louisiana has a chance to have a really great Governor in @EddieRispone. Auto insurance costs and taxes will be coming way down with Eddie, and your 2nd Amendment will be protected. Current Democrat governor has done a really poor job! VOTE EARLY FOR EDDIE!",Louisiana chance great governor @EddieRispone auto insurance cost taxis come Eddie Amendment protect current Democrat governor poor vote early EDDIE,14157,<UNK>,@EddieRispone,realDonaldTrump
1190693144310009858,2019-11-02 18:12:22+00:00,"Tate Reeves will be a great Governor of Mississippi, and what an electric Rally last night. Vote for Tate on Tuesday!",Tate Reeves great Governor Mississippi electric Rally night vote Tate Tuesday,11996,<UNK>,<UNK>,realDonaldTrump
1190666385418080257,2019-11-02 16:26:02+00:00,"A great new book by Howie Carr, “What Really Happened, How Donald J. Trump Saved America From Hillary Clinton,” is on sale now. Howie is a talented New England force who was there at the very beginning!",great book Howie Carr happen Donald Trump Saved America Hillary Clinton sale Howie talented England force beginning,19832,<UNK>,<UNK>,realDonaldTrump
1190407200109318144,2019-11-01 23:16:07+00:00,The Whistleblower must come forward to explain why his account of the phone call with the Ukrainian President was so inaccurate (fraudulent?). Why did the Whistleblower deal with corrupt politician Shifty Adam Schiff and/or his committee?,Whistleblower come forward explain account phone ukrainian President inaccurate fraudulent Whistleblower deal corrupt politician Shifty Adam Schiff and/or committee,24609,<UNK>,<UNK>,realDonaldTrump
1190400372180807681,2019-11-01 22:48:59+00:00,You can’t Impeach someone who hasn’t done anything wrong!,impeach wrong,47204,<UNK>,<UNK>,realDonaldTrump
1190385966621569024,2019-11-01 21:51:45+00:00,"Oh no, Beto just dropped out of race for President despite him saying he was “born for this.” I don’t think so!",Beto drop race President despite say bear think,30071,<UNK>,<UNK>,realDonaldTrump
1190383074632257536,2019-11-01 21:40:15+00:00,Republicans have never been more unified than they are right now! The Dems are a mess under the corrupt leadership of Nervous Nancy Pelosi and Shifty Adam Schiff!,Republicans unified right Dems mess corrupt leadership nervous Nancy Pelosi Shifty Adam Schiff,21128,<UNK>,<UNK>,realDonaldTrump
1190375834529468423,2019-11-01 21:11:29+00:00,.....with a President and Federal Government that wants our wonerful City and State to flourish and thrive. I Love New York!,President Federal Government want wonerful City State flourish thrive love York,9352,<UNK>,<UNK>,realDonaldTrump
1190375831840985091,2019-11-01 21:11:29+00:00,"....our great police are being disrespected, even with water dumped on them, because a Mayor and Governor just don’t “have their backs.” New York’s Finest must be cherished, respected and loved. Too many prople are leaving our special New York. Great leaders would work....",great police disrespect water dump Mayor Governor back York Finest cherish respect love prople leave special York great leader work,10228,<UNK>,<UNK>,realDonaldTrump
1190375830247104513,2019-11-01 21:11:28+00:00,"....in New York, and another reason they are leaving. Taxes and energy costs are way too high, Upstate is being allowed to die as other nearby states frack & drill for Gold (oil) while reducing taxes & creating jobs by the thousands. NYC is getting dirty & unsafe again, as....",York reason leave taxis energy cost high Upstate allow nearby state frack drill Gold reduce taxis create job thousand get dirty unsafe,5967,<UNK>,<UNK>,realDonaldTrump
1190375828099674113,2019-11-01 21:11:28+00:00,"I love New York, but New York can never be great again under the current leadership of Governor Andrew Cuomo (the brother of Fredo), or Mayor Bill DeBlasio. Cuomo has weaponized the prosecutors to do his dirty work (and to keep him out of jams), a reason some don’t want to be...",love York York great current leadership Governor Andrew Cuomo brother Fredo Mayor Bill DeBlasio Cuomo weaponize prosecutor dirty work jam reason want,18147,<UNK>,<UNK>,realDonaldTrump
1190269494788263936,2019-11-01 14:08:56+00:00,Stock Market up BIG! Record highs for S&P 500 and NASDAQ. Enjoy!,Stock Market record high NASDAQ enjoy,16951,<UNK>,<UNK>,realDonaldTrump
1190269335224430592,2019-11-01 14:08:18+00:00,"....Our Republican candidate @EddieRispone is a successful conservative businessman who will stand with me to create jobs and protect your Second Amendment. GET OUT AND VOTE for Eddie, the next Governor of the GREAT State of Louisiana!",republican candidate @EddieRispone successful conservative businessman stand create job protect Second Amendment vote Eddie Governor GREAT State Louisiana,10500,<UNK>,@EddieRispone,realDonaldTrump
1190269332623970304,2019-11-01 14:08:17+00:00,"LOUISIANA! Extreme Democrat John Bel Edwards has sided with Nancy Pelosi and Chuck Schumer to support Sanctuary Cities, High Taxes, and Open Borders. He is crushing Louisiana’s economy and your Second Amendment rights....",LOUISIANA Extreme Democrat John Edwards side Nancy Pelosi Chuck Schumer support Sanctuary Cities High Taxes open Borders crush Louisiana economy Second Amendment right,15070,<UNK>,<UNK>,realDonaldTrump
1190265325511757825,2019-11-01 13:52:22+00:00,"....@FoxNews @BillHemmer The public is watching and seeing for themselves how unfair this process is. Corrupt politicians, Pelosi and Schiff, are trying to take down the Republican Party. It will never happen, we will take back the House!",@foxnews @billhemmer public watch see unfair process corrupt politician Pelosi Schiff try Republican Party happen House,11943,<UNK>,@FoxNews @BillHemmer,realDonaldTrump
1190265313620836352,2019-11-01 13:52:19+00:00,"“Adam Schiff has taken all of the power for himself. That is very unfair. There were dozens of people on this call, yesterdays witness knew that and had no problems (nor did any of them). Facts matter, and that’s why this is not about Impeachment.” Guy Lewis, former prosecutor...",Adam Schiff take power unfair dozen people yesterdays witness know problem fact matter Impeachment Lewis prosecutor,15201,<UNK>,<UNK>,realDonaldTrump
1190261874371244032,2019-11-01 13:38:39+00:00,ISIS has a new leader. We know exactly who he is!,ISIS leader know exactly,37827,<UNK>,<UNK>,realDonaldTrump
1190261248367218688,2019-11-01 13:36:10+00:00,“The Democrats need more than this.” @tombrokaw Much more!,Democrats need @tombrokaw,7900,<UNK>,@tombrokaw,realDonaldTrump
1190260664062881792,2019-11-01 13:33:50+00:00,“The Democrats are so immersed in this (SCAM). They couldn’t care less about the American people!” @RushLimbaughEIB,Democrats immersed SCAM care american people @rushlimbaugheib,12390,<UNK>,@RushLimbaughEIB,realDonaldTrump
1190250133071519745,2019-11-01 12:52:00+00:00,"Wow, a blowout JOBS number just out, adjusted for revisions and the General Motors strike, 303,000. This is far greater than expectations. USA ROCKS!","blowout JOBS number adjust revision General Motors strike 303,000 great expectation rock",21942,<UNK>,<UNK>,realDonaldTrump
1190247105841057805,2019-11-01 12:39:58+00:00,Chicago will never stop its crime wave with the current Superintendent of Police. It just won’t happen! Thank you to Kevin Graham and all of the GREAT Chicago Police Officers I just had the privilege to meet. Tremendous crime fighting potential if allowed to do your thing!,Chicago stop crime wave current Superintendent Police happen thank Kevin Graham GREAT Chicago Police officer privilege meet tremendous crime fight potential allow thing,15693,<UNK>,<UNK>,realDonaldTrump
1190244509277458433,2019-11-01 12:29:39+00:00,"“This is the biggest, most disgusting scandal, and it’s all on the Democrat Party that has highjacked the Impeachment process, our tax dollars, the House of Representatives, to push their 2020 Election. That’s what’s going on.” @marklevinshow Cannot be said any better!",big disgusting scandal Democrat Party highjack Impeachment process dollar House Representatives push 2020 Election go @marklevinshow say well,17355,<UNK>,@marklevinshow,realDonaldTrump
1190240720633905152,2019-11-01 12:14:36+00:00,“It has been 3 years and Donald Trump hasn’t done anything wrong. Donald Trump hasn’t done a single thing of which he has been accused.” @RushLimbaughEIB @seanhannity A Witch Hunt like no other!,year Donald Trump wrong Donald Trump single thing accuse @RushLimbaughEIB @seanhannity witch Hunt like,16085,<UNK>,@RushLimbaughEIB @seanhannity,realDonaldTrump
1190239355627098112,2019-11-01 12:09:10+00:00,Thanks Lee!,thanks,10934,<UNK>,<UNK>,realDonaldTrump
1190113283078074369,2019-11-01 03:48:12+00:00,But the Crooked Democrats don’t want people to know this! Thank you to Tim Morrison for your honesty.,crooked Democrats want people know thank Morrison honesty,17261,<UNK>,<UNK>,realDonaldTrump
1190086080952967171,2019-11-01 02:00:07+00:00,A great place!,great place,8933,<UNK>,<UNK>,realDonaldTrump
1190079193582899200,2019-11-01 01:32:45+00:00,"....this decision, but in the end it will be best for all concerned. As President, I will always be there to help New York and the great people of New York. It will always have a special place in my heart!",decision good concern President help York great people York special place heart,14181,<UNK>,<UNK>,realDonaldTrump
1190079192358105088,2019-11-01 01:32:44+00:00,"....New York, and always will, but unfortunately, despite the fact that I pay millions of dollars in city, state and local taxes each year, I have been treated very badly by the political leaders of both the city and state. Few have been treated worse. I hated having to make....",York unfortunately despite fact million dollar city state local taxis year treat badly political leader city state treat bad hate have,13818,<UNK>,<UNK>,realDonaldTrump
1190079191355670529,2019-11-01 01:32:44+00:00,"1600 Pennsylvania Avenue, the White House, is the place I have come to love and will stay for, hopefully, another 5 years as we MAKE AMERICA GREAT AGAIN, but my family and I will be making Palm Beach, Florida, our Permanent Residence. I cherish New York, and the people of.....",1600 Pennsylvania Avenue White House place come love stay hopefully year AMERICA great family make Palm Beach Florida Permanent Residence cherish York people,21724,<UNK>,<UNK>,realDonaldTrump
1190067978089439239,2019-11-01 00:48:11+00:00,The home of Nancy Pelosi. I can’t believe her voters can be happy with the job she and the Do Nothing Democrats are doing! San Francisco has really gone down hill. So sad!,home Nancy Pelosi believe voter happy Democrats Francisco go hill,18486,<UNK>,<UNK>,realDonaldTrump
1190036836447641601,2019-10-31 22:44:26+00:00,"While the Do Nothing Democrats FAIL the American People, and continue the Impeachment Scam, my Administration will continue to deliver REAL RESULTS, as seen over the past month, below!",Democrats FAIL american People continue Impeachment Scam Administration continue deliver real result see past month,27640,<UNK>,<UNK>,realDonaldTrump
1189927952168996865,2019-10-31 15:31:46+00:00,The Greatest Witch Hunt In American History!,Greatest witch hunt american history,33633,<UNK>,<UNK>,realDonaldTrump
1189919331259424770,2019-10-31 14:57:30+00:00,The Impeachment Hoax is hurting our Stock Market. The Do Nothing Democrats don’t care!,Impeachment Hoax hurt Stock Market Democrats care,21793,<UNK>,<UNK>,realDonaldTrump
1189914359310553088,2019-10-31 14:37:45+00:00,"....our manufacturers. We should have lower interest rates than Germany, Japan and all others. We are now, by far, the biggest and strongest Country, but the Fed puts us at a competitive disadvantage. China is not our problem, the Federal Reserve is! We will win anyway.",manufacturer low interest rate Germany Japan big strong country put competitive disadvantage China problem Federal Reserve,10696,<UNK>,<UNK>,realDonaldTrump
1189914333842681858,2019-10-31 14:37:39+00:00,"People are VERY disappointed in Jay Powell and the Federal Reserve. The Fed has called it wrong from the beginning, too fast, too slow. They even tightened in the beginning. Others are running circles around them and laughing all the way to the bank. Dollar & Rates are hurting...",People disappointed Powell Federal Reserve call wrong beginning fast slow tighten beginning run circle laugh bank Dollar Rates hurt,13283,<UNK>,<UNK>,realDonaldTrump
1189897137984876545,2019-10-31 13:29:19+00:00,READ THE TRANSCRIPT!,read TRANSCRIPT,21305,<UNK>,<UNK>,realDonaldTrump
1189895935721197570,2019-10-31 13:24:32+00:00,"China and the USA are working on selecting a new site for signing of Phase One of Trade Agreement, about 60% of total deal, after APEC in Chile was canceled do to unrelated circumstances. The new location will be announced soon. President Xi and President Trump will do signing!",China work select site sign Phase Trade Agreement total deal APEC Chile cancel unrelated circumstance location announce soon President President Trump signing,16413,<UNK>,<UNK>,realDonaldTrump
1189887388832714752,2019-10-31 12:50:35+00:00,"Congratulations to @FoxNews, you left @CNN &amp; @MSNBC in the dust (that’s because the don’t tell the truth!).",congratulation @FoxNews leave @CNN @MSNBC dust tell truth,11064,<UNK>,@FoxNews @CNN @MSNBC,realDonaldTrump
1189882057759084569,2019-10-31 12:29:24+00:00,Thank you Matt.,thank Matt,7460,<UNK>,<UNK>,realDonaldTrump
1189879747318341632,2019-10-31 12:20:13+00:00,".....to any President, of either party, again. Laura @IngrahamAngle",President party Laura @IngrahamAngle,8592,<UNK>,@IngrahamAngle,realDonaldTrump
1189879746357841921,2019-10-31 12:20:13+00:00,"...never be allowed to roll into a winter showtrial. Indeed, allowing a long, drawn out trial in the Senate would merely validate and perpetuate the fraud begun in the House. The crisis is of the Democrats own making, and it’s up to Republicans to make sure this never happens....",allow roll winter showtrial allow long draw trial Senate merely validate perpetuate fraud begin House crisis Democrats making Republicans sure happen,9403,<UNK>,<UNK>,realDonaldTrump
1189879744659148801,2019-10-31 12:20:12+00:00,".....the Dems have selectively leaked. Nor was there any corrupt intent on the part of the President. Remember, the President knew that that call was being heard and documented by many people. Anyone with intent would be a tad more discreet, don’t you think? This farce should....",Dems selectively leak corrupt intent President remember President know hear document people intent discreet think farce,6089,<UNK>,<UNK>,realDonaldTrump
1189879743895810048,2019-10-31 12:20:12+00:00,"“Now is the time for Republicans to stand together and defend the leader of their party against these smears. It would be one thing if there were any indication of an underlying crime, but there is not-not in the transcripts, and not in the secret witness testimony that.....",time Republicans stand defend leader party smear thing indication underlie crime transcript secret witness testimony,19419,<UNK>,<UNK>,realDonaldTrump
1189766430826344449,2019-10-31 04:49:56+00:00,Congratulations to the Washington Nationals on a great season and an incredible World Series. Game 7 was amazing! @Nationals,congratulation Washington Nationals great season incredible World Series Game amazing @Nationals,8276,<UNK>,@Nationals,realDonaldTrump
1189762942004289536,2019-10-31 04:36:04+00:00,"Thank you Daily Wire. Very cute recreation, but the “live” version of Conan will be leaving the Middle East for the White House sometime next week!",thank Daily Wire cute recreation live version Conan leave Middle East White House week,18192,<UNK>,<UNK>,realDonaldTrump
1189758177824452608,2019-10-31 04:17:08+00:00,The Do Nothing Democrats have gone Crazy. Very bad for USA!,Democrats go crazy,12818,<UNK>,<UNK>,realDonaldTrump
