id,created_at,original_text,clean_text,retweet_count,hashtags,mentions,original_author
1136181473306914816,2019-06-05 08:02:27+00:00,"Could not have been treated more warmly in the United Kingdom by the Royal Family or the people. Our relationship has never been better, and I see a very big Trade Deal down the road. “This trip has been an incredible success for the President.” @IngrahamAngle",treat warmly United Kingdom Royal Family people relationship well Trade Deal road trip incredible success President @IngrahamAngle,18744,<UNK>,@IngrahamAngle,realDonaldTrump
1136173702859636736,2019-06-05 07:31:34+00:00,.@FLOTUS Melania and I send our deepest condolences to President Reuven Rivlin and the entire State of Israel upon the passing of Mrs. Nechama Rivlin. Mrs. Rivlin represented her beloved country with grace and stature. We will miss her along with all those who knew her.,.@FLOTUS Melania send deep condolence President Reuven Rivlin entire State Israel passing Mrs. Nechama Rivlin Mrs. Rivlin represent beloved country grace stature miss know,10188,<UNK>,@FLOTUS,realDonaldTrump
1136150992544604160,2019-06-05 06:01:19+00:00,"I kept hearing that there would be “massive” rallies against me in the UK, but it was quite the opposite. The big crowds, which the Corrupt Media hates to show, were those that gathered in support of the USA and me. They were big & enthusiastic as opposed to the organized flops!",keep hear massive rally opposite crowd Corrupt Media hate gather support enthusiastic oppose organized flop,21375,<UNK>,<UNK>,realDonaldTrump
1136149478862254080,2019-06-05 05:55:19+00:00,"Plagiarism charge against Sleepy Joe Biden on his ridiculous Climate Change Plan is a big problem, but the Corrupt Media will save him. His other problem is that he is drawing flies, not people, to his Rallies. Nobody is showing up, I mean nobody. You can’t win without people!",plagiarism charge Sleepy Biden ridiculous Climate Change Plan problem Corrupt Media save problem draw fly people Rallies show mean people,19474,<UNK>,<UNK>,realDonaldTrump
1136146104838434821,2019-06-05 05:41:54+00:00,#USStateVisit🇺🇸🇬🇧,usstatevisit united_states::united_kingdom,10699,#USStateVisit,<UNK>,realDonaldTrump
1136067842879709184,2019-06-05 00:30:55+00:00,"Washed up psycho @BetteMidler was forced to apologize for a statement she attributed to me that turned out to be totally fabricated by her in order to make “your great president” look really bad. She got caught, just like the Fake News Media gets caught. A sick scammer!",wash psycho @BetteMidler force apologize statement attribute turn totally fabricate order great president look catch like Fake News Media get catch sick scammer,26185,<UNK>,@BetteMidler,realDonaldTrump
1136061313174659073,2019-06-05 00:04:58+00:00,"Can you imagine Cryin’ Chuck Schumer saying out loud, for all to hear, that I am bluffing with respect to putting Tariffs on Mexico. What a Creep. He would rather have our Country fail with drugs & Immigration than give Republicans a win. But he gave Mexico bad advice, no bluff!",imagine Cryin Chuck Schumer say loud hear bluff respect put Tariffs Mexico Creep country fail drug Immigration Republicans give Mexico advice bluff,20836,<UNK>,<UNK>,realDonaldTrump
1135971860762439680,2019-06-04 18:09:31+00:00,Just had a big victory in Federal Court over the Democrats in the House on the desperately needed Border Wall. A big step in the right direction. Wall is under construction!,victory Federal Court Democrats House desperately need Border Wall step right direction Wall construction,27017,<UNK>,<UNK>,realDonaldTrump
1135921705677987840,2019-06-04 14:50:13+00:00,Thank you @Theresa_May!🇺🇸🇬🇧,thank @theresa_may!:united_states::united_kingdom,12548,<UNK>,@theresa_may,realDonaldTrump
1135822941588008960,2019-06-04 08:17:46+00:00,#USStateVisit🇺🇸🇬🇧,usstatevisit united_states::united_kingdom,19188,#USStateVisit,<UNK>,realDonaldTrump
1135609956563083266,2019-06-03 18:11:26+00:00,"As a sign of good faith, Mexico should immediately stop the flow of people and drugs through their country and to our Southern Border. They can do it if they want!",sign good faith Mexico immediately stop flow people drug country Southern Border want,19647,<UNK>,<UNK>,realDonaldTrump
1135603282104213504,2019-06-03 17:44:55+00:00,Russia has informed us that they have removed most of their people from Venezuela.,Russia inform remove people Venezuela,32058,<UNK>,<UNK>,realDonaldTrump
1135602452059906050,2019-06-03 17:41:37+00:00,"....Fake News will be working hard to find them. Great love all around. Also, big Trade Deal is possible once U.K. gets rid of the shackles. Already starting to talk!",Fake News work hard find great love Trade Deal possible U.K. get shackle start talk,19004,<UNK>,<UNK>,realDonaldTrump
1135602449987899395,2019-06-03 17:41:37+00:00,"London part of trip is going really well. The Queen and the entire Royal family have been fantastic. The relationship with the United Kingdom is very strong. Tremendous crowds of well wishers and people that love our Country. Haven’t seen any protests yet, but I’m sure the....",London trip go Queen entire royal family fantastic relationship United Kingdom strong tremendous crowd wisher people love country see protest sure,23813,<UNK>,<UNK>,realDonaldTrump
1135499002626154496,2019-06-03 10:50:33+00:00,"I believe that if people stoped using or subscribing to @ATT, they would be forced to make big changes at @CNN, which is dying in the ratings anyway. It is so unfair with such bad, Fake News! Why wouldn’t they act. When the World watches @CNN, it gets a false picture of USA. Sad!",believe people stop subscribe @ATT force change @CNN die rating unfair Fake News World watch @CNN get false picture,21006,<UNK>,@ATT @CNN @CNN,realDonaldTrump
1135495710894374917,2019-06-03 10:37:28+00:00,"Just arrived in the United Kingdom. The only problem is that @CNN is the primary source of news available from the U.S. After watching it for a short while, I turned it off. All negative &amp; so much Fake News, very bad for U.S. Big ratings drop. Why doesn’t owner @ATT do something?",arrive United Kingdom problem @CNN primary source news available U.S. watch short turn negative Fake News U.S. rating drop owner @ATT,23253,<UNK>,@CNN @ATT,realDonaldTrump
1135488087453253632,2019-06-03 10:07:11+00:00,"China is subsidizing its product in order that it can continue to be sold in the USA. Many firms are leaving China for other countries, including the United States, in order to avoid paying the Tariffs. No visible increase in costs or inflation, but U.S. is taking Billions!",China subsidize product order continue sell firm leave China country include United States order avoid pay Tariffs visible increase cost inflation U.S. take billion,14615,<UNK>,<UNK>,realDonaldTrump
1135469796437495808,2019-06-03 08:54:30+00:00,Thank you! 🇺🇸🇬🇧,thank united_states::united_kingdom,12858,<UNK>,<UNK>,realDonaldTrump
1135453895277203458,2019-06-03 07:51:19+00:00,"....Kahn reminds me very much of our very dumb and incompetent Mayor of NYC, de Blasio, who has also done a terrible job - only half his height. In any event, I look forward to being a great friend to the United Kingdom, and am looking very much forward to my visit. Landing now!",Kahn remind dumb incompetent Mayor Blasio terrible half height event look forward great friend United Kingdom look forward visit land,26145,<UNK>,<UNK>,realDonaldTrump
1135453891326238721,2019-06-03 07:51:18+00:00,".@SadiqKhan, who by all accounts has done a terrible job as Mayor of London, has been foolishly “nasty” to the visiting President of the United States, by far the most important ally of the United Kingdom. He is a stone cold loser who should focus on crime in London, not me......",.@SadiqKhan account terrible Mayor London foolishly nasty visit President United States important ally United Kingdom stone cold loser focus crime London,39817,<UNK>,@SadiqKhan,realDonaldTrump
1135361632840716288,2019-06-03 01:44:41+00:00,"BIG NEWS! As I promised two weeks ago, the first shipment of LNG has just left the Cameron LNG Export Facility in Louisiana. Not only have thousands of JOBS been created in USA, we’re shipping freedom and opportunity abroad!",NEWS promise week shipment leave Cameron Export Facility Louisiana thousand job create ship freedom opportunity abroad,19242,<UNK>,<UNK>,realDonaldTrump
1135360773557895169,2019-06-03 01:41:17+00:00,"Kevin Hassett, who has done such a great job for me and the Administration, will be leaving shortly. His very talented replacement will be named as soon as I get back to the U.S. I want to thank Kevin for all he has done - he is a true friend!",Kevin Hassett great Administration leave shortly talented replacement name soon U.S. want thank Kevin true friend,10622,<UNK>,<UNK>,realDonaldTrump
1135332642851893250,2019-06-02 23:49:30+00:00,"Hearing word that Russia, Syria and, to a lesser extent, Iran, are bombing the hell out of Idlib Province in Syria, and indiscriminately killing many innocent civilians. The World is watching this butchery. What is the purpose, what will it get you? STOP!",hear word Russia Syria less extent Iran bomb hell Idlib Province Syria indiscriminately kill innocent civilian World watch butchery purpose stop,19893,<UNK>,<UNK>,realDonaldTrump
1135331156239560709,2019-06-02 23:43:35+00:00,"Democrats can’t impeach a Republican President for crimes committed by Democrats. The facts are “pouring” in. The Greatest Witch Hunt in American History! Congress, go back to work and help us at the Border, with Drug Prices and on Infrastructure.",Democrats impeach republican President crime commit Democrats fact pour Greatest Witch Hunt american History Congress work help Border Drug Prices infrastructure,25682,<UNK>,<UNK>,realDonaldTrump
1135249668751929345,2019-06-02 18:19:47+00:00,"Mexico is sending a big delegation to talk about the Border. Problem is, they’ve been “talking” for 25 years. We want action, not talk. They could solve the Border Crisis in one day if they so desired. Otherwise, our companies and jobs are coming back to the USA!",Mexico send delegation talk Border problem talk year want action talk solve Border Crisis desire company job come,24103,<UNK>,<UNK>,realDonaldTrump
1135247979617685504,2019-06-02 18:13:04+00:00,"Peggy Noonan, the simplistic writer for Trump Haters all, is stuck in the past glory of Reagan and has no idea what is happening with the Radical Left Democrats, or how vicious and desperate they are. Mueller had to correct his ridiculous statement, Peggy never understood it!",Peggy Noonan simplistic writer Trump Haters stick past glory Reagan idea happen radical Left Democrats vicious desperate Mueller correct ridiculous statement Peggy understand,14101,<UNK>,<UNK>,realDonaldTrump
1135165268261519361,2019-06-02 12:44:24+00:00,"I never called Meghan Markle “nasty.” Made up by the Fake News Media, and they got caught cold! Will @CNN, @nytimes and others apologize? Doubt it!",call Meghan Markle nasty Fake News Media catch cold @cnn @nytime apologize doubt,21735,<UNK>,@CNN @nytimes,realDonaldTrump
1135161682580389888,2019-06-02 12:30:10+00:00,"NO COLLUSION, NO OBSTRUCTION, NO NOTHING! “What the Democrats are trying to do is the biggest sin in the impeachment business.” David Rivkin, Constitutional Scholar. Meantime, the Dems are getting nothing done in Congress. They are frozen stiff. Get back to work, much to do!",COLLUSION OBSTRUCTION Democrats try big impeachment business David Rivkin Constitutional Scholar meantime dem get Congress freeze stiff work,18613,<UNK>,<UNK>,realDonaldTrump
1135152434202980353,2019-06-02 11:53:25+00:00,"The Wall is under construction and moving along quickly, despite all of the Radical Liberal Democrat lawsuits. What are they thinking as our Country is invaded by so many people (illegals) and things (Drugs) that we do not want. Make America Great Again!",Wall construction move quickly despite Radical Liberal Democrat lawsuit think country invade people illegal thing Drugs want America Great,16543,<UNK>,<UNK>,realDonaldTrump
1135150118120939521,2019-06-02 11:44:12+00:00,"....Coyotes and Illegal Immigrants, which they can do very easily, or our many companies and jobs that have been foolishly allowed to move South of the Border, will be brought back into the United States through taxation (Tariffs). America has had enough!",Coyotes Illegal Immigrants easily company job foolishly allow South Border bring United States taxation Tariffs America,18633,<UNK>,<UNK>,realDonaldTrump
1135150117252673536,2019-06-02 11:44:12+00:00,"People have been saying for years that we should talk to Mexico. The problem is that Mexico is an “abuser” of the United States, taking but never giving. It has been this way for decades. Either they stop the invasion of our Country by Drug Dealers, Cartels, Human Traffickers....",People say year talk Mexico problem Mexico abuser United States take give decade stop invasion Country Drug Dealers Cartels Human Traffickers,21273,<UNK>,<UNK>,realDonaldTrump
1135141467062771713,2019-06-02 11:09:50+00:00,The Democrats are doing nothing on the Border to address the Humanitarian and National Security Crisis! Could be fixed so easily if they would vote with Republicans to fix the loopholes.,Democrats Border address humanitarian National Security Crisis fix easily vote Republicans loophole,14184,<UNK>,<UNK>,realDonaldTrump
1135010309381533701,2019-06-02 02:28:39+00:00,"The Great Jerry West will be receiving our Nation’s highest civilian honor, The Presidential Medal of Freedom, for his outstanding career, both on and off the court. Happy Birthday Jerry! @Sen_JoeManchin",Great Jerry West receive Nation high civilian honor Presidential Medal Freedom outstanding career court happy Birthday Jerry @Sen_JoeManchin,8608,<UNK>,@Sen_JoeManchin,realDonaldTrump
1135002792312156161,2019-06-02 01:58:47+00:00,THE TRUTH! The Witch Hunt is dead. Thank you @marcthiessen.,truth Witch Hunt dead thank @marcthiessen,13672,<UNK>,@marcthiessen,realDonaldTrump
1134963792935362563,2019-06-01 23:23:49+00:00,We will all stick together and WIN! Thank you Franklin.,stick thank Franklin,16432,<UNK>,<UNK>,realDonaldTrump
1134961396171640832,2019-06-01 23:14:18+00:00,"Thank you so much, Franklin!",thank Franklin,7499,<UNK>,<UNK>,realDonaldTrump
1134947966320553986,2019-06-01 22:20:56+00:00,"When you are the “Piggy Bank” Nation that foreign countries have been robbing and deceiving for years, the word TARIFF is a beautiful word indeed! Others must treat the United States fairly and with respect - We are no longer the “fools” of the past!",Piggy Bank nation foreign country rob deceive year word TARIFF beautiful word treat United States fairly respect long fool past,25065,<UNK>,<UNK>,realDonaldTrump
1134921830773469184,2019-06-01 20:37:04+00:00,"...travesty that is taking place in allowing millions of people to easily meander through their country and INVADE the U.S., not to mention the Drugs & Human Trafficking pouring in through Mexico. Are the Drug Lords, Cartels & Coyotes really running Mexico? We will soon find out!",travesty take place allow million people easily meander country INVADE U.S. mention Drugs Human Trafficking pour Mexico Drug Lords Cartels Coyotes run Mexico soon find,15267,<UNK>,<UNK>,realDonaldTrump
1134921828198232064,2019-06-01 20:37:04+00:00,"....U.S. in order to avoid paying the 25% Tariff. Like Mexican companies will move back to the United States once the Tariff reaches the higher levels. They took many of our companies & jobs, the foolish Pols let it happen, and now they will come back unless Mexico stops the.....",U.S. order avoid pay tariff like mexican company United States tariff reach high level take company job foolish Pols happen come Mexico stop,12372,<UNK>,<UNK>,realDonaldTrump
1134921826604331011,2019-06-01 20:37:03+00:00,"Washington Post got it wrong, as usual. The U.S. is charging 25% against 250 Billion Dollars of goods shipped from China, not 200 BD. Also, China is paying a heavy cost in that they will subsidize goods to keep them coming, devalue their currency, yet companies are moving to.....",Washington Post wrong usual U.S. charge billion dollar good ship China China pay heavy cost subsidize good come devalue currency company move,16024,<UNK>,<UNK>,realDonaldTrump
1134910182083969024,2019-06-01 19:50:47+00:00,The United States stands ready to work with @NayibBukele to advance prosperity in El Salvador and the hemisphere. Congratulations President Bukele on your inauguration!,United States stand ready work @NayibBukele advance prosperity Salvador hemisphere congratulation President Bukele inauguration,10589,<UNK>,@nayibbukele,realDonaldTrump
1134909712267436032,2019-06-01 19:48:55+00:00,"Emmet Flood, who came to the White House to help me with the Mueller Report, will be leaving service on June 14th. He has done an outstanding job – NO COLLUSION - NO OBSTRUCTION! Case Closed! Emmet is my friend, and I thank him for the GREAT JOB he has done.",Emmet Flood come White House help Mueller Report leave service June 14th outstanding COLLUSION obstruction case closed Emmet friend thank great,13055,<UNK>,<UNK>,realDonaldTrump
1134832749855039489,2019-06-01 14:43:06+00:00,"Spoke to Virginia Governor @RalphNortham last night, and the Mayor and Vice Mayor of Virginia Beach this morning, to offer condolences to that great community. The Federal Government is there, and will be, for whatever they may need. God bless the families and all!",speak Virginia Governor @RalphNortham night Mayor Vice Mayor Virginia Beach morning offer condolence great community Federal Government need bless family,10954,<UNK>,@RalphNortham,realDonaldTrump
1134559092545134593,2019-05-31 20:35:41+00:00,"I will be announcing my Second Term Presidential Run with First Lady Melania, Vice President Mike Pence, and Second Lady Karen Pence on June 18th in Orlando, Florida, at the 20,000 seat Amway Center. Join us for this Historic Rally! Tickets: https://www.donaldjtrump.com/rallies/jun-orla-flor-2019","announce Second Term Presidential Lady Melania Vice President Mike Pence Second Lady Karen Pence June 18th Orlando Florida 20,000 seat Amway Center join Historic Rally ticket",30945,<UNK>,<UNK>,realDonaldTrump
1134550682080620544,2019-05-31 20:02:16+00:00,GREAT NEWS! #MAGA,GREAT NEWS maga,17665,#MAGA,<UNK>,realDonaldTrump
1134538168324300800,2019-05-31 19:12:32+00:00,....on the basis of their sexual orientation. My Administration has launched a global campaign to decriminalize homosexuality and invite all nations to join us in this effort!,basis sexual orientation Administration launch global campaign decriminalize homosexuality invite nation join effort,17835,<UNK>,<UNK>,realDonaldTrump
1134538166919204865,2019-05-31 19:12:32+00:00,"As we celebrate LGBT Pride Month and recognize the outstanding contributions LGBT people have made to our great Nation, let us also stand in solidarity with the many LGBT people who live in dozens of countries worldwide that punish, imprison, or even execute individuals....",celebrate LGBT Pride Month recognize outstanding contribution LGBT people great nation stand solidarity LGBT people live dozen country worldwide punish imprison execute individual,25444,<UNK>,<UNK>,realDonaldTrump
1134522786804850688,2019-05-31 18:11:25+00:00,".@SeanHannity is having a DEEP STATE SHOW tonight on Fox News at 9:00 PM (E), exposing the tremendous abuse of power that has been uncovered. Tremendous guests, a must see – Enjoy!",.@SeanHannity have DEEP STATE tonight News 9:00 expose tremendous abuse power uncover tremendous guest enjoy,15480,<UNK>,@seanhannity,realDonaldTrump
1134522066508685314,2019-05-31 18:08:33+00:00,"Saddened to hear about the loss of John Pinto, a Navajo Code Talker in World War II, over the Memorial Day Weekend. The Code Talkers are true American HEROES and John never stopped serving his fellow citizens as a longtime New Mexico State Senator. John, Rest In Peace!",sadden hear loss John Pinto Navajo Code Talker World Memorial Weekend Code Talkers true american HEROES John stop serve fellow citizen longtime Mexico State Senator John Rest peace,13308,<UNK>,<UNK>,realDonaldTrump
1134469934816346113,2019-05-31 14:41:24+00:00,"90% of the Drugs coming into the United States come through Mexico & our Southern Border. 80,000 people died last year, 1,000,000 people ruined. This has gone on for many years & nothing has been done about it. We have a 100 Billion Dollar Trade Deficit with Mexico. It’s time!","drug come United States come Mexico Southern Border 80,000 people die year 1,000,000 people ruin go year billion Dollar Trade Deficit Mexico time",25188,<UNK>,<UNK>,realDonaldTrump
1134466523114999809,2019-05-31 14:27:51+00:00,"In order not to pay Tariffs, if they start rising, companies will leave Mexico, which has taken 30% of our Auto Industry, and come back home to the USA. Mexico must take back their country from the drug lords and cartels. The Tariff is about stopping drugs as well as illegals!",order tariff start rise company leave Mexico take Auto Industry come home Mexico country drug lord cartel Tariff stop drug illegal,19900,<UNK>,<UNK>,realDonaldTrump
1134452086857523205,2019-05-31 13:30:29+00:00,"Mexico has taken advantage of the United States for decades. Because of the Dems, our Immigration Laws are BAD. Mexico makes a FORTUNE from the U.S., have for decades, they can easily fix this problem. Time for them to finally do what must be done!",Mexico take advantage United States decade Dems Immigration Laws Mexico make FORTUNE U.S. decade easily problem time finally,18957,<UNK>,<UNK>,realDonaldTrump
1134448050464800769,2019-05-31 13:14:26+00:00,"Hard to believe that with the Crisis on the Border, the Dems won’t do the quick and easy fix. Would solve the problem but they want Open Borders, which equals crime!",hard believe Crisis Border Dems quick easy solve problem want open Borders equal crime,16635,<UNK>,<UNK>,realDonaldTrump
1134442192720879616,2019-05-31 12:51:10+00:00,Congratulations to the @AF_Academy Class of 2019!,congratulation @af_academy Class 2019,12675,<UNK>,@AF_Academy,realDonaldTrump
1134438947298467840,2019-05-31 12:38:16+00:00,"Sean Davis, The Federalist: “Mueller proved his entire operation was a political hit job. Still ZERO evidence of Trump-Russia Collusion, and no new evidence from Mueller.” @TuckerCarlson @FoxNews",Sean Davis Federalist Mueller prove entire operation political ZERO evidence Trump Russia Collusion evidence Mueller @TuckerCarlson @foxnews,12963,<UNK>,@TuckerCarlson @FoxNews,realDonaldTrump
1134276359260389377,2019-05-31 01:52:12+00:00,I will be watching @AlanDersh on @IngrahamAngle at 10:00 P.M. He speaks the truth!,watch @alandersh @ingrahamangle 10:00 P.M. speak truth,8575,<UNK>,@AlanDersh @IngrahamAngle,realDonaldTrump
1134240657621438464,2019-05-30 23:30:20+00:00,....at which time the Tariffs will be removed. Details from the White House to follow.,time Tariffs remove detail White House follow,17175,<UNK>,<UNK>,realDonaldTrump
1134240653926232064,2019-05-30 23:30:19+00:00,"On June 10th, the United States will impose a 5% Tariff on all goods coming into our Country from Mexico, until such time as illegal migrants coming through Mexico, and into our Country, STOP. The Tariff will gradually increase until the Illegal Immigration problem is remedied,..",June 10th United States impose tariff good come country Mexico time illegal migrant come Mexico country STOP Tariff gradually increase Illegal Immigration problem remedie,34110,<UNK>,<UNK>,realDonaldTrump
1134223799300153347,2019-05-30 22:23:21+00:00,"The Navy put out a disclaimer on the McCain story. Looks like the story was an exaggeration, or even Fake News - but why not, everything else is!",Navy disclaimer McCain story look like story exaggeration Fake News,18456,<UNK>,<UNK>,realDonaldTrump
1134206851174862856,2019-05-30 21:16:00+00:00,"Yesterday, Border Patrol agents apprehended the largest group of illegal aliens ever: 1,036 people who illegally crossed the border in El Paso around 4am. Democrats need to stand by our incredible Border Patrol and finally fix the loopholes at our Border!","yesterday Border Patrol agent apprehend large group illegal alien 1,036 people illegally cross border Paso Democrats need stand incredible Border Patrol finally loophole Border",32061,<UNK>,<UNK>,realDonaldTrump
1134134880860852225,2019-05-30 16:30:01+00:00,Just arrived in Colorado. Getting ready to deliver the commencement speech at the Air Force Academy graduation. Very exciting - probably will be broadcast live on TV. They want good ratings!,arrive Colorado get ready deliver commencement speech Force Academy graduation exciting probably broadcast live want good rating,11749,<UNK>,<UNK>,realDonaldTrump
1134134203308752898,2019-05-30 16:27:19+00:00,"Very sad to hear the news on the passing of my friend, Senator Thad Cochran. He was a real Senator with incredible values - even flew back to Senate from Mississippi for important Healthcare Vote when he was desperately ill. Thad never let our Country (or me) down!",hear news passing friend Senator Thad Cochran real Senator incredible value fly Senate Mississippi important Healthcare Vote desperately Thad country,14099,<UNK>,<UNK>,realDonaldTrump
1134120831389392896,2019-05-30 15:34:11+00:00,"Robert Mueller came to the Oval Office (along with other potential candidates) seeking to be named the Director of the FBI. He had already been in that position for 12 years, I told him NO. The next day he was named Special Counsel - A total Conflict of Interest. NICE!",Robert Mueller come Oval Office potential candidate seek name Director position year tell name Special Counsel total conflict Interest NICE,23397,<UNK>,<UNK>,realDonaldTrump
