id,created_at,original_text,clean_text,retweet_count,hashtags,mentions,original_author
1294419296047833091,2020-08-14 23:43:03+00:00,"...Steve Bullock is totally against your Second Amendment and just received an F rating from the @NRA. Steve, on the other hand, just received an A+ rating. Vote for Steve Daines. He has always had my Complete and Total Endorsement! #MTSEN",Steve Bullock totally Second Amendment receive rating @nra Steve hand receive rating vote Steve Daines Complete Total Endorsement MTSEN,7311,#MTSEN,@NRA,realDonaldTrump
1294419295003451399,2020-08-14 23:43:03+00:00,"Senator @SteveDaines is doing a tremendous job for the people of Montana! He just helped me pass the Great American Outdoors Act, which protects the Montana way of life. His opponent, Steve Bullock, would be an absolute horror for Montana...",Senator @SteveDaines tremendous people Montana help pass Great American Outdoors protect Montana life opponent Steve Bullock absolute horror Montana,13223,<UNK>,@SteveDaines,realDonaldTrump
1294419010512211971,2020-08-14 23:41:55+00:00,"Senator @CoryGardner is doing a terrific job - we just passed his landmark legislation, the Great American Outdoors Act. Strong on our Military, Vets and the Second Amendment, Cory has always had my Complete and Total Endorsement!",Senator @CoryGardner terrific pass landmark legislation Great American Outdoors strong military Vets Second Amendment Cory Complete Total Endorsement,8636,<UNK>,@CoryGardner,realDonaldTrump
1294400686772420609,2020-08-14 22:29:07+00:00,"The biggest difference between the Presidential Race in 2020 and that of 2016 is the 2016 candidate, Crooked Hillary Clinton, was much smarter and sharper than Slow Joe, we have even more ENTHUSIASM now, and @FoxNews has become politically correct and no longer the big deal!",big difference Presidential Race 2020 2016 2016 candidate Crooked Hillary Clinton smart sharp Slow enthusiasm @FoxNews politically correct long deal,27124,<UNK>,@FoxNews,realDonaldTrump
1294397381073678339,2020-08-14 22:15:59+00:00,"I promised YOU I would not take a dime of salary as your President. I donate the entire $400,000! It is my honor to give $100,000 to @NatlParkService to help repair and restore our GREAT National Monuments. So important to our American History! Thank You!!","promise dime salary President donate entire 400,000 honor 100,000 @NatlParkService help repair restore GREAT National Monuments important american history thank",61265,<UNK>,@NatlParkService,realDonaldTrump
1294388698738569224,2020-08-14 21:41:29+00:00,"Going up the East River Drive, and fast. THANK YOU NYPD! On November 3rd we’re bringing you back! #LESM #MAGA",go East River Drive fast thank NYPD November bring LESM maga,19309,#LESM #MAGA,<UNK>,realDonaldTrump
1294364456370286596,2020-08-14 20:05:09+00:00,"Just landed in New York to see my brother, Robert. We’re going for New York on November 3rd. We’re going to Reduce Taxes, Increase Law Enforcement, and bring it back BIG TIME! #MAGA",land York brother Robert go York November go reduce taxis Increase Enforcement bring time maga,22834,#MAGA,<UNK>,realDonaldTrump
1294348702987894784,2020-08-14 19:02:33+00:00,I am ready to send Rental Assistance payments to hardworking Americans that have been hurt by the ChinaVirus. DEMOCRATS ARE HOLDING THIS UP!,ready send rental assistance payment hardworking Americans hurt ChinaVirus DEMOCRATS hold,34740,<UNK>,<UNK>,realDonaldTrump
1294346904629805057,2020-08-14 18:55:24+00:00,I am ready to send $105B to the states to help open schools safely with additional PPE. DEMOCRATS ARE HOLDING THIS UP!,ready send 105b state help open school safely additional DEMOCRATS hold,31107,<UNK>,<UNK>,realDonaldTrump
1294345293824106496,2020-08-14 18:49:00+00:00,Great News!,Great News,9611,<UNK>,<UNK>,realDonaldTrump
1294309521922437120,2020-08-14 16:26:51+00:00,"I am ready to send more money to States and Local governments to save jobs for Police, Fire Fighters, First Responders, and Teachers. DEMOCRATS ARE HOLDING THIS UP!",ready send money States local government save job Police Fire Fighters Responders teacher DEMOCRATS hold,32656,<UNK>,<UNK>,realDonaldTrump
1294309253717598213,2020-08-14 16:25:47+00:00,I am ready to have @USTreasury and @SBA send additional PPP payments to small businesses that have been hurt by the ChinaVirus. DEMOCRATS ARE HOLDING THIS UP!,ready @ustreasury @SBA send additional payment small business hurt ChinaVirus DEMOCRATS hold,17975,<UNK>,@USTreasury @SBA,realDonaldTrump
1294308655718969345,2020-08-14 16:23:25+00:00,"I have directed @stevenmnuchin1 to get ready to send direct payments ($3,400 for family of four) to all Americans. DEMOCRATS ARE HOLDING THIS UP!","direct @stevenmnuchin1 ready send direct payment 3,400 family Americans DEMOCRATS hold",36914,<UNK>,@stevenmnuchin1,realDonaldTrump
1294307884055040001,2020-08-14 16:20:21+00:00,...Congress should send me H.R.473 ASAP and make this happen! It will INSPIRE all women to continue being bold and brave in achieving their DREAMS!,Congress send H.R.473 ASAP happen inspire woman continue bold brave achieve dreams,11263,<UNK>,<UNK>,realDonaldTrump
1294307882524119040,2020-08-14 16:20:20+00:00,"I have done more for WOMEN than just about any President in HISTORY! As we celebrate the 100th Anniversary of women’s voting rights, we should build a BEAUTIFUL STATUE in Washington D.C. to honor the many brave women who made this possible for our GREAT COUNTRY...",WOMEN President HISTORY celebrate 100th anniversary woman voting right build BEAUTIFUL STATUE Washington D.C. honor brave woman possible great COUNTRY,34573,<UNK>,<UNK>,realDonaldTrump
1294307234017681413,2020-08-14 16:17:46+00:00,"...The Bob Woodward book will be a FAKE, as always, just as many of the others have been. But, believe it or not, lately I’ve been getting lots of GREAT books!",Woodward book fake believe lately get lot great book,7246,<UNK>,<UNK>,realDonaldTrump
1294307233094934530,2020-08-14 16:17:46+00:00,"Everybody does phony books on Donald Trump and Republicans, just like the Fake Dossier, which turned out to be a total fraud perpetrated by Crooked Hillary Clinton and the DNC...",everybody phony book Donald Trump Republicans like Fake Dossier turn total fraud perpetrate Crooked Hillary Clinton,14670,<UNK>,<UNK>,realDonaldTrump
1294270573011492864,2020-08-14 13:52:05+00:00,Vote for TRUMP on November 3rd. I am going to bring our beloved New York back!,vote TRUMP November go bring beloved York,27074,<UNK>,<UNK>,realDonaldTrump
1294268813194801160,2020-08-14 13:45:06+00:00,Fake News will never change!,Fake News change,11652,<UNK>,<UNK>,realDonaldTrump
1294264832200515584,2020-08-14 13:29:16+00:00,"Today, we honor the brave Native American/First Nations soldiers who served our Nation and played a vital role in America's victory in WWII. The Navajo Code was never broken and saved untold American lives. Our country will be forever grateful. Happy Navajo Code Talkers Day!",today honor brave Native American Nations soldier serve Nation play vital role America victory WWII Navajo Code break save untold american life country forever grateful Happy Navajo Code Talkers,29972,<UNK>,<UNK>,realDonaldTrump
1294238798944129026,2020-08-14 11:45:50+00:00,Thank you Debbie!,thank Debbie,8271,<UNK>,<UNK>,realDonaldTrump
1294237653093756930,2020-08-14 11:41:16+00:00,Thank you!,thank,7923,<UNK>,<UNK>,realDonaldTrump
1294235587931668481,2020-08-14 11:33:04+00:00,"It was showing signs of future problems, but was so good when I left 4 years ago!",show sign future problem good leave year,10368,<UNK>,<UNK>,realDonaldTrump
1294235168471953409,2020-08-14 11:31:24+00:00,"Thank you James. Sadly, you are 100% correct!!!",thank James sadly correct,59510,<UNK>,<UNK>,realDonaldTrump
1294052825845182464,2020-08-13 23:26:50+00:00,".@DonYoungAK really produces for Alaska. He is an incredible Congressman who loves his State and works tirelessly for it. Strong on Public Lands, Energy, and our Second Amendment. He will never let you down, and has my Complete and Total Endorsement!",.@DonYoungAK produce Alaska incredible congressman love state work tirelessly strong Public Lands Energy Second Amendment Complete Total Endorsement,8783,<UNK>,@DonYoungAK,realDonaldTrump
1294051967933841415,2020-08-13 23:23:26+00:00,"...She will be a great Senator, and has my Complete and Total Endorsement!",great senator Complete Total Endorsement,6130,<UNK>,<UNK>,realDonaldTrump
1294051966818177026,2020-08-13 23:23:25+00:00,".@CynthiaMLummis is a friend of mine and a great woman. She is running for Senate in the very Special State of Wyoming. Cynthia is Strongly for our Military, our Vets, and protection of the Second Amendment...",.@CynthiaMLummis friend great woman run Senate special State Wyoming Cynthia strongly military Vets protection Second Amendment,15379,<UNK>,@CynthiaMLummis,realDonaldTrump
1293976130416861184,2020-08-13 18:22:05+00:00, https://twitter.com/realDonaldTrump/status/1293922936609546240,,17836,<UNK>,<UNK>,realDonaldTrump
1293937894525227013,2020-08-13 15:50:08+00:00,The world will be laughing and taking full advantage of the United States if Joe Biden ever became President. Our Country would COLLAPSE!,world laugh take advantage United States Biden President country collapse,32283,<UNK>,<UNK>,realDonaldTrump
1293937233037230080,2020-08-13 15:47:31+00:00,"Great National Champions, thank you Coach O!",Great National Champions thank Coach,11665,<UNK>,<UNK>,realDonaldTrump
1293922936609546240,2020-08-13 14:50:42+00:00,"HUGE breakthrough today! Historic Peace Agreement between our two GREAT friends, Israel and the United Arab Emirates!",HUGE breakthrough today Historic Peace Agreement great friend Israel United Arab Emirates,70045,<UNK>,<UNK>,realDonaldTrump
1293922803419353088,2020-08-13 14:50:10+00:00,"Joint Statement of the United States, the State of Israel, and the United Arab Emirates",Joint Statement United States State Israel United Arab Emirates,35111,<UNK>,<UNK>,realDonaldTrump
1293909392459350019,2020-08-13 13:56:53+00:00,"Drug companies, which are being forced by me to substantially reduce Drug Prices, are taking $millions in ads saying I want to increase Medicare Primiums. Wrong, just the opposite! These ads show DRUG PRICES ARE GOING DOWN, and they are not happy! False advertising!",drug company force substantially reduce Drug Prices take million say want increase Medicare Primiums wrong opposite drug price go happy false advertising,42189,<UNK>,<UNK>,realDonaldTrump
1293869227036811265,2020-08-13 11:17:17+00:00,"The Fake News Media is giving @KamalaHarris a free pass despite her Radical Left failures and very poor run in the Democrat Primary. There was nobody meaner or more condescending to Slow Joe, not even me, and yet she quickly evaporated down to almost zero in the polls. Bad!",Fake News Media give @KamalaHarris free pass despite radical left failure poor Democrat Primary mean condescending slow quickly evaporate zero poll,29727,<UNK>,@KamalaHarris,realDonaldTrump
1293861034009268224,2020-08-13 10:44:43+00:00,"Very poor morning TV ratings for MSDNC’s Morning Joe, headed by a complete Psycho named Joe Scarborough and his ditzy airhead wife, Mika, and also @CNN, headed by complete unknowns. Congratulations to @foxandfriends on dominating the mornings (thank you President Trump!).",poor morning rating MSDNC Morning head complete Psycho name Scarborough ditzy airhead wife Mika @CNN head complete unknown congratulation @foxandfriend dominate morning thank President Trump,24309,<UNK>,@CNN @foxandfriends,realDonaldTrump
1293860654626078721,2020-08-13 10:43:13+00:00,I will be interviewed by @MariaBartiromo on @FoxBusiness this morning at 7:30. A.M. Enjoy!,interview @MariaBartiromo @foxbusiness morning 7:30 A.M. Enjoy,11094,<UNK>,@MariaBartiromo @FoxBusiness,realDonaldTrump
1293619734894837760,2020-08-12 18:45:53+00:00,I am sending $15M from @USDOT to beautiful North Dakota! This federal funding will support bus service for people from Bismarck to Grand Forks and several other areas statewide. Congratulations!,send @USDOT beautiful North Dakota federal funding support service people Bismarck Grand Forks area statewide congratulation,15629,<UNK>,@USDOT,realDonaldTrump
1293619626681737219,2020-08-12 18:45:27+00:00,Congrats to Colorado who will be receiving $14.9M in federal infrastructure funds from @USDOT. Happy to support bus service for residents throughout this great state!,congrat Colorado receive 14.9 federal infrastructure fund @USDOT happy support service resident great state,12374,<UNK>,@USDOT,realDonaldTrump
1293619360762925057,2020-08-12 18:44:24+00:00,Honored to send $25.9 MILLION in @USDOT funds to the great State of Texas to support bus infrastructure improvements. Congratulations to the MANY Texans who will benefit!,honor send 25.9 million @USDOT fund great State Texas support infrastructure improvement congratulation Texans benefit,13314,<UNK>,@USDOT,realDonaldTrump
1293619293628829696,2020-08-12 18:44:08+00:00,Big news for Wisconsin! @USDOT is awarding $7.7M in federal infrastructure funds to support bus service for the people of Madison and Milwaukee County!,news Wisconsin @USDOT award federal infrastructure fund support service people Madison Milwaukee County,10359,<UNK>,@USDOT,realDonaldTrump
1293619264973414401,2020-08-12 18:44:01+00:00,"Good news for Florida! I’m awarding $27.8M from @USDOT in federal infrastructure funds to five areas including Orlando, Jacksonville, Ft. Myers/Naples, St. Petersburg, and Tampa. Happy to support bus service for the people in beautiful Florida!",good news Florida award 27.8 @USDOT federal infrastructure fund area include Orlando Jacksonville Myers Naples Petersburg Tampa happy support service people beautiful Florida,9662,<UNK>,@USDOT,realDonaldTrump
1293619226020806659,2020-08-12 18:43:52+00:00,Georgia will be receiving $13M in federal infrastructure funds from @USDOT. BIG investment in bus facilities for people in metro Atlanta – must keep people moving safely! @MARTASERVICE,Georgia receive federal infrastructure fund @USDOT investment facility people metro Atlanta people move safely @MARTASERVICE,8017,<UNK>,@USDOT @MARTASERVICE,realDonaldTrump
1293619197096927232,2020-08-12 18:43:45+00:00,Big improvements in rural bus service will be on their way to Michigan! I am awarding $27.8M in federal funding through @USDOT to improve bus service statewide. SO important for transit in this great state!,improvement rural service Michigan award 27.8 federal funding @USDOT improve service statewide important transit great state,8520,<UNK>,@USDOT,realDonaldTrump
1293619155422400512,2020-08-12 18:43:35+00:00,"Sending $8.3M in @USDOT funding to North Carolina for bus and bus facility improvements in Asheville, Fayetteville, and Chapel Hill. Glad to support bus service in these areas!",send @USDOT funding North Carolina facility improvement Asheville Fayetteville Chapel Hill glad support service area,9649,<UNK>,@USDOT,realDonaldTrump
1293619129354801163,2020-08-12 18:43:29+00:00,New Hampshire will receive nearly $822K in @USDOT funds for bus service in the city of Nashua. Happy to support @RideBigBlue and keep the people of Nashua moving!,Hampshire receive nearly @usdot fund service city Nashua happy support @RideBigBlue people Nashua move,7296,<UNK>,@USDOT @Ridebigblue,realDonaldTrump
1293619109180080128,2020-08-12 18:43:24+00:00,Congrats to Pennsylvania for receiving $11.5M in federal infrastructure funds from @USDOT. Huge investments in Hazleton and Erie County to improve transit service and bring an economic boost to these areas!,congrat Pennsylvania receive 11.5 federal infrastructure fund @USDOT huge investment Hazleton Erie County improve transit service bring economic boost area,9058,<UNK>,@USDOT,realDonaldTrump
1293619078129692672,2020-08-12 18:43:17+00:00,"BIG bucks heading to Illinois! $18.9M in federal infrastructure funds from @USDOT will be awarded to @ConnectTransit, @CityLinkPeoria, and @PaceSuburbanBus for improvements to bus service in the areas. Congratulations!",buck head Illinois 18.9 federal infrastructure fund @USDOT award @ConnectTransit @CityLinkPeoria @pacesuburbanbus improvement service area congratulation,6821,<UNK>,@USDOT @ConnectTransit @CityLinkPeoria @PaceSuburbanBus,realDonaldTrump
1293619029836468224,2020-08-12 18:43:05+00:00,$13.9M is heading to New Orleans in @USDOT funding for @NewOrleansRTA! Happy to support bus service and major fleet improvements for the great people of Louisiana and help them keep moving safely.,13.9 head Orleans @USDOT funding @NewOrleansRTA happy support service major fleet improvement great people Louisiana help move safely,6931,<UNK>,@USDOT @NewOrleansRTA,realDonaldTrump
1293618992150720512,2020-08-12 18:42:56+00:00,I’m awarding $14.7M in @USDOT funding to New Jersey to support bus infrastructure in @passaic_county. Helping make sure people can move quickly and safely!,award 14.7 @USDOT funding Jersey support infrastructure @passaic_county help sure people quickly safely,7003,<UNK>,@USDOT @passaic_county,realDonaldTrump
1293618947586248704,2020-08-12 18:42:46+00:00,Happy to send $18 MILLION in @USDOT funding to Utah to support their transit infrastructure and improve bus service. Huge and badly needed investment in the Cache Valley Region!,happy send million @usdot funding Utah support transit infrastructure improve service huge badly need investment Cache Valley Region,8051,<UNK>,@USDOT,realDonaldTrump
1293618908654645248,2020-08-12 18:42:36+00:00,Bus investments are in the works for the people of Nebraska! I’m sending $13.6M from @USDOT in federal infrastructure funds for improvements to bus service in Omaha. Great news!,investment work people Nebraska send 13.6 @USDOT federal infrastructure fund improvement service Omaha great news,7686,<UNK>,@USDOT,realDonaldTrump
1293618870746570756,2020-08-12 18:42:27+00:00,Happy to announce that @USDOT is providing $12.5M in federal infrastructure funds for bus improvements for the great people of Alabama. @huntsvillecity,happy announce @USDOT provide 12.5 federal infrastructure fund improvement great people Alabama @huntsvillecity,7034,<UNK>,@USDOT @huntsvillecity,realDonaldTrump
1293618631943901185,2020-08-12 18:41:30+00:00,"Big news, Oklahoma! I’m proud to support infrastructure in your state with $13.7 million from @USDOT for bus improvements across the state. SO important for helping people get where they need to go safely.",news Oklahoma proud support infrastructure state 13.7 million @USDOT improvement state important help people need safely,10259,<UNK>,@USDOT,realDonaldTrump
1293586660790239238,2020-08-12 16:34:28+00:00,"Congratulations to Andrew Clyde on a big win last night against a strong opponent in #GA09! An early supporter of ours, Andrew will be an incredible Congressman for the people of Georgia!",congratulation Andrew Clyde night strong opponent GA09 early supporter Andrew incredible congressman people Georgia,15798,#GA09,<UNK>,realDonaldTrump
1293525010523578375,2020-08-12 12:29:29+00:00,Congratulations to future Republican Star Marjorie Taylor Greene on a big Congressional primary win in Georgia against a very tough and smart opponent. Marjorie is strong on everything and never gives up - a real WINNER!,congratulation future republican Star Marjorie Taylor Greene congressional primary Georgia tough smart opponent Marjorie strong give real WINNER,19016,<UNK>,<UNK>,realDonaldTrump
1293520377952567307,2020-08-12 12:11:05+00:00,"Watched @billmaher last week for the first time in a long time. He’s totally SHOT, looks terrible, exhausted, gaunt, and weak. If there was ever a good reason for no shutdown, check out this jerk. He never had much going for him, but whatever he did have is missing in action!",watch @billmaher week time long time totally shoot look terrible exhausted gaunt weak good reason shutdown check jerk go miss action,14056,<UNK>,@billmaher,realDonaldTrump
1293517514798960640,2020-08-12 11:59:42+00:00,"The “suburban housewife” will be voting for me. They want safety & are thrilled that I ended the long running program where low income housing would invade their neighborhood. Biden would reinstall it, in a bigger form, with Corey Booker in charge! @foxandfriends @MariaBartiromo",suburban housewife vote want safety thrill end long running program income housing invade neighborhood Biden reinstall big form Corey Booker charge @foxandfriend @mariabartiromo,28345,<UNK>,@foxandfriends @MariaBartiromo,realDonaldTrump
1293513735533924352,2020-08-12 11:44:41+00:00,"96% Approval Rating in the Republican Party. Thank you! Also, leading in most swing states!",Approval Rating Republican Party thank lead swing state,40637,<UNK>,<UNK>,realDonaldTrump
1293510853074051073,2020-08-12 11:33:14+00:00,".@KamalaHarris started strong in the Democrat Primaries, and finished weak, ultimately fleeing the race with almost zero support. That’s the kind of opponent everyone dreams of!",.@KamalaHarris start strong Democrat Primaries finish weak ultimately flee race zero support kind opponent dream,32498,<UNK>,@KamalaHarris,realDonaldTrump
1293335445879820288,2020-08-11 23:56:13+00:00,"Sad to see the damage from the derecho in Midwest. 112 mile per hour winds in Midway, Iowa! The Federal government is in close coordination with State officials. We are with you all the way - Stay safe and strong!",damage derecho Midwest mile hour wind Midway Iowa Federal government close coordination State official stay safe strong,21625,<UNK>,<UNK>,realDonaldTrump
1293335144775004160,2020-08-11 23:55:02+00:00,"Thank you to Sheriff Gonzales of Bernalillo County, New Mexico, for joining my call with our Nation’s sheriffs. Appreciate your partnership to help make your county safe – great comments on Operation Legend!",thank Sheriff Gonzales Bernalillo County Mexico join nation sheriff appreciate partnership help county safe great comment Operation Legend,15785,<UNK>,<UNK>,realDonaldTrump
1293314244008644609,2020-08-11 22:31:59+00:00,Will be interviewed tonight on @seanhannity at 9:00 P.M. @FoxNews,interview tonight @seanhannity 9:00 P.M. @foxnews,15877,<UNK>,@seanhannity @FoxNews,realDonaldTrump
1293163818282094594,2020-08-11 12:34:14+00:00,Big Stock Market Numbers!,Stock Market Numbers,31465,<UNK>,<UNK>,realDonaldTrump
1293163704188645385,2020-08-11 12:33:47+00:00,"More Testing, which is a good thing (we have the most in the world), equals more Cases, which is Fake News Gold. They use Cases to demean the incredible job being done by the great men & women of the U.S. fighting the China Plague!",testing good thing world equal case Fake News Gold case demean incredible great woman U.S. fight China Plague,25639,<UNK>,<UNK>,realDonaldTrump
1293151454069391360,2020-08-11 11:45:06+00:00,"..so called American Intelligence were Dirty Cops who have now proven to be sleazebags at the highest level like James Comey, proven liar James Clapper, & perhaps the lowest of them all, Wacko John Brennan who headed the CIA, you could perhaps understand my reluctance to embrace!",call American Intelligence Dirty cop prove sleazebag high level like James Comey prove liar James Clapper low Wacko John Brennan head understand reluctance embrace,23868,<UNK>,<UNK>,realDonaldTrump
1293151453029322753,2020-08-11 11:45:06+00:00,"John Bolton, one of the dumbest people I’ve met in government and sadly, I’ve met plenty, states often that I respected, and even trusted, Vladimir Putin of Russia more than those in our Intelligence Agencies. While of course that is not true, if the first people you met from....",John Bolton dumb people government sadly plenty state respect trust Vladimir Putin Russia Intelligence Agencies course true people,25586,<UNK>,<UNK>,realDonaldTrump
1293141672440877056,2020-08-11 11:06:14+00:00,"....went on at the White House during some extremely interesting and important times. So many good stories by someone who, unlike most other so called writers, was actually there, and a part of the action - of which there was plenty. Go buy this book, a job well done!",go White House extremely interesting important time good story unlike call writer actually action plenty book,11440,<UNK>,<UNK>,realDonaldTrump
1293141671509659650,2020-08-11 11:06:14+00:00,"Great new book by former Director of Oval Office Operations, Madeleine Westerhout, entitled “Off the Record”. When I look at all of the Fake Books and garbage written about me, it’s really nice to see a very smart and already wise young woman write an honest depiction of what....",great book Director Oval Office Operations Madeleine Westerhout entitle Record look Fake Books garbage write nice smart wise young woman write honest depiction,17935,<UNK>,<UNK>,realDonaldTrump
1292908143920455681,2020-08-10 19:38:17+00:00,White House News Conference today at 5:30 P.M. Enjoy!,White House News Conference today 5:30 P.M. Enjoy,17629,<UNK>,<UNK>,realDonaldTrump
1292886763690745859,2020-08-10 18:13:19+00:00,Play College Football!,Play College Football,57828,<UNK>,<UNK>,realDonaldTrump
1292880642276036608,2020-08-10 17:49:00+00:00,...Jason worked with me to save Minneapolis along with your great National Guard after your local political leaders failed to do so. Jason has my Complete and Total Endorsement! #MNSEN,Jason work save Minneapolis great National Guard local political leader fail Jason Complete Total Endorsement MNSEN,5976,#MNSEN,<UNK>,realDonaldTrump
1292880641311334400,2020-08-10 17:49:00+00:00,"Jason Lewis (@LewisForMN) will be an incredible Senator for the State of Minnesota! He is a proven leader who will help us Lower your Taxes, Protect our Communities and Defend your Second Amendment…",Jason Lewis @LewisForMN incredible Senator State Minnesota proven leader help lower taxis protect community defend Second Amendment,11421,<UNK>,@LewisForMN,realDonaldTrump
