id,created_at,original_text,clean_text,retweet_count,hashtags,mentions,original_author
1187934016235888641,2019-10-26 03:28:34+00:00,https://twitter.com/robertjeffress/status/1187763371837415424,,9718,<UNK>,<UNK>,realDonaldTrump
1187917572102078465,2019-10-26 02:23:14+00:00,https://twitter.com/realDonaldTrump/status/1187819045690773504,,13824,<UNK>,<UNK>,realDonaldTrump
1187876694859882503,2019-10-25 23:40:48+00:00,Great Book!,Great Book,7870,<UNK>,<UNK>,realDonaldTrump
1187876420342689792,2019-10-25 23:39:42+00:00,Wow!,,13838,<UNK>,<UNK>,realDonaldTrump
1187874908660998144,2019-10-25 23:33:42+00:00,My lawyers should sue the Democrats and Shifty Adam Schiff for fraud!,lawyer Democrats Shifty Adam Schiff fraud,23175,<UNK>,<UNK>,realDonaldTrump
1187874124976271362,2019-10-25 23:30:35+00:00,"....The entire Impeachment Scam was based on my perfect Ukrainian call, and the Whistleblowers account of that call, which turned out to be false (a fraud?). Once I released the actual call, their entire case fell apart. The Democrats must end this Scam now. Witch Hunt!",entire Impeachment Scam base perfect ukrainian Whistleblowers account turn false fraud release actual entire case fall apart Democrats scam witch Hunt,14221,<UNK>,<UNK>,realDonaldTrump
1187874122279337987,2019-10-25 23:30:35+00:00,"Democrats just announced that they no longer want the Whistleblower to testify. But everything was about the Whistleblower (they no longer want the second Whistleblower either), which they don’t want because the account of my call bore NO RELATIONSHIP to the call itself.....",Democrats announce longer want Whistleblower testify Whistleblower longer want second Whistleblower want account bore relationship,19252,<UNK>,<UNK>,realDonaldTrump
1187861209942495234,2019-10-25 22:39:16+00:00,To Tim: The Button on the IPhone was FAR better than the Swipe!,Button IPhone well Swipe,28005,<UNK>,<UNK>,realDonaldTrump
1187838852255244288,2019-10-25 21:10:26+00:00,"....in the basement of the United States Capitol! They cannot win at the ballot box. Their sham for the past 3 years continues. The good news is that the American People get it, which will be proven once again on November 3, 2020!",basement United States Capitol ballot sham past year continue good news american People prove November 2020,12208,<UNK>,<UNK>,realDonaldTrump
1187838848732020737,2019-10-25 21:10:25+00:00,"I appreciate the support of Senator @LindseyGraham, @SenateMajLdr Mitch McConnell, and their Great Senate Republican colleagues, on the resolution condemning the Do Nothing Democrats for their Witch Hunt Impeachment inquiry, behind closed doors....",appreciate support Senator @LindseyGraham @SenateMajLdr Mitch McConnell great Senate republican colleague resolution condemn Democrats Witch Hunt Impeachment inquiry closed door,14344,<UNK>,@LindseyGraham @senatemajldr,realDonaldTrump
1187819045690773504,2019-10-25 19:51:43+00:00,"It was my great honor to deliver the keynote address at the 2019 Second Step Presidential Justice Forum hosted by the 20/20 Bipartisan Justice Center in South Carolina, and my true honor to receive the Bipartisan Justice Award, thank you!",great honor deliver keynote address 2019 Second Step Presidential Justice Forum host 20/20 Bipartisan Justice Center South Carolina true honor receive Bipartisan Justice Award thank,16046,<UNK>,<UNK>,realDonaldTrump
1187790279765647361,2019-10-25 17:57:25+00:00,Thank you @robertjeffress!,thank @robertjeffress,9133,<UNK>,@robertjeffress,realDonaldTrump
1187783467389444096,2019-10-25 17:30:21+00:00,Heading to South Carolina!,head South Carolina,11787,<UNK>,<UNK>,realDonaldTrump
1187714024378646531,2019-10-25 12:54:24+00:00,"“Donald J. Trump is an absolutely historic President already, in less than 3 years in office. His record is there for everyone to look at & to examine and compare. This is an illegitimate effort to overthrow a President, not a formal Impeachment inquiry.” @LouDobbs Thank you Lou",Donald Trump absolutely historic President year office record look examine compare illegitimate effort overthrow President formal Impeachment inquiry @LouDobbs thank,21179,<UNK>,@LouDobbs,realDonaldTrump
1187708412685107200,2019-10-25 12:32:06+00:00,"....COMING HOME! We were supposed to be there for 30 days - That was 10 years ago. When these pundit fools who have called the Middle East wrong for 20 years ask what we are getting out of the deal, I simply say, THE OIL, AND WE ARE BRINGING OUR SOLDIERS BACK HOME, ISIS SECURED!",come HOME suppose day year pundit fool call Middle East wrong year get deal simply bring soldier home isis SECURED,11102,<UNK>,<UNK>,realDonaldTrump
1187708411309375488,2019-10-25 12:32:06+00:00,"....USA has gained Trillions of Dollars in wealth since November 2016. All others way down. Our power is Economic before having to use our newly rebuilt Military, a much better alternative. Oil is secured. Our soldiers have left and are leaving Syria for other places, then....",gain Trillions dollar wealth November 2016 power economic have newly rebuild Military well alternative secure soldier leave leave Syria place,9459,<UNK>,<UNK>,realDonaldTrump
1187708410579603461,2019-10-25 12:32:06+00:00,Turkey fully understands not to fire on the Kurds as they leave what will be known as the Safe Zone for other fairly nearby areas. I don’t have to repeat that large scale Sanctions will be imposed for violations. Going well! ISIS secured by Kurds with Turkey ready as backup.....,Turkey fully understand fire Kurds leave know Safe Zone fairly nearby area repeat large scale sanction impose violation go isis secure Kurds Turkey ready backup,13311,<UNK>,<UNK>,realDonaldTrump
1187704353324503040,2019-10-25 12:15:58+00:00,"So Congressman Tim Ryan of Ohio has finally dropped out of the race for President, registering ZERO in the polls & unable to even qualify for the debate stage. See Tim, it’s not so easy out there if you don’t know what you’re doing. He wasn’t effective for USA workers, just talk!",Congressman Ryan Ohio finally drop race President register ZERO poll unable qualify debate stage easy know effective worker talk,11504,<UNK>,<UNK>,realDonaldTrump
1187703447744843776,2019-10-25 12:12:23+00:00,"Another big dropout of the Presidential race was, along with 0% Tim Ryan, 0% @RepSwalwell. Such talk and bravado from both, and nothing to show. They stood for nothing, and the voters couldn’t stand by them. Obnoxious and greedy politicians never make it in the end!",dropout presidential race Ryan @repswalwell talk bravado stand voter stand obnoxious greedy politician,14178,<UNK>,@RepSwalwell,realDonaldTrump
1187547459700121600,2019-10-25 01:52:32+00:00,"Where is the Whistleblower, and why did he or she write such a fictitious and incorrect account of my phone call with the Ukrainian President? Why did the IG allow this to happen? Who is the so-called Informant (Schiff?) who was so inaccurate? A giant Scam!",Whistleblower write fictitious incorrect account phone ukrainian President allow happen call Informant Schiff inaccurate giant scam,29093,<UNK>,<UNK>,realDonaldTrump
1187395521805275137,2019-10-24 15:48:47+00:00,"I really enjoyed my conversation with General @MazloumAbdi. He appreciates what we have done, and I appreciate what the Kurds have done. Perhaps it is time for the Kurds to start heading to the Oil Region!",enjoy conversation General @MazloumAbdi appreciate appreciate Kurds time Kurds start head Region,13916,<UNK>,@MazloumAbdi,realDonaldTrump
1187389630271934464,2019-10-24 15:25:23+00:00,The Oil Fields discussed in my speech on Turkey/Kurds yesterday were held by ISIS until the United States took them over with the help of the Kurds. We will NEVER let a reconstituted ISIS have those fields!,Fields discuss speech Turkey Kurds yesterday hold ISIS United States take help Kurds reconstitute ISIS field,15936,<UNK>,<UNK>,realDonaldTrump
1187375419022069761,2019-10-24 14:28:54+00:00,"Thank you to House Republicans for being tough, smart, and understanding in detail the greatest Witch Hunt in American History. It has been going on since long before I even got Elected (the Insurance Policy!). A total Scam!",thank House Republicans tough smart understanding detail great Witch Hunt american History go long elect Insurance Policy total scam,22052,<UNK>,<UNK>,realDonaldTrump
1187373187820130306,2019-10-24 14:20:02+00:00,"The Federal Reserve is derelict in its duties if it doesn’t lower the Rate and even, ideally, stimulate. Take a look around the World at our competitors. Germany and others are actually GETTING PAID to borrow money. Fed was way too fast to raise, and way too slow to cut!",Federal Reserve derelict duty lower rate ideally stimulate look World competitor Germany actually GETTING PAID borrow money fast raise slow,20189,<UNK>,<UNK>,realDonaldTrump
1187227271935021057,2019-10-24 04:40:13+00:00,Don’t hurt them please!,hurt,14095,<UNK>,<UNK>,realDonaldTrump
1187225389892022273,2019-10-24 04:32:45+00:00,It is the only thing the Do Nothing Dems are doing!,thing Dems,8399,<UNK>,<UNK>,realDonaldTrump
1187224585663635456,2019-10-24 04:29:33+00:00,Just a continuation of the Witch Hunt!,continuation Witch Hunt,11029,<UNK>,<UNK>,realDonaldTrump
1187222295556874241,2019-10-24 04:20:27+00:00,"(Kiddingly) We’re building a Wall in Colorado”(then stated, “we’re not building a Wall in Kansas but they get the benefit of the Wall we’re building on the Border”) refered to people in the very packed auditorium, from Colorado & Kansas, getting the benefit of the Border Wall!",Kiddingly build Wall Colorado”(then state build Wall Kansas benefit Wall build Border refer people packed auditorium Colorado Kansas get benefit Border Wall,12683,<UNK>,<UNK>,realDonaldTrump
1187116372997922821,2019-10-23 21:19:33+00:00,"PROMISES MADE, PROMISES KEPT! #SHALEINSIGHT2019",promise promise KEPT SHALEINSIGHT2019,15569,#SHALEINSIGHT2019,<UNK>,realDonaldTrump
1187114497384898560,2019-10-23 21:12:06+00:00,"It was wonderful to be back in Pittsburgh, Pennsylvania with the incredible Patriots who fuel our factories, light up our homes, power our industries and fill our hearts with true American Pride! #SHALEINSIGHT2019",wonderful Pittsburgh Pennsylvania incredible patriot fuel factory light home power industry fill heart true American Pride SHALEINSIGHT2019,13130,#SHALEINSIGHT2019,<UNK>,realDonaldTrump
1187081515051601920,2019-10-23 19:01:02+00:00,"It would be really great if the people within the Trump Administration, all well-meaning and good (I hope!), could stop hiring Never Trumpers, who are worse than the Do Nothing Democrats. Nothing good will ever come from them!",great people Trump Administration mean good hope stop hire Trumpers bad Democrats good come,22500,<UNK>,<UNK>,realDonaldTrump
1187080935373713408,2019-10-23 18:58:44+00:00,"....Does anybody think this is fair? Even though there was no quid pro quo, I’m sure they would like to try. Worse than the Dems!",anybody think fair quid sure like bad Dems,10270,<UNK>,<UNK>,realDonaldTrump
1187080923961012228,2019-10-23 18:58:41+00:00,"Never Trumper Republican John Bellinger, represents Never Trumper Diplomat Bill Taylor (who I don’t know), in testimony before Congress! Do Nothing Democrats allow Republicans Zero Representation, Zero due process, and Zero Transparency....",Trumper Republican John Bellinger represent Trumper Diplomat Bill Taylor know testimony Congress democrat allow Republicans Zero Representation Zero process Zero Transparency,15509,<UNK>,<UNK>,realDonaldTrump
1187063301731209220,2019-10-23 17:48:40+00:00,"The Never Trumper Republicans, though on respirators with not many left, are in certain ways worse and more dangerous for our Country than the Do Nothing Democrats. Watch out for them, they are human scum!",Trumper Republicans respirator leave certain way bad dangerous country Democrats watch human scum,25288,<UNK>,<UNK>,realDonaldTrump
1187044861725286400,2019-10-23 16:35:23+00:00,Thank you General Mazloum for your kind words and courage. Please extend my warmest regards to the Kurdish people. I look forward to seeing you soon. @mustefabali,thank General Mazloum kind word courage extend warm regard kurdish people look forward see soon @mustefabali,12980,<UNK>,@mustefabali,realDonaldTrump
1186985677176655872,2019-10-23 12:40:13+00:00,Where’s the Whistleblower?,Whistleblower,25030,<UNK>,<UNK>,realDonaldTrump
1186985455058898945,2019-10-23 12:39:20+00:00,Big success on the Turkey/Syria Border. Safe Zone created! Ceasefire has held and combat missions have ended. Kurds are safe and have worked very nicely with us. Captured ISIS prisoners secured. I will be making a statement at 11:00 A.M. from the White House. Thank you!,success Turkey Syria Border Safe Zone create Ceasefire hold combat mission end Kurds safe work nicely capture ISIS prisoner secure make statement 11:00 A.M. White House thank,19264,<UNK>,<UNK>,realDonaldTrump
1186982949180317697,2019-10-23 12:29:22+00:00,"....feel EMPOWERED. There’s a movement happening on these campuses like I’ve never seen before. When you have 3000 students wanting to get into an event that couldn’t get in, that’s pretty remarkable!” @charliekirk11 Turning Point USA KEEP AMERICA GREAT!",feel EMPOWERED movement happen campus like see 3000 student want event pretty remarkable @charliekirk11 Turning Point AMERICA GREAT,10926,<UNK>,@charliekirk11,realDonaldTrump
1186982948404449280,2019-10-23 12:29:22+00:00,....Order a couple of months ago saying that any school that does not uphold the First Amendment Rights of its students will lose Federal Funding. We have seen a huge change in how the Universities interact with us as a national & local student organization. Our studends....,order couple month say school uphold Amendment Rights student lose Federal Funding see huge change Universities interact national local student organization studend,10318,<UNK>,<UNK>,realDonaldTrump
1186982946336624640,2019-10-23 12:29:22+00:00,"Young campus Conservatives are flocking to Turning Point USA & other Conservative speaker events all over the Country, AND IN RECORD NUMBERS. Thousands of students are turning out. “I just want to compliment the President of the United States for signing that historic Executive..",young campus conservative flock Turning Point conservative speaker event country record number thousand student turn want compliment President United States sign historic Executive,17188,<UNK>,<UNK>,realDonaldTrump
1186969632944611335,2019-10-23 11:36:27+00:00,Republicans are going to fight harder than ever to win back the House because of what the Do Nothing Democrats have done to our Country!,Republicans go fight hard House Democrats country,18716,<UNK>,<UNK>,realDonaldTrump
1186968579125792768,2019-10-23 11:32:16+00:00,Neither he (Taylor) or any other witness has provided testimony that the Ukrainians were aware that military aid was being withheld. You can’t have a quid pro quo with no quo.” Congressman John Ratcliffe @foxandfriends Where is the Whistleblower? The Do Nothing Dems case is DEAD!,Taylor witness provide testimony Ukrainians aware military withhold quid Congressman John Ratcliffe @foxandfriend Whistleblower Dems case DEAD,15396,<UNK>,@foxandfriends,realDonaldTrump
1186959459878350848,2019-10-23 10:56:02+00:00,It never ends. The Do Nothing Dems are terrible!,end Dems terrible,10580,<UNK>,<UNK>,realDonaldTrump
1186858593364172800,2019-10-23 04:15:14+00:00,Thank you Steve!,thank Steve,7457,<UNK>,<UNK>,realDonaldTrump
1186857437657214976,2019-10-23 04:10:38+00:00,The Democrats Scam goes on and on! They Do Nothing!,Democrats Scam go,9013,<UNK>,<UNK>,realDonaldTrump
1186856923636948993,2019-10-23 04:08:35+00:00,The Witch Hunt continues!,Witch Hunt continue,9927,<UNK>,<UNK>,realDonaldTrump
1186856554055852035,2019-10-23 04:07:07+00:00,The Do Nothing Dems have nothing but time!,Dems time,9599,<UNK>,<UNK>,realDonaldTrump
1186850642901557248,2019-10-23 03:43:38+00:00,"Wrong, never even discussed this with Kellyanne Conway or Steve Mnuchin. Just more Fake News!",wrong discuss Kellyanne Conway Steve Mnuchin Fake News,14132,<UNK>,<UNK>,realDonaldTrump
1186768817822806016,2019-10-22 22:18:29+00:00,"Good news seems to be happening with respect to Turkey, Syria and the Middle East. Further reports to come later!",good news happen respect Turkey Syria Middle East report come later,19022,<UNK>,<UNK>,realDonaldTrump
1186645111154847746,2019-10-22 14:06:55+00:00,Great Job Tim!,Great,9494,<UNK>,<UNK>,realDonaldTrump
1186638807984230403,2019-10-22 13:41:53+00:00,“The Democrats are trying to draw out this inquiry because they don’t have the support. Donald Trump is guilty only of winning the 2016 Election.” @MZHemingway @foxandfriends,Democrats try draw inquiry support Donald Trump guilty win 2016 Election @mzhemingway @foxandfriend,14136,<UNK>,@MZHemingway @foxandfriends,realDonaldTrump
1186635396567961601,2019-10-22 13:28:19+00:00,"Can’t believe that Nervous Nancy Pelosi isn’t moving faster on USMCA. Her people want it, they don’t know why she isn’t putting it up for a bipartisan vote. Taking too long!",believe Nervous Nancy Pelosi move fast USMCA people want know put bipartisan vote take long,18523,<UNK>,<UNK>,realDonaldTrump
1186612453368651777,2019-10-22 11:57:09+00:00,95% Approval Rating in the Republican Party. Thank you!,Approval Rating Republican Party thank,20060,<UNK>,<UNK>,realDonaldTrump
1186611810931236870,2019-10-22 11:54:36+00:00,Thank you Republicans. 185 out of 185 present voted for “US” last night. Really good!,thank Republicans present vote night good,15984,<UNK>,<UNK>,realDonaldTrump
1186611272231636992,2019-10-22 11:52:28+00:00,"So some day, if a Democrat becomes President and the Republicans win the House, even by a tiny margin, they can impeach the President, without due process or fairness or any legal rights. All Republicans must remember what they are witnessing here - a lynching. But we will WIN!",Democrat President Republicans House tiny margin impeach President process fairness legal right Republicans remember witness lynching,34528,<UNK>,<UNK>,realDonaldTrump
1186607396917002241,2019-10-22 11:37:04+00:00,....@kilmeade “I want to know about Hillary Clinton with the Dossier? I want to know if there was FISA abuse? We’re still waiting for that report!” @ainsleyearhardt @foxandfriends,@kilmeade want know Hillary Clinton dossier want know FISA abuse wait report @ainsleyearhardt @foxandfriends,10121,<UNK>,@kilmeade @ainsleyearhardt @foxandfriends,realDonaldTrump
1186607396090724353,2019-10-22 11:37:03+00:00,"...A majority do not want him Impeached and removed from office. 94% of the people in these battleground states who voted for President Trump want him to continue as President. That’s squarely in his corner.” @SteveDoocy “That’s a revealing poll, don’t you think that matters?”...",majority want impeach remove office people battleground state vote President Trump want continue President squarely corner @SteveDoocy revealing poll think matter,13198,<UNK>,@SteveDoocy,realDonaldTrump
1186603407769034752,2019-10-22 11:21:13+00:00,"“I thought a very revealing poll was done by The New York Times. By about a 10 point margin, those in battleground states polled are against impeaching the President, and if Nancy Pelosi doesn’t take note of that, maybe she is the third rate politician.” @kilmeade @foxandfriends",think revealing poll York Times point margin battleground state poll impeach President Nancy Pelosi note maybe rate politician @kilmeade @foxandfriends,12445,<UNK>,@kilmeade @foxandfriends,realDonaldTrump
1186600971130015744,2019-10-22 11:11:32+00:00,"“The Ambassador to the European Union has already testified, he said there was no quid pro quo. He said the President had told him that.” @kilmeade @foxandfriends",Ambassador European Union testify say quid say President tell @kilmeade @foxandfriend,10564,<UNK>,@kilmeade @foxandfriends,realDonaldTrump
1186500787922448384,2019-10-22 04:33:26+00:00,Congratulations to @JustinTrudeau on a wonderful and hard fought victory. Canada is well served. I look forward to working with you toward the betterment of both of our countries!,congratulation @justintrudeau wonderful hard fight victory Canada serve look forward work betterment country,9280,<UNK>,@JustinTrudeau,realDonaldTrump
1186440600712814593,2019-10-22 00:34:16+00:00,Thank you Liz. Shows great Republican support!,thank show great republican support,12195,<UNK>,<UNK>,realDonaldTrump
1186439731237789696,2019-10-22 00:30:49+00:00,Thank you Dan and Kevin. Great Vote!,thank Kevin Great Vote,7866,<UNK>,<UNK>,realDonaldTrump
1186418453202247684,2019-10-21 23:06:16+00:00,Will be interviewed by @seanhannity tonight at 9:00 P.M. on @FoxNews. Enjoy!,interview @seanhannity tonight 9:00 P.M. @FoxNews enjoy,9491,<UNK>,@seanhannity @FoxNews,realDonaldTrump
1186270381491081218,2019-10-21 13:17:53+00:00,"Doral in Miami would have been the best place to hold the G-7, and free, but too much heat from the Do Nothing Radical Left Democrats & their Partner, the Fake News Media! I’m surprised that they allow me to give up my $400,000 Plus Presidential Salary! We’ll find someplace else!","doral Miami good place hold free heat Radical Left Democrats Partner Fake News Media surprised allow 400,000 Plus Presidential Salary find someplace",20240,<UNK>,<UNK>,realDonaldTrump
1186258762920792065,2019-10-21 12:31:43+00:00,"Censure (at least) Corrupt Adam Schiff! After what he got caught doing, any pol who does not so vote cannot be honest....are you listening Dems?",censure corrupt Adam Schiff catch vote honest listen dem,21198,<UNK>,<UNK>,realDonaldTrump
1186257181689237504,2019-10-21 12:25:26+00:00,"Great new book by wonderful and very street smart author Dan Bongino, EXONERATED, THE FAILED TAKEDOWN OF PRESIDENT DONALD TRUMP BY THE SWAMP. Dan hits all of the crooked points of the greatest Witch Hunt in political history. Nevertheless, the Scam continues!",great book wonderful street smart author Bongino EXONERATED FAILED TAKEDOWN PRESIDENT DONALD TRUMP swamp hit crooked point great Witch Hunt political history scam continue,16260,<UNK>,<UNK>,realDonaldTrump
1186101761368571904,2019-10-21 02:07:51+00:00,A Great Democrat Scam!,great Democrat Scam,13599,<UNK>,<UNK>,realDonaldTrump
1186101103676526592,2019-10-21 02:05:14+00:00,Adam Schiff is a Corrupt Politician!,Adam Schiff corrupt politician,19455,<UNK>,<UNK>,realDonaldTrump
1186099074371596288,2019-10-21 01:57:10+00:00,Congratulations Barbara!,Congratulations Barbara,7422,<UNK>,<UNK>,realDonaldTrump
1186096913520693248,2019-10-21 01:48:35+00:00,"“To the Democrats, Impeachment is partisan politics dressed up as principle.” @SteveHiltonx @FoxNews",Democrats Impeachment partisan politic dress principle @SteveHiltonx @foxnews,9415,<UNK>,@SteveHiltonx @FoxNews,realDonaldTrump
1186049749989892105,2019-10-20 22:41:10+00:00,"So interesting that, when I announced Trump National Doral in Miami would be used for the hosting of the G-7, and then rescinded due to Do Nothing Democrat/Fake News Anger, very few in Media mentioned that NO PROFITS would be taken, or would be given FREE, if legally permissible!",interesting announce Trump National Doral Miami hosting rescind Democrat Fake News Anger medium mention PROFITS take give free legally permissible,18721,<UNK>,<UNK>,realDonaldTrump
1186035686396321793,2019-10-20 21:45:17+00:00,"....fiction to Congress and the American People? I demand his deposition. He is a fraud, just like the Russia Hoax was, and the Ukraine Hoax is now. When do the Do Nothing Democrats pay a price for what they are doing to our Country, & when do the Republicans finally fight back?",fiction Congress american People demand deposition fraud like Russia Hoax Ukraine Hoax Democrats price country Republicans finally fight,17032,<UNK>,<UNK>,realDonaldTrump
1186035685163257857,2019-10-20 21:45:17+00:00,....because their so-called story didn’t come even close to matching up with the exact transcript of the phone call. Was it a Corrupt Adam Schiff con? Why didn’t the IG see this? When do we depose Shifty Schiff to find out why he fraudulently made up my phone call and read this..,call story come close match exact transcript phone Corrupt Adam Schiff depose Shifty Schiff find fraudulently phone read,13974,<UNK>,<UNK>,realDonaldTrump
1186035684525727744,2019-10-20 21:45:17+00:00,"This Scam going on right now by the Democrats against the Republican Party, and me, was all about a perfect phone call I had with the Ukrainian President. He’s already stated, NO PRESSURE! Where is the Whistleblower, or the 2nd Whistleblower, or the “informant?” All gone.....",scam go right Democrats Republican Party perfect phone ukrainian President state PRESSURE Whistleblower Whistleblower informant go,21094,<UNK>,<UNK>,realDonaldTrump
1186016354572353536,2019-10-20 20:28:28+00:00,"Pelosi is now leading a delegation of 9, including Corrupt Adam Schiff, to Jordan to check out Syria. She should find out why Obama drew The Red Line In the Sand, & then did NOTHING, losing Syria & all respect. I did something, 58 missiles. One million died under Obama’s mistake!",Pelosi lead delegation include Corrupt Adam Schiff Jordan check Syria find Obama draw Line Sand lose Syria respect missile million die Obama mistake,27355,<UNK>,<UNK>,realDonaldTrump
1185934502906007552,2019-10-20 15:03:13+00:00,"“The ceasefire is holding up very nicely. There are some minor skirmishes that have ended quickly. New areas being resettled with Kurds. U.S. soldiers are not in combat or ceasefire zone. We have secured the Oil.” Mark Esper, Secretary of Defense. Ending endless wars!",ceasefire hold nicely minor skirmish end quickly area resettle Kurds U.S. soldier combat ceasefire zone secure Mark Esper Secretary Defense end endless war,18159,<UNK>,<UNK>,realDonaldTrump
